URL,MatchDateTime,Station,Show,IAShowID,IAPreviewThumb,Snippet
https://archive.org/details/CNNW_20140218_180000_Wolf#start/1522/end/1557,2/18/2014 18:25:37,CNN,Wolf,CNNW_20140218_180000_Wolf,https://archive.org/download/CNNW_20140218_180000_Wolf/CNNW_20140218_180000_Wolf.thumbs/CNNW_20140218_180000_Wolf_001365.jpg,"oil, save more money, cut pollution. the new fuel standards for trucks are part of a larger push by the obama administration to focus in on climate change. the president is calling for $1 billion to develop new technologies to prepare for and"
https://archive.org/details/CNNW_20140225_210000_The_Lead_With_Jake_Tapper#start/3339/end/3374,2/25/2014 21:55:54,CNN,The Lead With Jake Tapper,CNNW_20140225_210000_The_Lead_With_Jake_Tapper,https://archive.org/download/CNNW_20140225_210000_The_Lead_With_Jake_Tapper/CNNW_20140225_210000_The_Lead_With_Jake_Tapper.thumbs/CNNW_20140225_210000_The_Lead_With_Jake_Tapper_003315.jpg,"of fact ts. so one of the reasons why there hasn't been action on climate change is because people see environmentalists saying, don't do this and they feel like it will -- and a lot of cases they are right -- affect jobs, hurt jobs, hurt the way that"
https://archive.org/details/CNNW_20140223_200000_CNN_Newsroom#start/2785/end/2820,2/23/2014 20:46:40,CNN,CNN Newsroom,CNNW_20140223_200000_CNN_Newsroom,https://archive.org/download/CNNW_20140223_200000_CNN_Newsroom/CNNW_20140223_200000_CNN_Newsroom.thumbs/CNNW_20140223_200000_CNN_Newsroom_002775.jpg,"decide to take -- to add cases to its docket that address some issues that are very important to this administration, issues like gun control and also the limits of the president's power to tackle things like climate change without the help of congress. there's no shortage of"
https://archive.org/details/CNNW_20140223_160000_Reliable_Sources#start/1091/end/1126,2/23/2014 16:18:26,CNN,Reliable Sources,CNNW_20140223_160000_Reliable_Sources,https://archive.org/download/CNNW_20140223_160000_Reliable_Sources/CNNW_20140223_160000_Reliable_Sources.thumbs/CNNW_20140223_160000_Reliable_Sources_001066.jpg,"climate scientists or meteorologists. 'meet the press' had a debate which the other two shows really didn't in the same way, about whether climate change is happening. even though the host david gregory started out by saying that he didn't want to have a"
https://archive.org/details/CNNW_20140224_210000_The_Lead_With_Jake_Tapper#start/2271/end/2306,2/24/2014 21:38:06,CNN,The Lead With Jake Tapper,CNNW_20140224_210000_The_Lead_With_Jake_Tapper,https://archive.org/download/CNNW_20140224_210000_The_Lead_With_Jake_Tapper/CNNW_20140224_210000_The_Lead_With_Jake_Tapper.thumbs/CNNW_20140224_210000_The_Lead_With_Jake_Tapper_002265.jpg,"i think everybody is getting a second, third, and fourth look. we're getting some reporting about bobby jindal of louisiana. jeb bush has been running around saying we have to do immigration reform, climate change is a real problem, doesn't necessarily sound like someone who is"
https://archive.org/details/CNNW_20140221_220000_The_Situation_Room#start/2316/end/2351,2/21/2014 22:38:51,CNN,The Situation Room,CNNW_20140221_220000_The_Situation_Room,https://archive.org/download/CNNW_20140221_220000_The_Situation_Room/CNNW_20140221_220000_The_Situation_Room.thumbs/CNNW_20140221_220000_The_Situation_Room_002295.jpg,"energy of the future, it's not going to come from the government picking winners and losers. we ought to open up energy innovation across the board and remove the barriers to every form of energy. do you believe climate change is real? you know, i'm always troubled"
https://archive.org/details/CNNW_20140203_232800_Crossfire#start/227/end/262,2/3/2014 23:32:02,CNN,Crossfire,CNNW_20140203_232800_Crossfire,https://archive.org/download/CNNW_20140203_232800_Crossfire/CNNW_20140203_232800_Crossfire.thumbs/CNNW_20140203_232800_Crossfire_000225.jpg,"a lefty libbereral speech, immigration reform, climate change, minimum wage, even talking about income inequality right now. the majority of the american people, the mainstream of america are there, they're with him. now, there's no question that it will be a tight rope because, as"
https://archive.org/details/CNNW_20140217_160000_This_Hour_With_Berman_and_Michaela#start/1091/end/1126,2/17/2014 16:18:26,CNN,This Hour With Berman and Michaela,CNNW_20140217_160000_This_Hour_With_Berman_and_Michaela,https://archive.org/download/CNNW_20140217_160000_This_Hour_With_Berman_and_Michaela/CNNW_20140217_160000_This_Hour_With_Berman_and_Michaela.thumbs/CNNW_20140217_160000_This_Hour_With_Berman_and_Michaela_001065.jpg,"case. he is relevant. he is newsworthy. i thought it was interesting so see. i think the silence may have been the most interesting part of all. ahead for us, violent weather patterns and extreme win iter storms have forced climate change right into the spotlight."
https://archive.org/details/CNNW_20140217_160000_This_Hour_With_Berman_and_Michaela#start/1330/end/1365,2/17/2014 16:22:25,CNN,This Hour With Berman and Michaela,CNNW_20140217_160000_This_Hour_With_Berman_and_Michaela,https://archive.org/download/CNNW_20140217_160000_This_Hour_With_Berman_and_Michaela/CNNW_20140217_160000_This_Hour_With_Berman_and_Michaela.thumbs/CNNW_20140217_160000_This_Hour_With_Berman_and_Michaela_001215.jpg,"asking is climate change to blame republican congressman and marsha blackburn debated the issue with bill nye, the science guy. what you have to do is look at what the warms is. when you look at the fact that we have gone from 320 parts per"
https://archive.org/details/CNNW_20140217_160000_This_Hour_With_Berman_and_Michaela#start/1379/end/1414,2/17/2014 16:23:14,CNN,This Hour With Berman and Michaela,CNNW_20140217_160000_This_Hour_With_Berman_and_Michaela,https://archive.org/download/CNNW_20140217_160000_This_Hour_With_Berman_and_Michaela/CNNW_20140217_160000_This_Hour_With_Berman_and_Michaela.thumbs/CNNW_20140217_160000_This_Hour_With_Berman_and_Michaela_001215.jpg,"the whole idea of climate change. what i would encourage everybody to do is back up and agree on the facts. would you say the an arctic has less ice than it used to. you asserted that a change from 320 to 400 parts per million is"
https://archive.org/details/CNNW_20140219_232800_Crossfire#start/519/end/554,2/19/2014 23:36:54,CNN,Crossfire,CNNW_20140219_232800_Crossfire,https://archive.org/download/CNNW_20140219_232800_Crossfire/CNNW_20140219_232800_Crossfire.thumbs/CNNW_20140219_232800_Crossfire_000496.jpg,"talking about this because jakarta is in danger of being drowned out if the flood waters rise as much as the army corps of engineers predicts it will by tend of the century, five feet. you think climate change is more dangerous than nuclear"
https://archive.org/details/CNNW_20140219_232800_Crossfire#start/772/end/807,2/19/2014 23:41:07,CNN,Crossfire,CNNW_20140219_232800_Crossfire,https://archive.org/download/CNNW_20140219_232800_Crossfire/CNNW_20140219_232800_Crossfire.thumbs/CNNW_20140219_232800_Crossfire_000766.jpg,"about, any problem we can talk about will get worse, as you said, under climate change. i'll connect the dots for you globally when we get back. there's this kid. coach calls her a team player. she's kind of special. she makes the whole team better."
https://archive.org/details/CNNW_20140219_190000_CNN_Newsroom#start/5941/end/5976,2/19/2014 20:39:16,CNN,CNN Newsroom,CNNW_20140219_190000_CNN_Newsroom,https://archive.org/download/CNNW_20140219_190000_CNN_Newsroom/CNNW_20140219_190000_CNN_Newsroom.thumbs/CNNW_20140219_190000_CNN_Newsroom_005925.jpg,"for the united states and telling them they believe the greatest danger we face is global climate change. among them. putin thought to himself this is a guy who is not in touch with reality and putin decided that he could take more risks"
https://archive.org/details/CNNW_20140221_220000_The_Situation_Room#start/2493/end/2528,2/21/2014 22:41:48,CNN,The Situation Room,CNNW_20140221_220000_The_Situation_Room,https://archive.org/download/CNNW_20140221_220000_The_Situation_Room/CNNW_20140221_220000_The_Situation_Room.thumbs/CNNW_20140221_220000_The_Situation_Room_002475.jpg,"arid right before that. when you have the climate change going on around the world, you get more instability which makes all of our other problems that much tougher. his main argument has become very popular, very dangerous. he's saying in the past 15 years"
https://archive.org/details/CNNW_20140218_180000_Wolf#start/543/end/578,2/18/2014 18:09:18,CNN,Wolf,CNNW_20140218_180000_Wolf,https://archive.org/download/CNNW_20140218_180000_Wolf/CNNW_20140218_180000_Wolf.thumbs/CNNW_20140218_180000_Wolf_000525.jpg,"fuel efficiency as he tackles climate change. gloria borger standing by live will discuss the politics of this. also ahead, the rocker, ted nugent, campaigning today for a republican candidate running for governor of texas. but nugent's recent remarks about president obama have a lot"
https://archive.org/details/CNNW_20140218_180000_Wolf#start/1263/end/1298,2/18/2014 18:21:18,CNN,Wolf,CNNW_20140218_180000_Wolf,https://archive.org/download/CNNW_20140218_180000_Wolf/CNNW_20140218_180000_Wolf.thumbs/CNNW_20140218_180000_Wolf_001245.jpg,"regime. but up next, president obama takes direct aim at truck pollution. his latest action targeting big trucks as part of a broader focus on climate change. [ male announcer ] this is kevin. to prove to you that aleve is the better choice for him,"
https://archive.org/details/CNNW_20140223_160000_Reliable_Sources#start/1169/end/1204,2/23/2014 16:19:44,CNN,Reliable Sources,CNNW_20140223_160000_Reliable_Sources,https://archive.org/download/CNNW_20140223_160000_Reliable_Sources/CNNW_20140223_160000_Reliable_Sources.thumbs/CNNW_20140223_160000_Reliable_Sources_001156.jpg,"actually doesn't have much debate around it, such as whether climate change is real, then i think these shows struggle to be so definitive about something and really break out of the paradigm they set themselves up with a lot. doctor, what are the risks that are involved in false"
https://archive.org/details/CNNW_20140224_232800_Crossfire#start/607/end/642,2/24/2014 23:38:22,CNN,Crossfire,CNNW_20140224_232800_Crossfire,https://archive.org/download/CNNW_20140224_232800_Crossfire/CNNW_20140224_232800_Crossfire.thumbs/CNNW_20140224_232800_Crossfire_000586.jpg,"coal and doing what it can to basically drive coal out of use given the importance of coal to missouri? first of all we have to accept climate change and we all have a joined responsibility to do things to make that better. but i should also note that the"
https://archive.org/details/CNNW_20140212_140000_CNN_Newsroom#start/5898/end/5933,2/12/2014 15:38:33,CNN,CNN Newsroom,CNNW_20140212_140000_CNN_Newsroom,https://archive.org/download/CNNW_20140212_140000_CNN_Newsroom/CNNW_20140212_140000_CNN_Newsroom.thumbs/CNNW_20140212_140000_CNN_Newsroom_005896.jpg,"prepared. we expect a lot of focus on climate change. there is a lot of disagreement. they want to talk about how much it will cost when communities and individuals are not prepared for extreme weather events like this. we have already heard at least one mention of this coming"
https://archive.org/details/CNNW_20140223_230000_CNN_Newsroom#start/905/end/940,2/23/2014 23:15:20,CNN,CNN Newsroom,CNNW_20140223_230000_CNN_Newsroom,https://archive.org/download/CNNW_20140223_230000_CNN_Newsroom/CNNW_20140223_230000_CNN_Newsroom.thumbs/CNNW_20140223_230000_CNN_Newsroom_000885.jpg,"could be put on that right? reporter: also on monday the court hears a case that could test the limits of president obama's push to use his executive power when congress won't act. this time on climate change. at issue, whether the epa went too far. when without congressional"
https://archive.org/details/CNNW_20140223_160000_Reliable_Sources#start/1123/end/1158,2/23/2014 16:18:58,CNN,Reliable Sources,CNNW_20140223_160000_Reliable_Sources,https://archive.org/download/CNNW_20140223_160000_Reliable_Sources/CNNW_20140223_160000_Reliable_Sources.thumbs/CNNW_20140223_160000_Reliable_Sources_001096.jpg,"it makes a lot of sense if you don't want to have a debate about the facts, you don't bring on people whose primary focus in the segment is going to be to debate the facts about whether climate change exists or not. it was -- why do you think shows are"
https://archive.org/details/CNNW_20140205_050000_Piers_Morgan_Live#start/2968/end/3003,2/5/2014 5:49:43,CNN,Piers Morgan Live,CNNW_20140205_050000_Piers_Morgan_Live,https://archive.org/download/CNNW_20140205_050000_Piers_Morgan_Live/CNNW_20140205_050000_Piers_Morgan_Live.thumbs/CNNW_20140205_050000_Piers_Morgan_Live_002956.jpg,"his response that the world is winding down since the great flood. and that somehow the climate change, what i heard, what i infer from your remarks, is that this is sort of a punishment for humankind. and i'm very skeptical of all three of those things, very"
https://archive.org/details/CNNW_20140219_232800_Crossfire#start/361/end/396,2/19/2014 23:34:16,CNN,Crossfire,CNNW_20140219_232800_Crossfire,https://archive.org/download/CNNW_20140219_232800_Crossfire/CNNW_20140219_232800_Crossfire.thumbs/CNNW_20140219_232800_Crossfire_000346.jpg,"weapons out and -- i know you're a critic. and 130000 people are dead in syria and some are dead from weapon of mass destruction and instead john kerry gives speeches about global climate change. ludicrous. i know you wish that we'd gone into war in syria and a"
https://archive.org/details/CNNW_20140219_232800_Crossfire#start/741/end/776,2/19/2014 23:40:36,CNN,Crossfire,CNNW_20140219_232800_Crossfire,https://archive.org/download/CNNW_20140219_232800_Crossfire/CNNW_20140219_232800_Crossfire.thumbs/CNNW_20140219_232800_Crossfire_000736.jpg,"the united states. none. now under your theory of all global climate change, how come it was the safest year since 1962 for hurricanes? scientists will tell you individual years will vary, but it's the overall trends. ten of the warmest years on record have happened in the last 12 years."
https://archive.org/details/CNNW_20140203_232800_Crossfire#start/581/end/616,2/3/2014 23:37:56,CNN,Crossfire,CNNW_20140203_232800_Crossfire,https://archive.org/download/CNNW_20140203_232800_Crossfire/CNNW_20140203_232800_Crossfire.thumbs/CNNW_20140203_232800_Crossfire_000555.jpg,"expands and carbon emissions will go up. and so i actually think taking that along with everything else a the president wants to do on climate change can give him a green light to say no. i really want to get your opinion on this. i don't understand why republicans have made this"
https://archive.org/details/CNNW_20140223_160000_Reliable_Sources#start/998/end/1033,2/23/2014 16:16:53,CNN,Reliable Sources,CNNW_20140223_160000_Reliable_Sources,https://archive.org/download/CNNW_20140223_160000_Reliable_Sources/CNNW_20140223_160000_Reliable_Sources.thumbs/CNNW_20140223_160000_Reliable_Sources_000976.jpg,"present unfortunately mainly ideology, they're looking at a scientific question through an ideological litmus test which is not responsible journalism. before we get into 'meet the press' in particular, jack, what do you make of the amount of coverage of climate change in general? often times i read on-sites like"
https://archive.org/details/CNNW_20140223_160000_Reliable_Sources#start/1107/end/1142,2/23/2014 16:18:42,CNN,Reliable Sources,CNNW_20140223_160000_Reliable_Sources,https://archive.org/download/CNNW_20140223_160000_Reliable_Sources/CNNW_20140223_160000_Reliable_Sources.thumbs/CNNW_20140223_160000_Reliable_Sources_001096.jpg,"debate, he still brought on someone who denied that climate change was happening in the first place. right. he said he wanted to talk about the policy, get beyond whether it's happening or not, but having a skeptic on they seemed to get muzled in the issues that have been debated endlessly."
https://archive.org/details/CNNW_20140223_160000_Reliable_Sources#start/1247/end/1282,2/23/2014 16:21:02,CNN,Reliable Sources,CNNW_20140223_160000_Reliable_Sources,https://archive.org/download/CNNW_20140223_160000_Reliable_Sources/CNNW_20140223_160000_Reliable_Sources.thumbs/CNNW_20140223_160000_Reliable_Sources_001246.jpg,"in the case of 'meet the press' they go about it all wrong. right. i think there is definitely a debate to be had what to do about climate change and that's an important debate. doctor, do you think there's some room at the table for skeptics? if i was to write a story about"
https://archive.org/details/CNNW_20140217_160000_This_Hour_With_Berman_and_Michaela#start/1616/end/1651,2/17/2014 16:27:11,CNN,This Hour With Berman and Michaela,CNNW_20140217_160000_This_Hour_With_Berman_and_Michaela,https://archive.org/download/CNNW_20140217_160000_This_Hour_With_Berman_and_Michaela/CNNW_20140217_160000_This_Hour_With_Berman_and_Michaela.thumbs/CNNW_20140217_160000_This_Hour_With_Berman_and_Michaela_001215.jpg,"clear. i look at what the arctic sea ice is doing. i think that's what we have to focus on. i think our case is heard when we try to take every single event and link it. there is plenty that is related to climate change. i like what you said about"
https://archive.org/details/CNNW_20140215_160000_CNN_Newsroom#start/5256/end/5291,2/15/2014 17:27:51,CNN,CNN Newsroom,CNNW_20140215_160000_CNN_Newsroom,https://archive.org/download/CNNW_20140215_160000_CNN_Newsroom/CNNW_20140215_160000_CNN_Newsroom.thumbs/CNNW_20140215_160000_CNN_Newsroom_005235.jpg,"climate change impacts those jet stream patterns and our crazy weather. fredricka? thank you so much, brian todd. that is one mound of snow. all right. a trial that has touched a big nerve could come to an end today. we have the latest on what's happening at the murder trial of"
https://archive.org/details/CNNW_20140218_160000_This_Hour_With_Berman_and_Michaela#start/3039/end/3074,2/18/2014 16:50:54,CNN,This Hour With Berman and Michaela,CNNW_20140218_160000_This_Hour_With_Berman_and_Michaela,https://archive.org/download/CNNW_20140218_160000_This_Hour_With_Berman_and_Michaela/CNNW_20140218_160000_This_Hour_With_Berman_and_Michaela.thumbs/CNNW_20140218_160000_This_Hour_With_Berman_and_Michaela_003018.jpg,"emissions, not just about fighting climate change. it's also about saving people money and shaking sure the u.s. can produce as much of its own energy as possible. and you heard in that speech a lot of focus on innovation. other ways this could be good for the economy, good for the"
https://archive.org/details/CNNW_20140223_230000_CNN_Newsroom#start/1642/end/1677,2/23/2014 23:27:37,CNN,CNN Newsroom,CNNW_20140223_230000_CNN_Newsroom,https://archive.org/download/CNNW_20140223_230000_CNN_Newsroom/CNNW_20140223_230000_CNN_Newsroom.thumbs/CNNW_20140223_230000_CNN_Newsroom_001635.jpg,"climate change, there's a reason we showed this shot. you cannot dismiss this. from a typhoon that ravaged the philippines to disasters close to home like superstorm sandy or the severe drought in california you'll probably agree the weather lately has been extreme. this week a new tool will be launched into space by nasa and"
https://archive.org/details/CNNW_20140217_160000_This_Hour_With_Berman_and_Michaela#start/1564/end/1599,2/17/2014 16:26:19,CNN,This Hour With Berman and Michaela,CNNW_20140217_160000_This_Hour_With_Berman_and_Michaela,https://archive.org/download/CNNW_20140217_160000_This_Hour_With_Berman_and_Michaela/CNNW_20140217_160000_This_Hour_With_Berman_and_Michaela.thumbs/CNNW_20140217_160000_This_Hour_With_Berman_and_Michaela_001215.jpg,"i agree with chad. you have to get beyond taking every single event and link to climate change. we can no the throw out the baby with the bath water. we know the climate is changing and human beings are contributing to it. for example, one of the things that's interesting about the recent snowstorms we have had"
https://archive.org/details/CNNW_20140219_232800_Crossfire#start/693/end/728,2/19/2014 23:39:48,CNN,Crossfire,CNNW_20140219_232800_Crossfire,https://archive.org/download/CNNW_20140219_232800_Crossfire/CNNW_20140219_232800_Crossfire.thumbs/CNNW_20140219_232800_Crossfire_000676.jpg,"we're taking half your budget and we'll put half your budget into fighting global climate change, they will all of a sudden say to you, i don't think you quite understood the way in which we wrote this. because that's a problem about 45 years from now, but this year we need three more ships. this is a budget issue."
