URL,MatchDateTime,Station,Show,IAShowID,IAPreviewThumb,Snippet
https://archive.org/details/CNNW_20140219_232800_Crossfire#start/1272/end/1307,2/19/2014 23:49:27,CNN,Crossfire,CNNW_20140219_232800_Crossfire,https://archive.org/download/CNNW_20140219_232800_Crossfire/CNNW_20140219_232800_Crossfire.thumbs/CNNW_20140219_232800_Crossfire_001246.jpg,"capital on global warming. don't you think from putin's standpoint as a guy who thinks of himself as probably the toughest guy on the planet that this is all sort of a joke? he has no interest in those things. his interest is what's going to happen to kiev and he has no"
https://archive.org/details/CNNW_20140219_232800_Crossfire#start/646/end/681,2/19/2014 23:39:01,CNN,Crossfire,CNNW_20140219_232800_Crossfire,https://archive.org/download/CNNW_20140219_232800_Crossfire/CNNW_20140219_232800_Crossfire.thumbs/CNNW_20140219_232800_Crossfire_000646.jpg,"said climate change didn't matter? this administration politically, it would be hopeless. to have a senior officer now say i will now repeat what the senator want meese to repeat --  _"
https://archive.org/details/CNNW_20140219_232800_Crossfire#start/1334/end/1369,2/19/2014 23:50:29,CNN,Crossfire,CNNW_20140219_232800_Crossfire,https://archive.org/download/CNNW_20140219_232800_Crossfire/CNNW_20140219_232800_Crossfire.thumbs/CNNW_20140219_232800_Crossfire_001336.jpg,"things you have to do. to govern is to choose so should they put their capital on climate change? should they put their capital on iranian nuclear weapons?"
https://archive.org/details/CNNW_20140218_140000_CNN_Newsroom#start/6697/end/6732,2/18/2014 15:51:52,CNN,CNN Newsroom,CNNW_20140218_140000_CNN_Newsroom,https://archive.org/download/CNNW_20140218_140000_CNN_Newsroom/CNNW_20140218_140000_CNN_Newsroom.thumbs/CNNW_20140218_140000_CNN_Newsroom_006675.jpg,"particularly on issues like climate change. i am told in a private meeting that the president had with senate democrats in his retreat two weeks ago. they pushed him."
https://archive.org/details/CNNW_20140219_232800_Crossfire#start/130/end/165,2/19/2014 23:30:25,CNN,Crossfire,CNNW_20140219_232800_Crossfire,https://archive.org/download/CNNW_20140219_232800_Crossfire/CNNW_20140219_232800_Crossfire.thumbs/CNNW_20140219_232800_Crossfire_000106.jpg,"in a sense, climate change can now be considered another weapon of mass destruction perhaps even the world's most fearsome weapon of mass destruction. that statement is delusional."
https://archive.org/details/CNNW_20140221_220000_The_Situation_Room#start/2394/end/2429,2/21/2014 22:40:09,CNN,The Situation Room,CNNW_20140221_220000_The_Situation_Room,https://archive.org/download/CNNW_20140221_220000_The_Situation_Room/CNNW_20140221_220000_The_Situation_Room.thumbs/CNNW_20140221_220000_The_Situation_Room_002385.jpg,"always have to be worried about something that is considered a so-called scientific theory that fits every scenario. climate change, as they've defined it, could never be"
https://archive.org/details/CNNW_20140221_220000_The_Situation_Room#start/2300/end/2335,2/21/2014 22:38:35,CNN,The Situation Room,CNNW_20140221_220000_The_Situation_Room,https://archive.org/download/CNNW_20140221_220000_The_Situation_Room/CNNW_20140221_220000_The_Situation_Room.thumbs/CNNW_20140221_220000_The_Situation_Room_002235.jpg,"hopeful spoke with cnn chief congressional correspondent. listen to the subject on climate change. we ought to be allowing the private sector to pursue every form of energy because the"
https://archive.org/details/CNNW_20140212_050000_Piers_Morgan_Live#start/1122/end/1157,2/12/2014 5:18:57,CNN,Piers Morgan Live,CNNW_20140212_050000_Piers_Morgan_Live,https://archive.org/download/CNNW_20140212_050000_Piers_Morgan_Live/CNNW_20140212_050000_Piers_Morgan_Live.thumbs/CNNW_20140212_050000_Piers_Morgan_Live_001095.jpg,"it is not true because when the pill was first introduced, suddenly abortions go through the roof. ill legitimacy goes through the roof. decades ago, i'm talking about now. some tiny little increase or decrease has also gone up -- there is a genuine pattern downwards. no. it's gone down with global warming. the two things are linked."
https://archive.org/details/CNNW_20140224_140000_CNN_Newsroom#start/5752/end/5787,2/24/2014 15:36:07,CNN,CNN Newsroom,CNNW_20140224_140000_CNN_Newsroom,https://archive.org/download/CNNW_20140224_140000_CNN_Newsroom/CNNW_20140224_140000_CNN_Newsroom.thumbs/CNNW_20140224_140000_CNN_Newsroom_005745.jpg,"a legal fight over climate change about to go down in the u.s. supreme court. republican-led states are fighting an obama administration edict that requires power plants to limit carbon emissions which"
https://archive.org/details/CNNW_20140201_200000_CNN_Newsroom#start/2052/end/2087,2/1/2014 20:34:27,CNN,CNN Newsroom,CNNW_20140201_200000_CNN_Newsroom,https://archive.org/download/CNNW_20140201_200000_CNN_Newsroom/CNNW_20140201_200000_CNN_Newsroom.thumbs/CNNW_20140201_200000_CNN_Newsroom_002025.jpg,"schell fled the nazis. and the keystone pipeline. the verdict, the project won't significantly impact the climate. environmentalists worried about green house gas emissions and climate change, and they were condemning the report."
https://archive.org/details/CNNW_20140216_200000_CNN_Newsroom#start/1969/end/2004,2/16/2014 20:33:04,CNN,CNN Newsroom,CNNW_20140216_200000_CNN_Newsroom,https://archive.org/download/CNNW_20140216_200000_CNN_Newsroom/CNNW_20140216_200000_CNN_Newsroom.thumbs/CNNW_20140216_200000_CNN_Newsroom_001966.jpg,"threatening the world. he told an audience in jakarta, indonesia, that the science of climate change is compelling the world to act and scientists certain it's the last stop on"
https://archive.org/details/CNNW_20140217_160000_This_Hour_With_Berman_and_Michaela#start/1517/end/1552,2/17/2014 16:25:32,CNN,This Hour With Berman and Michaela,CNNW_20140217_160000_This_Hour_With_Berman_and_Michaela,https://archive.org/download/CNNW_20140217_160000_This_Hour_With_Berman_and_Michaela/CNNW_20140217_160000_This_Hour_With_Berman_and_Michaela.thumbs/CNNW_20140217_160000_This_Hour_With_Berman_and_Michaela_001215.jpg,"of the problem we are having here. climate change deniers like to point to individual weather events and say, this isn't part of global warning. let me read you a tweet from the"
https://archive.org/details/CNNW_20140225_210000_The_Lead_With_Jake_Tapper#start/3182/end/3217,2/25/2014 21:53:17,CNN,The Lead With Jake Tapper,CNNW_20140225_210000_The_Lead_With_Jake_Tapper,https://archive.org/download/CNNW_20140225_210000_The_Lead_With_Jake_Tapper/CNNW_20140225_210000_The_Lead_With_Jake_Tapper.thumbs/CNNW_20140225_210000_The_Lead_With_Jake_Tapper_003165.jpg,"tighten emission standards. the cross may be skeptical about the climate change but the world metrological organization said that the first six weeks of this year have been note blg for unusual weather extremes,"
https://archive.org/details/CNNW_20140224_140000_CNN_Newsroom#start/2182/end/2217,2/24/2014 14:36:37,CNN,CNN Newsroom,CNNW_20140224_140000_CNN_Newsroom,https://archive.org/download/CNNW_20140224_140000_CNN_Newsroom/CNNW_20140224_140000_CNN_Newsroom.thumbs/CNNW_20140224_140000_CNN_Newsroom_002175.jpg,"climate change. at issue whether the epa went too far without congressional approval it limited carbon emissions from power plants, factories beyond cars and trucks. on the constitutional side this is a constant conflict"
https://archive.org/details/CNNW_20140225_210000_The_Lead_With_Jake_Tapper#start/3228/end/3263,2/25/2014 21:54:03,CNN,The Lead With Jake Tapper,CNNW_20140225_210000_The_Lead_With_Jake_Tapper,https://archive.org/download/CNNW_20140225_210000_The_Lead_With_Jake_Tapper/CNNW_20140225_210000_The_Lead_With_Jake_Tapper.thumbs/CNNW_20140225_210000_The_Lead_With_Jake_Tapper_003225.jpg,"few days ago. climate change can now be considered another weapon of mass destruction, perhaps the worst more fierce weapon of mass destruction. is he right? is that dire? i don't think people realize"
https://archive.org/details/CNNW_20140221_220000_The_Situation_Room#start/2455/end/2490,2/21/2014 22:41:10,CNN,The Situation Room,CNNW_20140221_220000_The_Situation_Room,https://archive.org/download/CNNW_20140221_220000_The_Situation_Room/CNNW_20140221_220000_The_Situation_Room.thumbs/CNNW_20140221_220000_The_Situation_Room_002445.jpg,"let's get reaction from senator cruz. van jones, the host of 'crossfire' is joining us. you totally disagree with me. this is a big issue for you, climate change. first of all, i applaud john"
https://archive.org/details/CNNW_20140217_160000_This_Hour_With_Berman_and_Michaela#start/1470/end/1505,2/17/2014 16:24:45,CNN,This Hour With Berman and Michaela,CNNW_20140217_160000_This_Hour_With_Berman_and_Michaela,https://archive.org/download/CNNW_20140217_160000_This_Hour_With_Berman_and_Michaela/CNNW_20140217_160000_This_Hour_With_Berman_and_Michaela.thumbs/CNNW_20140217_160000_This_Hour_With_Berman_and_Michaela_001215.jpg,"change. we have different things going on in the atmosphere that make our weather. the problem with americans and people all across the world is that global climate change means from me to my walgreen's."
https://archive.org/details/CNNW_20140218_220000_The_Situation_Room#start/3312/end/3347,2/18/2014 22:55:27,CNN,The Situation Room,CNNW_20140218_220000_The_Situation_Room,https://archive.org/download/CNNW_20140218_220000_The_Situation_Room/CNNW_20140218_220000_The_Situation_Room.thumbs/CNNW_20140218_220000_The_Situation_Room_003286.jpg,"climate change can now be considered another weapon of mass destruction, perhaps even the world's most fearsome weapon of mass destruction. to which you tweeted this. you said every american who cares about national security"
https://archive.org/details/CNNW_20140219_232800_Crossfire#start/83/end/118,2/19/2014 23:29:38,CNN,Crossfire,CNNW_20140219_232800_Crossfire,https://archive.org/download/CNNW_20140219_232800_Crossfire/CNNW_20140219_232800_Crossfire.thumbs/CNNW_20140219_232800_Crossfire_000076.jpg,"and bill kristol, one of the president's harshest critics. is climate change the biggest threat we face? tonight on 'crossfire.' welcome to 'crossfire.' i'm van jones is on the left. i'm newt gingrich on the"
https://archive.org/details/CNNW_20140219_232800_Crossfire#start/550/end/585,2/19/2014 23:37:25,CNN,Crossfire,CNNW_20140219_232800_Crossfire,https://archive.org/download/CNNW_20140219_232800_Crossfire/CNNW_20140219_232800_Crossfire.thumbs/CNNW_20140219_232800_Crossfire_000526.jpg,"climate change can change our planet forever. why do you disagree with the pentagon's assessment on this? make a statement knowing that the -- let me ask you this. yes. 1997 was a resolution in the"
https://archive.org/details/CNNW_20140223_160000_Reliable_Sources#start/154/end/189,2/23/2014 16:02:49,CNN,Reliable Sources,CNNW_20140223_160000_Reliable_Sources,https://archive.org/download/CNNW_20140223_160000_Reliable_Sources/CNNW_20140223_160000_Reliable_Sources.thumbs/CNNW_20140223_160000_Reliable_Sources_000136.jpg,"reporters need to grow a backbone. then, stories that don't have two sides. scientists all over the world agree climate change is real and it's here. but on television, you never know it. and donald trump."
https://archive.org/details/CNNW_20140224_140000_CNN_Newsroom#start/5942/end/5977,2/24/2014 15:39:17,CNN,CNN Newsroom,CNNW_20140224_140000_CNN_Newsroom,https://archive.org/download/CNNW_20140224_140000_CNN_Newsroom/CNNW_20140224_140000_CNN_Newsroom.thumbs/CNNW_20140224_140000_CNN_Newsroom_005925.jpg,"last but not least is the last group. they are the ones that deny climate change is happening. who are they? that group we call the dismissive. they are firmly convinced, it is not happening, not humanly"
https://archive.org/details/CNNW_20140224_140000_CNN_Newsroom#start/5976/end/6011,2/24/2014 15:39:51,CNN,CNN Newsroom,CNNW_20140224_140000_CNN_Newsroom,https://archive.org/download/CNNW_20140224_140000_CNN_Newsroom/CNNW_20140224_140000_CNN_Newsroom.thumbs/CNNW_20140224_140000_CNN_Newsroom_005955.jpg,"all of which has nothing whatsoever to do with the basic, fundamental science in what you alluded to before. the scientific community, based upon the evidence, 97% of climate scientists agree that my climate change is happening in"
https://archive.org/details/CNNW_20140224_140000_CNN_Newsroom#start/6038/end/6073,2/24/2014 15:40:53,CNN,CNN Newsroom,CNNW_20140224_140000_CNN_Newsroom,https://archive.org/download/CNNW_20140224_140000_CNN_Newsroom/CNNW_20140224_140000_CNN_Newsroom.thumbs/CNNW_20140224_140000_CNN_Newsroom_006015.jpg,"they are deeply distrust full of cly pat chan climate change. it is not something we can all solve through our own individual voluntary behavior. we can make a difference by turning out the light its and"
https://archive.org/details/CNNW_20140221_220000_The_Situation_Room#start/2409/end/2444,2/21/2014 22:40:24,CNN,The Situation Room,CNNW_20140221_220000_The_Situation_Room,https://archive.org/download/CNNW_20140221_220000_The_Situation_Room/CNNW_20140221_220000_The_Situation_Room.thumbs/CNNW_20140221_220000_The_Situation_Room_002385.jpg,"disapproved. they say it's changing so it proves our theory. reporter: secretary kerry said of climate change, it's perhaps the most fearsome weapon of mass destruction. sounds like you don't agree with that. well, it is ironic that"
https://archive.org/details/CNNW_20140205_020000_Piers_Morgan_Live#start/3015/end/3050,2/5/2014 2:50:30,CNN,Piers Morgan Live,CNNW_20140205_020000_Piers_Morgan_Live,https://archive.org/download/CNNW_20140205_020000_Piers_Morgan_Live/CNNW_20140205_020000_Piers_Morgan_Live.thumbs/CNNW_20140205_020000_Piers_Morgan_Live_003015.jpg,"energy is being added is what's causing all kinds of trouble or all kinds of potential trouble around the world. you cannot tie any one event to climate change. but interestingly enough, there is new statistical evidence that"
https://archive.org/details/CNNW_20140205_020000_Piers_Morgan_Live#start/2924/end/2959,2/5/2014 2:48:59,CNN,Piers Morgan Live,CNNW_20140205_020000_Piers_Morgan_Live,https://archive.org/download/CNNW_20140205_020000_Piers_Morgan_Live/CNNW_20140205_020000_Piers_Morgan_Live.thumbs/CNNW_20140205_020000_Piers_Morgan_Live_002925.jpg,"ever since the flood of noah's day, we would say, massive climate change. so it all depend on the weather patterns. it's what we see today, the way things interact. creationists have no different explanations, they talk about"
https://archive.org/details/CNNW_20140217_160000_This_Hour_With_Berman_and_Michaela#start/1503/end/1538,2/17/2014 16:25:18,CNN,This Hour With Berman and Michaela,CNNW_20140217_160000_This_Hour_With_Berman_and_Michaela,https://archive.org/download/CNNW_20140217_160000_This_Hour_With_Berman_and_Michaela/CNNW_20140217_160000_This_Hour_With_Berman_and_Michaela.thumbs/CNNW_20140217_160000_This_Hour_With_Berman_and_Michaela_001215.jpg,"warm here. it has little events that don't have a way. everything to do with climate change. in a small way, yes, it is weather. we're talking climate, not day to day weather. marshall, i think that's part"
https://archive.org/details/CNNW_20140219_232800_Crossfire#start/661/end/696,2/19/2014 23:39:16,CNN,Crossfire,CNNW_20140219_232800_Crossfire,https://archive.org/download/CNNW_20140219_232800_Crossfire/CNNW_20140219_232800_Crossfire.thumbs/CNNW_20140219_232800_Crossfire_000646.jpg,"the quadrennial review which sets policy for the country which is key to our national security and includes climate change, you're saying that document, the political document is wrong? here's what i'm saying. of course it's a political"
https://archive.org/details/CNNW_20140218_160000_This_Hour_With_Berman_and_Michaela#start/2175/end/2210,2/18/2014 16:36:30,CNN,This Hour With Berman and Michaela,CNNW_20140218_160000_This_Hour_With_Berman_and_Michaela,https://archive.org/download/CNNW_20140218_160000_This_Hour_With_Berman_and_Michaela/CNNW_20140218_160000_This_Hour_With_Berman_and_Michaela.thumbs/CNNW_20140218_160000_This_Hour_With_Berman_and_Michaela_002148.jpg,"produces more oil here at home than we buy from other countries. all levels of dangerous carbon pollution that contributes to climate change has gone down even as our production has gone up. one of the reasons why is"
https://archive.org/details/CNNW_20140219_232800_Crossfire#start/1039/end/1074,2/19/2014 23:45:34,CNN,Crossfire,CNNW_20140219_232800_Crossfire,https://archive.org/download/CNNW_20140219_232800_Crossfire/CNNW_20140219_232800_Crossfire.thumbs/CNNW_20140219_232800_Crossfire_001006.jpg,"call to action on climate change and we're also debating newt gingrich's call for him to resign. now here's a good question. should serious people focus on global political instability, terrorism, failing states, nuclear weapons or should we"
https://archive.org/details/CNNW_20140219_232800_Crossfire#start/1874/end/1909,2/19/2014 23:59:29,CNN,Crossfire,CNNW_20140219_232800_Crossfire,https://archive.org/download/CNNW_20140219_232800_Crossfire/CNNW_20140219_232800_Crossfire.thumbs/CNNW_20140219_232800_Crossfire_001846.jpg,"twitter. do you agree with secretary of state's assertion -- kerry's assertion that the climate change is perhaps the most fierce some weapon of mass destruction 567892% say yes, 48% say no. i think that's where the country"
https://archive.org/details/CNNW_20140223_110000_New_Day_Sunday#start/3206/end/3241,2/23/2014 11:53:41,CNN,New Day Sunday,CNNW_20140223_110000_New_Day_Sunday,https://archive.org/download/CNNW_20140223_110000_New_Day_Sunday/CNNW_20140223_110000_New_Day_Sunday.thumbs/CNNW_20140223_110000_New_Day_Sunday_001395.jpg,"his executive power when congress won't act. this time on climate change. what if the epa went too far. when without congressional approval it limited carbon approval from power plants and factories beyond cars and trucks. on the constitutional side,"
https://archive.org/details/CNNW_20140224_140000_CNN_Newsroom#start/5553/end/5588,2/24/2014 15:32:48,CNN,CNN Newsroom,CNNW_20140224_140000_CNN_Newsroom,https://archive.org/download/CNNW_20140224_140000_CNN_Newsroom/CNNW_20140224_140000_CNN_Newsroom.thumbs/CNNW_20140224_140000_CNN_Newsroom_005535.jpg,"it is real and we, in part, are to blame. why are there so many climate change deniers out there. we'll talk about that next. [ male announcer ] whether it takes 200000 parts, 800000 hours of supercomputing time, 3 million lines of code,"
https://archive.org/details/CNNW_20140224_140000_CNN_Newsroom#start/5895/end/5930,2/24/2014 15:38:30,CNN,CNN Newsroom,CNNW_20140224_140000_CNN_Newsroom,https://archive.org/download/CNNW_20140224_140000_CNN_Newsroom/CNNW_20140224_140000_CNN_Newsroom.thumbs/CNNW_20140224_140000_CNN_Newsroom_005895.jpg,"it is human cause and a very serious problem. about a quarter are concerned about climate change. they think it is happening and human caused and serious but think the impacts are more distant. there is another quarter we call"
https://archive.org/details/CNNW_20140206_140000_CNN_Newsroom#start/1675/end/1710,2/6/2014 14:28:10,CNN,CNN Newsroom,CNNW_20140206_140000_CNN_Newsroom,https://archive.org/download/CNNW_20140206_140000_CNN_Newsroom/CNNW_20140206_140000_CNN_Newsroom.thumbs/CNNW_20140206_140000_CNN_Newsroom_001665.jpg,"saving lives from hiv/aids to combating climate change so that we can preserve god's incredible creation on all these issues, faith leaders and faith organizations here in the united states and around the world are incredible partners and we're"
https://archive.org/details/CNNW_20140221_220000_The_Situation_Room#start/1992/end/2027,2/21/2014 22:33:27,CNN,The Situation Room,CNNW_20140221_220000_The_Situation_Room,https://archive.org/download/CNNW_20140221_220000_The_Situation_Room/CNNW_20140221_220000_The_Situation_Room.thumbs/CNNW_20140221_220000_The_Situation_Room_001965.jpg,"apologize and nugent sort of apologized. leadership. i like that. rand paul did the right thing. up next, climate change controversy. sent for ted cruz talks exclusive to cnn and calls out the secretary of state john kerry. plus, venezuela is being cr"
https://archive.org/details/CNNW_20140205_020000_Piers_Morgan_Live#start/3033/end/3068,2/5/2014 2:50:48,CNN,Piers Morgan Live,CNNW_20140205_020000_Piers_Morgan_Live,https://archive.org/download/CNNW_20140205_020000_Piers_Morgan_Live/CNNW_20140205_020000_Piers_Morgan_Live.thumbs/CNNW_20140205_020000_Piers_Morgan_Live_003015.jpg,"extreme heat events can be tied to climate change. so when more heat energy is in the atmosphere, you expect more storms. if i can say -- ken, let me ask you this. this is what concerns me about this whole debate."
https://archive.org/details/CNNW_20140205_020000_Piers_Morgan_Live#start/3115/end/3150,2/5/2014 2:52:10,CNN,Piers Morgan Live,CNNW_20140205_020000_Piers_Morgan_Live,https://archive.org/download/CNNW_20140205_020000_Piers_Morgan_Live/CNNW_20140205_020000_Piers_Morgan_Live.thumbs/CNNW_20140205_020000_Piers_Morgan_Live_003105.jpg,"one of the emphasis i brought tonight is we need to talk about talking about the fact and observational science and the present. if we're going to talk about climate change, we need to talk about that. we've got records of"
https://archive.org/details/CNNW_20140215_200000_CNN_Newsroom#start/4493/end/4528,2/15/2014 21:15:08,CNN,CNN Newsroom,CNNW_20140215_200000_CNN_Newsroom,https://archive.org/download/CNNW_20140215_200000_CNN_Newsroom/CNNW_20140215_200000_CNN_Newsroom.thumbs/CNNW_20140215_200000_CNN_Newsroom_004485.jpg,"question. if we did, we would have a much more skillful prediction in the longer time scale say out to one to two months. reporter: another mystery, whether all of this is connected to climate change or not. the centers of environmental"
https://archive.org/details/CNNW_20140215_160000_CNN_Newsroom#start/5239/end/5274,2/15/2014 17:27:34,CNN,CNN Newsroom,CNNW_20140215_160000_CNN_Newsroom,https://archive.org/download/CNNW_20140215_160000_CNN_Newsroom/CNNW_20140215_160000_CNN_Newsroom.thumbs/CNNW_20140215_160000_CNN_Newsroom_005235.jpg,"much more skillful prediction in the longer time scale, say, out to 1 to 2 months. reporter: another mystery? whether this is all connected to climate change or not. they're still trying to crack that code trying to find out if"
https://archive.org/details/CNNW_20140219_232800_Crossfire#start/208/end/243,2/19/2014 23:31:43,CNN,Crossfire,CNNW_20140219_232800_Crossfire,https://archive.org/download/CNNW_20140219_232800_Crossfire/CNNW_20140219_232800_Crossfire.thumbs/CNNW_20140219_232800_Crossfire_000196.jpg,"weapons, to suggest that global climate change is anything comparable to the threat of nuclear weapons? i use the word 'delusional' deliberately. it's really out of touch with the real world. the pentagon disagrees with you. there's a guy named newt"
https://archive.org/details/CNNW_20140219_232800_Crossfire#start/567/end/602,2/19/2014 23:37:42,CNN,Crossfire,CNNW_20140219_232800_Crossfire,https://archive.org/download/CNNW_20140219_232800_Crossfire/CNNW_20140219_232800_Crossfire.thumbs/CNNW_20140219_232800_Crossfire_000556.jpg,"united states senate should there be binding limits as kyoto suggested the climate change on carbon emissions. no, the u.s. should sign no treaty with binding limits. one of those senators was john kerry. now he's secretary of state, he"
https://archive.org/details/CNNW_20140218_160000_This_Hour_With_Berman_and_Michaela#start/1579/end/1614,2/18/2014 16:26:34,CNN,This Hour With Berman and Michaela,CNNW_20140218_160000_This_Hour_With_Berman_and_Michaela,https://archive.org/download/CNNW_20140218_160000_This_Hour_With_Berman_and_Michaela/CNNW_20140218_160000_This_Hour_With_Berman_and_Michaela.thumbs/CNNW_20140218_160000_This_Hour_With_Berman_and_Michaela_001578.jpg,"challenge of climate change. these rules are the next phase of an effort that began back in 2010 and 2011, when the administration first announced these new standards for trucks. those were for models 2014-2018."
https://archive.org/details/CNNW_20140219_232800_Crossfire#start/1100/end/1135,2/19/2014 23:46:35,CNN,Crossfire,CNNW_20140219_232800_Crossfire,https://archive.org/download/CNNW_20140219_232800_Crossfire/CNNW_20140219_232800_Crossfire.thumbs/CNNW_20140219_232800_Crossfire_001096.jpg,"i want to start with you. let's just go back to this point about the pentagon and its concern. you don't deny that the science of climate change. you believe that something could be happening here. we should take it seriously."
https://archive.org/details/CNNW_20140219_190000_CNN_Newsroom#start/5973/end/6008,2/19/2014 20:39:48,CNN,CNN Newsroom,CNNW_20140219_190000_CNN_Newsroom,https://archive.org/download/CNNW_20140219_190000_CNN_Newsroom/CNNW_20140219_190000_CNN_Newsroom.thumbs/CNNW_20140219_190000_CNN_Newsroom_005955.jpg,"john kerry? the pentagon. the cia. they all say that climate change is a major threat to national security. everybody in the pentagon should resign as well. ben jones and newt gingrich, we will have to have part two. we will tonight."
https://archive.org/details/CNNW_20140218_110000_New_Day#start/5343/end/5378,2/18/2014 12:29:18,CNN,New Day,CNNW_20140218_110000_New_Day,https://archive.org/download/CNNW_20140218_110000_New_Day/CNNW_20140218_110000_New_Day.thumbs/CNNW_20140218_110000_New_Day_005325.jpg,"slaughtering tens of thousands of people? can we sit by? we have done it so far. we have a secretary of state saying climate change is the worst weapon of mass destruction and he's sitting by watching assad doing what's he's doing."
