URL,MatchDateTime,Station,Show,IAShowID,IAPreviewThumb,Snippet
https://archive.org/details/CNNW_20150322_180000_CNN_Newsroom_With_Poppy_Harlow#start/10999/end/11034,3/22/2015 21:03:34,CNN,CNN Newsroom With Poppy Harlow,CNNW_20150322_180000_CNN_Newsroom_With_Poppy_Harlow,https://archive.org/download/CNNW_20150322_180000_CNN_Newsroom_With_Poppy_Harlow/CNNW_20150322_180000_CNN_Newsroom_With_Poppy_Harlow.thumbs/CNNW_20150322_180000_CNN_Newsroom_With_Poppy_Harlow_010996.jpg,"made change but also be shown how to be false. wait are you saying -- hold on. what the costs are associated -- are you saying the science is not behind climate change. no the climb is changing -- are you saying that science is not behind global warming."
https://archive.org/details/CNNW_20150314_140000_CNN_Newsroom#start/305/end/340,3/14/2015 14:05:20,CNN,CNN Newsroom,CNNW_20150314_140000_CNN_Newsroom,https://archive.org/download/CNNW_20150314_140000_CNN_Newsroom/CNNW_20150314_140000_CNN_Newsroom.thumbs/CNNW_20150314_140000_CNN_Newsroom_000285.jpg,"watch. there is an alarming number of americans who are skeptical it's even happening and that island nations see this as an easy way to get extra money. what is the reality when it comes to climate change for an"
https://archive.org/details/CNNW_20150309_140000_CNN_Newsroom_With_Carol_Costello#start/2215/end/2250,3/9/2015 14:37:10,CNN,CNN Newsroom With Carol Costello,CNNW_20150309_140000_CNN_Newsroom_With_Carol_Costello,https://archive.org/download/CNNW_20150309_140000_CNN_Newsroom_With_Carol_Costello/CNNW_20150309_140000_CNN_Newsroom_With_Carol_Costello.thumbs/CNNW_20150309_140000_CNN_Newsroom_With_Carol_Costello_002205.jpg,"climate change and global warming in e-mails reporting or any other official communication. the florida center for investigative reporting says the unwritten policy went into effect after governor rick scott went into office in 2011."
https://archive.org/details/CNNW_20150322_090000_CNNI_Simulcast#start/1606/end/1641,3/22/2015 9:27:01,CNN,CNNI Simulcast,CNNW_20150322_090000_CNNI_Simulcast,https://archive.org/download/CNNW_20150322_090000_CNNI_Simulcast/CNNW_20150322_090000_CNNI_Simulcast.thumbs/CNNW_20150322_090000_CNNI_Simulcast_001605.jpg,"so something we're going to be monitoring going forward. just a brief sign there of global climate change and global warming as well. isa? you're running a marathon after doing this shift, is that right? running a marathon after i do"
https://archive.org/details/CNNW_20150323_100000_New_Day#start/1438/end/1473,3/23/2015 10:24:13,CNN,New Day,CNNW_20150323_100000_New_Day,https://archive.org/download/CNNW_20150323_100000_New_Day/CNNW_20150323_100000_New_Day.thumbs/CNNW_20150323_100000_New_Day_001425.jpg,"science doesn't back them up. my 9-year-old knows from 3rd grade science just because it's cold doesn't mean there is no global warming. dershowitz says he is the"
https://archive.org/details/CNNW_20150322_180000_CNN_Newsroom_With_Poppy_Harlow#start/10981/end/11016,3/22/2015 21:03:16,CNN,CNN Newsroom With Poppy Harlow,CNNW_20150322_180000_CNN_Newsroom_With_Poppy_Harlow,https://archive.org/download/CNNW_20150322_180000_CNN_Newsroom_With_Poppy_Harlow/CNNW_20150322_180000_CNN_Newsroom_With_Poppy_Harlow.thumbs/CNNW_20150322_180000_CNN_Newsroom_With_Poppy_Harlow_010966.jpg,"elf of global warming. today california's governor jerry brown came out and pointed at those comments saying that makes him unfit for office. as people see a lot of the pribz"
https://archive.org/details/CNNW_20150320_210000_The_Situation_Room#start/6906/end/6941,3/20/2015 22:55:21,CNN,The Situation Room,CNNW_20150320_210000_The_Situation_Room,https://archive.org/download/CNNW_20150320_210000_The_Situation_Room/CNNW_20150320_210000_The_Situation_Room.thumbs/CNNW_20150320_210000_The_Situation_Room_006886.jpg,"he's heading to iowa in may to fire up the activists about global warming. is that -- al gore. possible that al gore might think about running against hillary clinton. i don't think al gore has"
https://archive.org/details/CNNW_20150320_210000_The_Situation_Room#start/6970/end/7005,3/20/2015 22:56:25,CNN,The Situation Room,CNNW_20150320_210000_The_Situation_Room,https://archive.org/download/CNNW_20150320_210000_The_Situation_Room/CNNW_20150320_210000_The_Situation_Room.thumbs/CNNW_20150320_210000_The_Situation_Room_006946.jpg,"conference to support him on his global warming effort. a friend said he's enjoying the speculation giving interviews but i'm with gloria i don't think we'll get a gore. you also mentioned john kerry's name. he hasn't ruled it out."
https://archive.org/details/CNNW_20150324_000000_Anderson_Cooper_360#start/3963/end/3998,3/24/2015 1:06:18,CNN,Anderson Cooper 360,CNNW_20150324_000000_Anderson_Cooper_360,https://archive.org/download/CNNW_20150324_000000_Anderson_Cooper_360/CNNW_20150324_000000_Anderson_Cooper_360.thumbs/CNNW_20150324_000000_Anderson_Cooper_360_003945.jpg,"senator cruz made the announcement at liberty university. he vowed to repeal every single word of the affordable care act, 3r078 sing to abolish the irs, and mocking the notion of global warming. it's the kind of mix that wins"
https://archive.org/details/CNNW_20150323_230000_Erin_Burnett_OutFront#start/2434/end/2469,3/23/2015 23:40:49,CNN,Erin Burnett OutFront,CNNW_20150323_230000_Erin_Burnett_OutFront,https://archive.org/download/CNNW_20150323_230000_Erin_Burnett_OutFront/CNNW_20150323_230000_Erin_Burnett_OutFront.thumbs/CNNW_20150323_230000_Erin_Burnett_OutFront_002416.jpg,"hampshire where there's snow and ice everywhere. my view actually is simple. debates on this should follow science and should follow data. and many of the alarmists on global warming, they've got a problem because the science doesn't back them up."
https://archive.org/details/CNNW_20150320_200000_The_Lead_With_Jake_Tapper#start/2306/end/2341,3/20/2015 20:38:41,CNN,The Lead With Jake Tapper,CNNW_20150320_200000_The_Lead_With_Jake_Tapper,https://archive.org/download/CNNW_20150320_200000_The_Lead_With_Jake_Tapper/CNNW_20150320_200000_The_Lead_With_Jake_Tapper.thumbs/CNNW_20150320_200000_The_Lead_With_Jake_Tapper_002295.jpg,"a competition. he's heading to iowa in may to fire up activists about global warming. there's a lot of chatter recently in some democratic circles about a gore return but i'm told by a person close to the former vice president he has"
https://archive.org/details/CNNW_20150304_110000_New_Day#start/1630/end/1665,3/4/2015 11:27:25,CNN,New Day,CNNW_20150304_110000_New_Day,https://archive.org/download/CNNW_20150304_110000_New_Day/CNNW_20150304_110000_New_Day.thumbs/CNNW_20150304_110000_New_Day_001606.jpg,"advocate for whether it's evolution or global warming or sexuality, that science may not be as strong as people think it is on the left. is the implicit thing, but he is known as such a clinician and a scientist. so emboldens."
https://archive.org/details/CNNW_20150323_100000_New_Day#start/1423/end/1458,3/23/2015 10:23:58,CNN,New Day,CNNW_20150323_100000_New_Day,https://archive.org/download/CNNW_20150323_100000_New_Day/CNNW_20150323_100000_New_Day.thumbs/CNNW_20150323_100000_New_Day_001425.jpg,"i just came back from new hampshire where there is snow and ice everywhere. my view is simple. debates on this should follow science and should follow data and many of the alarmists on global warming. they got a problem because the"
https://archive.org/details/CNNW_20150324_000000_Anderson_Cooper_360#start/977/end/1012,3/24/2015 0:16:32,CNN,Anderson Cooper 360,CNNW_20150324_000000_Anderson_Cooper_360,https://archive.org/download/CNNW_20150324_000000_Anderson_Cooper_360/CNNW_20150324_000000_Anderson_Cooper_360.thumbs/CNNW_20150324_000000_Anderson_Cooper_360_000975.jpg,"regarded by the gop and the general public. he's a tea party firebrand. obamacare is a train wreck. we're seeing our constitutional rights under assault. reporter: a climate change skeptic. there's snow and ice"
https://archive.org/details/CNNW_20150323_210000_The_Situation_Room#start/6990/end/7025,3/23/2015 22:56:45,CNN,The Situation Room,CNNW_20150323_210000_The_Situation_Room,https://archive.org/download/CNNW_20150323_210000_The_Situation_Room/CNNW_20150323_210000_The_Situation_Room.thumbs/CNNW_20150323_210000_The_Situation_Room_006975.jpg,"conservative whether it means denying climate change overruling obamacare, fighting immigration reform all of that is just find because a pure message will beat a moderate message, so he says. jeff zelany you're there on"
https://archive.org/details/CNNW_20150315_150000_Reliable_Sources#start/2563/end/2598,3/15/2015 15:42:58,CNN,Reliable Sources,CNNW_20150315_150000_Reliable_Sources,https://archive.org/download/CNNW_20150315_150000_Reliable_Sources/CNNW_20150315_150000_Reliable_Sources.thumbs/CNNW_20150315_150000_Reliable_Sources_002565.jpg,"kmbt. thanks for being here. my pleasure. we talked about stories like climate change having two sides. this is different. this has many many many sides. there are many angles on topics as complex as race arrests."
https://archive.org/details/CNNW_20150309_140000_CNN_Newsroom_With_Carol_Costello#start/2200/end/2235,3/9/2015 14:36:55,CNN,CNN Newsroom With Carol Costello,CNNW_20150309_140000_CNN_Newsroom_With_Carol_Costello,https://archive.org/download/CNNW_20150309_140000_CNN_Newsroom_With_Carol_Costello/CNNW_20150309_140000_CNN_Newsroom_With_Carol_Costello.thumbs/CNNW_20150309_140000_CNN_Newsroom_With_Carol_Costello_002175.jpg,"handiwork. the last person to deface the amphitheater was fined $25000. the state of florida is not acknowledging climate change at least not in official correspondence. according to a new report the florida department of environmental protection is banned from using the terms"
https://archive.org/details/CNNW_20150317_200000_The_Lead_With_Jake_Tapper#start/2568/end/2603,3/17/2015 20:43:03,CNN,The Lead With Jake Tapper,CNNW_20150317_200000_The_Lead_With_Jake_Tapper,https://archive.org/download/CNNW_20150317_200000_The_Lead_With_Jake_Tapper/CNNW_20150317_200000_The_Lead_With_Jake_Tapper.thumbs/CNNW_20150317_200000_The_Lead_With_Jake_Tapper_002566.jpg,"of congress. i said this to president obama in writing when he went to the climate change meeting. i have said this about the bush administration when they did the strategic framework agreement in iraq. i said it again to this"
https://archive.org/details/CNNW_20150314_220000_Smerconish#start/2929/end/2964,3/14/2015 22:49:04,CNN,Smerconish,CNNW_20150314_220000_Smerconish,https://archive.org/download/CNNW_20150314_220000_Smerconish/CNNW_20150314_220000_Smerconish.thumbs/CNNW_20150314_220000_Smerconish_002925.jpg,"an issue of major interest. people are worried about how we create millions of job, how we deal with income and wealth inequality how we deal with climate change how we deal with this disastrous citizens united a supreme court decision, i"
https://archive.org/details/CNNW_20150324_030000_Anderson_Cooper_360#start/996/end/1031,3/24/2015 3:16:51,CNN,Anderson Cooper 360,CNNW_20150324_030000_Anderson_Cooper_360,https://archive.org/download/CNNW_20150324_030000_Anderson_Cooper_360/CNNW_20150324_030000_Anderson_Cooper_360.thumbs/CNNW_20150324_030000_Anderson_Cooper_360_000976.jpg,"he's a tea party fire brand. obamacare is a train wreck. we are seeing our constitutional rights under assault. reporter: a climate change skeptic. i just came back from new hampshire where there is snow and ice everywhere and my view actually is pimple debates on"
https://archive.org/details/CNNW_20150314_220000_Smerconish#start/2990/end/3025,3/14/2015 22:50:05,CNN,Smerconish,CNNW_20150314_220000_Smerconish,https://archive.org/download/CNNW_20150314_220000_Smerconish/CNNW_20150314_220000_Smerconish.thumbs/CNNW_20150314_220000_Smerconish_002985.jpg,"climate change? yeah hillary's e-mails to my mind not much of an issue. senator, maybe your time has come with regard to the issues you champion. the issue of minimum wage seems right. the issue of problems for the middle class seems right. problems of health care and"
https://archive.org/details/CNNW_20150314_130000_Smerconish#start/3045/end/3080,3/14/2015 13:51:00,CNN,Smerconish,CNNW_20150314_130000_Smerconish,https://archive.org/download/CNNW_20150314_130000_Smerconish/CNNW_20150314_130000_Smerconish.thumbs/CNNW_20150314_130000_Smerconish_003045.jpg,"system to reverse climate change? so yeah hillary's e-mails to my mind not much of an issue. senator, maybe your time has come with regard to the issues you champion you know, the issue of mim mum wage seems right, the issue of problems for the middle class seems right,"
https://archive.org/details/CNNW_20150322_180000_CNN_Newsroom_With_Poppy_Harlow#start/11015/end/11050,3/22/2015 21:03:50,CNN,CNN Newsroom With Poppy Harlow,CNNW_20150322_180000_CNN_Newsroom_With_Poppy_Harlow,https://archive.org/download/CNNW_20150322_180000_CNN_Newsroom_With_Poppy_Harlow/CNNW_20150322_180000_CNN_Newsroom_With_Poppy_Harlow.thumbs/CNNW_20150322_180000_CNN_Newsroom_With_Poppy_Harlow_010996.jpg,"they say climate change because they don't want to be tied to one direction or another. it is going up. and -- rather i should say it is changing. the issue then becoming what do you do about that? what is a realistic policy to actually address this issue that"
https://archive.org/details/CNNW_20150314_130000_Smerconish#start/2981/end/3016,3/14/2015 13:49:56,CNN,Smerconish,CNNW_20150314_130000_Smerconish,https://archive.org/download/CNNW_20150314_130000_Smerconish/CNNW_20150314_130000_Smerconish.thumbs/CNNW_20150314_130000_Smerconish_002955.jpg,"is interested in but i can tell you in vermont that i think around the rest of the country that is not an issue of major interest. people are worried about how we create millions of jobs how we deal with income and wealth inequality deal with climate change how we deal with the"
https://archive.org/details/CNNW_20150309_170000_Wolf#start/1478/end/1513,3/9/2015 17:24:53,CNN,Wolf,CNNW_20150309_170000_Wolf,https://archive.org/download/CNNW_20150309_170000_Wolf/CNNW_20150309_170000_Wolf.thumbs/CNNW_20150309_170000_Wolf_001456.jpg,"and another time to talk about climate change. no mention of the e-mails so far today. we're told by a source that her team considered this as a possible event for her to address this issue that is very much dogging her at this point. the issue of using just a"
