URL,MatchDateTime,Station,Show,IAShowID,IAPreviewThumb,Snippet
https://archive.org/details/FOXNEWSW_20121112_090000_The_Journal_Editorial_Report#start/2549/end/2584,11/12/2012 9:42:44,FOXNEWS,The Journal Editorial Report,FOXNEWSW_20121112_090000_The_Journal_Editorial_Report,https://archive.org/download/FOXNEWSW_20121112_090000_The_Journal_Editorial_Report/FOXNEWSW_20121112_090000_The_Journal_Editorial_Report.thumbs/FOXNEWSW_20121112_090000_The_Journal_Editorial_Report_002548.jpg,"that's what he means. and i would predict this, you will see floated during this term, a carbon tax idea. but something like immigration reform i think he could be serious. and you think that"
https://archive.org/details/FOXNEWSW_20121117_163000_Cashin_In#start/1026/end/1061,11/17/2012 16:47:21,FOXNEWS,Cashin In,FOXNEWSW_20121117_163000_Cashin_In,https://archive.org/download/FOXNEWSW_20121117_163000_Cashin_In/FOXNEWSW_20121117_163000_Cashin_In.thumbs/FOXNEWSW_20121117_163000_Cashin_In_001018.jpg,"jonathan -- that's like saying your motto needs to be fish baby fish, when we've whale oil being used to power electricity. we've got to advance somewhere. i agree with the carbon tax. you think carbon --  _"
https://archive.org/details/FOXNEWSW_20121121_050000_Hannity#start/3576/end/3611,11/21/2012 5:59:51,FOXNEWS,Hannity,FOXNEWSW_20121121_050000_Hannity,https://archive.org/download/FOXNEWSW_20121121_050000_Hannity/FOXNEWSW_20121121_050000_Hannity.thumbs/FOXNEWSW_20121121_050000_Hannity_003568.jpg,"organizations contacting me. around the world some very big ones and none of them have even suggested to use it in climate change or climate disruption."
https://archive.org/details/FOXNEWSW_20121121_020000_Hannity#start/3577/end/3612,11/21/2012 2:59:52,FOXNEWS,Hannity,FOXNEWSW_20121121_020000_Hannity,https://archive.org/download/FOXNEWSW_20121121_020000_Hannity/FOXNEWSW_20121121_020000_Hannity.thumbs/FOXNEWSW_20121121_020000_Hannity_003567.jpg,"organizations contacting me. around the world some very big ones and none of them have even suggested to use it in climate change or climate disruption."
https://archive.org/details/FOXNEWSW_20121124_163000_Cashin_In#start/1724/end/1759,11/24/2012 16:58:59,FOXNEWS,Cashin In,FOXNEWSW_20121124_163000_Cashin_In,https://archive.org/download/FOXNEWSW_20121124_163000_Cashin_In/FOXNEWSW_20121124_163000_Cashin_In.thumbs/FOXNEWSW_20121124_163000_Cashin_In_001558.jpg,"it is it time for what i need to know for next week. . >> we talk about al gore and the carbon tax no one is buying into it not evenlet cia. we'll see if it is taxpayer money .  _"
https://archive.org/details/FOXNEWSW_20121114_210000_Your_World_With_Neil_Cavuto#start/2756/end/2791,11/14/2012 21:46:11,FOXNEWS,Your World With Neil Cavuto,FOXNEWSW_20121114_210000_Your_World_With_Neil_Cavuto,https://archive.org/download/FOXNEWSW_20121114_210000_Your_World_With_Neil_Cavuto/FOXNEWSW_20121114_210000_Your_World_With_Neil_Cavuto.thumbs/FOXNEWSW_20121114_210000_Your_World_With_Neil_Cavuto_002758.jpg,"one gouging government to another area of gaming government. they just add gouging, right? guest: they do. i am talking the theoretical possibility of cutting something else in place of the carbon tax. the climate argument is absurd."
https://archive.org/details/FOXNEWSW_20121119_210000_Your_World_With_Neil_Cavuto#start/2621/end/2656,11/19/2012 21:43:56,FOXNEWS,Your World With Neil Cavuto,FOXNEWSW_20121119_210000_Your_World_With_Neil_Cavuto,https://archive.org/download/FOXNEWSW_20121119_210000_Your_World_With_Neil_Cavuto/FOXNEWSW_20121119_210000_Your_World_With_Neil_Cavuto.thumbs/FOXNEWSW_20121119_210000_Your_World_With_Neil_Cavuto_002607.jpg,"proposing it. stuart: the republicans the propose this? you might be right, the right would prefer a carbon tax to increased taxes on income and capital gains. guest: democrats will be willing to work with them."
https://archive.org/details/FOXNEWSW_20121101_210000_The_Five#start/2414/end/2449,11/1/2012 21:40:29,FOXNEWS,The Five,FOXNEWSW_20121101_210000_The_Five,https://archive.org/download/FOXNEWSW_20121101_210000_The_Five/FOXNEWSW_20121101_210000_The_Five.thumbs/FOXNEWSW_20121101_210000_The_Five_002398.jpg,"other voices, we never would have known about al gore's opinions about climate change during hurricane sandy. or get an amazing rebuttal from joe pistardi on 'o'reilly factor.'"
https://archive.org/details/FOXNEWSW_20121101_080000_The_OReilly_Factor#start/3113/end/3148,11/1/2012 8:52:08,FOXNEWS,The OReilly Factor,FOXNEWSW_20121101_080000_The_OReilly_Factor,https://archive.org/download/FOXNEWSW_20121101_080000_The_OReilly_Factor/FOXNEWSW_20121101_080000_The_OReilly_Factor.thumbs/FOXNEWSW_20121101_080000_The_OReilly_Factor_003087.jpg,"saying. four things, we have sea level rise caused by climate change that is making storm surges worse. three, we have the situation where sea level rise is"
https://archive.org/details/FOXNEWSW_20121101_000000_The_OReilly_Factor#start/3115/end/3150,11/1/2012 0:52:10,FOXNEWS,The OReilly Factor,FOXNEWSW_20121101_000000_The_OReilly_Factor,https://archive.org/download/FOXNEWSW_20121101_000000_The_OReilly_Factor/FOXNEWSW_20121101_000000_The_OReilly_Factor.thumbs/FOXNEWSW_20121101_000000_The_OReilly_Factor_003087.jpg,"scientists who study this are saying. four things, we have sea level rise caused by climate change that is making storm surges worse. three, we have the situation"
https://archive.org/details/FOXNEWSW_20121108_110000_FOX_and_Friends#start/8730/end/8765,11/8/2012 13:25:45,FOXNEWS,FOX and Friends,FOXNEWSW_20121108_110000_FOX_and_Friends,https://archive.org/download/FOXNEWSW_20121108_110000_FOX_and_Friends/FOXNEWSW_20121108_110000_FOX_and_Friends.thumbs/FOXNEWSW_20121108_110000_FOX_and_Friends_008727.jpg,"don't put in political supreme court justices? do we say okay, yeah, we're going to do global warming, but at the same time we're not going to do the deficit the way the president wants to have it done? do people walk away from what"
https://archive.org/details/FOXNEWSW_20121107_140000_Americas_Election_Headquarters#start/4767/end/4802,11/7/2012 15:19:42,FOXNEWS,Americas Election Headquarters,FOXNEWSW_20121107_140000_Americas_Election_Headquarters,https://archive.org/download/FOXNEWSW_20121107_140000_Americas_Election_Headquarters/FOXNEWSW_20121107_140000_Americas_Election_Headquarters.thumbs/FOXNEWSW_20121107_140000_Americas_Election_Headquarters_004767.jpg,"global warming is one thing he wants to address. that is not an issue at this point. i think the president wants to unify the country but it's not how he ran this campaign. this was not a campaign on teams to reunite the country."
https://archive.org/details/FOXNEWSW_20121101_080000_The_OReilly_Factor#start/48/end/83,11/1/2012 8:01:03,FOXNEWS,The OReilly Factor,FOXNEWSW_20121101_080000_The_OReilly_Factor,https://archive.org/download/FOXNEWSW_20121101_080000_The_OReilly_Factor/FOXNEWSW_20121101_080000_The_OReilly_Factor.thumbs/FOXNEWSW_20121101_080000_The_OReilly_Factor_000027.jpg,"a part of manhattan has been shut down. bill: al gore blaming hurricane sandy on global warming and the far left using the warming issue in the presidential campaign. we'll have two opposing points of view on this. the chinese who now own big"
https://archive.org/details/FOXNEWSW_20121115_010000_The_OReilly_Factor#start/391/end/426,11/15/2012 1:06:46,FOXNEWS,The OReilly Factor,FOXNEWSW_20121115_010000_The_OReilly_Factor,https://archive.org/download/FOXNEWSW_20121115_010000_The_OReilly_Factor/FOXNEWSW_20121115_010000_The_OReilly_Factor.thumbs/FOXNEWSW_20121115_010000_The_OReilly_Factor_000388.jpg,"immigration reform done. just like he was four years ago. the 'new york times' asked the president about global warming. he said he is going to do everything he can to cool down this planet because our kids and grand kids deserve it or"
https://archive.org/details/FOXNEWSW_20121101_030000_The_OReilly_Factor#start/47/end/82,11/1/2012 3:01:02,FOXNEWS,The OReilly Factor,FOXNEWSW_20121101_030000_The_OReilly_Factor,https://archive.org/download/FOXNEWSW_20121101_030000_The_OReilly_Factor/FOXNEWSW_20121101_030000_The_OReilly_Factor.thumbs/FOXNEWSW_20121101_030000_The_OReilly_Factor_000028.jpg,"second time in two years that a part of manhattan has been shut down. bill: al gore blaming hurricane sandy on global warming and the far left using the warming issue in the presidential campaign. we'll have two opposing points of view on this."
https://archive.org/details/FOXNEWSW_20121101_030000_The_OReilly_Factor#start/2195/end/2230,11/1/2012 3:36:50,FOXNEWS,The OReilly Factor,FOXNEWSW_20121101_030000_The_OReilly_Factor,https://archive.org/download/FOXNEWSW_20121101_030000_The_OReilly_Factor/FOXNEWSW_20121101_030000_The_OReilly_Factor.thumbs/FOXNEWSW_20121101_030000_The_OReilly_Factor_002188.jpg,"but, among married women romney has surged ahead 52 to 42 over the president. come right back, dennis miller does not approve of mr. obama. he will assess the election as he sees it right now. global warming devastate the northeast this week in the"
https://archive.org/details/FOXNEWSW_20121101_030000_The_OReilly_Factor#start/2999/end/3034,11/1/2012 3:50:14,FOXNEWS,The OReilly Factor,FOXNEWSW_20121101_030000_The_OReilly_Factor,https://archive.org/download/FOXNEWSW_20121101_030000_The_OReilly_Factor/FOXNEWSW_20121101_030000_The_OReilly_Factor.thumbs/FOXNEWSW_20121101_030000_The_OReilly_Factor_002878.jpg,"back of the book segment tonight, it's predictable al gore jumped on the hurricane sandy story to promote global warming. the storms are getting stronger. the stronger storms are getting more frequent. and you know, this is the second time in two years that"
https://archive.org/details/FOXNEWSW_20121105_110000_FOX_and_Friends#start/4208/end/4243,11/5/2012 12:10:23,FOXNEWS,FOX and Friends,FOXNEWSW_20121105_110000_FOX_and_Friends,https://archive.org/download/FOXNEWSW_20121105_110000_FOX_and_Friends/FOXNEWSW_20121105_110000_FOX_and_Friends.thumbs/FOXNEWSW_20121105_110000_FOX_and_Friends_004198.jpg,"light because you hear so much about global warming. tonight is very, very cold. today is very, very cold. and we're really going through an unbelievable cold spell right now, which is going to be horrible for those people. they have to get taken care of"
https://archive.org/details/FOXNEWSW_20121101_210000_The_Five#start/2522/end/2557,11/1/2012 21:42:17,FOXNEWS,The Five,FOXNEWSW_20121101_210000_The_Five,https://archive.org/download/FOXNEWSW_20121101_210000_The_Five/FOXNEWSW_20121101_210000_The_Five.thumbs/FOXNEWSW_20121101_210000_The_Five_002518.jpg,"so one would sea rising, three is sea rising, causing storm surge, number two. and four, we don't know anything. that is the greatest climate change expert i have ever heard."
https://archive.org/details/FOXNEWSW_20121114_180000_America_Live#start/4643/end/4678,11/14/2012 19:17:38,FOXNEWS,America Live,FOXNEWSW_20121114_180000_America_Live,https://archive.org/download/FOXNEWSW_20121114_180000_America_Live/FOXNEWSW_20121114_180000_America_Live.thumbs/FOXNEWSW_20121114_180000_America_Live_004618.jpg,"as you know, mark, we can't attribute any particular weather event to climate change. what we do know is the temperature around the globes increasing. faster than was predicted even"
https://archive.org/details/FOXNEWSW_20121101_030000_The_OReilly_Factor#start/3106/end/3141,11/1/2012 3:52:01,FOXNEWS,The OReilly Factor,FOXNEWSW_20121101_030000_The_OReilly_Factor,https://archive.org/download/FOXNEWSW_20121101_030000_The_OReilly_Factor/FOXNEWSW_20121101_030000_The_OReilly_Factor.thumbs/FOXNEWSW_20121101_030000_The_OReilly_Factor_003088.jpg,"bill: doctor, you say? first, let's look at what scientists who study this are saying. four things, we have sea level rise caused by climate change that is making storm surges"
https://archive.org/details/FOXNEWSW_20121110_190000_The_Journal_Editorial_Report#start/2554/end/2589,11/10/2012 19:42:49,FOXNEWS,The Journal Editorial Report,FOXNEWSW_20121110_190000_The_Journal_Editorial_Report,https://archive.org/download/FOXNEWSW_20121110_190000_The_Journal_Editorial_Report/FOXNEWSW_20121110_190000_The_Journal_Editorial_Report.thumbs/FOXNEWSW_20121110_190000_The_Journal_Editorial_Report_002548.jpg,"this term, a carbon tax idea. but something like immigration reform i think he could be serious. and you think that republicans-- kim, would republicans be willing to work with the president on immigration reform? there's a lot of bad feeling"
https://archive.org/details/FOXNEWSW_20121111_040000_The_Journal_Editorial_Report#start/2554/end/2589,11/11/2012 4:42:49,FOXNEWS,The Journal Editorial Report,FOXNEWSW_20121111_040000_The_Journal_Editorial_Report,https://archive.org/download/FOXNEWSW_20121111_040000_The_Journal_Editorial_Report/FOXNEWSW_20121111_040000_The_Journal_Editorial_Report.thumbs/FOXNEWSW_20121111_040000_The_Journal_Editorial_Report_002547.jpg,"you will see floated during this term, a carbon tax idea. but something like immigration reform i think he could be serious. and you think that republicans-- kim, would republicans be willing to work with the president on immigration reform?"
https://archive.org/details/FOXNEWSW_20121113_160000_Happening_Now#start/1162/end/1197,11/13/2012 16:19:37,FOXNEWS,Happening Now,FOXNEWSW_20121113_160000_Happening_Now,https://archive.org/download/FOXNEWSW_20121113_160000_Happening_Now/FOXNEWSW_20121113_160000_Happening_Now.thumbs/FOXNEWSW_20121113_160000_Happening_Now_001138.jpg,"you're also seeing the epa with emission standards and still talk after carbon tax as well, jenna. so we'll be watching this one closely. the oil and gas industry still faces some hurdles to be fully, reach the potential that it could, if"
https://archive.org/details/FOXNEWSW_20121126_210000_Your_World_With_Neil_Cavuto#start/1509/end/1544,11/26/2012 21:25:24,FOXNEWS,Your World With Neil Cavuto,FOXNEWSW_20121126_210000_Your_World_With_Neil_Cavuto,https://archive.org/download/FOXNEWSW_20121126_210000_Your_World_With_Neil_Cavuto/FOXNEWSW_20121126_210000_Your_World_With_Neil_Cavuto.thumbs/FOXNEWSW_20121126_210000_Your_World_With_Neil_Cavuto_001498.jpg,"hurricanes remain much worse but the idea of a carbon tax is being floated and the idea of regulations and climate measures we could take are going to impact our weather, this is now reaching a level of the mayan calendar for science."
https://archive.org/details/FOXNEWSW_20121101_000000_The_OReilly_Factor#start/2197/end/2232,11/1/2012 0:36:52,FOXNEWS,The OReilly Factor,FOXNEWSW_20121101_000000_The_OReilly_Factor,https://archive.org/download/FOXNEWSW_20121101_000000_The_OReilly_Factor/FOXNEWSW_20121101_000000_The_OReilly_Factor.thumbs/FOXNEWSW_20121101_000000_The_OReilly_Factor_002187.jpg,"but, among married women romney has surged ahead 52 to 42 over the president. come right back, dennis miller does not approve of mr. obama. he will assess the election as he sees it right now. global warming devastate the northeast this week in the form of sandy."
https://archive.org/details/FOXNEWSW_20121126_210000_Your_World_With_Neil_Cavuto#start/1394/end/1429,11/26/2012 21:23:29,FOXNEWS,Your World With Neil Cavuto,FOXNEWSW_20121126_210000_Your_World_With_Neil_Cavuto,https://archive.org/download/FOXNEWSW_20121126_210000_Your_World_With_Neil_Cavuto/FOXNEWSW_20121126_210000_Your_World_With_Neil_Cavuto.thumbs/FOXNEWSW_20121126_210000_Your_World_With_Neil_Cavuto_001378.jpg,"this is a primitive form of science. to use hurricane sandy as a poster child for global warming as the united nations and al gore is now doing, that makes as little sense as you can possibly imagine. we are at 30 or 40 years historic lows in activity and"
https://archive.org/details/FOXNEWSW_20121115_070000_The_Five#start/1822/end/1857,11/15/2012 7:30:37,FOXNEWS,The Five,FOXNEWSW_20121115_070000_The_Five,https://archive.org/download/FOXNEWSW_20121115_070000_The_Five/FOXNEWSW_20121115_070000_The_Five.thumbs/FOXNEWSW_20121115_070000_The_Five_001798.jpg,"greg: yes. it was, you know it was -- [over talk ] eric: al gore said sandy is climate change. kimberly: manipulated by people trying to take advantage of the -- okay. let me ask you."
https://archive.org/details/FOXNEWSW_20121114_220000_The_Five#start/1820/end/1855,11/14/2012 22:30:35,FOXNEWS,The Five,FOXNEWSW_20121114_220000_The_Five,https://archive.org/download/FOXNEWSW_20121114_220000_The_Five/FOXNEWSW_20121114_220000_The_Five.thumbs/FOXNEWSW_20121114_220000_The_Five_001797.jpg,"have been a series of things like a hot decade, right? greg: yes. it was, you know it was -- [over talk ] eric: al gore said sandy is climate change. kimberly: manipulated by"
https://archive.org/details/FOXNEWSW_20121130_080000_Red_Eye#start/851/end/886,11/30/2012 8:14:26,FOXNEWS,Red Eye,FOXNEWSW_20121130_080000_Red_Eye,https://archive.org/download/FOXNEWSW_20121130_080000_Red_Eye/FOXNEWSW_20121130_080000_Red_Eye.thumbs/FOXNEWSW_20121130_080000_Red_Eye_000838.jpg,"charles, let me ask you, the scientists say that instead of being concerned with the maya apocalypse, people should be concerned with threats to the planet like climate change. they are basically"
https://archive.org/details/FOXNEWSW_20121101_210000_The_Five#start/1101/end/1136,11/1/2012 21:18:36,FOXNEWS,The Five,FOXNEWSW_20121101_210000_The_Five,https://archive.org/download/FOXNEWSW_20121101_210000_The_Five/FOXNEWSW_20121101_210000_The_Five.thumbs/FOXNEWSW_20121101_210000_The_Five_001078.jpg,"bob: because of a hurricane. it's a god given phenomena. greg: i thought it was climate change. bob: it is. eric: greg points something out, the timing of this enforcement of president"
https://archive.org/details/FOXNEWSW_20121101_210000_The_Five#start/2491/end/2526,11/1/2012 21:41:46,FOXNEWS,The Five,FOXNEWSW_20121101_210000_The_Five,https://archive.org/download/FOXNEWSW_20121101_210000_The_Five/FOXNEWSW_20121101_210000_The_Five.thumbs/FOXNEWSW_20121101_210000_The_Five_002488.jpg,"four things. we have sea level rise, caused by climate change. that is making storm surges worse. we also have more severe rains and coastal flooding and three, we have the situation"
https://archive.org/details/FOXNEWSW_20121102_100000_FOX_and_Friends#start/1696/end/1731,11/2/2012 10:28:31,FOXNEWS,FOX and Friends,FOXNEWSW_20121102_100000_FOX_and_Friends,https://archive.org/download/FOXNEWSW_20121102_100000_FOX_and_Friends/FOXNEWSW_20121102_100000_FOX_and_Friends.thumbs/FOXNEWSW_20121102_100000_FOX_and_Friends_001677.jpg,"island. where is the federal government and michael bloomburg cozying up to president obama saying climate change is why he is epidorsing him? it is preposterous what is happen no one except folks"
https://archive.org/details/FOXNEWSW_20121102_210000_The_Five#start/144/end/179,11/2/2012 21:02:39,FOXNEWS,The Five,FOXNEWSW_20121102_210000_The_Five,https://archive.org/download/FOXNEWSW_20121102_210000_The_Five/FOXNEWSW_20121102_210000_The_Five.thumbs/FOXNEWSW_20121102_210000_The_Five_000148.jpg,"party. climate change, or fad diet of the american public. the world can survive with one less marathon. i don't think we should be sacrificing the help and safety of others to cater to"
https://archive.org/details/FOXNEWSW_20121115_070000_The_Five#start/1744/end/1779,11/15/2012 7:29:19,FOXNEWS,The Five,FOXNEWSW_20121115_070000_The_Five,https://archive.org/download/FOXNEWSW_20121115_070000_The_Five/FOXNEWSW_20121115_070000_The_Five.thumbs/FOXNEWSW_20121115_070000_The_Five_001738.jpg,"doubles down on programs and things to fight climate change. it's like when they say that gun ownership, studies will show that gun ownership doesn't lead to gun crime but they advocate gun control anyway."
https://archive.org/details/FOXNEWSW_20121103_060000_The_Five#start/144/end/179,11/3/2012 6:02:39,FOXNEWS,The Five,FOXNEWSW_20121103_060000_The_Five,https://archive.org/download/FOXNEWSW_20121103_060000_The_Five/FOXNEWSW_20121103_060000_The_Five.thumbs/FOXNEWSW_20121103_060000_The_Five_000148.jpg,"party. climate change, or fad diet of the american public. the world can survive with one less marathon. i don't think we should be sacrificing the help and safety of others to cater to"
https://archive.org/details/FOXNEWSW_20121102_100000_FOX_and_Friends#start/712/end/747,11/2/2012 10:12:07,FOXNEWS,FOX and Friends,FOXNEWSW_20121102_100000_FOX_and_Friends,https://archive.org/download/FOXNEWSW_20121102_100000_FOX_and_Friends/FOXNEWSW_20121102_100000_FOX_and_Friends.thumbs/FOXNEWSW_20121102_100000_FOX_and_Friends_000687.jpg,"president obama because of a climate change stance. that is crazy town. steve: we sound frustrate we are. there are reports here in new york city people don't have food they are dumpster dive"
https://archive.org/details/FOXNEWSW_20121101_080000_The_OReilly_Factor#start/3191/end/3226,11/1/2012 8:53:26,FOXNEWS,The OReilly Factor,FOXNEWSW_20121101_080000_The_OReilly_Factor,https://archive.org/download/FOXNEWSW_20121101_080000_The_OReilly_Factor/FOXNEWSW_20121101_080000_The_OReilly_Factor.thumbs/FOXNEWSW_20121101_080000_The_OReilly_Factor_003177.jpg,"we need our first responders to be -- if we do not protect our coastal citizens and ignore climate change, that means we may have insufficient coastal adaptation strategies. when i see a storm coming."
https://archive.org/details/FOXNEWSW_20121116_040000_The_OReilly_Factor#start/2738/end/2773,11/16/2012 4:45:53,FOXNEWS,The OReilly Factor,FOXNEWSW_20121116_040000_The_OReilly_Factor,https://archive.org/download/FOXNEWSW_20121116_040000_The_OReilly_Factor/FOXNEWSW_20121116_040000_The_OReilly_Factor.thumbs/FOXNEWSW_20121116_040000_The_OReilly_Factor_002728.jpg,"what's next tater tots on tuesdays. are they going to take away wienerless wednesdays? i did some research and say animal agriculture contributes to climate change and so when you, bill o'reilly, eat your"
https://archive.org/details/FOXNEWSW_20121102_060000_The_Five#start/2409/end/2444,11/2/2012 6:40:24,FOXNEWS,The Five,FOXNEWSW_20121102_060000_The_Five,https://archive.org/download/FOXNEWSW_20121102_060000_The_Five/FOXNEWSW_20121102_060000_The_Five.thumbs/FOXNEWSW_20121102_060000_The_Five_002398.jpg,"now. if there was no fox news, no other voices, we never would have known about al gore's opinions about climate change during hurricane sandy. or get an amazing rebuttal from joe pistardi on 'o'reilly"
https://archive.org/details/FOXNEWSW_20121102_060000_The_Five#start/2518/end/2553,11/2/2012 6:42:13,FOXNEWS,The Five,FOXNEWSW_20121102_060000_The_Five,https://archive.org/download/FOXNEWSW_20121102_060000_The_Five/FOXNEWSW_20121102_060000_The_Five.thumbs/FOXNEWSW_20121102_060000_The_Five_002518.jpg,"questions. greg: wait a second. so one would sea rising, three is sea rising, causing storm surge, number two. and four, we don't know anything. that is the greatest climate change expert i have ever"
https://archive.org/details/FOXNEWSW_20121116_090000_The_OReilly_Factor#start/2738/end/2773,11/16/2012 9:45:53,FOXNEWS,The OReilly Factor,FOXNEWSW_20121116_090000_The_OReilly_Factor,https://archive.org/download/FOXNEWSW_20121116_090000_The_OReilly_Factor/FOXNEWSW_20121116_090000_The_OReilly_Factor.thumbs/FOXNEWSW_20121116_090000_The_OReilly_Factor_002727.jpg,"what's next tater tots on tuesdays. are they going to take away wienerless wednesdays? i did some research and say animal agriculture contributes to climate change and so when you, bill o'reilly, eat your"
https://archive.org/details/FOXNEWSW_20121112_160000_Happening_Now#start/2835/end/2870,11/12/2012 16:47:30,FOXNEWS,Happening Now,FOXNEWSW_20121112_160000_Happening_Now,https://archive.org/download/FOXNEWSW_20121112_160000_Happening_Now/FOXNEWSW_20121112_160000_Happening_Now.thumbs/FOXNEWSW_20121112_160000_Happening_Now_002818.jpg,"to $7 a gallon. now they did back off that carbon tax. we know this administration would much rather power this economy with the energy technologies that won't be viable for 30, 40 years from now as opposed to driving the economy with what's"
https://archive.org/details/FOXNEWSW_20121112_070000_FOX_News_Sunday_With_Chris_Wallace#start/2403/end/2438,11/12/2012 7:40:18,FOXNEWS,FOX News Sunday With Chris Wallace,FOXNEWSW_20121112_070000_FOX_News_Sunday_With_Chris_Wallace,https://archive.org/download/FOXNEWSW_20121112_070000_FOX_News_Sunday_With_Chris_Wallace/FOXNEWSW_20121112_070000_FOX_News_Sunday_With_Chris_Wallace.thumbs/FOXNEWSW_20121112_070000_FOX_News_Sunday_With_Chris_Wallace_002397.jpg,"that. this time now with a second term without check he doubles down on the things he wants to do. i think he rams through an amnesty, immigration reform or whatever you call it. he goes further toward carbon tax. toward all sorts of other environmental regulations"
https://archive.org/details/FOXNEWSW_20121119_210000_Your_World_With_Neil_Cavuto#start/2530/end/2565,11/19/2012 21:42:25,FOXNEWS,Your World With Neil Cavuto,FOXNEWSW_20121119_210000_Your_World_With_Neil_Cavuto,https://archive.org/download/FOXNEWSW_20121119_210000_Your_World_With_Neil_Cavuto/FOXNEWSW_20121119_210000_Your_World_With_Neil_Cavuto.thumbs/FOXNEWSW_20121119_210000_Your_World_With_Neil_Cavuto_002517.jpg,"discussed by the congressional budget office is a payroll tax rebate for those in the lower income brackets so we shield the middle class and the poor from the effects of the tax while still getting the benefits of reduced carbon tax, rather, reduced carbon emission."
https://archive.org/details/FOXNEWSW_20121119_210000_Your_World_With_Neil_Cavuto#start/2605/end/2640,11/19/2012 21:43:40,FOXNEWS,Your World With Neil Cavuto,FOXNEWSW_20121119_210000_Your_World_With_Neil_Cavuto,https://archive.org/download/FOXNEWSW_20121119_210000_Your_World_With_Neil_Cavuto/FOXNEWSW_20121119_210000_Your_World_With_Neil_Cavuto.thumbs/FOXNEWSW_20121119_210000_Your_World_With_Neil_Cavuto_002607.jpg,"institute prefer the carbon tax to, for instance --. stuart: they prefer nothing. they do not want any tax but if they have to have one they want a straightforward tax. you think we will get it? guest: i do. it will be the republicans"
