URL,MatchDateTime,Station,Show,IAShowID,IAPreviewThumb,Snippet
https://archive.org/details/FOXNEWSW_20121117_163000_Cashin_In#start/868/end/903,11/17/2012 16:44:43,FOXNEWS,Cashin In,FOXNEWSW_20121117_163000_Cashin_In,https://archive.org/download/FOXNEWSW_20121117_163000_Cashin_In/FOXNEWSW_20121117_163000_Cashin_In.thumbs/FOXNEWSW_20121117_163000_Cashin_In_000868.jpg,"otherwise. that's a market failure. that's a market distortion. you need to fix that. but a well designed carbon tax has to be revenue neutral. it has to be offset with reductions and payroll tax which is is not part of our current fiscal discussion."
https://archive.org/details/FOXNEWSW_20121117_163000_Cashin_In#start/882/end/917,11/17/2012 16:44:57,FOXNEWS,Cashin In,FOXNEWSW_20121117_163000_Cashin_In,https://archive.org/download/FOXNEWSW_20121117_163000_Cashin_In/FOXNEWSW_20121117_163000_Cashin_In.thumbs/FOXNEWSW_20121117_163000_Cashin_In_000868.jpg,"so he's right about the policy, but really wrong about the timing. jonathan, they would have to accomplish that to hold back and not spend the revenues from a carbon tax or a vat tax on energy tax, take your pick. cheryl, what about man in all"
https://archive.org/details/FOXNEWSW_20121112_110000_FOX_and_Friends#start/5645/end/5680,11/12/2012 12:34:20,FOXNEWS,FOX and Friends,FOXNEWSW_20121112_110000_FOX_and_Friends,https://archive.org/download/FOXNEWSW_20121112_110000_FOX_and_Friends/FOXNEWSW_20121112_110000_FOX_and_Friends.thumbs/FOXNEWSW_20121112_110000_FOX_and_Friends_005638.jpg,"requirement. great. gretchen: tension coffee drinkers, your precious cup of joe could be in jeopardy. researchers say coffee beans are under threat from climate change. rising temperatures could wipe out up to 99% of wild arabica"
https://archive.org/details/FOXNEWSW_20121115_070000_The_Five#start/1697/end/1732,11/15/2012 7:28:32,FOXNEWS,The Five,FOXNEWSW_20121115_070000_The_Five,https://archive.org/download/FOXNEWSW_20121115_070000_The_Five/FOXNEWSW_20121115_070000_The_Five.thumbs/FOXNEWSW_20121115_070000_The_Five_000988.jpg,"press him on issues vital to all americans, national security, economy and taxes, but others did not. what specifically do you plan to do in the secondtorium tackle the issue of climate change? a do you think the political"
https://archive.org/details/FOXNEWSW_20121115_070000_The_Five#start/1713/end/1748,11/15/2012 7:28:48,FOXNEWS,The Five,FOXNEWSW_20121115_070000_The_Five,https://archive.org/download/FOXNEWSW_20121115_070000_The_Five/FOXNEWSW_20121115_070000_The_Five.thumbs/FOXNEWSW_20121115_070000_The_Five_001258.jpg,"will exists in washington to pass legislation that could include some kind of aa tax on carbon? you know, mark, we can't attribute any particular weather event to clim climate change. well, i guess he is giving"
https://archive.org/details/FOXNEWSW_20121103_060000_The_Five#start/535/end/570,11/3/2012 6:09:10,FOXNEWS,The Five,FOXNEWSW_20121103_060000_The_Five,https://archive.org/download/FOXNEWSW_20121103_060000_The_Five/FOXNEWSW_20121103_060000_The_Five.thumbs/FOXNEWSW_20121103_060000_The_Five_000508.jpg,"why didn't he take $5000 and send where it they needed it? greg: it's worse to politicize catastrophe to prove a point, like you did with climate change that any expert says you're wrong. bob: any expert?"
https://archive.org/details/FOXNEWSW_20121102_100000_FOX_and_Friends#start/682/end/717,11/2/2012 10:11:37,FOXNEWS,FOX and Friends,FOXNEWSW_20121102_100000_FOX_and_Friends,https://archive.org/download/FOXNEWSW_20121102_100000_FOX_and_Friends/FOXNEWSW_20121102_100000_FOX_and_Friends.thumbs/FOXNEWSW_20121102_100000_FOX_and_Friends_000657.jpg,"earned and made billions out of his own brilliance to pick climate change as the reason right now? that was related to the storm? eric: you know what that is related to? it was a deal that went down"
https://archive.org/details/FOXNEWSW_20121101_210000_The_Five#start/1039/end/1074,11/1/2012 21:17:34,FOXNEWS,The Five,FOXNEWSW_20121101_210000_The_Five,https://archive.org/download/FOXNEWSW_20121101_210000_The_Five/FOXNEWSW_20121101_210000_The_Five.thumbs/FOXNEWSW_20121101_210000_The_Five_001018.jpg,"i'm banning it later, he pivots. he piths. he endorses president obama on the basis of climate change. so he is actually using the election to talk about the weather. and in order to shift responsibility from his own"
https://archive.org/details/FOXNEWSW_20121114_180000_America_Live#start/4596/end/4631,11/14/2012 19:16:51,FOXNEWS,America Live,FOXNEWSW_20121114_180000_America_Live,https://archive.org/download/FOXNEWSW_20121114_180000_America_Live/FOXNEWSW_20121114_180000_America_Live.thumbs/FOXNEWSW_20121114_180000_America_Live_004588.jpg,"thank you, mr. president. in his endorsement of you a few weeks ago mayor bloomberg said he was motivated by the belief that you would do more to confront the threat of climate change than your oh point."
https://archive.org/details/FOXNEWSW_20121114_180000_America_Live#start/4838/end/4873,11/14/2012 19:20:53,FOXNEWS,America Live,FOXNEWSW_20121114_180000_America_Live,https://archive.org/download/FOXNEWSW_20121114_180000_America_Live/FOXNEWSW_20121114_180000_America_Live.thumbs/FOXNEWSW_20121114_180000_America_Live_004828.jpg,"but if we can shape an agenda that says we can create jobs, advance growth, and make a serious dent in climate change and be an international leader i think that's something the american people would support."
https://archive.org/details/FOXNEWSW_20121115_180000_America_Live#start/5423/end/5458,11/15/2012 19:30:38,FOXNEWS,America Live,FOXNEWSW_20121115_180000_America_Live,https://archive.org/download/FOXNEWSW_20121115_180000_America_Live/FOXNEWSW_20121115_180000_America_Live.thumbs/FOXNEWSW_20121115_180000_America_Live_005398.jpg,"why to media critics are asking if the white house press corps has lost its touch. what specifically do you plan to do to tackle the issue of climate change and do you think the political will exists in"
https://archive.org/details/FOXNEWSW_20121114_180000_America_Live#start/4822/end/4857,11/14/2012 19:20:37,FOXNEWS,America Live,FOXNEWSW_20121114_180000_America_Live,https://archive.org/download/FOXNEWSW_20121114_180000_America_Live/FOXNEWSW_20121114_180000_America_Live.thumbs/FOXNEWSW_20121114_180000_America_Live_004798.jpg,"and jobs and growth that if the message is somehow we are going to ignore jobs and growth simply to address climate change i don't think anybody is going to go for that. i won't go for that."
https://archive.org/details/FOXNEWSW_20121102_060000_The_Five#start/1038/end/1073,11/2/2012 6:17:33,FOXNEWS,The Five,FOXNEWSW_20121102_060000_The_Five,https://archive.org/download/FOXNEWSW_20121102_060000_The_Five/FOXNEWSW_20121102_060000_The_Five.thumbs/FOXNEWSW_20121102_060000_The_Five_001018.jpg,"i'm banning it later, he pivots. he piths. he endorses president obama on the basis of climate change. so he is actually using the election to talk about the weather. and in order to shift responsibility from his own"
https://archive.org/details/FOXNEWSW_20121102_060000_The_Five#start/1101/end/1136,11/2/2012 6:18:36,FOXNEWS,The Five,FOXNEWSW_20121102_060000_The_Five,https://archive.org/download/FOXNEWSW_20121102_060000_The_Five/FOXNEWSW_20121102_060000_The_Five.thumbs/FOXNEWSW_20121102_060000_The_Five_001078.jpg,"eric: a year ago. bob: because of a hurricane. it's a god given phenomena. greg: i thought it was climate change. bob: it is. eric: greg points something out, the timing of this enforcement of president"
https://archive.org/details/FOXNEWSW_20121115_040000_The_OReilly_Factor#start/1008/end/1043,11/15/2012 4:17:03,FOXNEWS,The OReilly Factor,FOXNEWSW_20121115_040000_The_OReilly_Factor,https://archive.org/download/FOXNEWSW_20121115_040000_The_OReilly_Factor/FOXNEWSW_20121115_040000_The_OReilly_Factor.thumbs/FOXNEWSW_20121115_040000_The_OReilly_Factor_000988.jpg,"too far to the left where he said i don't think that you can definitive can i say that hurricane sandy was definitely caused by global climate change. he pushed back on that one. i would have loved more questions about so what"
https://archive.org/details/FOXNEWSW_20121113_160000_Happening_Now#start/3344/end/3379,11/13/2012 16:55:59,FOXNEWS,Happening Now,FOXNEWSW_20121113_160000_Happening_Now,https://archive.org/download/FOXNEWSW_20121113_160000_Happening_Now/FOXNEWSW_20121113_160000_Happening_Now.thumbs/FOXNEWSW_20121113_160000_Happening_Now_003328.jpg,"feet. that is the 6th highest level in venice since 1872. this is the fourth time since 2000 that venice has been hit by record high water. that is prompting local officials to blame global climate change. a barrier to protect the"
https://archive.org/details/FOXNEWSW_20121102_100000_FOX_and_Friends#start/698/end/733,11/2/2012 10:11:53,FOXNEWS,FOX and Friends,FOXNEWSW_20121102_100000_FOX_and_Friends,https://archive.org/download/FOXNEWSW_20121102_100000_FOX_and_Friends/FOXNEWSW_20121102_100000_FOX_and_Friends.thumbs/FOXNEWSW_20121102_100000_FOX_and_Friends_000687.jpg,"before the storm happened. bloomburg at this date you are going come out and endorse president obama and tie it to climate change. that is a back door deal . no one in their right mind would say i am endorsing"
https://archive.org/details/FOXNEWSW_20121114_220000_The_Five#start/1710/end/1745,11/14/2012 22:28:45,FOXNEWS,The Five,FOXNEWSW_20121114_220000_The_Five,https://archive.org/download/FOXNEWSW_20121114_220000_The_Five/FOXNEWSW_20121114_220000_The_Five.thumbs/FOXNEWSW_20121114_220000_The_Five_001707.jpg,"plan to do in the secondtorium tackle the issue of climate change? a do you think the political will exists in washington to pass legislation that could include some kind of aa tax on carbon? you know, mark, we can't attribute any particular"
https://archive.org/details/FOXNEWSW_20121103_190000_FOX_News_Watch#start/246/end/281,11/3/2012 19:04:21,FOXNEWS,FOX News Watch,FOXNEWSW_20121103_190000_FOX_News_Watch,https://archive.org/download/FOXNEWSW_20121103_190000_FOX_News_Watch/FOXNEWSW_20121103_190000_FOX_News_Watch.thumbs/FOXNEWSW_20121103_190000_FOX_News_Watch_000238.jpg,"to get the right information. jon: it didn't take long for liberal media to trot out climate change as the reason for behind the storm? that is silly. hype of the storm before hand is somebody who doesn't live on the"
https://archive.org/details/FOXNEWSW_20121101_210000_The_Five#start/1117/end/1152,11/1/2012 21:18:52,FOXNEWS,The Five,FOXNEWSW_20121101_210000_The_Five,https://archive.org/download/FOXNEWSW_20121101_210000_The_Five/FOXNEWSW_20121101_210000_The_Five.thumbs/FOXNEWSW_20121101_210000_The_Five_001108.jpg,"obama and anything insidious about that? dana: this is silly. i do think it basically, a way to say don't blame me for the fact that you have all the problems now. let's do climate change. let's say all of us were in"
https://archive.org/details/FOXNEWSW_20121101_100000_FOX_and_Friends#start/1690/end/1725,11/1/2012 10:28:25,FOXNEWS,FOX and Friends,FOXNEWSW_20121101_100000_FOX_and_Friends,https://archive.org/download/FOXNEWSW_20121101_100000_FOX_and_Friends/FOXNEWSW_20121101_100000_FOX_and_Friends.thumbs/FOXNEWSW_20121101_100000_FOX_and_Friends_001677.jpg,"you think. hear from him coming up next. we told you about it next. al gore saying climate change is to blame for the monster storm sandy and the experts may have proved him wrong, that's next . happy birthday to lyle loveit"
https://archive.org/details/FOXNEWSW_20121101_030000_The_OReilly_Factor#start/3175/end/3210,11/1/2012 3:53:10,FOXNEWS,The OReilly Factor,FOXNEWSW_20121101_030000_The_OReilly_Factor,https://archive.org/download/FOXNEWSW_20121101_030000_The_OReilly_Factor/FOXNEWSW_20121101_030000_The_OReilly_Factor.thumbs/FOXNEWSW_20121101_030000_The_OReilly_Factor_003148.jpg,"pacific. could it be just nature? absolutely. natural factors are a major, major driver. but to ignore the factors of climate change, we do that at our peril. coastal residents in florida get. this people in new york city they are studying."
https://archive.org/details/FOXNEWSW_20121101_100000_FOX_and_Friends#start/9612/end/9647,11/1/2012 12:40:27,FOXNEWS,FOX and Friends,FOXNEWSW_20121101_100000_FOX_and_Friends,https://archive.org/download/FOXNEWSW_20121101_100000_FOX_and_Friends/FOXNEWSW_20121101_100000_FOX_and_Friends.thumbs/FOXNEWSW_20121101_100000_FOX_and_Friends_009597.jpg,"down. currently they think they might still be on the property. peter: we told you about this story yesterday. former democratic vice president al gore blaming climate change for hurricane sandy. chief meteorologists for weather bell says we were overdue for a"
https://archive.org/details/FOXNEWSW_20121114_180000_America_Live#start/4626/end/4661,11/14/2012 19:17:21,FOXNEWS,America Live,FOXNEWSW_20121114_180000_America_Live,https://archive.org/download/FOXNEWSW_20121114_180000_America_Live/FOXNEWSW_20121114_180000_America_Live.thumbs/FOXNEWSW_20121114_180000_America_Live_004618.jpg,"what do you plan to do in a second term to tackle the issue of climate change and do you think the political will exists in washington to pass legislation that could include some kind of a tax on carbon?"
https://archive.org/details/FOXNEWSW_20121114_180000_America_Live#start/4792/end/4827,11/14/2012 19:20:07,FOXNEWS,America Live,FOXNEWSW_20121114_180000_America_Live,https://archive.org/download/FOXNEWSW_20121114_180000_America_Live/FOXNEWSW_20121114_180000_America_Live.thumbs/FOXNEWSW_20121114_180000_America_Live_004768.jpg,"democrats or republicans are prepared to do at this point. because this one of those issues that's not just a partisan issue. i think there are regional differences. there is no doubt for us to take on climate change in a serious"
https://archive.org/details/FOXNEWSW_20121115_180000_America_Live#start/5849/end/5884,11/15/2012 19:37:44,FOXNEWS,America Live,FOXNEWSW_20121115_180000_America_Live,https://archive.org/download/FOXNEWSW_20121115_180000_America_Live/FOXNEWSW_20121115_180000_America_Live.thumbs/FOXNEWSW_20121115_180000_America_Live_005848.jpg,"what do you plan to do in a second term to tackle the issue of climate change and do you think the political will exists in washington to passa legislation that would include tax on carbon. two years ago you said i"
https://archive.org/details/FOXNEWSW_20121102_060000_The_Five#start/1116/end/1151,11/2/2012 6:18:51,FOXNEWS,The Five,FOXNEWSW_20121102_060000_The_Five,https://archive.org/download/FOXNEWSW_20121102_060000_The_Five/FOXNEWSW_20121102_060000_The_Five.thumbs/FOXNEWSW_20121102_060000_The_Five_001108.jpg,"obama and anything insidious about that? dana: this is silly. i do think it basically, a way to say don't blame me for the fact that you have all the problems now. let's do climate change. let's say all of us were in"
https://archive.org/details/FOXNEWSW_20121101_000000_The_OReilly_Factor#start/3177/end/3212,11/1/2012 0:53:12,FOXNEWS,The OReilly Factor,FOXNEWSW_20121101_000000_The_OReilly_Factor,https://archive.org/download/FOXNEWSW_20121101_000000_The_OReilly_Factor/FOXNEWSW_20121101_000000_The_OReilly_Factor.thumbs/FOXNEWSW_20121101_000000_The_OReilly_Factor_003177.jpg,"could it be just nature? absolutely. natural factors are a major, major driver. but to ignore the factors of climate change, we do that at our peril. coastal residents in florida get. this people in new york city they are studying."
https://archive.org/details/FOXNEWSW_20121102_210000_The_Five#start/535/end/570,11/2/2012 21:09:10,FOXNEWS,The Five,FOXNEWSW_20121102_210000_The_Five,https://archive.org/download/FOXNEWSW_20121102_210000_The_Five/FOXNEWSW_20121102_210000_The_Five.thumbs/FOXNEWSW_20121102_210000_The_Five_000508.jpg,"what is that about? why didn't he take $5000 and send where it they needed it? greg: it's worse to politicize catastrophe to prove a point, like you did with climate change that any expert says you're wrong. bob: any expert?"
https://archive.org/details/FOXNEWSW_20121115_070000_The_Five#start/17/end/52,11/15/2012 7:00:32,FOXNEWS,The Five,FOXNEWSW_20121115_070000_The_Five,https://archive.org/download/FOXNEWSW_20121115_070000_The_Five/FOXNEWSW_20121115_070000_The_Five.thumbs/FOXNEWSW_20121115_070000_The_Five_000028.jpg,"president obama held his first white house press conference since winning re-election. he took questions on topics including benghazi, petraeus resignation, fiscal cliff and climate change. we have it all covered in this hour, but first i'm kimberly guilfoyle with bob beckel, eric bolling, casey"
https://archive.org/details/FOXNEWSW_20121115_090000_The_OReilly_Factor#start/1006/end/1041,11/15/2012 9:17:01,FOXNEWS,The OReilly Factor,FOXNEWSW_20121115_090000_The_OReilly_Factor,https://archive.org/download/FOXNEWSW_20121115_090000_The_OReilly_Factor/FOXNEWSW_20121115_090000_The_OReilly_Factor.thumbs/FOXNEWSW_20121115_090000_The_OReilly_Factor_000988.jpg,"interesting obama pushed back too far to the left where he said i don't think that you can definitive can i say that hurricane sandy was definitely caused by global climate change. he pushed back on that one. i would have loved more questions about so what"
https://archive.org/details/FOXNEWSW_20121107_220000_The_Five#start/3040/end/3075,11/7/2012 22:50:55,FOXNEWS,The Five,FOXNEWSW_20121107_220000_The_Five,https://archive.org/download/FOXNEWSW_20121107_220000_The_Five/FOXNEWSW_20121107_220000_The_Five.thumbs/FOXNEWSW_20121107_220000_The_Five_003028.jpg,"damage, death and destruction, you caused last week became ironically the undoing of a party that didn't believe in you or your climate change power. hooray, people died we won an election. that's a left winger. ugly one at that. kimberly: that says it"
https://archive.org/details/FOXNEWSW_20121114_220000_The_Five#start/17/end/52,11/14/2012 22:00:32,FOXNEWS,The Five,FOXNEWSW_20121114_220000_The_Five,https://archive.org/download/FOXNEWSW_20121114_220000_The_Five/FOXNEWSW_20121114_220000_The_Five.thumbs/FOXNEWSW_20121114_220000_The_Five_000027.jpg,"kimberly: this is a fox news alert. president obama held his first white house press conference since winning re-election. he took questions on topics including benghazi, petraeus resignation, fiscal cliff and climate change. we have it all covered in this hour, but first i'm kimberly"
https://archive.org/details/FOXNEWSW_20121114_220000_The_Five#start/1739/end/1774,11/14/2012 22:29:14,FOXNEWS,The Five,FOXNEWSW_20121114_220000_The_Five,https://archive.org/download/FOXNEWSW_20121114_220000_The_Five/FOXNEWSW_20121114_220000_The_Five.thumbs/FOXNEWSW_20121114_220000_The_Five_001737.jpg,"begin to heal. what do you think? greg: he said you can't attribute any weather event to claims change and then he doubles down on programs and things to fight climate change. it's like when they say that gun ownership, studies will show that gun ownership"
https://archive.org/details/FOXNEWSW_20121101_230000_The_FOX_Report_With_Shepard_Smith#start/477/end/512,11/1/2012 23:08:12,FOXNEWS,The FOX Report With Shepard Smith,FOXNEWSW_20121101_230000_The_FOX_Report_With_Shepard_Smith,https://archive.org/download/FOXNEWSW_20121101_230000_The_FOX_Report_With_Shepard_Smith/FOXNEWSW_20121101_230000_The_FOX_Report_With_Shepard_Smith.thumbs/FOXNEWSW_20121101_230000_The_FOX_Report_With_Shepard_Smith_000477.jpg,"politics is back for sure. the new york city mayor michael bloomberg says he is endorsing president obama and the reason? his leadership on climate change. the mayor said today our climate is changing and while the increase in extreme weather we have experienced in"
https://archive.org/details/FOXNEWSW_20121101_060000_The_Five#start/1087/end/1122,11/1/2012 6:18:22,FOXNEWS,The Five,FOXNEWSW_20121101_060000_The_Five,https://archive.org/download/FOXNEWSW_20121101_060000_The_Five/FOXNEWSW_20121101_060000_The_Five.thumbs/FOXNEWSW_20121101_060000_The_Five_001078.jpg,"political looting. use a catastrophe for political aim you were unable to push before. a couple of examples, maureen dowd talking aboutie's relationship with obama. the hurricane is fault of the climate change deniers. al gore using other people misery to advance his own"
https://archive.org/details/FOXNEWSW_20121102_060000_The_Five#start/1242/end/1277,11/2/2012 6:20:57,FOXNEWS,The Five,FOXNEWSW_20121102_060000_The_Five,https://archive.org/download/FOXNEWSW_20121102_060000_The_Five/FOXNEWSW_20121102_060000_The_Five.thumbs/FOXNEWSW_20121102_060000_The_Five_001228.jpg,"blamed climate change. greg: he would have used it as an tune -- bob: you guys take a catastrophic event like this where millions of people -- dana: he did! he is the one who started it. bob: did what? i am talking about blaming this on obama."
https://archive.org/details/FOXNEWSW_20121116_010000_The_OReilly_Factor#start/2743/end/2778,11/16/2012 1:45:58,FOXNEWS,The OReilly Factor,FOXNEWSW_20121116_010000_The_OReilly_Factor,https://archive.org/download/FOXNEWSW_20121116_010000_The_OReilly_Factor/FOXNEWSW_20121116_010000_The_OReilly_Factor.thumbs/FOXNEWSW_20121116_010000_The_OReilly_Factor_002727.jpg,"tuesdays. are they going to take away wienerless wednesdays? i did some research and say animal agriculture contributes to climate change and so when you, bill o'reilly, eat your steak, you're contributing to the odds that the guy in the jersey shore's house is going to"
https://archive.org/details/FOXNEWSW_20121108_070000_The_Five#start/3035/end/3070,11/8/2012 7:50:50,FOXNEWS,The Five,FOXNEWSW_20121108_070000_The_Five,https://archive.org/download/FOXNEWSW_20121108_070000_The_Five/FOXNEWSW_20121108_070000_The_Five.thumbs/FOXNEWSW_20121108_070000_The_Five_003027.jpg,"sending hurricane sandy to help obama. michael moore said you mother nature with your horrific damage, death and destruction, you caused last week became ironically the undoing of a party that didn't believe in you or your climate change power. hooray, people died we won an"
https://archive.org/details/FOXNEWSW_20121111_190000_FOX_News_Sunday_With_Chris_Wallace#start/2401/end/2436,11/11/2012 19:40:16,FOXNEWS,FOX News Sunday With Chris Wallace,FOXNEWSW_20121111_190000_FOX_News_Sunday_With_Chris_Wallace,https://archive.org/download/FOXNEWSW_20121111_190000_FOX_News_Sunday_With_Chris_Wallace/FOXNEWSW_20121111_190000_FOX_News_Sunday_With_Chris_Wallace.thumbs/FOXNEWSW_20121111_190000_FOX_News_Sunday_With_Chris_Wallace_002397.jpg,"he had to do that. even democrats urged him to do that. this time now with a second term without check he doubles down on the things he wants to do. i think he rams through an amnesty, immigration reform or whatever you call it. he goes further toward carbon tax. toward all sorts of other"
https://archive.org/details/FOXNEWSW_20121101_210000_The_Five#start/1149/end/1184,11/1/2012 21:19:24,FOXNEWS,The Five,FOXNEWSW_20121101_210000_The_Five,https://archive.org/download/FOXNEWSW_20121101_210000_The_Five/FOXNEWSW_20121101_210000_The_Five.thumbs/FOXNEWSW_20121101_210000_The_Five_001138.jpg,"day. in addition to that, there was obviously coordination with the obama campaign. president obama did not talk about climate change for the first four years. he has said in his mtv interview last week, he will not push for gay marriage in the second term. all the things that supposedly"
https://archive.org/details/FOXNEWSW_20121101_210000_The_Five#start/1243/end/1278,11/1/2012 21:20:58,FOXNEWS,The Five,FOXNEWSW_20121101_210000_The_Five,https://archive.org/download/FOXNEWSW_20121101_210000_The_Five/FOXNEWSW_20121101_210000_The_Five.thumbs/FOXNEWSW_20121101_210000_The_Five_001228.jpg,"blamed climate change. greg: he would have used it as an tune -- bob: you guys take a catastrophic event like this where millions of people -- dana: he did! he is the one who started it. bob: did what? i am talking about blaming this on obama. greg: yes, you linked the"
https://archive.org/details/FOXNEWSW_20121101_210000_The_Five#start/1290/end/1325,11/1/2012 21:21:45,FOXNEWS,The Five,FOXNEWSW_20121101_210000_The_Five,https://archive.org/download/FOXNEWSW_20121101_210000_The_Five/FOXNEWSW_20121101_210000_The_Five.thumbs/FOXNEWSW_20121101_210000_The_Five_001288.jpg,"climate change. eric: let me do this. i'll bring this back to why i put the two things in the same segment, bob. here is why. we gave him $1 trillion. the administration $1 trillion to beef up the infrastructure. they spent $1 trillion making the grid. burying the grid underground"
https://archive.org/details/FOXNEWSW_20121115_010000_The_OReilly_Factor#start/1009/end/1044,11/15/2012 1:17:04,FOXNEWS,The OReilly Factor,FOXNEWSW_20121115_010000_The_OReilly_Factor,https://archive.org/download/FOXNEWSW_20121115_010000_The_OReilly_Factor/FOXNEWSW_20121115_010000_The_OReilly_Factor.thumbs/FOXNEWSW_20121115_010000_The_OReilly_Factor_000988.jpg,"too far to the left where he said i don't think that you can definitive can i say that hurricane sandy was definitely caused by global climate change. he pushed back on that one. i would have loved more questions about so what exactly do you propose to fix"
https://archive.org/details/FOXNEWSW_20121115_180000_America_Live#start/6018/end/6053,11/15/2012 19:40:33,FOXNEWS,America Live,FOXNEWSW_20121115_180000_America_Live,https://archive.org/download/FOXNEWSW_20121115_180000_America_Live/FOXNEWSW_20121115_180000_America_Live.thumbs/FOXNEWSW_20121115_180000_America_Live_005998.jpg,"corps. you are telling me these are all issues that matter to some americans. climate change, immigration and so on. but when you only have eight questions and there isn't a question about how we are going to gets the debt under control or what we are going to do about"
