URL,MatchDateTime,Station,Show,IAShowID,IAPreviewThumb,Snippet
https://archive.org/details/MSNBCW_20111114_110000_Morning_Joe#start/6188/end/6223,11/14/2011 12:43:23,MSNBC,Morning Joe,MSNBCW_20111114_110000_Morning_Joe,https://archive.org/download/MSNBCW_20111114_110000_Morning_Joe/MSNBCW_20111114_110000_Morning_Joe.thumbs/MSNBCW_20111114_110000_Morning_Joe_006177.jpg,"of cities contributed unfairly to the estimate. cities do heat more. but that's not because of the greenhouse effects. so you don't want to include that in when you measure global warming. there are issues of whether they had treated the data fairly. they used only 20% of the data"
https://archive.org/details/MSNBCW_20111114_110000_Morning_Joe#start/6388/end/6423,11/14/2011 12:46:43,MSNBC,Morning Joe,MSNBCW_20111114_110000_Morning_Joe,https://archive.org/download/MSNBCW_20111114_110000_Morning_Joe/MSNBCW_20111114_110000_Morning_Joe.thumbs/MSNBCW_20111114_110000_Morning_Joe_006387.jpg,"that needed addressing. that's why two years ago i was not convinced that global warming was real or that it existed. now, the other scientific groups said, oh, we've done a good job, but there were outstanding issues, we have addressed those now. i think now we've stepped"
https://archive.org/details/MSNBCW_20111121_220000_Hardball_With_Chris_Matthews#start/836/end/871,11/21/2011 22:14:11,MSNBC,Hardball With Chris Matthews,MSNBCW_20111121_220000_Hardball_With_Chris_Matthews,https://archive.org/download/MSNBCW_20111121_220000_Hardball_With_Chris_Matthews/MSNBCW_20111121_220000_Hardball_With_Chris_Matthews.thumbs/MSNBCW_20111121_220000_Hardball_With_Chris_Matthews_000836.jpg,"is a flip-flopper? well, he is, of course. wait until you catch this one. newt gingrich is explaining why he changed his positions on just about everything from health care to global warming to tarp and big shocker, every one of this has changes are to the currently popular conservative"
https://archive.org/details/MSNBCW_20111118_000000_Hardball_With_Chris_Matthews#start/3087/end/3122,11/18/2011 0:51:42,MSNBC,Hardball With Chris Matthews,MSNBCW_20111118_000000_Hardball_With_Chris_Matthews,https://archive.org/download/MSNBCW_20111118_000000_Hardball_With_Chris_Matthews/MSNBCW_20111118_000000_Hardball_With_Chris_Matthews.thumbs/MSNBCW_20111118_000000_Hardball_With_Chris_Matthews_003087.jpg,"presumably felt at the time about issues like global warming and choice and gay rights and things like that. all of which he has flip-flopped on now that he is running for president in the republican party. this is an extraordinary event we have here, watching this"
https://archive.org/details/MSNBCW_20111101_230000_Hardball_With_Chris_Matthews#start/1378/end/1413,11/1/2011 23:23:13,MSNBC,Hardball With Chris Matthews,MSNBCW_20111101_230000_Hardball_With_Chris_Matthews,https://archive.org/download/MSNBCW_20111101_230000_Hardball_With_Chris_Matthews/MSNBCW_20111101_230000_Hardball_With_Chris_Matthews.thumbs/MSNBCW_20111101_230000_Hardball_With_Chris_Matthews_001376.jpg,"penchant for flip-flopping. listen to what he said back in june followed by what he said on thursday on global warming. let's watch the moves. i believe based on what i read that the world is getting warmer. and number two, i believe that humans contribute to that."
https://archive.org/details/MSNBCW_20111102_060000_Hardball_With_Chris_Matthews#start/1367/end/1402,11/2/2011 6:23:02,MSNBC,Hardball With Chris Matthews,MSNBCW_20111102_060000_Hardball_With_Chris_Matthews,https://archive.org/download/MSNBCW_20111102_060000_Hardball_With_Chris_Matthews/MSNBCW_20111102_060000_Hardball_With_Chris_Matthews.thumbs/MSNBCW_20111102_060000_Hardball_With_Chris_Matthews_001346.jpg,"penchant for flip-flopping. listen to what he said back in june followed by what he said on thursday on global warming. let's watch the moves. i believe based on what i read that the world is getting warmer. and number two, i believe that humans contribute to that."
https://archive.org/details/MSNBCW_20111130_080000_The_Ed_Show#start/875/end/910,11/30/2011 8:14:50,MSNBC,The Ed Show,MSNBCW_20111130_080000_The_Ed_Show,https://archive.org/download/MSNBCW_20111130_080000_The_Ed_Show/MSNBCW_20111130_080000_The_Ed_Show.thumbs/MSNBCW_20111130_080000_The_Ed_Show_000867.jpg,"coming up, newt gingrich could be the new republican front-runner, so republicans, well, they're going to have to forgive him for things like global warming. that ad he did with speaker nancy pelosi. who's going to forget that? not me. later, republicans are hedging on a tax cut that would"
https://archive.org/details/MSNBCW_20111130_030000_The_Last_Word#start/2641/end/2676,11/30/2011 3:44:16,MSNBC,The Last Word,MSNBCW_20111130_030000_The_Last_Word,https://archive.org/download/MSNBCW_20111130_030000_The_Last_Word/MSNBCW_20111130_030000_The_Last_Word.thumbs/MSNBCW_20111130_030000_The_Last_Word_002637.jpg,"do you believe in man made global warming that because the planet is polluted and spew out stuff in the air that has influenced the way climate comes about, do you believe that? i don't think we know. i think the evidence is not complete, and i think that we're"
https://archive.org/details/MSNBCW_20111102_190000_Martin_Bashir#start/2617/end/2652,11/2/2011 19:43:52,MSNBC,Martin Bashir,MSNBCW_20111102_190000_Martin_Bashir,https://archive.org/download/MSNBCW_20111102_190000_Martin_Bashir/MSNBCW_20111102_190000_Martin_Bashir.thumbs/MSNBCW_20111102_190000_Martin_Bashir_002610.jpg,"well, the republicans in the house passed legislation that basically is doing away with the clean air act. there is almost a premise in there that we can get rid of global warming or health hazards bypassing a law saying it doesn't count. that's the absurd definition of"
https://archive.org/details/MSNBCW_20111116_110000_Morning_Joe#start/583/end/618,11/16/2011 11:09:58,MSNBC,Morning Joe,MSNBCW_20111116_110000_Morning_Joe,https://archive.org/download/MSNBCW_20111116_110000_Morning_Joe/MSNBCW_20111116_110000_Morning_Joe.thumbs/MSNBCW_20111116_110000_Morning_Joe_000566.jpg,"even romney now has to say he doesn't know where global warming comes from. even the smart ones have to act stupid. for those who seem to be on the cain train, let's take a look at his pauses, just for a second. this is what he calls pausing."
https://archive.org/details/MSNBCW_20111130_030000_The_Last_Word#start/2800/end/2835,11/30/2011 3:46:55,MSNBC,The Last Word,MSNBCW_20111130_030000_The_Last_Word,https://archive.org/download/MSNBCW_20111130_030000_The_Last_Word/MSNBCW_20111130_030000_The_Last_Word.thumbs/MSNBCW_20111130_030000_The_Last_Word_002787.jpg,"dumber than agreeing with nancy pelosi about climate change, and, of course, limiting himself to recent years allows gingrich to ignore the $300000 fine that the house ethics committee hit him with in 1997."
https://archive.org/details/MSNBCW_20111113_130000_Up_W_Chris_Hayes#start/4507/end/4542,11/13/2011 14:15:22,MSNBC,Up W Chris Hayes,MSNBCW_20111113_130000_Up_W_Chris_Hayes,https://archive.org/download/MSNBCW_20111113_130000_Up_W_Chris_Hayes/MSNBCW_20111113_130000_Up_W_Chris_Hayes.thumbs/MSNBCW_20111113_130000_Up_W_Chris_Hayes_004496.jpg,"we had the biggest recession in 80 years, and still our carbons emission jumped 6%. climate change is real. it's happening. it's happening to america today and americans today. we need a renewable national"
https://archive.org/details/MSNBCW_20111130_060000_The_Last_Word#start/2990/end/3025,11/30/2011 6:50:05,MSNBC,The Last Word,MSNBCW_20111130_060000_The_Last_Word,https://archive.org/download/MSNBCW_20111130_060000_The_Last_Word/MSNBCW_20111130_060000_The_Last_Word.thumbs/MSNBCW_20111130_060000_The_Last_Word_002970.jpg,"running for office thought it was cool to have oral sex with another man's wife in a suburban driveway while his kids were walking past the car. doing a tv ad about climate change with nancy pelosi is"
https://archive.org/details/MSNBCW_20111130_080000_The_Ed_Show#start/1197/end/1232,11/30/2011 8:20:12,MSNBC,The Ed Show,MSNBCW_20111130_080000_The_Ed_Show,https://archive.org/download/MSNBCW_20111130_080000_The_Ed_Show/MSNBCW_20111130_080000_The_Ed_Show.thumbs/MSNBCW_20111130_080000_The_Ed_Show_001197.jpg,"address climate change. did he say agree? that's a problem. here's gingrich telling o'reilly, it was a mistake. well, i've said it's one of the dumbest things i've done in recent years. i actively oppose cap and trade."
https://archive.org/details/MSNBCW_20111130_030000_The_Last_Word#start/2989/end/3024,11/30/2011 3:50:04,MSNBC,The Last Word,MSNBCW_20111130_030000_The_Last_Word,https://archive.org/download/MSNBCW_20111130_030000_The_Last_Word/MSNBCW_20111130_030000_The_Last_Word.thumbs/MSNBCW_20111130_030000_The_Last_Word_002967.jpg,"doing a tv ad about climate change with nancy pelosi is nowhere close to the dumbest things newt gingrich has done in recent years or any years. at the obama re-election headquarters tonight, everyone"
https://archive.org/details/MSNBCW_20111130_180000_Andrea_Mitchell_Reports#start/2390/end/2425,11/30/2011 18:40:05,MSNBC,Andrea Mitchell Reports,MSNBCW_20111130_180000_Andrea_Mitchell_Reports,https://archive.org/download/MSNBCW_20111130_180000_Andrea_Mitchell_Reports/MSNBCW_20111130_180000_Andrea_Mitchell_Reports.thumbs/MSNBCW_20111130_180000_Andrea_Mitchell_Reports_002366.jpg,"with bret baird, and got a little testy. let's watch. climate change, abortion, immigration, gay rights, how can voters trust what they hear from you today is what you will believe if you win the white"
https://archive.org/details/MSNBCW_20111113_123000_Your_Business#start/1247/end/1282,11/13/2011 12:51:02,MSNBC,Your Business,MSNBCW_20111113_123000_Your_Business,https://archive.org/download/MSNBCW_20111113_123000_Your_Business/MSNBCW_20111113_123000_Your_Business.thumbs/MSNBCW_20111113_123000_Your_Business_001226.jpg,"service, but it has to make economic sense. i think it was former president clinton that said we will tackle climate change when it's good business to do so. when we are looking at any environmental matter, again,"
https://archive.org/details/MSNBCW_20111109_110000_Morning_Joe#start/1927/end/1962,11/9/2011 11:32:22,MSNBC,Morning Joe,MSNBCW_20111109_110000_Morning_Joe,https://archive.org/download/MSNBCW_20111109_110000_Morning_Joe/MSNBCW_20111109_110000_Morning_Joe.thumbs/MSNBCW_20111109_110000_Morning_Joe_001916.jpg,"simply overreached telling us florida was going to be under water in five years. if you raised any questions, you were burned at the stake. seriously, they were fundamentalists of the climate change movement, and americans"
https://archive.org/details/MSNBCW_20111106_130000_Up_W_Chris_Hayes#start/3312/end/3347,11/6/2011 13:55:27,MSNBC,Up W Chris Hayes,MSNBCW_20111106_130000_Up_W_Chris_Hayes,https://archive.org/download/MSNBCW_20111106_130000_Up_W_Chris_Hayes/MSNBCW_20111106_130000_Up_W_Chris_Hayes.thumbs/MSNBCW_20111106_130000_Up_W_Chris_Hayes_003296.jpg,"clear that human beings are causing climate change, and this is the challenge of the 21st century that is being ignored by the republican side certainly. how can you stop yourself from standing up and shaking these"
https://archive.org/details/MSNBCW_20111101_210000_Hardball_With_Chris_Matthews#start/1120/end/1155,11/1/2011 21:18:55,MSNBC,Hardball With Chris Matthews,MSNBCW_20111101_210000_Hardball_With_Chris_Matthews,https://archive.org/download/MSNBCW_20111101_210000_Hardball_With_Chris_Matthews/MSNBCW_20111101_210000_Hardball_With_Chris_Matthews.thumbs/MSNBCW_20111101_210000_Hardball_With_Chris_Matthews_001106.jpg,"but he's not the only one who's had a bad few days. look at mitt romney's flip-flopping around climate change. that won't go away. that flip-flopping label's not going away. and last week, romney got caught"
https://archive.org/details/MSNBCW_20111116_150000_Jansing_and_Co.#start/287/end/322,11/16/2011 15:05:02,MSNBC,Jansing and Co.,MSNBCW_20111116_150000_Jansing_and_Co.,https://archive.org/download/MSNBCW_20111116_150000_Jansing_and_Co./MSNBCW_20111116_150000_Jansing_and_Co..thumbs/MSNBCW_20111116_150000_Jansing_and_Co._000267.jpg,"and then the ad that you both remember -- we don't always see eye to eye, do we, newt? no. but we do agree, our country must take action to address climate change. so, josh, that ad he calls"
https://archive.org/details/MSNBCW_20111130_060000_The_Last_Word#start/2553/end/2588,11/30/2011 6:42:48,MSNBC,The Last Word,MSNBCW_20111130_060000_The_Last_Word,https://archive.org/download/MSNBCW_20111130_060000_The_Last_Word/MSNBCW_20111130_060000_The_Last_Word.thumbs/MSNBCW_20111130_060000_The_Last_Word_002550.jpg,"newt used to be a liberal on climate change, and bill o'reilly took on the job last night of helping him deal with that anyway forthright fox news kind of way so newt could put it"
https://archive.org/details/MSNBCW_20111130_103000_Way_Too_Early_With_Willie_Geist#start/319/end/354,11/30/2011 10:35:34,MSNBC,Way Too Early With Willie Geist,MSNBCW_20111130_103000_Way_Too_Early_With_Willie_Geist,https://archive.org/download/MSNBCW_20111130_103000_Way_Too_Early_With_Willie_Geist/MSNBCW_20111130_103000_Way_Too_Early_With_Willie_Geist.thumbs/MSNBCW_20111130_103000_Way_Too_Early_With_Willie_Geist_000300.jpg,"fit keeps me from winning a primary, so be it. gingrich was, of course, the one who did the global warming ad with nancy pelosi. the democratic national committee focusing its attention on romney, attacking him for changing positions in the ad we've been showing you this week called mitt versus mitt."
https://archive.org/details/MSNBCW_20111106_120000_Hardball_Weekend#start/1582/end/1617,11/6/2011 12:26:37,MSNBC,Hardball Weekend,MSNBCW_20111106_120000_Hardball_Weekend,https://archive.org/download/MSNBCW_20111106_120000_Hardball_Weekend/MSNBCW_20111106_120000_Hardball_Weekend.thumbs/MSNBCW_20111106_120000_Hardball_Weekend_001556.jpg,"the current crop of gop candidates or some of them, at least, are not exactly on the dean's list when it comes to the science behind global warming. how will this anti-science platform play out in the race for the white house? according to a new york city mayor michael bloomberg, it"
https://archive.org/details/MSNBCW_20111122_000000_Hardball_With_Chris_Matthews#start/797/end/832,11/22/2011 0:13:32,MSNBC,Hardball With Chris Matthews,MSNBCW_20111122_000000_Hardball_With_Chris_Matthews,https://archive.org/download/MSNBCW_20111122_000000_Hardball_With_Chris_Matthews/MSNBCW_20111122_000000_Hardball_With_Chris_Matthews.thumbs/MSNBCW_20111122_000000_Hardball_With_Chris_Matthews_000776.jpg,"joining us. coming up, think mitt romney is a flip-flopper who will say anything to win? well now newt gingrich is explaining why he's changed his position on, well let's count, health care, global warming, tarp and big shocker, his new opinions are just what conservatives want to hear. how surprising."
https://archive.org/details/MSNBCW_20111123_080000_The_Ed_Show#start/3570/end/3605,11/23/2011 8:59:45,MSNBC,The Ed Show,MSNBCW_20111123_080000_The_Ed_Show,https://archive.org/download/MSNBCW_20111123_080000_The_Ed_Show/MSNBCW_20111123_080000_The_Ed_Show.thumbs/MSNBCW_20111123_080000_The_Ed_Show_003566.jpg,"gingrich and then the flip-flops on the issues where he used to be for global warming and now he isn't. joe, does he beat mitt romney? no, he's not going to beat mitt romney in this. he's the latest flavor. and i look for ron paul after iowa to be up there."
https://archive.org/details/MSNBCW_20111130_010000_The_Ed_Show#start/879/end/914,11/30/2011 1:14:54,MSNBC,The Ed Show,MSNBCW_20111130_010000_The_Ed_Show,https://archive.org/download/MSNBCW_20111130_010000_The_Ed_Show/MSNBCW_20111130_010000_The_Ed_Show.thumbs/MSNBCW_20111130_010000_The_Ed_Show_000866.jpg,"well, they're going to have to forgive him for things like global warming. that ad he did with speaker nancy pelosi. who's going to forget that? not me. later, republicans are hedging on a tax cut that would put $1500 in the pockets of middle class americans because the richest 2% of this country"
https://archive.org/details/MSNBCW_20111130_103000_Way_Too_Early_With_Willie_Geist#start/286/end/321,11/30/2011 10:35:01,MSNBC,Way Too Early With Willie Geist,MSNBCW_20111130_103000_Way_Too_Early_With_Willie_Geist,https://archive.org/download/MSNBCW_20111130_103000_Way_Too_Early_With_Willie_Geist/MSNBCW_20111130_103000_Way_Too_Early_With_Willie_Geist.thumbs/MSNBCW_20111130_103000_Way_Too_Early_With_Willie_Geist_000270.jpg,"anything to get elected, wouldn't i just say it was a mistake? i watched other people on the stage when they talk about the cap and trade policies. they say that was a mistake. when someone says i did this ad on global warming, that was a mistake. so they just dust it aside."
https://archive.org/details/MSNBCW_20111113_130000_Up_W_Chris_Hayes#start/5299/end/5334,11/13/2011 14:28:34,MSNBC,Up W Chris Hayes,MSNBCW_20111113_130000_Up_W_Chris_Hayes,https://archive.org/download/MSNBCW_20111113_130000_Up_W_Chris_Hayes/MSNBCW_20111113_130000_Up_W_Chris_Hayes.thumbs/MSNBCW_20111113_130000_Up_W_Chris_Hayes_005276.jpg,"issue. environmentalist used to fight the cap and trade -- yeah, a carbon tax. what we are seeing is we are trying to chase the consensus. this is something that i really think about a lot. i think about the civil rights movement, and i think about the level of social consensus that"
https://archive.org/details/MSNBCW_20111130_010000_The_Ed_Show#start/1193/end/1228,11/30/2011 1:20:08,MSNBC,The Ed Show,MSNBCW_20111130_010000_The_Ed_Show,https://archive.org/download/MSNBCW_20111130_010000_The_Ed_Show/MSNBCW_20111130_010000_The_Ed_Show.thumbs/MSNBCW_20111130_010000_The_Ed_Show_001166.jpg,"no, but we do agree, our country must take action to address climate change. did he say agree? that's a problem. here's gingrich telling o'reilly, it was a mistake. well, i've said it's one of the dumbest things i've done in"
https://archive.org/details/MSNBCW_20111129_200000_Martin_Bashir#start/3077/end/3112,11/29/2011 20:51:32,MSNBC,Martin Bashir,MSNBCW_20111129_200000_Martin_Bashir,https://archive.org/download/MSNBCW_20111129_200000_Martin_Bashir/MSNBCW_20111129_200000_Martin_Bashir.thumbs/MSNBCW_20111129_200000_Martin_Bashir_003060.jpg,"children and grandchildren depend on decisions we make now, and yet we have politicians pandering to the polluting corporations, saying, oh, we don't know if climate change is real. and it's embarrassing and shocking. newt gingrich says that he's agnostic on the science."
https://archive.org/details/MSNBCW_20111104_140000_Jansing_and_Co.#start/2733/end/2768,11/4/2011 14:45:48,MSNBC,Jansing and Co.,MSNBCW_20111104_140000_Jansing_and_Co.,https://archive.org/download/MSNBCW_20111104_140000_Jansing_and_Co./MSNBCW_20111104_140000_Jansing_and_Co..thumbs/MSNBCW_20111104_140000_Jansing_and_Co._002727.jpg,"fight climate change and create clean-energy economies. even as our countries work to save lives from the drought and terrible famine in the horn of africa, we agreed on the need to mobilize new resources to support the development that"
https://archive.org/details/MSNBCW_20111102_060000_Hardball_With_Chris_Matthews#start/1133/end/1168,11/2/2011 6:19:08,MSNBC,Hardball With Chris Matthews,MSNBCW_20111102_060000_Hardball_With_Chris_Matthews,https://archive.org/download/MSNBCW_20111102_060000_Hardball_With_Chris_Matthews/MSNBCW_20111102_060000_Hardball_With_Chris_Matthews.thumbs/MSNBCW_20111102_060000_Hardball_With_Chris_Matthews_001106.jpg,"going away. and last week, romney got caught making contradictory statements about two different statements, about the upcoming ohio union vote and climate change. meanwhile, rick perry has plummeted in the polls and gave a bizarre performance to put it"
https://archive.org/details/MSNBCW_20111130_140000_The_Daily_Rundown#start/139/end/174,11/30/2011 14:02:34,MSNBC,The Daily Rundown,MSNBCW_20111130_140000_The_Daily_Rundown,https://archive.org/download/MSNBCW_20111130_140000_The_Daily_Rundown/MSNBCW_20111130_140000_The_Daily_Rundown.thumbs/MSNBCW_20111130_140000_The_Daily_Rundown_000117.jpg,"day. last night's combative interview with fox shows why it started, it started with a straightforward question on issues that romney has changed his views on over time. here's how he reacted -- climate change, abortion, immigration, gay rights, how can"
https://archive.org/details/MSNBCW_20111113_130000_Up_W_Chris_Hayes#start/3824/end/3859,11/13/2011 14:03:59,MSNBC,Up W Chris Hayes,MSNBCW_20111113_130000_Up_W_Chris_Hayes,https://archive.org/download/MSNBCW_20111113_130000_Up_W_Chris_Hayes/MSNBCW_20111113_130000_Up_W_Chris_Hayes.thumbs/MSNBCW_20111113_130000_Up_W_Chris_Hayes_003806.jpg,"man's biggest enemy is climate change. if we don't turn it back in five years, it will be unstoppable. we will experience a world of pain and so will our children. the keystone pipeline was a collect action that was"
https://archive.org/details/MSNBCW_20111114_220000_Hardball_With_Chris_Matthews#start/230/end/265,11/14/2011 22:04:05,MSNBC,Hardball With Chris Matthews,MSNBCW_20111114_220000_Hardball_With_Chris_Matthews,https://archive.org/download/MSNBCW_20111114_220000_Hardball_With_Chris_Matthews/MSNBCW_20111114_220000_Hardball_With_Chris_Matthews.thumbs/MSNBCW_20111114_220000_Hardball_With_Chris_Matthews_000206.jpg,"he's as much as a flip-flopper as mitt romney is on cap and trade, climate change, on mandates and the paul ryan budget plan. a lot of evangelicals say that he has one ex-wife too many. i mean, he is getting the --  _"
https://archive.org/details/MSNBCW_20111130_110000_Morning_Joe#start/70/end/105,11/30/2011 11:01:25,MSNBC,Morning Joe,MSNBCW_20111130_110000_Morning_Joe,https://archive.org/download/MSNBCW_20111130_110000_Morning_Joe/MSNBCW_20111130_110000_Morning_Joe.thumbs/MSNBCW_20111130_110000_Morning_Joe_000056.jpg,"i watch other people on the stage and they say, oh, that was a mistake. oh, someone says i did this ad on global warming, that was a mistake. they dust it aside. and that makes them more attractive in a primary. i'm standing by what i did in massachusetts. not trying to dust it aside."
https://archive.org/details/MSNBCW_20111104_210000_Hardball_With_Chris_Matthews#start/1800/end/1835,11/4/2011 21:30:15,MSNBC,Hardball With Chris Matthews,MSNBCW_20111104_210000_Hardball_With_Chris_Matthews,https://archive.org/download/MSNBCW_20111104_210000_Hardball_With_Chris_Matthews/MSNBCW_20111104_210000_Hardball_With_Chris_Matthews.thumbs/MSNBCW_20111104_210000_Hardball_With_Chris_Matthews_001796.jpg,"and finally, we all know that the current crop of gop candidates or some of them, at least, are not exactly on the dean's list when it comes to the science behind global warming. how will this anti-science platform play out in the race for the white house? according to a new york city mayor michael bloomberg, it"
https://archive.org/details/MSNBCW_20111118_070000_Hardball_With_Chris_Matthews#start/3077/end/3112,11/18/2011 7:51:32,MSNBC,Hardball With Chris Matthews,MSNBCW_20111118_070000_Hardball_With_Chris_Matthews,https://archive.org/download/MSNBCW_20111118_070000_Hardball_With_Chris_Matthews/MSNBCW_20111118_070000_Hardball_With_Chris_Matthews.thumbs/MSNBCW_20111118_070000_Hardball_With_Chris_Matthews_003056.jpg,"well, that's what it seems. it's fair i guess to say that he was damaged in his senate campaigns and his gubernatorial term in massachusetts. but if he was damaged by that, he damaged himself. simply by revealing what he presumably felt at the time about issues like global warming and choice and gay rights and things like that."
https://archive.org/details/MSNBCW_20111130_110000_Morning_Joe#start/7344/end/7379,11/30/2011 13:02:39,MSNBC,Morning Joe,MSNBCW_20111130_110000_Morning_Joe,https://archive.org/download/MSNBCW_20111130_110000_Morning_Joe/MSNBCW_20111130_110000_Morning_Joe.thumbs/MSNBCW_20111130_110000_Morning_Joe_007342.jpg,"wouldn't i say, oh, it's a mistake. because i look at other people when they are on the stage when they talk about the cap and trade policy, that was a mistake. when they talk about global warming, that's a mistake. and that makes them more attractive in a primary. i'm standing by what i did in"
https://archive.org/details/MSNBCW_20111130_030000_The_Last_Word#start/1649/end/1684,11/30/2011 3:27:44,MSNBC,The Last Word,MSNBCW_20111130_030000_The_Last_Word,https://archive.org/download/MSNBCW_20111130_030000_The_Last_Word/MSNBCW_20111130_030000_The_Last_Word.thumbs/MSNBCW_20111130_030000_The_Last_Word_001526.jpg,"record on climate change. that's in the rewrite. [ engine revs ] [ male announcer ] oh what fun it is to ride. get the mercedes-benz on your wish list at the winter event going on now -- but hurry, the offer ends soon. [ santa ] ho, ho, ho, ho!."
https://archive.org/details/MSNBCW_20111115_070000_Hardball_With_Chris_Matthews#start/271/end/306,11/15/2011 7:04:46,MSNBC,Hardball With Chris Matthews,MSNBCW_20111115_070000_Hardball_With_Chris_Matthews,https://archive.org/download/MSNBCW_20111115_070000_Hardball_With_Chris_Matthews/MSNBCW_20111115_070000_Hardball_With_Chris_Matthews.thumbs/MSNBCW_20111115_070000_Hardball_With_Chris_Matthews_000266.jpg,"trade, climate change, on mandates and the paul ryan budget plan. a lot of evangelicals say that he has one ex-wife too many. i mean, he is getting the -- he's the beneficiary of this anti-romney sentiment that has been conveyed to one candidate"
https://archive.org/details/MSNBCW_20111112_120000_Up_W_Chris_Hayes#start/1151/end/1186,11/12/2011 12:19:26,MSNBC,Up W Chris Hayes,MSNBCW_20111112_120000_Up_W_Chris_Hayes,https://archive.org/download/MSNBCW_20111112_120000_Up_W_Chris_Hayes/MSNBCW_20111112_120000_Up_W_Chris_Hayes.thumbs/MSNBCW_20111112_120000_Up_W_Chris_Hayes_001136.jpg,"grandchildren will inherit an earth in crisis. the moral challenge of our time is man made global climate change on track to devastate the coastlines where our grandkids will live and the farms that will grow their food. it has been largely ignored by"
