URL,MatchDateTime,Station,Show,IAShowID,IAPreviewThumb,Snippet
https://archive.org/details/BBCNEWS_20170511_200000_Outside_Source#start/1043/end/1078,5/11/2017 20:17:38,BBCNEWS,Outside Source,BBCNEWS_20170511_200000_Outside_Source,https://archive.org/download/BBCNEWS_20170511_200000_Outside_Source/BBCNEWS_20170511_200000_Outside_Source.thumbs/BBCNEWS_20170511_200000_Outside_Source_001018.jpg,"human cost. i am hopeful hearing this statement. i am part of the arctic social sciences that oration. we are working hard to understand what it means to respond to climate change. -- federation. the place                 _"
https://archive.org/details/BBCNEWS_20170511_200000_Outside_Source#start/1159/end/1194,5/11/2017 20:19:34,BBCNEWS,Outside Source,BBCNEWS_20170511_200000_Outside_Source,https://archive.org/download/BBCNEWS_20170511_200000_Outside_Source/BBCNEWS_20170511_200000_Outside_Source.thumbs/BBCNEWS_20170511_200000_Outside_Source_001138.jpg,"is, from an alaskan point of view, what is alaska experiencing? how does it affect all walks of life? we are seeing a lot of impact from climate change. that is part of the"
https://archive.org/details/BBCNEWS_20170512_030000_BBC_News#start/498/end/533,5/12/2017 3:08:33,BBCNEWS,BBC News,BBCNEWS_20170512_030000_BBC_News,https://archive.org/download/BBCNEWS_20170512_030000_BBC_News/BBCNEWS_20170512_030000_BBC_News.thumbs/BBCNEWS_20170512_030000_BBC_News_000477.jpg,"by reducing emissions. but for how long? in the united states, we are currently reviewing several important policies, including how the trump administration will approach the issue of climate change. we are appreciative that each"
https://archive.org/details/BBCNEWS_20170526_200000_World_News_Today#start/46/end/81,5/26/2017 20:01:01,BBCNEWS,World News Today,BBCNEWS_20170526_200000_World_News_Today,https://archive.org/download/BBCNEWS_20170526_200000_World_News_Today/BBCNEWS_20170526_200000_World_News_Today.thumbs/BBCNEWS_20170526_200000_World_News_Today_000058.jpg,"reach agreement on extremism - but no deal on climate change as the us mulls over its position. the bbc gets exclusive access to incredible footage showing what young western explorers discovered nearly 100 years ago."
https://archive.org/details/BBCNEWS_20170524_120000_BBC_News_at_One#start/1375/end/1410,5/24/2017 12:23:10,BBCNEWS,BBC News at One,BBCNEWS_20170524_120000_BBC_News_at_One,https://archive.org/download/BBCNEWS_20170524_120000_BBC_News_at_One/BBCNEWS_20170524_120000_BBC_News_at_One.thumbs/BBCNEWS_20170524_120000_BBC_News_at_One_001348.jpg,"francis will hope so. it is hard to imagine a meeting between two more contrasting leaders. the pope, who is already on to his next audience, opposes the president on immigration, climate change and border walls."
https://archive.org/details/BBCNEWS_20170524_180000_100_Days#start/1430/end/1465,5/24/2017 18:24:05,BBCNEWS,100 Days,BBCNEWS_20170524_180000_100_Days,https://archive.org/download/BBCNEWS_20170524_180000_100_Days/BBCNEWS_20170524_180000_100_Days.thumbs/BBCNEWS_20170524_180000_100_Days_001407.jpg,"contained in the international climate change group 2040 report. the essence of diplomacy is not to let your disagreements over come the opportunities to pursue common objectives where you are aligned, and we have many of those, the fight"
https://archive.org/details/BBCNEWS_20170524_200000_Outside_Source#start/42/end/77,5/24/2017 20:00:57,BBCNEWS,Outside Source,BBCNEWS_20170524_200000_Outside_Source,https://archive.org/download/BBCNEWS_20170524_200000_Outside_Source/BBCNEWS_20170524_200000_Outside_Source.thumbs/BBCNEWS_20170524_200000_Outside_Source_000057.jpg,"also today. donald trump has met the pope at the vatican. the two leaders have clashed in the past over border walls and climate change - we'll hear how the meeting today went. and later, christian fraser will be"
https://archive.org/details/BBCNEWS_20170525_044500_BBC_News#start/0/end/34,5/25/2017 4:45:14,BBCNEWS,BBC News,BBCNEWS_20170525_044500_BBC_News,https://archive.org/download/BBCNEWS_20170525_044500_BBC_News/BBCNEWS_20170525_044500_BBC_News.thumbs/BBCNEWS_20170525_044500_BBC_News_000058.jpg,"and britain over leaked photos from the crime scene. in the financial times, climate change and how leaders in europe will lobby donald trump to try and get the us to stick with the landmark paris agreement."
https://archive.org/details/BBCNEWS_20170522_080000_Victoria_Derbyshire#start/6239/end/6274,5/22/2017 9:44:14,BBCNEWS,Victoria Derbyshire,BBCNEWS_20170522_080000_Victoria_Derbyshire,https://archive.org/download/BBCNEWS_20170522_080000_Victoria_Derbyshire/BBCNEWS_20170522_080000_Victoria_Derbyshire.thumbs/BBCNEWS_20170522_080000_Victoria_Derbyshire_006238.jpg,"felt more uncertain with brexit, with accelerating climate change, with an nhs in crisis. we face challenges that we can't possibly pretend to fix in the next 100 days or the next 1000. threats to our"
https://archive.org/details/BBCNEWS_20170530_180000_100_Days#start/237/end/272,5/30/2017 18:04:12,BBCNEWS,100 Days,BBCNEWS_20170530_180000_100_Days,https://archive.org/download/BBCNEWS_20170530_180000_100_Days/BBCNEWS_20170530_180000_100_Days.thumbs/BBCNEWS_20170530_180000_100_Days_000237.jpg,"might bea europe or specific policies?m might be a mixture. i was not sitting next to them in those meetings but also there are questions to do with climate change in which angela merkel is very much"
https://archive.org/details/BBCNEWS_20170530_180000_100_Days#start/254/end/289,5/30/2017 18:04:29,BBCNEWS,100 Days,BBCNEWS_20170530_180000_100_Days,https://archive.org/download/BBCNEWS_20170530_180000_100_Days/BBCNEWS_20170530_180000_100_Days.thumbs/BBCNEWS_20170530_180000_100_Days_000237.jpg,"interested. if there is nojoint policy on climate change we cannot solve problems in africa, and fighting terrorism and have a solution to migration, if we have no understanding of international trade relations. we have to see that bmw"
https://archive.org/details/BBCNEWS_20170529_020000_BBC_News#start/146/end/181,5/29/2017 2:02:41,BBCNEWS,BBC News,BBCNEWS_20170529_020000_BBC_News,https://archive.org/download/BBCNEWS_20170529_020000_BBC_News/BBCNEWS_20170529_020000_BBC_News.thumbs/BBCNEWS_20170529_020000_BBC_News_000118.jpg,"an agreement to reduce greehouse gases to help combat climate change. an agreement to reduce greenhouse angela merkel was not impressed. translation: the entire discussion about climate was very difficult if not to say very dissatisfying."
https://archive.org/details/BBCNEWS_20170529_133000_Great_Explorations#start/271/end/306,5/29/2017 13:34:46,BBCNEWS,Great Explorations,BBCNEWS_20170529_133000_Great_Explorations,https://archive.org/download/BBCNEWS_20170529_133000_Great_Explorations/BBCNEWS_20170529_133000_Great_Explorations.thumbs/BBCNEWS_20170529_133000_Great_Explorations_000267.jpg,"over mount everest. this view from the top of mount everest had never been seen before. the footage is also helping scientists today learn more about the impact of climate change. will you give me a hand"
https://archive.org/details/BBCNEWS_20170529_133000_Great_Explorations#start/616/end/651,5/29/2017 13:40:31,BBCNEWS,Great Explorations,BBCNEWS_20170529_133000_Great_Explorations,https://archive.org/download/BBCNEWS_20170529_133000_Great_Explorations/BBCNEWS_20170529_133000_Great_Explorations.thumbs/BBCNEWS_20170529_133000_Great_Explorations_000597.jpg,"the impact climate change has had on the himalayas over the past hundred years. but until now, he's only had a handful of still images from the early expeditions. so the availability of captain noel's footage will give him"
https://archive.org/details/BBCNEWS_20170529_203000_Outside_Source#start/376/end/411,5/29/2017 20:36:31,BBCNEWS,Outside Source,BBCNEWS_20170529_203000_Outside_Source,https://archive.org/download/BBCNEWS_20170529_203000_Outside_Source/BBCNEWS_20170529_203000_Outside_Source.thumbs/BBCNEWS_20170529_203000_Outside_Source_000358.jpg,"with donald trump and his refusal to cooperate with the rest of the g-7 on climate change and migration. this is angela merkel's strongest language to date. particularly when it comes to donald trump. angela"
https://archive.org/details/BBCNEWS_20170526_043000_World_Business_Report#start/70/end/105,5/26/2017 4:31:25,BBCNEWS,World Business Report,BBCNEWS_20170526_043000_World_Business_Report,https://archive.org/download/BBCNEWS_20170526_043000_World_Business_Report/BBCNEWS_20170526_043000_World_Business_Report.thumbs/BBCNEWS_20170526_043000_World_Business_Report_000057.jpg,"can the other g7 leaders keep the us president on side over trade and climate change? plus - from rags to riches. it's the global capital of cast-off clothing but is india's textile recycling trade now under threat?"
https://archive.org/details/BBCNEWS_20170526_043000_World_Business_Report#start/247/end/282,5/26/2017 4:34:22,BBCNEWS,World Business Report,BBCNEWS_20170526_043000_World_Business_Report,https://archive.org/download/BBCNEWS_20170526_043000_World_Business_Report/BBCNEWS_20170526_043000_World_Business_Report.thumbs/BBCNEWS_20170526_043000_World_Business_Report_000237.jpg,"they have their work cut out. want to look at the paris climate change agreement. how likely do you rate their chances of getting president trump to soften the stands? there is certainly effort by france and"
https://archive.org/details/BBCNEWS_20170527_110000_BBC_News#start/1078/end/1113,5/27/2017 11:18:13,BBCNEWS,BBC News,BBCNEWS_20170527_110000_BBC_News,https://archive.org/download/BBCNEWS_20170527_110000_BBC_News/BBCNEWS_20170527_110000_BBC_News.thumbs/BBCNEWS_20170527_110000_BBC_News_001077.jpg,"between the g7 leaders, above all on the need to do more to tackle global terrorism. but there have also been some dramatic discordant notes on trade and climate change. donald trump has voiced his anger"
https://archive.org/details/BBCNEWS_20170527_130000_BBC_News#start/1246/end/1281,5/27/2017 13:21:01,BBCNEWS,BBC News,BBCNEWS_20170527_130000_BBC_News,https://archive.org/download/BBCNEWS_20170527_130000_BBC_News/BBCNEWS_20170527_130000_BBC_News.thumbs/BBCNEWS_20170527_130000_BBC_News_001227.jpg,"views are evolving, having previously said climate change was a hoax. how encouraging is that? we will have to put that against comments quoted by angela merkel quartered and several news agencies who said she is very disappointed by"
https://archive.org/details/BBCNEWS_20170527_153000_Great_Explorations#start/659/end/694,5/27/2017 15:41:14,BBCNEWS,Great Explorations,BBCNEWS_20170527_153000_Great_Explorations,https://archive.org/download/BBCNEWS_20170527_153000_Great_Explorations/BBCNEWS_20170527_153000_Great_Explorations.thumbs/BBCNEWS_20170527_153000_Great_Explorations_000658.jpg,"the east rongbuk glacier is the glacier here, right through here. he provides the old and new images to scientists. they use them to determine the impact climate change has had on the himalayas over the past hundred years."
https://archive.org/details/BBCNEWS_20170527_180000_BBC_News#start/1525/end/1560,5/27/2017 18:25:40,BBCNEWS,BBC News,BBCNEWS_20170527_180000_BBC_News,https://archive.org/download/BBCNEWS_20170527_180000_BBC_News/BBCNEWS_20170527_180000_BBC_News.thumbs/BBCNEWS_20170527_180000_BBC_News_001528.jpg,"g-7 there is a fault line must then the g-7 on climate change. you have the sub grouping of the gi and they stand against the grouping of the gi. and gi containing just the usa."
https://archive.org/details/BBCNEWS_20170528_000000_BBC_News#start/726/end/761,5/28/2017 0:12:21,BBCNEWS,BBC News,BBCNEWS_20170528_000000_BBC_News,https://archive.org/download/BBCNEWS_20170528_000000_BBC_News/BBCNEWS_20170528_000000_BBC_News.thumbs/BBCNEWS_20170528_000000_BBC_News_000717.jpg,"troops in sicily that his overseas tour had been a success. from saudi arabia, to israel, to nato, to the g7, we made extraordinary gains on this historic trip. this disagreement over climate change has shown that donald trump"
https://archive.org/details/BBCNEWS_20170528_010000_BBC_News#start/781/end/816,5/28/2017 1:13:16,BBCNEWS,BBC News,BBCNEWS_20170528_010000_BBC_News,https://archive.org/download/BBCNEWS_20170528_010000_BBC_News/BBCNEWS_20170528_010000_BBC_News.thumbs/BBCNEWS_20170528_010000_BBC_News_000778.jpg,"extraordinary gains on this historic trip. this disagreement over climate change has shown that donald trump is ready and willing to confront his allies in europe. in stark contrast to the warm words he offered partners in the middle"
https://archive.org/details/BBCNEWS_20170528_013000_Dateline_London#start/924/end/959,5/28/2017 1:45:39,BBCNEWS,Dateline London,BBCNEWS_20170528_013000_Dateline_London,https://archive.org/download/BBCNEWS_20170528_013000_Dateline_London/BBCNEWS_20170528_013000_Dateline_London.thumbs/BBCNEWS_20170528_013000_Dateline_London_000897.jpg,"that maybe climate change is real. we also have short-term memory loss. over the past three months, how many times has trump done something and people say, oh, i think he has caught on now."
https://archive.org/details/BBCNEWS_20170528_030000_BBC_News#start/1246/end/1281,5/28/2017 3:21:01,BBCNEWS,BBC News,BBCNEWS_20170528_030000_BBC_News,https://archive.org/download/BBCNEWS_20170528_030000_BBC_News/BBCNEWS_20170528_030000_BBC_News.thumbs/BBCNEWS_20170528_030000_BBC_News_001228.jpg,"this disagreement over climate change has shown that donald trump is ready and willing to confront his allies in europe. in stark contrast to the warm words he offered partners in the middle east. james landale, bbc news, sicily."
https://archive.org/details/BBCNEWS_20170526_003000_Asia_Business_Report#start/215/end/250,5/26/2017 0:33:50,BBCNEWS,Asia Business Report,BBCNEWS_20170526_003000_Asia_Business_Report,https://archive.org/download/BBCNEWS_20170526_003000_Asia_Business_Report/BBCNEWS_20170526_003000_Asia_Business_Report.thumbs/BBCNEWS_20170526_003000_Asia_Business_Report_000208.jpg,"climate change is going to be front and centre because that is the issue re: what president trump is postulated. he said the everyone he intends to withdraw from the paris accord. away from the g7, mr trump"
https://archive.org/details/BBCNEWS_20170526_020000_BBC_News#start/1111/end/1146,5/26/2017 2:18:46,BBCNEWS,BBC News,BBCNEWS_20170526_020000_BBC_News,https://archive.org/download/BBCNEWS_20170526_020000_BBC_News/BBCNEWS_20170526_020000_BBC_News.thumbs/BBCNEWS_20170526_020000_BBC_News_001108.jpg,"out over other issues. international trade, climate change, and global migration. areas where mr trump's smiles are not matched by his g7 colleagues. this summit will be overshadowed, notjust by mount edna, but also by the events"
https://archive.org/details/BBCNEWS_20170515_020000_BBC_News#start/543/end/578,5/15/2017 2:09:18,BBCNEWS,BBC News,BBCNEWS_20170515_020000_BBC_News,https://archive.org/download/BBCNEWS_20170515_020000_BBC_News/BBCNEWS_20170515_020000_BBC_News.thumbs/BBCNEWS_20170515_020000_BBC_News_000538.jpg,"speech to restore his country's global standing. he said france needed to find answers to the great challenges, including migration, terrorism and climate change. 0ur europe correspondent damian grammaticas was there watching. not since france had"
https://archive.org/details/BBCNEWS_20170515_020000_BBC_News#start/1744/end/1779,5/15/2017 2:29:19,BBCNEWS,BBC News,BBCNEWS_20170515_020000_BBC_News,https://archive.org/download/BBCNEWS_20170515_020000_BBC_News/BBCNEWS_20170515_020000_BBC_News.thumbs/BBCNEWS_20170515_020000_BBC_News_001738.jpg,"for an emergency meeting of the un security council. emmanuel macron has promised to restore france's global standing, after being sworn in as the country's youngest president. he promised to tackle great challenges, including migration, terrorism and climate change. one of his first tasks will be to name a new prime minister. now on bbc news, dateline london."
https://archive.org/details/BBCNEWS_20170515_030000_BBC_News#start/524/end/559,5/15/2017 3:08:59,BBCNEWS,BBC News,BBCNEWS_20170515_030000_BBC_News,https://archive.org/download/BBCNEWS_20170515_030000_BBC_News/BBCNEWS_20170515_030000_BBC_News.thumbs/BBCNEWS_20170515_030000_BBC_News_000508.jpg,"speech to restore his country's global standing. he said france needed to find answers to the great challenges, including migration, terrorism and climate change. 0ur europe correspondent damian grammaticas was there watching. not since france had an emperor,"
https://archive.org/details/BBCNEWS_20170515_040000_BBC_News#start/1743/end/1778,5/15/2017 4:29:18,BBCNEWS,BBC News,BBCNEWS_20170515_040000_BBC_News,https://archive.org/download/BBCNEWS_20170515_040000_BBC_News/BBCNEWS_20170515_040000_BBC_News.thumbs/BBCNEWS_20170515_040000_BBC_News_001738.jpg,"he promised to tackle great challenges, including migration, terrorism, and climate change. this year's eurovision song contest winner salvador sobral has arrived home in portugal to hundreds of cheering fans. the 27-year-old singer has become"
https://archive.org/details/BBCNEWS_20170531_183000_BBC_Election_Debate_2017#start/4100/end/4135,5/31/2017 19:38:35,BBCNEWS,BBC Election Debate 2017,BBCNEWS_20170531_183000_BBC_Election_Debate_2017,https://archive.org/download/BBCNEWS_20170531_183000_BBC_Election_Debate_2017/BBCNEWS_20170531_183000_BBC_Election_Debate_2017.thumbs/BBCNEWS_20170531_183000_BBC_Election_Debate_2017_004078.jpg,"muesli eating guardian readers to solve card climate change, we all soft so let's make a difference and that made a nationwide and app planet wide concerted effort to build the future we need. what can"
https://archive.org/details/BBCNEWS_20170527_000000_BBC_News#start/815/end/850,5/27/2017 0:13:50,BBCNEWS,BBC News,BBCNEWS_20170527_000000_BBC_News,https://archive.org/download/BBCNEWS_20170527_000000_BBC_News/BBCNEWS_20170527_000000_BBC_News.thumbs/BBCNEWS_20170527_000000_BBC_News_000807.jpg,"convincing him that it is worth his while to be a member of this small clu b club of large nations. so they may push him on climate change, but not that hard. stay with us on bbc news."
https://archive.org/details/BBCNEWS_20170527_010000_BBC_News#start/732/end/767,5/27/2017 1:12:27,BBCNEWS,BBC News,BBCNEWS_20170527_010000_BBC_News,https://archive.org/download/BBCNEWS_20170527_010000_BBC_News/BBCNEWS_20170527_010000_BBC_News.thumbs/BBCNEWS_20170527_010000_BBC_News_000717.jpg,"sicily, there has been some harmony between g7 leaders, above all on the need to tackle global terrorism. but there have also been some dramatic and discordant notes on trade and climate change. donald trump has"
https://archive.org/details/BBCNEWS_20170527_013000_Talking_Movies#start/437/end/472,5/27/2017 1:37:32,BBCNEWS,Talking Movies,BBCNEWS_20170527_013000_Talking_Movies,https://archive.org/download/BBCNEWS_20170527_013000_Talking_Movies/BBCNEWS_20170527_013000_Talking_Movies.thumbs/BBCNEWS_20170527_013000_Talking_Movies_000418.jpg,"climate change document tree which premiered at cannes 11 years ago. the new film has more action than the original. it is wrong to louis bisson! -- pollute this earth. the original. it is wrong to louis"
https://archive.org/details/BBCNEWS_20170527_020000_BBC_News#start/1724/end/1759,5/27/2017 2:28:59,BBCNEWS,BBC News,BBCNEWS_20170527_020000_BBC_News,https://archive.org/download/BBCNEWS_20170527_020000_BBC_News/BBCNEWS_20170527_020000_BBC_News.thumbs/BBCNEWS_20170527_020000_BBC_News_001707.jpg,"says the paris climate change agreement will not collapse if president trump does as he has threatened and withdraws the united states. antonio guterres called on donald trump to stay engaged with the agreement. newswatch is coming up later."
https://archive.org/details/BBCNEWS_20170527_040000_BBC_News#start/900/end/935,5/27/2017 4:15:15,BBCNEWS,BBC News,BBCNEWS_20170527_040000_BBC_News,https://archive.org/download/BBCNEWS_20170527_040000_BBC_News/BBCNEWS_20170527_040000_BBC_News.thumbs/BBCNEWS_20170527_040000_BBC_News_000897.jpg,"but the leaders were unable to reach an agreement on climate change, with differences remaining between president trump and the rest of the group. the bbc's james landale is at the summit. at this summit, in an ancient town"
https://archive.org/details/BBCNEWS_20170508_040000_BBC_News#start/112/end/147,5/8/2017 4:02:07,BBCNEWS,BBC News,BBCNEWS_20170508_040000_BBC_News,https://archive.org/download/BBCNEWS_20170508_040000_BBC_News/BBCNEWS_20170508_040000_BBC_News.thumbs/BBCNEWS_20170508_040000_BBC_News_000117.jpg,"mr macron promised to heal divisions, restore confidence in the european union, and combat the threats posed by terrorism and climate change. with results almost counted, projections show mr macron has won more than 66% of the vote,"
https://archive.org/details/BBCNEWS_20170511_040000_BBC_News#start/677/end/712,5/11/2017 4:11:32,BBCNEWS,BBC News,BBCNEWS_20170511_040000_BBC_News,https://archive.org/download/BBCNEWS_20170511_040000_BBC_News/BBCNEWS_20170511_040000_BBC_News.thumbs/BBCNEWS_20170511_040000_BBC_News_000657.jpg,"pristine wilderness of alaska for this summit, their conversations have been dominated one topic. what does president trump think about climate change? what is america's policy? there is particular concern that the us might be about to"
https://archive.org/details/BBCNEWS_20170511_180000_100_Days#start/43/end/78,5/11/2017 18:00:58,BBCNEWS,100 Days,BBCNEWS_20170511_180000_100_Days,https://archive.org/download/BBCNEWS_20170511_180000_100_Days/BBCNEWS_20170511_180000_100_Days.thumbs/BBCNEWS_20170511_180000_100_Days_000058.jpg,"where the ice is getting thinner, summers are getting longer, and climate change is far from just a political debate. also, a regional election in germany is suddenly in the spotlight. could the result help predict"
https://archive.org/details/BBCNEWS_20170511_200000_Outside_Source#start/41/end/76,5/11/2017 20:00:56,BBCNEWS,Outside Source,BBCNEWS_20170511_200000_Outside_Source,https://archive.org/download/BBCNEWS_20170511_200000_Outside_Source/BBCNEWS_20170511_200000_Outside_Source.thumbs/BBCNEWS_20170511_200000_Outside_Source_000058.jpg,"elected office and half of them are women. we'll be live in alaska, where the foreign ministers of the eight arctic council nations are meeting. climate change is top of the agenda. the business will be live in new"
https://archive.org/details/BBCNEWS_20170511_200000_Outside_Source#start/926/end/961,5/11/2017 20:15:41,BBCNEWS,Outside Source,BBCNEWS_20170511_200000_Outside_Source,https://archive.org/download/BBCNEWS_20170511_200000_Outside_Source/BBCNEWS_20170511_200000_Outside_Source.thumbs/BBCNEWS_20170511_200000_Outside_Source_000898.jpg,"that the declaration has been issued, the fairbanks declaration. it is several pages long full you will be interested to learn that the key pa rt, key part, about climate change, with the united states except language"
https://archive.org/details/BBCNEWS_20170512_000000_Newsday#start/480/end/515,5/12/2017 0:08:15,BBCNEWS,Newsday,BBCNEWS_20170512_000000_Newsday,https://archive.org/download/BBCNEWS_20170512_000000_Newsday/BBCNEWS_20170512_000000_Newsday.thumbs/BBCNEWS_20170512_000000_Newsday_000477.jpg,"america's climate change policy. the secretary of state, rex tillerson, told the ministers, meeting in alaska, that the us would not rush to make a decision. indonesia's justice minister has said he will review the country's"
https://archive.org/details/BBCNEWS_20170514_220000_BBC_News#start/447/end/482,5/14/2017 22:07:42,BBCNEWS,BBC News,BBCNEWS_20170514_220000_BBC_News,https://archive.org/download/BBCNEWS_20170514_220000_BBC_News/BBCNEWS_20170514_220000_BBC_News.thumbs/BBCNEWS_20170514_220000_BBC_News_000448.jpg,"he said france has to find answers to the great crises of the time, including migration, terrorism, and climate change. 0ur europe correspondent damian grammaticas was watching. not since france had an emperor 200 years ago,"
https://archive.org/details/BBCNEWS_20170512_100000_BBC_Newsroom_Live#start/3339/end/3374,5/12/2017 10:55:54,BBCNEWS,BBC Newsroom Live,BBCNEWS_20170512_100000_BBC_Newsroom_Live,https://archive.org/download/BBCNEWS_20170512_100000_BBC_Newsroom_Live/BBCNEWS_20170512_100000_BBC_Newsroom_Live.thumbs/BBCNEWS_20170512_100000_BBC_Newsroom_Live_003327.jpg,"huge problems as well as the legacy of regime change was. there is a dangerous cocktail of ethnic conflicts, food insecurity and water scarcity and fast emerging effects of climate change. to that mix and a"
https://archive.org/details/BBCNEWS_20170526_080000_Victoria_Derbyshire#start/3848/end/3883,5/26/2017 9:04:23,BBCNEWS,Victoria Derbyshire,BBCNEWS_20170526_080000_Victoria_Derbyshire,https://archive.org/download/BBCNEWS_20170526_080000_Victoria_Derbyshire/BBCNEWS_20170526_080000_Victoria_Derbyshire.thumbs/BBCNEWS_20170526_080000_Victoria_Derbyshire_003838.jpg,"terror, they may fall out over other issues - international trade, climate change and global migration, areas where mr trump's smiles are not matched by his g7 colleagues. james landale, bbc news, sicily. travellers through gatwick airport are suffering major"
https://archive.org/details/BBCNEWS_20170526_080000_Victoria_Derbyshire#start/6552/end/6587,5/26/2017 9:49:27,BBCNEWS,Victoria Derbyshire,BBCNEWS_20170526_080000_Victoria_Derbyshire,https://archive.org/download/BBCNEWS_20170526_080000_Victoria_Derbyshire/BBCNEWS_20170526_080000_Victoria_Derbyshire.thumbs/BBCNEWS_20170526_080000_Victoria_Derbyshire_006538.jpg,"pull out from the paris climate agreement. they were asking do you believe in climate change or not? this is a chance for them to work out where he stands. emmanuel macron, the new french president,"
