URL,MatchDateTime,Station,Show,IAShowID,IAPreviewThumb,Snippet
https://archive.org/details/BBCNEWS_20190215_210000_World_News_Today#start/1398/end/1433,2/15/2019 21:23:33,BBCNEWS,World News Today,BBCNEWS_20190215_210000_World_News_Today,https://archive.org/download/BBCNEWS_20190215_210000_World_News_Today/BBCNEWS_20190215_210000_World_News_Today.thumbs/BBCNEWS_20190215_210000_World_News_Today_001377.jpg,"in a day of protests, calling for action on climate change. frankie mccamley reports from manchester, where children have been out in force. we are angry that the government's not doing anything, but we also see it as important to fight for our futures. to all the politicians,"
https://archive.org/details/BBCNEWS_20190215_090000_BBC_News_at_9#start/2280/end/2315,2/15/2019 9:38:15,BBCNEWS,BBC News at 9,BBCNEWS_20190215_090000_BBC_News_at_9,https://archive.org/download/BBCNEWS_20190215_090000_BBC_News_at_9/BBCNEWS_20190215_090000_BBC_News_at_9.thumbs/BBCNEWS_20190215_090000_BBC_News_at_9_002277.jpg,"things we are doing. we have the committee on climate change, an independent body, i am throwing lots of words are you but i am excited about this too. i have asked them advice on how we get to a net zero economy. sorry, we have left the energy"
https://archive.org/details/BBCNEWS_20190215_190000_BBC_News#start/880/end/915,2/15/2019 19:14:55,BBCNEWS,BBC News,BBCNEWS_20190215_190000_BBC_News,https://archive.org/download/BBCNEWS_20190215_190000_BBC_News/BBCNEWS_20190215_190000_BBC_News.thumbs/BBCNEWS_20190215_190000_BBC_News_000867.jpg,"powers to pay for a border wall with mexico. the head of mi6 has warned governments in europe not to become complacent to the threat from islamic terror groups. thousands of pupils skip school , and take to the streets , in protest against climate change. schoolchildren across the uk"
https://archive.org/details/BBCNEWS_20190216_010000_BBC_News#start/564/end/599,2/16/2019 1:09:39,BBCNEWS,BBC News,BBCNEWS_20190216_010000_BBC_News,https://archive.org/download/BBCNEWS_20190216_010000_BBC_News/BBCNEWS_20190216_010000_BBC_News.thumbs/BBCNEWS_20190216_010000_BBC_News_000537.jpg,"# born to love in everyone. before nine-year-old lilia had her say. i'm worried about climate change because of the animals. would you like it if your home was disappearing in front of your eyes? this is clearly the first time many of these pupils have ever"
https://archive.org/details/BBCNEWS_20190216_050000_BBC_News#start/973/end/1008,2/16/2019 5:16:28,BBCNEWS,BBC News,BBCNEWS_20190216_050000_BBC_News,https://archive.org/download/BBCNEWS_20190216_050000_BBC_News/BBCNEWS_20190216_050000_BBC_News.thumbs/BBCNEWS_20190216_050000_BBC_News_000958.jpg,"national emergency powers to fund the border wall with mexico. the democrats accuse him of 'an abuse of power.' schoolchildren across the uk, have been taking part in a day of protests, calling for action on climate change. 0rganisers say pupils walked out of schools in more than 60 towns"
https://archive.org/details/BBCNEWS_20190211_140000_Afternoon_Live#start/1756/end/1791,2/11/2019 14:29:31,BBCNEWS,Afternoon Live,BBCNEWS_20190211_140000_Afternoon_Live,https://archive.org/download/BBCNEWS_20190211_140000_Afternoon_Live/BBCNEWS_20190211_140000_Afternoon_Live.thumbs/BBCNEWS_20190211_140000_Afternoon_Live_001738.jpg,"in the region's settlement. officials say about six to ten can regularly be seen in and around the local military garrison. climate change has caused arctic sea ice to melt and that has driven polar bears to spend more time on land in an effort to find food."
https://archive.org/details/BBCNEWS_20190212_040000_BBC_News#start/597/end/632,2/12/2019 4:10:12,BBCNEWS,BBC News,BBCNEWS_20190212_040000_BBC_News,https://archive.org/download/BBCNEWS_20190212_040000_BBC_News/BBCNEWS_20190212_040000_BBC_News.thumbs/BBCNEWS_20190212_040000_BBC_News_000598.jpg,"so much of our atmospheric carbon, which is linked to climate change, that's stored in the soil, and that's cycled through the soil by insects. our food is grown in the soil, that's made by insects. and then our food is then pollinated by insects. every single step along that has"
https://archive.org/details/BBCNEWS_20190212_040000_BBC_News#start/628/end/663,2/12/2019 4:10:43,BBCNEWS,BBC News,BBCNEWS_20190212_040000_BBC_News,https://archive.org/download/BBCNEWS_20190212_040000_BBC_News/BBCNEWS_20190212_040000_BBC_News.thumbs/BBCNEWS_20190212_040000_BBC_News_000629.jpg,"and our food production practices that have been driving these declines. there are three key things that this study highlights as threats to our planet's insect diversity - climate change, invasive species, and critically, how we use our land, the increasing intensification of agriculture. around the world, suitable habitat"
https://archive.org/details/BBCNEWS_20190212_030000_BBC_News#start/795/end/830,2/12/2019 3:13:30,BBCNEWS,BBC News,BBCNEWS_20190212_030000_BBC_News,https://archive.org/download/BBCNEWS_20190212_030000_BBC_News/BBCNEWS_20190212_030000_BBC_News.thumbs/BBCNEWS_20190212_030000_BBC_News_000779.jpg,"could jeopardise our way of life. so much of our atmospheric carbon, which is linked to climate change, that's stored in the soil, and that's cycled through the soil by insects. our food is grown in the soil, that's made by insects. and then our food is then"
https://archive.org/details/BBCNEWS_20190212_000000_Newsday#start/508/end/543,2/12/2019 0:08:43,BBCNEWS,Newsday,BBCNEWS_20190212_000000_Newsday,https://archive.org/download/BBCNEWS_20190212_000000_Newsday/BBCNEWS_20190212_000000_Newsday.thumbs/BBCNEWS_20190212_000000_Newsday_000508.jpg,"but, as much as we rely on insects, it is primarily our activities and our food production practices that have been driving these declines. there are three key things that this study highlights as threats to our planet's insect diversity - climate change, invasive species, and critically, how we use our land,"
https://archive.org/details/BBCNEWS_20190210_203000_The_Travel_Show#start/673/end/708,2/10/2019 20:41:28,BBCNEWS,The Travel Show,BBCNEWS_20190210_203000_The_Travel_Show,https://archive.org/download/BBCNEWS_20190210_203000_The_Travel_Show/BBCNEWS_20190210_203000_The_Travel_Show.thumbs/BBCNEWS_20190210_203000_The_Travel_Show_000660.jpg,"butterflies will start their long flight north as they prepare to spend the spring and summer months over the border in the us and canada. but climate change is having a real effect on butterfly numbers, and some scientists fear that within 20 years, they could be extinct."
https://archive.org/details/BBCNEWS_20190211_090000_BBC_News_at_9#start/3254/end/3289,2/11/2019 9:54:29,BBCNEWS,BBC News at 9,BBCNEWS_20190211_090000_BBC_News_at_9,https://archive.org/download/BBCNEWS_20190211_090000_BBC_News_at_9/BBCNEWS_20190211_090000_BBC_News_at_9.thumbs/BBCNEWS_20190211_090000_BBC_News_at_9_003237.jpg,"since december more than 50 polar bears have been reported in the main settlement. officials say around 6-10 settlement. officials say around 6-10 can regularly be seen around a local military garrison. climate change has caused arctic sea ice to melt and that has driven polar bears"
https://archive.org/details/BBCNEWS_20190211_060000_Breakfast#start/3333/end/3368,2/11/2019 6:55:48,BBCNEWS,Breakfast,BBCNEWS_20190211_060000_Breakfast,https://archive.org/download/BBCNEWS_20190211_060000_Breakfast/BBCNEWS_20190211_060000_Breakfast.thumbs/BBCNEWS_20190211_060000_Breakfast_003327.jpg,"gielgud, that is entertainment's select club. it could happen. you are watching breakfast. still to come this morning: when journalist david wallace-wells started interviewing scientists about climate change, he was told the outlook is much worse than people realise. he will be here to tell us how"
https://archive.org/details/BBCNEWS_20190208_060000_Breakfast#start/401/end/436,2/8/2019 6:06:56,BBCNEWS,Breakfast,BBCNEWS_20190208_060000_Breakfast,https://archive.org/download/BBCNEWS_20190208_060000_Breakfast/BBCNEWS_20190208_060000_Breakfast.thumbs/BBCNEWS_20190208_060000_Breakfast_000388.jpg,"they are thanking the community for everything they have done this week that she has a close group of friends. sarah, thank you. the drax power station in north yorkshire has become the first in the world to reverse climate change on a tiny scale - in a process known"
https://archive.org/details/BBCNEWS_20190208_110000_BBC_Newsroom_Live#start/2381/end/2416,2/8/2019 11:39:56,BBCNEWS,BBC Newsroom Live,BBCNEWS_20190208_110000_BBC_Newsroom_Live,https://archive.org/download/BBCNEWS_20190208_110000_BBC_Newsroom_Live/BBCNEWS_20190208_110000_BBC_Newsroom_Live.thumbs/BBCNEWS_20190208_110000_BBC_Newsroom_Live_002367.jpg,"the technology captures carbon dioxide from burning wood pellets. the company says it's the first time it has been tried anywhere in the world and could help tackle climate change. our environment analyst roger harrabin explains. we humans or trees a great debt. when they are going the absorb much"
https://archive.org/details/BBCNEWS_20190209_053000_The_Travel_Show#start/674/end/709,2/9/2019 5:41:29,BBCNEWS,The Travel Show,BBCNEWS_20190209_053000_The_Travel_Show,https://archive.org/download/BBCNEWS_20190209_053000_The_Travel_Show/BBCNEWS_20190209_053000_The_Travel_Show.thumbs/BBCNEWS_20190209_053000_The_Travel_Show_000658.jpg,"truly remarked -- remarkable migration is getting ready to take place. next one, millions of monarch butterflies will start their long ﬂight flight north as they repaired to spend this bring in some months over the border in the us and canada. but climate change is having a real"
https://archive.org/details/BBCNEWS_20190207_010000_Newsday#start/0/end/33,2/7/2019 1:00:13,BBCNEWS,Newsday,BBCNEWS_20190207_010000_Newsday,https://archive.org/download/BBCNEWS_20190207_010000_Newsday/BBCNEWS_20190207_010000_Newsday.thumbs/BBCNEWS_20190207_010000_Newsday_000027.jpg,"hello, everyone. i'm rico hizon in singapore. the headlines: the starkest warning yet on climate change. scientists say the world's set for the hottest decade ever recorded. we are looking at really big changes in the climate. we're going into territory that we have never been in before."
https://archive.org/details/BBCNEWS_20190207_030000_BBC_News#start/727/end/762,2/7/2019 3:12:22,BBCNEWS,BBC News,BBCNEWS_20190207_030000_BBC_News,https://archive.org/download/BBCNEWS_20190207_030000_BBC_News/BBCNEWS_20190207_030000_BBC_News.thumbs/BBCNEWS_20190207_030000_BBC_News_000719.jpg,"the latest headlines for you: scientists have issued the starkest warning yet on climate change. they say the world is set for the hottest decade ever recorded. after sweeping gains against the so-called is militants in syria and iraq, donald trump has claimed total defeat is just days away."
https://archive.org/details/BBCNEWS_20190207_030000_BBC_News#start/760/end/795,2/7/2019 3:12:55,BBCNEWS,BBC News,BBCNEWS_20190207_030000_BBC_News,https://archive.org/download/BBCNEWS_20190207_030000_BBC_News/BBCNEWS_20190207_030000_BBC_News.thumbs/BBCNEWS_20190207_030000_BBC_News_000749.jpg,"told by many people that we have haps 12 years to avoid the most catastrophic effects of man-made climate change. the new figures coming from the met office in the uk and from the nasa scientist seem to be very specific about a much shorter period. what is significant"
https://archive.org/details/BBCNEWS_20190207_030000_BBC_News#start/793/end/828,2/7/2019 3:13:28,BBCNEWS,BBC News,BBCNEWS_20190207_030000_BBC_News,https://archive.org/download/BBCNEWS_20190207_030000_BBC_News/BBCNEWS_20190207_030000_BBC_News.thumbs/BBCNEWS_20190207_030000_BBC_News_000778.jpg,"celsius over the preindustrial level, and that is very significant because the paris agreement on climate change says that we should try to limit increases in temperature at that level, so we may have already exceeded at least one of the initial targets on paris.|j"
https://archive.org/details/BBCNEWS_20190207_030000_BBC_News#start/876/end/911,2/7/2019 3:14:51,BBCNEWS,BBC News,BBCNEWS_20190207_030000_BBC_News,https://archive.org/download/BBCNEWS_20190207_030000_BBC_News/BBCNEWS_20190207_030000_BBC_News.thumbs/BBCNEWS_20190207_030000_BBC_News_000868.jpg,"to the economy, hundreds of billions of dollars every year, again and we do not do something quickly about this problem. what are the chances of doing something about the problem? the most powerful man in the world, donald trump, does not believe in climate change, he says it isa"
https://archive.org/details/BBCNEWS_20190213_010000_Newsday#start/68/end/103,2/13/2019 1:01:23,BBCNEWS,Newsday,BBCNEWS_20190213_010000_Newsday,https://archive.org/download/BBCNEWS_20190213_010000_Newsday/BBCNEWS_20190213_010000_Newsday.thumbs/BBCNEWS_20190213_010000_Newsday_000027.jpg,"i believe it's a gang of extremists. and urging the chinese to chop out the pork. the un says the world's largest consumer of meat is causing the biggest emission of climate-change gases. good morning. it's 9am in singapore, one in the morning in london, and eight in the evening"
https://archive.org/details/BBCNEWS_20190214_140000_Afternoon_Live#start/2691/end/2726,2/14/2019 14:45:06,BBCNEWS,Afternoon Live,BBCNEWS_20190214_140000_Afternoon_Live,https://archive.org/download/BBCNEWS_20190214_140000_Afternoon_Live/BBCNEWS_20190214_140000_Afternoon_Live.thumbs/BBCNEWS_20190214_140000_Afternoon_Live_002668.jpg,"it's usually the job of environmental lobbyists or experienced campaigners to tell the people in power to do more about climate change. but there are a growing number of younger voices now able to do that, as well. patiently waiting at fort william"
https://archive.org/details/BBCNEWS_20190215_060000_Breakfast#start/8473/end/8508,2/15/2019 8:21:28,BBCNEWS,Breakfast,BBCNEWS_20190215_060000_Breakfast,https://archive.org/download/BBCNEWS_20190215_060000_Breakfast/BBCNEWS_20190215_060000_Breakfast.thumbs/BBCNEWS_20190215_060000_Breakfast_008458.jpg,"what i'm going to say is, would you like to ask the energy minister a question? yes. what action will you be taking to reassure our generation about climate change because in the end it is as who is going to suffer? george, it is great to see you. i"
https://archive.org/details/BBCNEWS_20190215_060000_Breakfast#start/8629/end/8664,2/15/2019 8:24:04,BBCNEWS,Breakfast,BBCNEWS_20190215_060000_Breakfast,https://archive.org/download/BBCNEWS_20190215_060000_Breakfast/BBCNEWS_20190215_060000_Breakfast.thumbs/BBCNEWS_20190215_060000_Breakfast_008608.jpg,"we need to be in a place where all of the emissions we might be creating in some parts of the economy are taken away by other things we're doing. -- net zero. and we have a committee on climate change in the uk, an independent body, i'm actually really excited"
https://archive.org/details/BBCNEWS_20190214_023000_Wednesday_in_Parliament#start/1388/end/1423,2/14/2019 2:53:23,BBCNEWS,Wednesday in Parliament,BBCNEWS_20190214_023000_Wednesday_in_Parliament,https://archive.org/download/BBCNEWS_20190214_023000_Wednesday_in_Parliament/BBCNEWS_20190214_023000_Wednesday_in_Parliament.thumbs/BBCNEWS_20190214_023000_Wednesday_in_Parliament_001378.jpg,"to review that honour. an education minister has warned students thinking of taking part in a climate change protest on friday that missing school is not the answer. lord agnew said absence created disruption for both pupils and teachers. but a liberal democrat peer said anyone missing lessons"
https://archive.org/details/BBCNEWS_20190218_190000_Beyond_100_Days#start/1959/end/1994,2/18/2019 19:32:54,BBCNEWS,Beyond 100 Days,BBCNEWS_20190218_190000_Beyond_100_Days,https://archive.org/download/BBCNEWS_20190218_190000_Beyond_100_Days/BBCNEWS_20190218_190000_Beyond_100_Days.thumbs/BBCNEWS_20190218_190000_Beyond_100_Days_001948.jpg,"theissues thank you forjoining us. of all of the issues that have become subject to political paralysis or partisanship here in the united states, climate change perhaps is the most depressing one. is it possible to take part in partisan politics out of american politics cosmic not entirely. it's been too"
https://archive.org/details/BBCNEWS_20190218_023000_The_Week_in_Parliament#start/1163/end/1198,2/18/2019 2:49:38,BBCNEWS,The Week in Parliament,BBCNEWS_20190218_023000_The_Week_in_Parliament,https://archive.org/download/BBCNEWS_20190218_023000_The_Week_in_Parliament/BBCNEWS_20190218_023000_The_Week_in_Parliament.thumbs/BBCNEWS_20190218_023000_The_Week_in_Parliament_001139.jpg,"education minister warned pupils planning on taking part in friday's one-day strike to protest against climate change that they should go to school instead. they had 15 weeks of holidays and half-terms to demonstrate without incurring disruption and extra workload to teachers. an average primary school"
https://archive.org/details/BBCNEWS_20190218_033000_Dateline_London#start/661/end/696,2/18/2019 3:41:16,BBCNEWS,Dateline London,BBCNEWS_20190218_033000_Dateline_London,https://archive.org/download/BBCNEWS_20190218_033000_Dateline_London/BBCNEWS_20190218_033000_Dateline_London.thumbs/BBCNEWS_20190218_033000_Dateline_London_000658.jpg,"for you to declare a national emergency, what happens when there is president who says it is about climate change? i hate to point this out but on the same day he declared this emergency, there was another big shooting in the us. by people died in illinois."
https://archive.org/details/BBCNEWS_20190217_000000_BBC_News#start/627/end/662,2/17/2019 0:10:42,BBCNEWS,BBC News,BBCNEWS_20190217_000000_BBC_News,https://archive.org/download/BBCNEWS_20190217_000000_BBC_News/BBCNEWS_20190217_000000_BBC_News.thumbs/BBCNEWS_20190217_000000_BBC_News_000628.jpg,"former us secretary of state, john kerry, has slammed the climate change record of the current us government, personally criticising president donald trump and vice-president mike pence. kerry was speaking at the munich security conference which, as we've reported, was also attended by the vice-president."
https://archive.org/details/BBCNEWS_20190209_223000_The_Papers#start/0/end/33,2/9/2019 22:30:13,BBCNEWS,The Papers,BBCNEWS_20190209_223000_The_Papers,https://archive.org/download/BBCNEWS_20190209_223000_The_Papers/BBCNEWS_20190209_223000_The_Papers.thumbs/BBCNEWS_20190209_223000_The_Papers_000029.jpg,"which splashes on what the paper calls a devastating new book onjeremy corbyn's leadership credentials. a head teachers' union has applauded a planned strike by school pupils who will walk out of lessons on friday over climate change. that's according to the sunday express, which also carries tonight's news"
https://archive.org/details/BBCNEWS_20190208_140000_Afternoon_Live#start/8718/end/8753,2/8/2019 16:25:33,BBCNEWS,Afternoon Live,BBCNEWS_20190208_140000_Afternoon_Live,https://archive.org/download/BBCNEWS_20190208_140000_Afternoon_Live/BBCNEWS_20190208_140000_Afternoon_Live.thumbs/BBCNEWS_20190208_140000_Afternoon_Live_008698.jpg,"season was 2018 even intojune quite a busy season was 2018 even into june there intojune there was quite a vigorous storm came through, people may remember hector. it is difficult to get a sense of a trend, people are wondering if it is climate change. the season with"
https://archive.org/details/BBCNEWS_20190221_110000_BBC_Newsroom_Live#start/1585/end/1620,2/21/2019 11:26:40,BBCNEWS,BBC Newsroom Live,BBCNEWS_20190221_110000_BBC_Newsroom_Live,https://archive.org/download/BBCNEWS_20190221_110000_BBC_Newsroom_Live/BBCNEWS_20190221_110000_BBC_Newsroom_Live.thumbs/BBCNEWS_20190221_110000_BBC_Newsroom_Live_001557.jpg,"we risk saving up a problem for the next generation if we don't make actions and put plans in place now. so we know that spending a small amount of money now to address climate change saves a big cost in the future. that's a cost that will fall"
https://archive.org/details/BBCNEWS_20190226_090000_BBC_News_at_9#start/1413/end/1448,2/26/2019 9:23:48,BBCNEWS,BBC News at 9,BBCNEWS_20190226_090000_BBC_News_at_9,https://archive.org/download/BBCNEWS_20190226_090000_BBC_News_at_9/BBCNEWS_20190226_090000_BBC_News_at_9.thumbs/BBCNEWS_20190226_090000_BBC_News_at_9_001797.jpg,"climate change is widely considered the greatest challenge of our age. the consequences of a warming planet could be drastic for generations to come. if scientists are to understand what's happening they need good data - and one man in colorado has made it his mission to supply as much as possible."
https://archive.org/details/BBCNEWS_20190226_190000_Beyond_100_Days#start/1090/end/1125,2/26/2019 19:18:25,BBCNEWS,Beyond 100 Days,BBCNEWS_20190226_190000_Beyond_100_Days,https://archive.org/download/BBCNEWS_20190226_190000_Beyond_100_Days/BBCNEWS_20190226_190000_Beyond_100_Days.thumbs/BBCNEWS_20190226_190000_Beyond_100_Days_001707.jpg,"according to a white house memo, the committee will be headed by retired princeton professor william happer. mr happer's views on climate change put him at odds with scientific consensus. he believes that increased carbon dioxide levels aren't a bad thing - but would actually benefit the planet by spurring"
https://archive.org/details/BBCNEWS_20190226_190000_Beyond_100_Days#start/1415/end/1450,2/26/2019 19:23:50,BBCNEWS,Beyond 100 Days,BBCNEWS_20190226_190000_Beyond_100_Days,https://archive.org/download/BBCNEWS_20190226_190000_Beyond_100_Days/BBCNEWS_20190226_190000_Beyond_100_Days.thumbs/BBCNEWS_20190226_190000_Beyond_100_Days_001707.jpg,"finding friends to verify what you just made up. there are facts and there is make believe and we have got to deal with the wealth of fa cts . facts. well the world cannot tackle climate change is the biggest polluter does nothing but it also sets a precedent, that other"
https://archive.org/details/BBCNEWS_20190222_060000_Breakfast#start/2287/end/2322,2/22/2019 6:38:22,BBCNEWS,Breakfast,BBCNEWS_20190222_060000_Breakfast,https://archive.org/download/BBCNEWS_20190222_060000_Breakfast/BBCNEWS_20190222_060000_Breakfast.thumbs/BBCNEWS_20190222_060000_Breakfast_002277.jpg,"juan guaido as president, following mass street protests last month. the world's ability to produce food is being put under threat by climate change and farming practices according to a un study. scientists have been studying the plants, animals and micro-organisms that we rely on to survive."
https://archive.org/details/BBCNEWS_20190222_050000_The_Briefing#start/546/end/581,2/22/2019 5:09:21,BBCNEWS,The Briefing,BBCNEWS_20190222_050000_The_Briefing,https://archive.org/download/BBCNEWS_20190222_050000_The_Briefing/BBCNEWS_20190222_050000_The_Briefing.thumbs/BBCNEWS_20190222_050000_The_Briefing_000537.jpg,"new disease, a problem with climate change so it's very important to haveit change so it's very important to have it very broad and wide range of species to feed the world. with global population approaching 8 billion people, the un warns we need to rethink the way we produce our"
https://archive.org/details/BBCNEWS_20190221_190000_Beyond_100_Days#start/876/end/911,2/21/2019 19:14:51,BBCNEWS,Beyond 100 Days,BBCNEWS_20190221_190000_Beyond_100_Days,https://archive.org/download/BBCNEWS_20190221_190000_Beyond_100_Days/BBCNEWS_20190221_190000_Beyond_100_Days.thumbs/BBCNEWS_20190221_190000_Beyond_100_Days_001708.jpg,"rolled out until the award ceremony on sunday. we'll be in la - finding out just what it takes to actually win an oscar. advisors to the government on climate change, say gas boilers and cookers should be banned in new homes, within six years. so, what can we do"
https://archive.org/details/BBCNEWS_20190222_140000_Afternoon_Live#start/818/end/853,2/22/2019 14:13:53,BBCNEWS,Afternoon Live,BBCNEWS_20190222_140000_Afternoon_Live,https://archive.org/download/BBCNEWS_20190222_140000_Afternoon_Live/BBCNEWS_20190222_140000_Afternoon_Live.thumbs/BBCNEWS_20190222_140000_Afternoon_Live_001917.jpg,"on a few species to feed the world, because anything can happen. you can have a new disease, you can have a problem with climate change, so it's very important to have available a wider range of species to feed the world. with the global population approaching 8 billion people,"
https://archive.org/details/BBCNEWS_20190222_140000_Afternoon_Live#start/2534/end/2569,2/22/2019 14:42:29,BBCNEWS,Afternoon Live,BBCNEWS_20190222_140000_Afternoon_Live,https://archive.org/download/BBCNEWS_20190222_140000_Afternoon_Live/BBCNEWS_20190222_140000_Afternoon_Live.thumbs/BBCNEWS_20190222_140000_Afternoon_Live_002518.jpg,"because anything can happen. you can have a new disease, you can have a problem with climate change, so it's very important to have available a wider range of species to feed the world. with the global population approaching 8 billion people, the un warns we need to rethink"
https://archive.org/details/BBCNEWS_20190222_140000_Afternoon_Live#start/2695/end/2730,2/22/2019 14:45:10,BBCNEWS,Afternoon Live,BBCNEWS_20190222_140000_Afternoon_Live,https://archive.org/download/BBCNEWS_20190222_140000_Afternoon_Live/BBCNEWS_20190222_140000_Afternoon_Live.thumbs/BBCNEWS_20190222_140000_Afternoon_Live_002668.jpg,"areas. creating new areas where spaces can thrive, linking together habitats across the landscape so we do not have so many extinction as a result of climate change, and only government can do that. we have seen the children out in the streets around the world campaigning about"
https://archive.org/details/BBCNEWS_20190222_200000_BBC_News#start/2467/end/2502,2/22/2019 20:41:22,BBCNEWS,BBC News,BBCNEWS_20190222_200000_BBC_News,https://archive.org/download/BBCNEWS_20190222_200000_BBC_News/BBCNEWS_20190222_200000_BBC_News.thumbs/BBCNEWS_20190222_200000_BBC_News_002458.jpg,"it's very risky really to focus just on a few species to feed the world, because anything can happen. you can have a new disease, you can have a problem with climate change, so it's very important to have available a wider range of species to feed the world."
