URL,MatchDateTime,Station,Show,IAShowID,IAPreviewThumb,Snippet
https://archive.org/details/BBCNEWS_20170512_020000_BBC_News#start/555/end/590,5/12/2017 2:09:30,BBCNEWS,BBC News,BBCNEWS_20170512_020000_BBC_News,https://archive.org/download/BBCNEWS_20170512_020000_BBC_News/BBCNEWS_20170512_020000_BBC_News.thumbs/BBCNEWS_20170512_020000_BBC_News_000537.jpg,"and, of course, if us wouldn't be the part of it, it is a serious setback. and so all eyes remain on the united states, because while climate change sceptics are at the fringes of science, they are at the heart of the us government."
https://archive.org/details/BBCNEWS_20170512_080000_Victoria_Derbyshire#start/488/end/523,5/12/2017 8:08:23,BBCNEWS,Victoria Derbyshire,BBCNEWS_20170512_080000_Victoria_Derbyshire,https://archive.org/download/BBCNEWS_20170512_080000_Victoria_Derbyshire/BBCNEWS_20170512_080000_Victoria_Derbyshire.thumbs/BBCNEWS_20170512_080000_Victoria_Derbyshire_000477.jpg,"parents can claim a defence of 'justifiable assault' when punishing their child. the united states says it will consider its own interests first, as it reviews its climate change policy. the us secretary of state, rex tillerson, told a meeting of the eight nations with land"
https://archive.org/details/BBCNEWS_20170512_100000_BBC_Newsroom_Live#start/4011/end/4046,5/12/2017 11:07:06,BBCNEWS,BBC Newsroom Live,BBCNEWS_20170512_100000_BBC_Newsroom_Live,https://archive.org/download/BBCNEWS_20170512_100000_BBC_Newsroom_Live/BBCNEWS_20170512_100000_BBC_Newsroom_Live.thumbs/BBCNEWS_20170512_100000_BBC_Newsroom_Live_003987.jpg,"to lead this work, labour has created a minister for peace who will work across the ministry of defence and the foreign and commonwealth office. we boldly claimed britain's leading role in tackling climate change, working ha rd hard to preserve the paris agreement"
https://archive.org/details/BBCNEWS_20170526_120000_BBC_News_at_One#start/1350/end/1385,5/26/2017 12:22:45,BBCNEWS,BBC News at One,BBCNEWS_20170526_120000_BBC_News_at_One,https://archive.org/download/BBCNEWS_20170526_120000_BBC_News_at_One/BBCNEWS_20170526_120000_BBC_News_at_One.thumbs/BBCNEWS_20170526_120000_BBC_News_at_One_001347.jpg,"would walk his own path on issues such as trade and climate change. but the italian hosts were doing everything they could to keep the summit together and heading in the same direction. and on counterterrorism, some said they were impressed by mr trump's determination."
https://archive.org/details/BBCNEWS_20170526_180000_BBC_News#start/1084/end/1119,5/26/2017 18:18:19,BBCNEWS,BBC News,BBCNEWS_20170526_180000_BBC_News,https://archive.org/download/BBCNEWS_20170526_180000_BBC_News/BBCNEWS_20170526_180000_BBC_News.thumbs/BBCNEWS_20170526_180000_BBC_News_001078.jpg,"they have got this agreement, climate change, international trade, to see how far they can push them to get him to change his mind without putting in so far that he disagrees. and ending up in a perhaps less than diplomatic result when this summit"
https://archive.org/details/BBCNEWS_20170526_190000_BBC_News#start/1047/end/1082,5/26/2017 19:17:42,BBCNEWS,BBC News,BBCNEWS_20170526_190000_BBC_News,https://archive.org/download/BBCNEWS_20170526_190000_BBC_News/BBCNEWS_20170526_190000_BBC_News.thumbs/BBCNEWS_20170526_190000_BBC_News_001047.jpg,"they can push him on issues where there are disagreements, whether it is climate change or international trade, seeing how far they can push him to get him to change his mind without pushing him so far that he disagrees and ends up with less than"
https://archive.org/details/BBCNEWS_20170526_203000_Newswatch#start/31/end/66,5/26/2017 20:30:46,BBCNEWS,Newswatch,BBCNEWS_20170526_203000_Newswatch,https://archive.org/download/BBCNEWS_20170526_203000_Newswatch/BBCNEWS_20170526_203000_Newswatch.thumbs/BBCNEWS_20170526_203000_Newswatch_000058.jpg,"companies have been called upon to stop the spread of hateful content online. the world leaders were unable to reach an agreement on climate change at the summit. true anger is calling for international assistance is at least 91 people die in flooding and mudslides caused by"
https://archive.org/details/BBCNEWS_20170525_073000_BBC_Business_Live#start/1454/end/1489,5/25/2017 7:54:29,BBCNEWS,BBC Business Live,BBCNEWS_20170525_073000_BBC_Business_Live,https://archive.org/download/BBCNEWS_20170525_073000_BBC_Business_Live/BBCNEWS_20170525_073000_BBC_Business_Live.thumbs/BBCNEWS_20170525_073000_BBC_Business_Live_001438.jpg,"encourage him to changes thinking. donald trump hasn't achieved everything he planned to deliver one of the things he has done, a lot of executive orders reversing climate change issues. the europeans are very keen to change his view on this. the german line is particularly interesting, because"
https://archive.org/details/BBCNEWS_20170525_073000_BBC_Business_Live#start/1469/end/1504,5/25/2017 7:54:44,BBCNEWS,BBC Business Live,BBCNEWS_20170525_073000_BBC_Business_Live,https://archive.org/download/BBCNEWS_20170525_073000_BBC_Business_Live/BBCNEWS_20170525_073000_BBC_Business_Live.thumbs/BBCNEWS_20170525_073000_BBC_Business_Live_001468.jpg,"what they are saying the president trump is, look, it is notjustjobs or reversing climate change, you can have both, but actually these measures can be good economic growth and thejobs and the jobs as well. it is quite interesting, because when you think about this, during the election"
https://archive.org/details/BBCNEWS_20170525_073000_BBC_Business_Live#start/1484/end/1519,5/25/2017 7:54:59,BBCNEWS,BBC Business Live,BBCNEWS_20170525_073000_BBC_Business_Live,https://archive.org/download/BBCNEWS_20170525_073000_BBC_Business_Live/BBCNEWS_20170525_073000_BBC_Business_Live.thumbs/BBCNEWS_20170525_073000_BBC_Business_Live_001468.jpg,"campaign he said many times he would rip up the paris accord. when you think about the time, the effort and the energy to get to these accords, the transpacific partnership, 0bamacare, paris 0bamaca re, paris climate 0bamacare, paris climate change, it is years of negotiations and hours"
https://archive.org/details/BBCNEWS_20170529_030000_BBC_News#start/405/end/440,5/29/2017 3:07:00,BBCNEWS,BBC News,BBCNEWS_20170529_030000_BBC_News,https://archive.org/download/BBCNEWS_20170529_030000_BBC_News/BBCNEWS_20170529_030000_BBC_News.thumbs/BBCNEWS_20170529_030000_BBC_News_000387.jpg,"a clear reluctance to adhere to the paris climate change treaty, and has given pretty strong hints that he is going to pull out of that treaty this week, suggests that merkel is almost pre-empting trump's move away from sort of western liberal international order. british airways passengers have"
https://archive.org/details/BBCNEWS_20170526_020000_BBC_News#start/1693/end/1728,5/26/2017 2:28:28,BBCNEWS,BBC News,BBCNEWS_20170526_020000_BBC_News,https://archive.org/download/BBCNEWS_20170526_020000_BBC_News/BBCNEWS_20170526_020000_BBC_News.thumbs/BBCNEWS_20170526_020000_BBC_News_001678.jpg,"way later on friday, with leaders from canada, france, germany, italy, japan, the united kingdom, and the united states meeting in the sicilian resort town of taormina. they will discuss the global fight against terrorism, as well differences over trade and climate change. let's have a look at the front pages"
https://archive.org/details/BBCNEWS_20170526_040000_BBC_News#start/638/end/673,5/26/2017 4:10:53,BBCNEWS,BBC News,BBCNEWS_20170526_040000_BBC_News,https://archive.org/download/BBCNEWS_20170526_040000_BBC_News/BBCNEWS_20170526_040000_BBC_News.thumbs/BBCNEWS_20170526_040000_BBC_News_000627.jpg,"pushing him to soften this position. then there's the environment - and the future of the 2015 paris climate change agreement. president trump has threatened to pull the us out of the deal. his fellow g7 leaders will try to convince him otherwise the hosts italy are at the forefront"
https://archive.org/details/BBCNEWS_20170526_043000_World_Business_Report#start/170/end/205,5/26/2017 4:33:05,BBCNEWS,World Business Report,BBCNEWS_20170526_043000_World_Business_Report,https://archive.org/download/BBCNEWS_20170526_043000_World_Business_Report/BBCNEWS_20170526_043000_World_Business_Report.thumbs/BBCNEWS_20170526_043000_World_Business_Report_000147.jpg,"the other g7 members will be pushing him to soften this position. then there's the environment and the future of the 2015 paris climate change agreement. president trump has threatened to pull the us out of the deal. his fellow g7 leaders will try to convince him otherwise."
https://archive.org/details/BBCNEWS_20170526_080000_Victoria_Derbyshire#start/3801/end/3836,5/26/2017 9:03:36,BBCNEWS,Victoria Derbyshire,BBCNEWS_20170526_080000_Victoria_Derbyshire,https://archive.org/download/BBCNEWS_20170526_080000_Victoria_Derbyshire/BBCNEWS_20170526_080000_Victoria_Derbyshire.thumbs/BBCNEWS_20170526_080000_Victoria_Derbyshire_003778.jpg,"they'll discuss world trade, climate change, migration from north africa across these very seas. but, after the events of recent days, almost inevitably the focus will be the fight against global terrorism. theresa may will sit down formally with the us president, and discuss notjust those leaks from the manchester bombing"
https://archive.org/details/BBCNEWS_20170527_090000_BBC_News#start/1188/end/1223,5/27/2017 9:20:03,BBCNEWS,BBC News,BBCNEWS_20170527_090000_BBC_News,https://archive.org/download/BBCNEWS_20170527_090000_BBC_News/BBCNEWS_20170527_090000_BBC_News.thumbs/BBCNEWS_20170527_090000_BBC_News_001168.jpg,"son-in-law, jared kushner, and his alleged involvement in secret dealings with russia. leaders of the g7 leading industrial nations failed to reach an agreement on climate change at a summit in italy. now let's get a round-up from the bbc sports centre. we'll start with the fa"
https://archive.org/details/BBCNEWS_20170527_090000_BBC_News#start/1711/end/1746,5/27/2017 9:28:46,BBCNEWS,BBC News,BBCNEWS_20170527_090000_BBC_News,https://archive.org/download/BBCNEWS_20170527_090000_BBC_News/BBCNEWS_20170527_090000_BBC_News.thumbs/BBCNEWS_20170527_090000_BBC_News_001708.jpg,"everything in the difficult column. this is the g7 but in some way it is six countries against one. the six leaders of the other countries are trying to persuade donald trump to join them on climate change. it is interesting that the un"
https://archive.org/details/BBCNEWS_20170527_103000_Dateline_London#start/834/end/869,5/27/2017 10:44:09,BBCNEWS,Dateline London,BBCNEWS_20170527_103000_Dateline_London,https://archive.org/download/BBCNEWS_20170527_103000_Dateline_London/BBCNEWS_20170527_103000_Dateline_London.thumbs/BBCNEWS_20170527_103000_Dateline_London_000808.jpg,"suppose, when you talk about lowering the standard, he finally understand that maybe climate change is real. we also have short-term memory loss. 0ver is real. we also have short-term memory loss. over the past three months, family thames has trump done something and people say, oh, i"
https://archive.org/details/BBCNEWS_20170527_210000_BBC_News#start/191/end/226,5/27/2017 21:03:26,BBCNEWS,BBC News,BBCNEWS_20170527_210000_BBC_News,https://archive.org/download/BBCNEWS_20170527_210000_BBC_News/BBCNEWS_20170527_210000_BBC_News.thumbs/BBCNEWS_20170527_210000_BBC_News_000178.jpg,"back up and running, after crashing earlier. thank you very much. the g7 summit of world leaders in sicily has broken up without reaching an agreement on climate change, after donald trump refused to commit to the deal to cut carbon emissions. six world leaders - including theresa may - reaffirmed their commitment                 _"
https://archive.org/details/BBCNEWS_20170527_220000_BBC_News#start/1474/end/1509,5/27/2017 22:24:49,BBCNEWS,BBC News,BBCNEWS_20170527_220000_BBC_News,https://archive.org/download/BBCNEWS_20170527_220000_BBC_News/BBCNEWS_20170527_220000_BBC_News.thumbs/BBCNEWS_20170527_220000_BBC_News_001468.jpg,"the paris accord on combating climate change next week. he's among the leaders of the seven top industrial nations meeting at the g7 summit in italy for the final day of talks. our correspondent, james reynolds, has been following developments in sicily. well, there is a realfault line"
https://archive.org/details/BBCNEWS_20170527_220000_BBC_News#start/1489/end/1524,5/27/2017 22:25:04,BBCNEWS,BBC News,BBCNEWS_20170527_220000_BBC_News,https://archive.org/download/BBCNEWS_20170527_220000_BBC_News/BBCNEWS_20170527_220000_BBC_News.thumbs/BBCNEWS_20170527_220000_BBC_News_001468.jpg,"within the g7 on the issue of climate change. on the one hand, you have the group of the gtx, and they 110w have the group of the gtx, and they now stand against the g1. -- the group of the g6. the final communique said that the six"
https://archive.org/details/BBCNEWS_20170528_020000_BBC_News#start/974/end/1009,5/28/2017 2:16:29,BBCNEWS,BBC News,BBCNEWS_20170528_020000_BBC_News,https://archive.org/download/BBCNEWS_20170528_020000_BBC_News/BBCNEWS_20170528_020000_BBC_News.thumbs/BBCNEWS_20170528_020000_BBC_News_000958.jpg,"even at gatwick and heathrow. i am not surprised at these complaints. leaders of some of the world's most powerful nations have left the g7 summit without agreeing a joint statement on climate change. six of them did reaffirm their commitment to the paris accord on reducing greenhouse emissions,"
https://archive.org/details/BBCNEWS_20170528_030000_BBC_News#start/13/end/48,5/28/2017 3:00:28,BBCNEWS,BBC News,BBCNEWS_20170528_030000_BBC_News,https://archive.org/download/BBCNEWS_20170528_030000_BBC_News/BBCNEWS_20170528_030000_BBC_News.thumbs/BBCNEWS_20170528_030000_BBC_News_000058.jpg,"but british airways says it will get services running again on sunday. no commitment on climate change. president trump refuses to say whether he'll cut carbon emissions. and another fa cup win for arsenal, making manager, arsene wenger, the most successful in the competition's history. good to have you with us."
https://archive.org/details/BBCNEWS_20170528_040000_BBC_News#start/1178/end/1213,5/28/2017 4:19:53,BBCNEWS,BBC News,BBCNEWS_20170528_040000_BBC_News,https://archive.org/download/BBCNEWS_20170528_040000_BBC_News/BBCNEWS_20170528_040000_BBC_News.thumbs/BBCNEWS_20170528_040000_BBC_News_001168.jpg,"most powerful nations have left the g7 summit without agreeing on a joint statement on climate change. six of them did reaffirm their commitment to the paris accord on reducing greenhouse emissions but president trump refused to sign up for the united states, saying he'll make his own decision next week."
https://archive.org/details/BBCNEWS_20170528_213000_The_Papers#start/408/end/443,5/28/2017 21:37:03,BBCNEWS,The Papers,BBCNEWS_20170528_213000_The_Papers,https://archive.org/download/BBCNEWS_20170528_213000_The_Papers/BBCNEWS_20170528_213000_The_Papers.thumbs/BBCNEWS_20170528_213000_The_Papers_000388.jpg,"g-7 angela merkel! off the back of the g-7 summit, when they were trained to get people on the right page over climate change, the united states could remain isolated if they do not carry on with the paris accord. the important thing, apart from the"
https://archive.org/details/BBCNEWS_20170526_050000_Breakfast#start/510/end/545,5/26/2017 5:08:45,BBCNEWS,Breakfast,BBCNEWS_20170526_050000_Breakfast,https://archive.org/download/BBCNEWS_20170526_050000_Breakfast/BBCNEWS_20170526_050000_Breakfast.thumbs/BBCNEWS_20170526_050000_Breakfast_000508.jpg,"they will be hoping for few dramas, above all from donald trump who has made his doubts about multilateral groups like this well-known -- taormina. at the summit as ever they will discuss world trade, climate change, migration from north africa across these very seas but after the"
https://archive.org/details/BBCNEWS_20170526_050000_Breakfast#start/5951/end/5986,5/26/2017 6:39:26,BBCNEWS,Breakfast,BBCNEWS_20170526_050000_Breakfast,https://archive.org/download/BBCNEWS_20170526_050000_Breakfast/BBCNEWS_20170526_050000_Breakfast.thumbs/BBCNEWS_20170526_050000_Breakfast_005938.jpg,"president donald trump is attending the event, which is taking place in sicily. the leaders of the g7 nations are expected to discuss a range of issues, including global security, trade and climate change. a leading economic think tank has suggested schools could be worse off financially under a conservative"
https://archive.org/details/BBCNEWS_20170526_050000_Breakfast#start/7775/end/7810,5/26/2017 7:09:50,BBCNEWS,Breakfast,BBCNEWS_20170526_050000_Breakfast,https://archive.org/download/BBCNEWS_20170526_050000_Breakfast/BBCNEWS_20170526_050000_Breakfast.thumbs/BBCNEWS_20170526_050000_Breakfast_007768.jpg,"past climate change is a hoax. we will be watching to see how they behave, do they get along with each other? it is the first summit for four of the leaders. yesterday in brussels there was a moment when donald trump appeared to barge is way past month and 's  _"
https://archive.org/details/BBCNEWS_20170515_043000_World_Business_Report#start/907/end/942,5/15/2017 4:45:22,BBCNEWS,World Business Report,BBCNEWS_20170515_043000_World_Business_Report,https://archive.org/download/BBCNEWS_20170515_043000_World_Business_Report/BBCNEWS_20170515_043000_World_Business_Report.thumbs/BBCNEWS_20170515_043000_World_Business_Report_000897.jpg,"including migration, terrorism, and climate change. the south china morning post says president xi jinping of china has set out a plan for increased global trade spurred by billions of dollars of infrastructure investment. mr xi outlined the vision for a 21st century silk road to further boost economies in asia."
https://archive.org/details/BBCNEWS_20170515_044500_BBC_News#start/15/end/50,5/15/2017 4:45:30,BBCNEWS,BBC News,BBCNEWS_20170515_044500_BBC_News,https://archive.org/download/BBCNEWS_20170515_044500_BBC_News/BBCNEWS_20170515_044500_BBC_News.thumbs/BBCNEWS_20170515_044500_BBC_News_000057.jpg,"including migration, terrorism, and climate change. the south china morning post says president xi jinping of china has set out a plan for increased global trade spurred by billions of dollars of infrastructure investment. mr xi outlined the vision for a 21st century silk road to further boost economies in asia."
https://archive.org/details/BBCNEWS_20170531_183000_BBC_Election_Debate_2017#start/4133/end/4168,5/31/2017 19:39:08,BBCNEWS,BBC Election Debate 2017,BBCNEWS_20170531_183000_BBC_Election_Debate_2017,https://archive.org/download/BBCNEWS_20170531_183000_BBC_Election_Debate_2017/BBCNEWS_20170531_183000_BBC_Election_Debate_2017.thumbs/BBCNEWS_20170531_183000_BBC_Election_Debate_2017_004108.jpg,"guaranteeing our futures? caroline lucas. i want to thank user much for that question because the green party have been trying to get climate change onto this election campaign agenda for the past six weeks and it has been impossible soap thank you so much. it is a"
https://archive.org/details/BBCNEWS_20170531_183000_BBC_Election_Debate_2017#start/4297/end/4332,5/31/2017 19:41:52,BBCNEWS,BBC Election Debate 2017,BBCNEWS_20170531_183000_BBC_Election_Debate_2017,https://archive.org/download/BBCNEWS_20170531_183000_BBC_Election_Debate_2017/BBCNEWS_20170531_183000_BBC_Election_Debate_2017.thumbs/BBCNEWS_20170531_183000_BBC_Election_Debate_2017_004288.jpg,"also determined to reduce emissions but it is notjust about climate change emissions, it is also about our attitude towards the environment, levels of air quality and air pollution in our cities which are not being addressed by this government, and also, when we did have a growing and thriving"
https://archive.org/details/BBCNEWS_20170531_220000_BBC_News#start/764/end/799,5/31/2017 22:12:59,BBCNEWS,BBC News,BBCNEWS_20170531_220000_BBC_News,https://archive.org/download/BBCNEWS_20170531_220000_BBC_News/BBCNEWS_20170531_220000_BBC_News.thumbs/BBCNEWS_20170531_220000_BBC_News_000748.jpg,"pull out of the paris climate deal to combat climate change. donald trump has not confirmed those reports, but he's tweeted that he'll will make an announcement in the next few days. pulling out of the climate accord, which was signed in 2015, was one of president trump's"
https://archive.org/details/BBCNEWS_20170527_013000_Talking_Movies#start/31/end/66,5/27/2017 1:30:46,BBCNEWS,Talking Movies,BBCNEWS_20170527_013000_Talking_Movies,https://archive.org/download/BBCNEWS_20170527_013000_Talking_Movies/BBCNEWS_20170527_013000_Talking_Movies.thumbs/BBCNEWS_20170527_013000_Talking_Movies_000058.jpg,"for a militant attack on a bus carrying coptic christians. at least 28 people were killed in the ambush south of cairo. the united nations secretary-general says the paris climate change agreement will not collapse if president trump does as he has threatened - and withdraws the united states. antonio guterres -  _"
https://archive.org/details/BBCNEWS_20170527_050000_Breakfast#start/2460/end/2495,5/27/2017 5:41:15,BBCNEWS,Breakfast,BBCNEWS_20170527_050000_Breakfast,https://archive.org/download/BBCNEWS_20170527_050000_Breakfast/BBCNEWS_20170527_050000_Breakfast.thumbs/BBCNEWS_20170527_050000_Breakfast_002458.jpg,"of heat, he processed hundreds of rolls of film on the mountain. and this footage is helping scientists to see how climate change might have affected the himalayas. the historical imagery in the archives of the royal geographical society is a bounty, and a limited gift and a"
https://archive.org/details/BBCNEWS_20170527_060000_Breakfast#start/1836/end/1871,5/27/2017 6:30:51,BBCNEWS,Breakfast,BBCNEWS_20170527_060000_Breakfast,https://archive.org/download/BBCNEWS_20170527_060000_Breakfast/BBCNEWS_20170527_060000_Breakfast.thumbs/BBCNEWS_20170527_060000_Breakfast_001828.jpg,"at a summit in sicily. they have agreed that internet companies need to do more to tackle the spread of extremist content online. but the leaders were unable to reach an agreement on climate change with differences remaining between us president donald trump and the rest of the group."
https://archive.org/details/BBCNEWS_20170527_070000_Breakfast#start/384/end/419,5/27/2017 7:06:39,BBCNEWS,Breakfast,BBCNEWS_20170527_070000_Breakfast,https://archive.org/download/BBCNEWS_20170527_070000_Breakfast/BBCNEWS_20170527_070000_Breakfast.thumbs/BBCNEWS_20170527_070000_Breakfast_000358.jpg,"counter-terrorism in italy. they agree internet companies need to do more to tackle the spread. but they we re more to tackle the spread. but they were unable to reach an agreement on climate change. james reynolds is in sicily for us. for such an important meeting. talk"
https://archive.org/details/BBCNEWS_20170509_200000_Outside_Source#start/837/end/872,5/9/2017 20:14:12,BBCNEWS,Outside Source,BBCNEWS_20170509_200000_Outside_Source,https://archive.org/download/BBCNEWS_20170509_200000_Outside_Source/BBCNEWS_20170509_200000_Outside_Source.thumbs/BBCNEWS_20170509_200000_Outside_Source_000837.jpg,"from bbc world service. china is not president is vowing to protect the climate agreement. that deal is to slow climate change, curb fossil fuel emissions. the promise was made ina fuel emissions. the promise was made in a phone call with the french president-elect, immanuel macron."
https://archive.org/details/BBCNEWS_20170508_043000_World_Business_Report#start/785/end/820,5/8/2017 4:43:20,BBCNEWS,World Business Report,BBCNEWS_20170508_043000_World_Business_Report,https://archive.org/download/BBCNEWS_20170508_043000_World_Business_Report/BBCNEWS_20170508_043000_World_Business_Report.thumbs/BBCNEWS_20170508_043000_World_Business_Report_000777.jpg,"the latest headlines: france's president-elect - the pro-european centrist emmanuel macron - has promised to unite the country, restore confidence in the eu, and tackle terrorism and climate change. his first priority following his decisive win will be to form a new government. his defeated rival, marine le pen,"
https://archive.org/details/BBCNEWS_20170502_221500_Newsnight#start/2304/end/2339,5/2/2017 22:53:39,BBCNEWS,Newsnight,BBCNEWS_20170502_221500_Newsnight,https://archive.org/download/BBCNEWS_20170502_221500_Newsnight/BBCNEWS_20170502_221500_Newsnight.thumbs/BBCNEWS_20170502_221500_Newsnight_002277.jpg,"citizen because there is so much happening in the world. i have a 15-year-old and i am much more politically attuned, especially about things like climate change, nhs, education, particularly, so there are issues. brexit seems to be slumping a bit. you do like a dimpled seat."
https://archive.org/details/BBCNEWS_20170511_040000_BBC_News#start/708/end/743,5/11/2017 4:12:03,BBCNEWS,BBC News,BBCNEWS_20170511_040000_BBC_News,https://archive.org/download/BBCNEWS_20170511_040000_BBC_News/BBCNEWS_20170511_040000_BBC_News.thumbs/BBCNEWS_20170511_040000_BBC_News_000687.jpg,"to 100 years is greater than the warming we have seen at any time in the last 2000 years. is human activity causing that climate change? yes, it is. it is a prime contributor, i will put it in those terms. and so the clear air here is"
https://archive.org/details/BBCNEWS_20170511_100000_BBC_Newsroom_Live#start/1482/end/1517,5/11/2017 10:24:57,BBCNEWS,BBC Newsroom Live,BBCNEWS_20170511_100000_BBC_Newsroom_Live,https://archive.org/download/BBCNEWS_20170511_100000_BBC_Newsroom_Live/BBCNEWS_20170511_100000_BBC_Newsroom_Live.thumbs/BBCNEWS_20170511_100000_BBC_Newsroom_Live_001468.jpg,"governance and passing legislation. it's an important part, but we have a good performing health service, they are tackling education and looking at issues like climate change, all at a time when the uk government has grown to a halt over its focus on a hard brexit. the"
https://archive.org/details/BBCNEWS_20170511_180000_100_Days#start/1537/end/1572,5/11/2017 18:25:52,BBCNEWS,100 Days,BBCNEWS_20170511_180000_100_Days,https://archive.org/download/BBCNEWS_20170511_180000_100_Days/BBCNEWS_20170511_180000_100_Days.thumbs/BBCNEWS_20170511_180000_100_Days_001528.jpg,"the scenes with donald trump at the white house. and we'll be live in alaska where a meeting of eight countries is trying to find out where the trump administration stands on climate change. that's still to come on 100 days plus, from bbc news. good evening. a decent day across."
