URL,MatchDateTime,Station,Show,IAShowID,IAPreviewThumb,Snippet
https://archive.org/details/BBCNEWS_20190208_130000_BBC_News_at_One#start/999/end/1034,2/8/2019 13:16:54,BBCNEWS,BBC News at One,BBCNEWS_20190208_130000_BBC_News_at_One,https://archive.org/download/BBCNEWS_20190208_130000_BBC_News_at_One/BBCNEWS_20190208_130000_BBC_News_at_One.thumbs/BBCNEWS_20190208_130000_BBC_News_at_One_000988.jpg,"negative power station, which we believe is absolutely critical, if we are to hit our global warming targets, and keep temperatures below preindustrial levels. but what to do with that captured carbon dioxide? well, in nearby leeds, this firm is buying carbon dioxide,"
https://archive.org/details/BBCNEWS_20190206_170000_BBC_News_at_Five#start/49/end/84,2/6/2019 17:01:04,BBCNEWS,BBC News at Five,BBCNEWS_20190206_170000_BBC_News_at_Five,https://archive.org/download/BBCNEWS_20190206_170000_BBC_News_at_Five/BBCNEWS_20190206_170000_BBC_News_at_Five.thumbs/BBCNEWS_20190206_170000_BBC_News_at_Five_000028.jpg,"of emiliano sala, whose plane crashed in the english channel. there's a warning on global warming, with the met office predicting we could be living in the hottest decade since records began. in his delayed state of the union address, president trump appeals"
https://archive.org/details/BBCNEWS_20190203_013000_The_Travel_Show#start/252/end/287,2/3/2019 1:34:27,BBCNEWS,The Travel Show,BBCNEWS_20190203_013000_The_Travel_Show,https://archive.org/download/BBCNEWS_20190203_013000_The_Travel_Show/BBCNEWS_20190203_013000_The_Travel_Show.thumbs/BBCNEWS_20190203_013000_The_Travel_Show_000237.jpg,"despite the resort's high altitude, like many others, it had to delay the start of its season by a couple of weeks due to lack of snow. across the world, global warming is shortening the ski season, and starting to seriously affect"
https://archive.org/details/BBCNEWS_20190215_110000_BBC_Newsroom_Live#start/5672/end/5707,2/15/2019 12:34:47,BBCNEWS,BBC Newsroom Live,BBCNEWS_20190215_110000_BBC_Newsroom_Live,https://archive.org/download/BBCNEWS_20190215_110000_BBC_Newsroom_Live/BBCNEWS_20190215_110000_BBC_Newsroom_Live.thumbs/BBCNEWS_20190215_110000_BBC_Newsroom_Live_005667.jpg,"about climate change. i'm joined by one of them now, 18-year-olds sofia. why are you here today and why have you skipped school?” why are you here today and why have you skipped school? i think the complete ignorance about what climate change is really going to do to us. the met office predicts 130"
https://archive.org/details/BBCNEWS_20190221_180000_BBC_News_at_Six#start/980/end/1015,2/21/2019 18:16:35,BBCNEWS,BBC News at Six,BBCNEWS_20190221_180000_BBC_News_at_Six,https://archive.org/download/BBCNEWS_20190221_180000_BBC_News_at_Six/BBCNEWS_20190221_180000_BBC_News_at_Six.thumbs/BBCNEWS_20190221_180000_BBC_News_at_Six_000958.jpg,"advisors to the government on climate change say gas boilers and cookers should be banned in new homes within six years. the committee on climate change says the move is crucial to the uk meeting legally binding targets, on carbon dioxide emissions. so, what can we do to change or adapt our homes in the battle against claimate change? our correspondent emma vardy"
https://archive.org/details/BBCNEWS_20190206_000000_Newsday#start/631/end/666,2/6/2019 0:10:46,BBCNEWS,Newsday,BBCNEWS_20190206_000000_Newsday,https://archive.org/download/BBCNEWS_20190206_000000_Newsday/BBCNEWS_20190206_000000_Newsday.thumbs/BBCNEWS_20190206_000000_Newsday_000629.jpg,"climate issues. the piece, by the way, is fantastic for climate change. nobody talks about the impact of waron change. nobody talks about the impact of war on climate change and omissions. we have an issue around the opioid epidemic which is killing record numbers of americans. we have record numbers of americans. we have record numbers of mass murders. gun"
https://archive.org/details/BBCNEWS_20190208_200000_BBC_News#start/1933/end/1968,2/8/2019 20:32:28,BBCNEWS,BBC News,BBCNEWS_20190208_200000_BBC_News,https://archive.org/download/BBCNEWS_20190208_200000_BBC_News/BBCNEWS_20190208_200000_BBC_News.thumbs/BBCNEWS_20190208_200000_BBC_News_001918.jpg,"believe is absolutely critical, if we are to hit our global warming targets, and keep temperatures below preindustrial levels. but what to do with that captured carbon dioxide? well, in nearby leeds, this firm is buying carbon dioxide, and mixing it with incinerator ash"
https://archive.org/details/BBCNEWS_20190207_030000_BBC_News#start/63/end/98,2/7/2019 3:01:18,BBCNEWS,BBC News,BBCNEWS_20190207_030000_BBC_News,https://archive.org/download/BBCNEWS_20190207_030000_BBC_News/BBCNEWS_20190207_030000_BBC_News.thumbs/BBCNEWS_20190207_030000_BBC_News_000059.jpg,"for the first time, global warming may be about to hit a tipping point - a level of temperature rise that could bring rapid and far-reaching changes for our planet, creating conditions we have never experienced before. nasa scientists have already confirmed the warmest years"
https://archive.org/details/BBCNEWS_20190207_030000_BBC_News#start/1705/end/1740,2/7/2019 3:28:40,BBCNEWS,BBC News,BBCNEWS_20190207_030000_BBC_News,https://archive.org/download/BBCNEWS_20190207_030000_BBC_News/BBCNEWS_20190207_030000_BBC_News.thumbs/BBCNEWS_20190207_030000_BBC_News_001708.jpg,"next week, though, high-pressure returns. it's looking quieter once again. this is bbc news, the headlines: scientists have warned that global warming may be about to hit a tipping point, a level of temperature rise that could bring rapid and far-reaching changes for our planet."
https://archive.org/details/BBCNEWS_20190208_140000_Afternoon_Live#start/6089/end/6124,2/8/2019 15:41:44,BBCNEWS,Afternoon Live,BBCNEWS_20190208_140000_Afternoon_Live,https://archive.org/download/BBCNEWS_20190208_140000_Afternoon_Live/BBCNEWS_20190208_140000_Afternoon_Live.thumbs/BBCNEWS_20190208_140000_Afternoon_Live_006087.jpg,"the carbon emissions when we use bioenergy to produce electricity. so actually becoming a carbon negative power station, which we believe is absolutely critical, if we are to hit our global warming targets, and keep temperatures below preindustrial levels. but what to do with that"
https://archive.org/details/BBCNEWS_20190226_200000_BBC_News#start/1473/end/1508,2/26/2019 20:24:48,BBCNEWS,BBC News,BBCNEWS_20190226_200000_BBC_News,https://archive.org/download/BBCNEWS_20190226_200000_BBC_News/BBCNEWS_20190226_200000_BBC_News.thumbs/BBCNEWS_20190226_200000_BBC_News_001977.jpg,"recorded in britain. we know the average world temperature is rising with global warming, so is this the reason? we asked a leading climate scientist. as global temperatures rise, then we are going to get more extreme heat events. this is just one example"
https://archive.org/details/BBCNEWS_20190221_140000_Afternoon_Live#start/1089/end/1124,2/21/2019 14:18:24,BBCNEWS,Afternoon Live,BBCNEWS_20190221_140000_Afternoon_Live,https://archive.org/download/BBCNEWS_20190221_140000_Afternoon_Live/BBCNEWS_20190221_140000_Afternoon_Live.thumbs/BBCNEWS_20190221_140000_Afternoon_Live_002007.jpg,"says, significantly contributes to global warming and doing something about that is something politicians will have to deal with when they answer to the electorate as they do every five years. thank you very much. if only we could bottle all that hot air. he mentioned one"
https://archive.org/details/BBCNEWS_20190224_093000_The_Papers#start/1445/end/1480,2/24/2019 9:54:20,BBCNEWS,The Papers,BBCNEWS_20190224_093000_The_Papers,https://archive.org/download/BBCNEWS_20190224_093000_The_Papers/BBCNEWS_20190224_093000_The_Papers.thumbs/BBCNEWS_20190224_093000_The_Papers_001438.jpg,"february where everybody is getting close to tops off, and last year we we re were under at least six inches of snow, so the difference is very striking, and we probably ought to be alarmed on a global warming scale, but, you know! quite make you"
https://archive.org/details/BBCNEWS_20190203_180000_BBC_News#start/2795/end/2830,2/3/2019 18:46:50,BBCNEWS,BBC News,BBCNEWS_20190203_180000_BBC_News,https://archive.org/download/BBCNEWS_20190203_180000_BBC_News/BBCNEWS_20190203_180000_BBC_News.thumbs/BBCNEWS_20190203_180000_BBC_News_002789.jpg,"across the world, global warming is shortening the ski season, and starting to seriously affect the economy for lower resorts. it may be hard to believe given recent heavy snowfall in europe, but the bigger picture is looking bleak. the charity protect our winters has"
https://archive.org/details/BBCNEWS_20190215_183000_Sportsday#start/1797/end/1832,2/15/2019 19:00:12,BBCNEWS,Sportsday,BBCNEWS_20190215_183000_Sportsday,https://archive.org/download/BBCNEWS_20190215_183000_Sportsday/BBCNEWS_20190215_183000_Sportsday.thumbs/BBCNEWS_20190215_183000_Sportsday_001769.jpg,"thousands of pupils skip school and take to the streets, in protest against climate change. how our personal data has been manipulated for political influence, sometimes at the highest levels of power."
https://archive.org/details/BBCNEWS_20190226_190000_Beyond_100_Days#start/1193/end/1228,2/26/2019 19:20:08,BBCNEWS,Beyond 100 Days,BBCNEWS_20190226_190000_Beyond_100_Days,https://archive.org/download/BBCNEWS_20190226_190000_Beyond_100_Days/BBCNEWS_20190226_190000_Beyond_100_Days.thumbs/BBCNEWS_20190226_190000_Beyond_100_Days_001707.jpg,"views as the president would call it on climate change and the scientists around climate change, what is the white house trying to do?m white house trying to do? it really is just white house trying to do? it really isjust a white house trying to do? it really is just a political ploy as you might suggest, we all know in the"
https://archive.org/details/BBCNEWS_20190215_060000_Breakfast#start/8549/end/8584,2/15/2019 8:22:44,BBCNEWS,Breakfast,BBCNEWS_20190215_060000_Breakfast,https://archive.org/download/BBCNEWS_20190215_060000_Breakfast/BBCNEWS_20190215_060000_Breakfast.thumbs/BBCNEWS_20190215_060000_Breakfast_008547.jpg,"because the best way to cut your emissions is to shut the economy down, and we don't want that because we want there to be jobs for you and money for schools at money for schools et cetera. but what we've got to do is act together and one thing i've been doing as the minister for nst and also climate"
https://archive.org/details/BBCNEWS_20190215_110000_BBC_Newsroom_Live#start/6294/end/6329,2/15/2019 12:45:09,BBCNEWS,BBC Newsroom Live,BBCNEWS_20190215_110000_BBC_Newsroom_Live,https://archive.org/download/BBCNEWS_20190215_110000_BBC_Newsroom_Live/BBCNEWS_20190215_110000_BBC_Newsroom_Live.thumbs/BBCNEWS_20190215_110000_BBC_Newsroom_Live_006298.jpg,"action on climate change. the british and us governments have announced a $30 million"
https://archive.org/details/BBCNEWS_20190214_100000_Victoria_Derbyshire#start/1566/end/1601,2/14/2019 10:26:21,BBCNEWS,Victoria Derbyshire,BBCNEWS_20190214_100000_Victoria_Derbyshire,https://archive.org/download/BBCNEWS_20190214_100000_Victoria_Derbyshire/BBCNEWS_20190214_100000_Victoria_Derbyshire.thumbs/BBCNEWS_20190214_100000_Victoria_Derbyshire_001558.jpg,"efficiently. thank you for coming on the programme. we appreciate your time. tomorrow, thousands of children across the uk are going to walk out of school for two hours because they want to persuade politicians to bring in tougher measures to deal with global warming. the 'schools 4 climate action'"
https://archive.org/details/BBCNEWS_20190226_180000_BBC_News_at_Six#start/1587/end/1622,2/26/2019 18:26:42,BBCNEWS,BBC News at Six,BBCNEWS_20190226_180000_BBC_News_at_Six,https://archive.org/download/BBCNEWS_20190226_180000_BBC_News_at_Six/BBCNEWS_20190226_180000_BBC_News_at_Six.thumbs/BBCNEWS_20190226_180000_BBC_News_at_Six_001587.jpg,"while the warm spell rolls on, it's here at kew gardens that weather history has been made, with a new record. the highest winter temperature ever recorded in britain. we know the average world temperature is rising with global warming, so is this the reason? we asked a leading"
https://archive.org/details/BBCNEWS_20190206_170000_BBC_News_at_Five#start/922/end/957,2/6/2019 17:15:37,BBCNEWS,BBC News at Five,BBCNEWS_20190206_170000_BBC_News_at_Five,https://archive.org/download/BBCNEWS_20190206_170000_BBC_News_at_Five/BBCNEWS_20190206_170000_BBC_News_at_Five.thumbs/BBCNEWS_20190206_170000_BBC_News_at_Five_000898.jpg,"the french club nantes, has demanded payment from cardiff city, over the £15 million transfer of emiliano sala, whose plane crashed in the english channel. and there's a warning on global warming, with the met office predicting we could be living in the hottest decade since records began."
https://archive.org/details/BBCNEWS_20190215_174500_The_Film_Review#start/807/end/842,2/15/2019 17:58:42,BBCNEWS,The Film Review,BBCNEWS_20190215_174500_The_Film_Review,https://archive.org/download/BBCNEWS_20190215_174500_The_Film_Review/BBCNEWS_20190215_174500_The_Film_Review.thumbs/BBCNEWS_20190215_174500_The_Film_Review_000807.jpg,"show me what democracy looks like. this is what democracy looks like. schoolchildren make their voices heard, leaving classrooms across the country to protest climate change. a record number of children are now in care in england,"
https://archive.org/details/BBCNEWS_20190211_190000_Beyond_100_Days#start/2680/end/2715,2/11/2019 19:44:55,BBCNEWS,Beyond 100 Days,BBCNEWS_20190211_190000_Beyond_100_Days,https://archive.org/download/BBCNEWS_20190211_190000_Beyond_100_Days/BBCNEWS_20190211_190000_Beyond_100_Days.thumbs/BBCNEWS_20190211_190000_Beyond_100_Days_002668.jpg,"and climate change are being blamed for the decline. here's our environment correspondent, victoria gill. producing ourfood,"
https://archive.org/details/BBCNEWS_20190226_023000_Monday_in_Parliament#start/18/end/53,2/26/2019 2:30:33,BBCNEWS,Monday in Parliament,BBCNEWS_20190226_023000_Monday_in_Parliament,https://archive.org/download/BBCNEWS_20190226_023000_Monday_in_Parliament/BBCNEWS_20190226_023000_Monday_in_Parliament.thumbs/BBCNEWS_20190226_023000_Monday_in_Parliament_001767.jpg,"in a surprise move, iran's foreign minister announces his resignation on social media and apologises for his shortcomings. the old man and the snow - the colorado hermit who's produced decades of data to help combat climate change."
https://archive.org/details/BBCNEWS_20190206_183000_Sportsday#start/14/end/49,2/6/2019 18:30:29,BBCNEWS,Sportsday,BBCNEWS_20190206_183000_Sportsday,https://archive.org/download/BBCNEWS_20190206_183000_Sportsday/BBCNEWS_20190206_183000_Sportsday.thumbs/BBCNEWS_20190206_183000_Sportsday_000028.jpg,"who took her own life in 2017 - have been unsuccessful in their attempts to access her social media data, which they believe could help them to understand her suicide. there's a warning on global warming, as the met office predicts we are in the middle of what is likely to be the hottest"
https://archive.org/details/BBCNEWS_20190201_050000_The_Briefing#start/524/end/559,2/1/2019 5:08:59,BBCNEWS,The Briefing,BBCNEWS_20190201_050000_The_Briefing,https://archive.org/download/BBCNEWS_20190201_050000_The_Briefing/BBCNEWS_20190201_050000_The_Briefing.thumbs/BBCNEWS_20190201_050000_The_Briefing_000508.jpg,"that the mean temperature across the continent exceeded 30 degrees celsius. the hottest temperature of 49.5 celsius was recorded in port augusta in south australia. climate experts say the main cause was a persistent high pressure system over the tasman sea, as well as the broader trend in global warming. let's turn now to our"
https://archive.org/details/BBCNEWS_20190213_190000_Beyond_100_Days#start/2715/end/2750,2/13/2019 19:45:30,BBCNEWS,Beyond 100 Days,BBCNEWS_20190213_190000_Beyond_100_Days,https://archive.org/download/BBCNEWS_20190213_190000_Beyond_100_Days/BBCNEWS_20190213_190000_Beyond_100_Days.thumbs/BBCNEWS_20190213_190000_Beyond_100_Days_002698.jpg,"basically the future. climate change. sexual harassment. peer pressure. acid attacks, against muslims. my biggest fear is bullying."
https://archive.org/details/BBCNEWS_20190215_140000_Afternoon_Live#start/4181/end/4216,2/15/2019 15:09:56,BBCNEWS,Afternoon Live,BBCNEWS_20190215_140000_Afternoon_Live,https://archive.org/download/BBCNEWS_20190215_140000_Afternoon_Live/BBCNEWS_20190215_140000_Afternoon_Live.thumbs/BBCNEWS_20190215_140000_Afternoon_Live_004168.jpg,"to raise awareness of the issues around climate change. the prisons minister says there are early signs that violence"
https://archive.org/details/BBCNEWS_20190215_170000_BBC_News_at_Five#start/2553/end/2588,2/15/2019 17:42:48,BBCNEWS,BBC News at Five,BBCNEWS_20190215_170000_BBC_News_at_Five,https://archive.org/download/BBCNEWS_20190215_170000_BBC_News_at_Five/BBCNEWS_20190215_170000_BBC_News_at_Five.thumbs/BBCNEWS_20190215_170000_BBC_News_at_Five_002548.jpg,"over climate change. now on bbc news a look ahead to sportsday at 6:30 tonight."
https://archive.org/details/BBCNEWS_20190215_204500_The_Film_Review#start/195/end/230,2/15/2019 20:48:30,BBCNEWS,The Film Review,BBCNEWS_20190215_204500_The_Film_Review,https://archive.org/download/BBCNEWS_20190215_204500_The_Film_Review/BBCNEWS_20190215_204500_The_Film_Review.thumbs/BBCNEWS_20190215_204500_The_Film_Review_000177.jpg,"and take to the streets, in protest against climate change. now on bbc news it's time for the film review."
https://archive.org/details/BBCNEWS_20190205_000000_Newsday#start/410/end/445,2/5/2019 0:07:05,BBCNEWS,Newsday,BBCNEWS_20190205_000000_Newsday,https://archive.org/download/BBCNEWS_20190205_000000_Newsday/BBCNEWS_20190205_000000_Newsday.thumbs/BBCNEWS_20190205_000000_Newsday_000388.jpg,"a new study has warned that climate change could cause two-thirds of himalayan glaciers to melt by the end"
https://archive.org/details/BBCNEWS_20190215_110000_BBC_Newsroom_Live#start/4963/end/4998,2/15/2019 12:22:58,BBCNEWS,BBC Newsroom Live,BBCNEWS_20190215_110000_BBC_Newsroom_Live,https://archive.org/download/BBCNEWS_20190215_110000_BBC_Newsroom_Live/BBCNEWS_20190215_110000_BBC_Newsroom_Live.thumbs/BBCNEWS_20190215_110000_BBC_Newsroom_Live_004948.jpg,"on climate change. these students in ullapool in scotland joined thousand of others across the country in a protest organised"
https://archive.org/details/BBCNEWS_20190214_110000_BBC_Newsroom_Live#start/3133/end/3168,2/14/2019 11:52:28,BBCNEWS,BBC Newsroom Live,BBCNEWS_20190214_110000_BBC_Newsroom_Live,https://archive.org/download/BBCNEWS_20190214_110000_BBC_Newsroom_Live/BBCNEWS_20190214_110000_BBC_Newsroom_Live.thumbs/BBCNEWS_20190214_110000_BBC_Newsroom_Live_003118.jpg,"tomorrow, thousands of children across the uk will walk out of school for two hours in an effort to persuade politicians to bring in tougher measures to deal with global warming. the schools for climate action movement started after a 15 -year-old girl called greta thunberg started a solo protest outside her parliament buildings in sweden."
https://archive.org/details/BBCNEWS_20190206_200000_BBC_News#start/1972/end/2007,2/6/2019 20:33:07,BBCNEWS,BBC News,BBCNEWS_20190206_200000_BBC_News,https://archive.org/download/BBCNEWS_20190206_200000_BBC_News/BBCNEWS_20190206_200000_BBC_News.thumbs/BBCNEWS_20190206_200000_BBC_News_001948.jpg,"thank you very much. a rare moment of unity in a divided america - congress celebrates a record number of women in national politics - during president trump's state of the union address. there's a warning on global warming, as the met office predicts we are in the middle of what is likely to be the hottest decade since records began."
https://archive.org/details/BBCNEWS_20190207_040000_BBC_News#start/1708/end/1743,2/7/2019 4:28:43,BBCNEWS,BBC News,BBCNEWS_20190207_040000_BBC_News,https://archive.org/download/BBCNEWS_20190207_040000_BBC_News/BBCNEWS_20190207_040000_BBC_News.thumbs/BBCNEWS_20190207_040000_BBC_News_001709.jpg,"for sunday, because it looks like we could see a spell of heavy rain pushing into england and wales to bring the weekend to a close. next week, though, high-pressure returns. it's looking quieter once again. this is bbc news, the headlines: scientists have warned that global warming may be about to hit a tipping point,"
https://archive.org/details/BBCNEWS_20190215_170000_BBC_News_at_Five#start/46/end/81,2/15/2019 17:01:01,BBCNEWS,BBC News at Five,BBCNEWS_20190215_170000_BBC_News_at_Five,https://archive.org/download/BBCNEWS_20190215_170000_BBC_News_at_Five/BBCNEWS_20190215_170000_BBC_News_at_Five.thumbs/BBCNEWS_20190215_170000_BBC_News_at_Five_000029.jpg,"skipping school - thousands of pupils take to the streets in protest over climate change. award-winning author, andrea levy, whose works chronicled"
https://archive.org/details/BBCNEWS_20190215_170000_BBC_News_at_Five#start/1040/end/1075,2/15/2019 17:17:35,BBCNEWS,BBC News at Five,BBCNEWS_20190215_170000_BBC_News_at_Five,https://archive.org/download/BBCNEWS_20190215_170000_BBC_News_at_Five/BBCNEWS_20190215_170000_BBC_News_at_Five.thumbs/BBCNEWS_20190215_170000_BBC_News_at_Five_001018.jpg,"to the streets in protest over climate change. and in port they have taken some serious scalps so far in the fa cup,"
https://archive.org/details/BBCNEWS_20190215_200000_BBC_News#start/1435/end/1470,2/15/2019 20:24:10,BBCNEWS,BBC News,BBCNEWS_20190215_200000_BBC_News,https://archive.org/download/BBCNEWS_20190215_200000_BBC_News/BBCNEWS_20190215_200000_BBC_News.thumbs/BBCNEWS_20190215_200000_BBC_News_001437.jpg,"and both have been taking part in climate change protests today. how was it for you both? it was incredible. it was extremely"
https://archive.org/details/BBCNEWS_20190216_020000_BBC_News#start/848/end/883,2/16/2019 2:14:23,BBCNEWS,BBC News,BBCNEWS_20190216_020000_BBC_News,https://archive.org/download/BBCNEWS_20190216_020000_BBC_News/BBCNEWS_20190216_020000_BBC_News.thumbs/BBCNEWS_20190216_020000_BBC_News_000838.jpg,"still to come: making their voices heard - children from across britain skip school to protest about climate change. nine years and 15000 deaths"
https://archive.org/details/BBCNEWS_20190208_060000_Breakfast#start/2169/end/2204,2/8/2019 6:36:24,BBCNEWS,Breakfast,BBCNEWS_20190208_060000_Breakfast,https://archive.org/download/BBCNEWS_20190208_060000_Breakfast/BBCNEWS_20190208_060000_Breakfast.thumbs/BBCNEWS_20190208_060000_Breakfast_002159.jpg,"tackle climate change. those are the main stories. right now we have mike. we are starting with equine flu and how horseracing"
https://archive.org/details/BBCNEWS_20190211_180000_BBC_News_at_Six#start/1072/end/1107,2/11/2019 18:18:07,BBCNEWS,BBC News at Six,BBCNEWS_20190211_180000_BBC_News_at_Six,https://archive.org/download/BBCNEWS_20190211_180000_BBC_News_at_Six/BBCNEWS_20190211_180000_BBC_News_at_Six.thumbs/BBCNEWS_20190211_180000_BBC_News_at_Six_001049.jpg,"climate change, invasive species and critically how we use our land. increasing intensification of agriculture. around the world, suitable habitat is being consumed"
https://archive.org/details/BBCNEWS_20190226_190000_Beyond_100_Days#start/1074/end/1109,2/26/2019 19:18:09,BBCNEWS,Beyond 100 Days,BBCNEWS_20190226_190000_Beyond_100_Days,https://archive.org/download/BBCNEWS_20190226_190000_Beyond_100_Days/BBCNEWS_20190226_190000_Beyond_100_Days.thumbs/BBCNEWS_20190226_190000_Beyond_100_Days_001707.jpg,"amol rajan, bbc news. president trump is preparing a new panel to assess whether climate change is a threat to us national security."
https://archive.org/details/BBCNEWS_20190216_050000_BBC_News#start/873/end/908,2/16/2019 5:14:48,BBCNEWS,BBC News,BBCNEWS_20190216_050000_BBC_News,https://archive.org/download/BBCNEWS_20190216_050000_BBC_News/BBCNEWS_20190216_050000_BBC_News.thumbs/BBCNEWS_20190216_050000_BBC_News_000868.jpg,"making their voices heard - children from across britain skip school to protest about climate change. nine years and 15000 deaths after going into afghanistan,"
https://archive.org/details/BBCNEWS_20190211_200000_BBC_News#start/1781/end/1816,2/11/2019 20:29:56,BBCNEWS,BBC News,BBCNEWS_20190211_200000_BBC_News,https://archive.org/download/BBCNEWS_20190211_200000_BBC_News/BBCNEWS_20190211_200000_BBC_News.thumbs/BBCNEWS_20190211_200000_BBC_News_001767.jpg,"to our planet's insect diversity - climate change, invasive species and critically how we use our land. the increasing intensification of agriculture. around the world, suitable"
https://archive.org/details/BBCNEWS_20190218_100000_Victoria_Derbyshire#start/63/end/98,2/18/2019 10:01:18,BBCNEWS,Victoria Derbyshire,BBCNEWS_20190218_100000_Victoria_Derbyshire,https://archive.org/download/BBCNEWS_20190218_100000_Victoria_Derbyshire/BBCNEWS_20190218_100000_Victoria_Derbyshire.thumbs/BBCNEWS_20190218_100000_Victoria_Derbyshire_000059.jpg,"after thousands of uk school children walked out of class last week to demand action on climate change, we're challenging a group of students from"
https://archive.org/details/BBCNEWS_20190202_223000_The_Papers#start/710/end/745,2/2/2019 22:42:05,BBCNEWS,The Papers,BBCNEWS_20190202_223000_The_Papers,https://archive.org/download/BBCNEWS_20190202_223000_The_Papers/BBCNEWS_20190202_223000_The_Papers.thumbs/BBCNEWS_20190202_223000_The_Papers_000688.jpg,"accusations, outline this for us?l memberof the member of the house of lords, the head of the climate change committee, which is involved in"
https://archive.org/details/BBCNEWS_20190214_110000_BBC_Newsroom_Live#start/3242/end/3277,2/14/2019 11:54:17,BBCNEWS,BBC Newsroom Live,BBCNEWS_20190214_110000_BBC_Newsroom_Live,https://archive.org/download/BBCNEWS_20190214_110000_BBC_Newsroom_Live/BBCNEWS_20190214_110000_BBC_Newsroom_Live.thumbs/BBCNEWS_20190214_110000_BBC_Newsroom_Live_003239.jpg,"in solidarity with greta, holly has been missing an hour of class every friday morning. i care about climate change because it's my future and it's"
