URL,MatchDateTime,Station,Show,IAShowID,IAPreviewThumb,Snippet
https://archive.org/details/CNNW_20120702_130000_CNN_Newsroom#start/4802/end/4837,7/2/2012 14:20:17,CNN,CNN Newsroom,CNNW_20120702_130000_CNN_Newsroom,https://archive.org/download/CNNW_20120702_130000_CNN_Newsroom/CNNW_20120702_130000_CNN_Newsroom.thumbs/CNNW_20120702_130000_CNN_Newsroom_004800.jpg,"addressing climate change, but the united states is the world's largest economy, and by long tradition, whether it's an iphone or methods of growing food to feed a lot of people, the united states has been the world leader in this sort of innovative technology."
https://archive.org/details/CNNW_20120702_170000_CNN_Newsroom#start/1359/end/1394,7/2/2012 17:22:54,CNN,CNN Newsroom,CNNW_20120702_170000_CNN_Newsroom,https://archive.org/download/CNNW_20120702_170000_CNN_Newsroom/CNNW_20120702_170000_CNN_Newsroom.thumbs/CNNW_20120702_170000_CNN_Newsroom_001350.jpg,"change is contributing to starting these fires. how so? well, there's several dots that you can connect between the climate and the climate change and the fires. first off in a warmer atmosphere both globally and in the united states. when it is warmer, water"
https://archive.org/details/CNNW_20120722_170000_Fareed_Zakaria_GPS#start/2272/end/2307,7/22/2012 17:38:07,CNN,Fareed Zakaria GPS,CNNW_20120722_170000_Fareed_Zakaria_GPS,https://archive.org/download/CNNW_20120722_170000_Fareed_Zakaria_GPS/CNNW_20120722_170000_Fareed_Zakaria_GPS.thumbs/CNNW_20120722_170000_Fareed_Zakaria_GPS_002250.jpg,"i spoke to him recently. you came to worldwide attention at the copenhagen conference because you -- you really tried to get them to do something about climate change and some people argue that your speech in copenhagen was crucial to actually getting some kind of"
https://archive.org/details/CNNW_20120704_070000_Piers_Morgan_Tonight#start/2410/end/2445,7/4/2012 7:40:25,CNN,Piers Morgan Tonight,CNNW_20120704_070000_Piers_Morgan_Tonight,https://archive.org/download/CNNW_20120704_070000_Piers_Morgan_Tonight/CNNW_20120704_070000_Piers_Morgan_Tonight.thumbs/CNNW_20120704_070000_Piers_Morgan_Tonight_002400.jpg,"manmade but it is climate change because in our lifetimes we haven't seen anything like this. so no matter who you're going to blame the warming on, or the change on, whether it's cyclical or manmade, i think what we need to concentrate on now are realizing that our oceans are"
https://archive.org/details/CNNW_20120710_010000_Piers_Morgan_Tonight#start/2154/end/2189,7/10/2012 1:36:09,CNN,Piers Morgan Tonight,CNNW_20120710_010000_Piers_Morgan_Tonight,https://archive.org/download/CNNW_20120710_010000_Piers_Morgan_Tonight/CNNW_20120710_010000_Piers_Morgan_Tonight.thumbs/CNNW_20120710_010000_Piers_Morgan_Tonight_002130.jpg,"and also have an effect on reducing the effects of climate change. so these are all the things that i think are important going forward. but the economy will take care of itself. i think it is slowly starting to do that. it would have done better had"
https://archive.org/details/CNNW_20120727_130000_CNN_Newsroom#start/6573/end/6608,7/27/2012 14:49:48,CNN,CNN Newsroom,CNNW_20120727_130000_CNN_Newsroom,https://archive.org/download/CNNW_20120727_130000_CNN_Newsroom/CNNW_20120727_130000_CNN_Newsroom.thumbs/CNNW_20120727_130000_CNN_Newsroom_006570.jpg,"so it was an opportunity. let's find out, let's say when the debates start at the end of the summer we'll find out how everybody stands on the environment and climate change. bill nye the science guy, thanks so much for joining us this morning. thank you, carol."
https://archive.org/details/CNNW_20120727_130000_CNN_Newsroom#start/6443/end/6478,7/27/2012 14:47:38,CNN,CNN Newsroom,CNNW_20120727_130000_CNN_Newsroom,https://archive.org/download/CNNW_20120727_130000_CNN_Newsroom/CNNW_20120727_130000_CNN_Newsroom.thumbs/CNNW_20120727_130000_CNN_Newsroom_006420.jpg,"energy more efficiently and have a better quality of life for everyone. but you know, bill, there is zero talk of climate change by our politicians in 2012. of course that's a far cry from what president obama said, you know, back when he phelan 2008. let's listen."
https://archive.org/details/CNNW_20120702_130000_CNN_Newsroom#start/4757/end/4792,7/2/2012 14:19:32,CNN,CNN Newsroom,CNNW_20120702_130000_CNN_Newsroom,https://archive.org/download/CNNW_20120702_130000_CNN_Newsroom/CNNW_20120702_130000_CNN_Newsroom.thumbs/CNNW_20120702_130000_CNN_Newsroom_004740.jpg,"and energy distribution and storage? wouldn't you want that. but the people who are politicizing this issue they seem to be winning because not much is being done on the issue of climate change even though president barack obama promised that, you know, back in the day, 2008."
https://archive.org/details/CNNW_20120718_090000_EarlyStart#start/3244/end/3279,7/18/2012 9:54:19,CNN,EarlyStart,CNNW_20120718_090000_EarlyStart,https://archive.org/download/CNNW_20120718_090000_EarlyStart/CNNW_20120718_090000_EarlyStart.thumbs/CNNW_20120718_090000_EarlyStart_003240.jpg,"evidence it's getting hotter out there. some people don't. that's what they're blaming. they say climate change and the rising ocean temperature made this break away. it's not the largest on record. it was like four years ago there was one or two years ago. isn't that incredible? i thought that was funny."
https://archive.org/details/CNNW_20120704_010000_Piers_Morgan_Tonight#start/2403/end/2438,7/4/2012 1:40:18,CNN,Piers Morgan Tonight,CNNW_20120704_010000_Piers_Morgan_Tonight,https://archive.org/download/CNNW_20120704_010000_Piers_Morgan_Tonight/CNNW_20120704_010000_Piers_Morgan_Tonight.thumbs/CNNW_20120704_010000_Piers_Morgan_Tonight_002400.jpg,"so i try these days to take that out of the argument. so let's just say it's not manmade but it is climate change because in our lifetimes we haven't seen anything like this. so no matter who you're going to blame the warming on, or the change on, whether it's cyclical"
https://archive.org/details/CNNW_20120702_170000_CNN_Newsroom#start/1489/end/1524,7/2/2012 17:25:04,CNN,CNN Newsroom,CNNW_20120702_170000_CNN_Newsroom,https://archive.org/download/CNNW_20120702_170000_CNN_Newsroom/CNNW_20120702_170000_CNN_Newsroom.thumbs/CNNW_20120702_170000_CNN_Newsroom_001470.jpg,"in every region but every time, and the southwest region of the united states is one of the areas most at risk. is there an effective way to fight fires and should we be changing the way we approach this? well, the climate change adaptation is an important concept. the mission global ly in terms f"
https://archive.org/details/CNNW_20120731_200000_The_Situation_Room#start/8296/end/8331,7/31/2012 22:18:31,CNN,The Situation Room,CNNW_20120731_200000_The_Situation_Room,https://archive.org/download/CNNW_20120731_200000_The_Situation_Room/CNNW_20120731_200000_The_Situation_Room.thumbs/CNNW_20120731_200000_The_Situation_Room_008280.jpg,"also says we need to take as a country a closer look at storing water when we have floods because we're not going to just face increased drought with climate change in the future, there's going to be more floods, there should be a way she says to store more of that for dry years, kate."
https://archive.org/details/CNNW_20120704_070000_Piers_Morgan_Tonight#start/2342/end/2377,7/4/2012 7:39:17,CNN,Piers Morgan Tonight,CNNW_20120704_070000_Piers_Morgan_Tonight,https://archive.org/download/CNNW_20120704_070000_Piers_Morgan_Tonight/CNNW_20120704_070000_Piers_Morgan_Tonight.thumbs/CNNW_20120704_070000_Piers_Morgan_Tonight_002340.jpg,"there with the warmest temperatures on the planet. so if it's not global warming, let's play devil's advocate, what else could be heating america up like this? what is another explanation? well, there are folks who are going to be on the side that we run in cycles on this planet and because we've only been studying weather for a couple hundred years at best, and then, you know, coming up with the satellite in the '60s would probably be reliable weather"
https://archive.org/details/CNNW_20120703_200000_The_Situation_Room#start/4922/end/4957,7/3/2012 21:22:17,CNN,The Situation Room,CNNW_20120703_200000_The_Situation_Room,https://archive.org/download/CNNW_20120703_200000_The_Situation_Room/CNNW_20120703_200000_The_Situation_Room.thumbs/CNNW_20120703_200000_The_Situation_Room_004920.jpg,"climate change. now they're saying, all right, if you can prepare for a storm, there's no reason not to. and we'll fine you if you don't do a good job. this isn't lost on companies. they know this. they are trying to get ahead of this as well. they are trying the best they can. there's still a lot of frustration out there. yes."
