URL,MatchDateTime,Station,Show,IAShowID,IAPreviewThumb,Snippet
https://archive.org/details/CNNW_20160204_040000_CNN_Tonight_With_Don_Lemon#start/800/end/835,2/4/2016 4:13:35,CNN,CNN Tonight With Don Lemon,CNNW_20160204_040000_CNN_Tonight_With_Don_Lemon,https://archive.org/download/CNNW_20160204_040000_CNN_Tonight_With_Don_Lemon/CNNW_20160204_040000_CNN_Tonight_With_Don_Lemon.thumbs/CNNW_20160204_040000_CNN_Tonight_With_Don_Lemon_000778.jpg,"president who led the way on climate change, led the way on gay rights, who did the iran bill and opened up relations with cuba. how is he not a progressive? that's how we start having the serious issues and then he goes into this rant of i don't know a"
https://archive.org/details/CNNW_20160228_180000_Fareed_Zakaria_GPS#start/335/end/370,2/28/2016 18:05:50,CNN,Fareed Zakaria GPS,CNNW_20160228_180000_Fareed_Zakaria_GPS,https://archive.org/download/CNNW_20160228_180000_Fareed_Zakaria_GPS/CNNW_20160228_180000_Fareed_Zakaria_GPS.thumbs/CNNW_20160228_180000_Fareed_Zakaria_GPS_000327.jpg,"climate change among others. yeats was wrong, the center can and does hold, but just barely. for more, go to cnn.com/fareed and read my 'washington post' column this week. let's get started. i have lots to talk about with my guest, michael hayden, from the presidential race to"
https://archive.org/details/CNNW_20160223_220000_Situation_Room_With_Wolf_Blitzer#start/5372/end/5407,2/23/2016 23:29:47,CNN,Situation Room With Wolf Blitzer,CNNW_20160223_220000_Situation_Room_With_Wolf_Blitzer,https://archive.org/download/CNNW_20160223_220000_Situation_Room_With_Wolf_Blitzer/CNNW_20160223_220000_Situation_Room_With_Wolf_Blitzer.thumbs/CNNW_20160223_220000_Situation_Room_With_Wolf_Blitzer_005367.jpg,"inequality. how important is that for him to push back on that tonight? well, i think it's very important. we don't have to do much pushing because every where the senator goes he not only talks about economic inequality he's talking about climate change and criminal justice reforeign"
https://archive.org/details/CNNW_20160204_000000_Erin_Burnett_OutFront#start/3329/end/3364,2/4/2016 0:55:44,CNN,Erin Burnett OutFront,CNNW_20160204_000000_Erin_Burnett_OutFront,https://archive.org/download/CNNW_20160204_000000_Erin_Burnett_OutFront/CNNW_20160204_000000_Erin_Burnett_OutFront.thumbs/CNNW_20160204_000000_Erin_Burnett_OutFront_003328.jpg,"know, covering all the topics you would think a lot of democrats would be interested in, education, there's climate change, there's a whole range of subjects. but you also have independent voters who have said that they plan to vote in the democratic primary and are eligible to"
https://archive.org/details/CNNW_20160223_210000_The_Lead_With_Jake_Tapper#start/1535/end/1570,2/23/2016 21:25:50,CNN,The Lead With Jake Tapper,CNNW_20160223_210000_The_Lead_With_Jake_Tapper,https://archive.org/download/CNNW_20160223_210000_The_Lead_With_Jake_Tapper/CNNW_20160223_210000_The_Lead_With_Jake_Tapper.thumbs/CNNW_20160223_210000_The_Lead_With_Jake_Tapper_001527.jpg,"a strong record on the environment. today we started advertising in colorado that bernie sanders opposes fracking. hillary clinton put out an energy paper that said fracking's okay. bernie believes if you want to take on climate change, you have to recognize that fracking is not for our future, we need to"
https://archive.org/details/CNNW_20160228_200000_CNN_Newsroom_With_Fredricka_Whitfield#start/3620/end/3655,2/28/2016 21:00:35,CNN,CNN Newsroom With Fredricka Whitfield,CNNW_20160228_200000_CNN_Newsroom_With_Fredricka_Whitfield,https://archive.org/download/CNNW_20160228_200000_CNN_Newsroom_With_Fredricka_Whitfield/CNNW_20160228_200000_CNN_Newsroom_With_Fredricka_Whitfield.thumbs/CNNW_20160228_200000_CNN_Newsroom_With_Fredricka_Whitfield_003597.jpg,"getting together to do different things for advanced manufacturing. we will have skills and make sure we are ready to do that work. and i also believe the best way to combat climate change is by creating clean renewable energy jobs that will change the way we produce energy in the country."
https://archive.org/details/CNNW_20160228_210000_CNN_Newsroom_With_Fredricka_Whitfield#start/20/end/55,2/28/2016 21:00:35,CNN,CNN Newsroom With Fredricka Whitfield,CNNW_20160228_210000_CNN_Newsroom_With_Fredricka_Whitfield,https://archive.org/download/CNNW_20160228_210000_CNN_Newsroom_With_Fredricka_Whitfield/CNNW_20160228_210000_CNN_Newsroom_With_Fredricka_Whitfield.thumbs/CNNW_20160228_210000_CNN_Newsroom_With_Fredricka_Whitfield_000057.jpg,"getting together to do different things for advanced manufacturing. we will have skills and make sure we are ready to do that work. and i also believe the best way to combat climate change is by creating clean renewable energy jobs that will change the way we produce energy in the country."
https://archive.org/details/CNNW_20160217_020000_Anderson_Cooper_360#start/1072/end/1107,2/17/2016 2:18:07,CNN,Anderson Cooper 360,CNNW_20160217_020000_Anderson_Cooper_360,https://archive.org/download/CNNW_20160217_020000_Anderson_Cooper_360/CNNW_20160217_020000_Anderson_Cooper_360.thumbs/CNNW_20160217_020000_Anderson_Cooper_360_001048.jpg,"barack obama, he's going to be able to have a third, perhaps. he needs a victory in november to make sure that that happens. also on issues like climate change, gun violence, it's really a third obama term in many ways, hillary clinton, and he must be very pleased at the way she's helping the president"
https://archive.org/details/CNNW_20160212_220000_Situation_Room_With_Wolf_Blitzer#start/1098/end/1133,2/12/2016 22:18:33,CNN,Situation Room With Wolf Blitzer,CNNW_20160212_220000_Situation_Room_With_Wolf_Blitzer,https://archive.org/download/CNNW_20160212_220000_Situation_Room_With_Wolf_Blitzer/CNNW_20160212_220000_Situation_Room_With_Wolf_Blitzer.thumbs/CNNW_20160212_220000_Situation_Room_With_Wolf_Blitzer_001078.jpg,"of his hour-long stump speeches. this is a guy who talks with such a broad range of issues. what we're going to do to have universal college education, how we'll reform health care so 29 million who don't have health care can have it, how we're going to deal with climate change and rebuild our"
https://archive.org/details/CNNW_20160212_060000_PBS_NewsHour#start/3952/end/3987,2/12/2016 7:06:07,CNN,PBS NewsHour,CNNW_20160212_060000_PBS_NewsHour,https://archive.org/download/CNNW_20160212_060000_PBS_NewsHour/CNNW_20160212_060000_PBS_NewsHour.thumbs/CNNW_20160212_060000_PBS_NewsHour_003927.jpg,"climate change is real, and that we have got to transform our energy system? and when we talk about wall street, let's talk about wall street. i voted for dodd-frank. got an important amendment in it. my view, it doesn't go anywhere near far enough. but when we talk about wall street, you have wall street and"
https://archive.org/details/CNNW_20160228_180000_Fareed_Zakaria_GPS#start/2935/end/2970,2/28/2016 18:49:10,CNN,Fareed Zakaria GPS,CNNW_20160228_180000_Fareed_Zakaria_GPS,https://archive.org/download/CNNW_20160228_180000_Fareed_Zakaria_GPS/CNNW_20160228_180000_Fareed_Zakaria_GPS.thumbs/CNNW_20160228_180000_Fareed_Zakaria_GPS_002937.jpg,"is an urgent problem? there's no doubt about those things. it's only urgent in the sense that the amount of time to solve the problem is so long. that is, the problems caused by climate change in the next 20, 30 years are not that dramatic but because when you emit co2 it stays in the atmosphere for"
https://archive.org/details/CNNW_20160207_140000_State_of_the_Union_With_Jake_Tapper#start/1263/end/1298,2/7/2016 14:21:18,CNN,State of the Union With Jake Tapper,CNNW_20160207_140000_State_of_the_Union_With_Jake_Tapper,https://archive.org/download/CNNW_20160207_140000_State_of_the_Union_With_Jake_Tapper/CNNW_20160207_140000_State_of_the_Union_With_Jake_Tapper.thumbs/CNNW_20160207_140000_State_of_the_Union_With_Jake_Tapper_001257.jpg,"it's not an accident that there's not one republican candidate who is prepared to stand up to the fossil fuel industry and help transform our energy system to deal with climate change. so i'm not going to go around saying well, she got this, she did that. that is not my point. i do not have a super pac, jake."
https://archive.org/details/CNNW_20160213_030000_PBS_NewsHour#start/4111/end/4146,2/13/2016 4:08:46,CNN,PBS NewsHour,CNNW_20160213_030000_PBS_NewsHour,https://archive.org/download/CNNW_20160213_030000_PBS_NewsHour/CNNW_20160213_030000_PBS_NewsHour.thumbs/CNNW_20160213_030000_PBS_NewsHour_004107.jpg,"huge amounts of money on contributions? any connection to the fact that not one republican candidate for president thinks and agrees with the scientific community that climate change is real and this we have got to transform our energy system? and when we talk about wall street, let's talk about wall street. i voted for dodd-frank. got an important amendment in it."
