URL,MatchDateTime,Station,Show,IAShowID,IAPreviewThumb,Snippet
https://archive.org/details/FOXNEWS_20091213_043000_FOX_News_Watch#start/1316/end/1351,12/13/2009 4:52:11,FOXNEWS,FOX News Watch,FOXNEWS_20091213_043000_FOX_News_Watch,https://archive.org/download/FOXNEWS_20091213_043000_FOX_News_Watch/FOXNEWS_20091213_043000_FOX_News_Watch.thumbs/FOXNEWS_20091213_043000_FOX_News_Watch_001290.jpg,"lisa jackson administrator of the epa that greenhouse gases are harmful for your health, was that done so the u.s. could get some positive press out of the copenhagen summit? sure, i mean this entire process is a political event. let's be honest, not just scientists gathering for"
https://archive.org/details/FOXNEWS_20091218_160000_Happening_Now#start/5837/end/5872,12/18/2009 17:37:32,FOXNEWS,Happening Now,FOXNEWS_20091218_160000_Happening_Now,https://archive.org/download/FOXNEWS_20091218_160000_Happening_Now/FOXNEWS_20091218_160000_Happening_Now.thumbs/FOXNEWS_20091218_160000_Happening_Now_005820.jpg,"jon: and andrea, the chinese would be happy to take our money. they just don't seem to want to allow verification that they're actually doing anything about greenhouse gases? right. that's absolutely right, jon. it's the same problem we faced with kioto. doug hit on a very important"
https://archive.org/details/FOXNEWS_20091213_110000_The_OReilly_Factor#start/3106/end/3141,12/13/2009 11:52:01,FOXNEWS,The OReilly Factor,FOXNEWS_20091213_110000_The_OReilly_Factor,https://archive.org/download/FOXNEWS_20091213_110000_The_OReilly_Factor/FOXNEWS_20091213_110000_The_OReilly_Factor.thumbs/FOXNEWS_20091213_110000_The_OReilly_Factor_003083.jpg,"rest of us are going to die and most of the media dismisses that as being unworthy of consideration and that's not science. that amendment elliss, from lisa jackson administrator of the epa that greenhouse gases are harmful for your health, was that done so the u.s. could get"
https://archive.org/details/FOXNEWS_20091212_150000_Bulls_and_Bears#start/1779/end/1814,12/12/2009 15:29:54,FOXNEWS,Bulls and Bears,FOXNEWS_20091212_150000_Bulls_and_Bears,https://archive.org/download/FOXNEWS_20091212_150000_Bulls_and_Bears/FOXNEWS_20091212_150000_Bulls_and_Bears.thumbs/FOXNEWS_20091212_150000_Bulls_and_Bears_001770.jpg,"eric. global warming no, way, global freezing. temperatures in kansas city, nevada, it is snowing, man! below normal tests is the biggest provider of oil on the east coast, 20 million gallons"
https://archive.org/details/FOXNEWS_20091208_110000_FOX_and_Friends#start/7802/end/7837,12/8/2009 13:10:17,FOXNEWS,FOX and Friends,FOXNEWS_20091208_110000_FOX_and_Friends,https://archive.org/download/FOXNEWS_20091208_110000_FOX_and_Friends/FOXNEWS_20091208_110000_FOX_and_Friends.thumbs/FOXNEWS_20091208_110000_FOX_and_Friends_007800.jpg,"have an investigation into these countries, and what is the point? the u.s. should be standing for facts in science. we have talked about this before, it is not about climate"
https://archive.org/details/FOXNEWS_20091209_230000_Special_Report_With_Bret_Baier#start/861/end/896,12/9/2009 23:14:36,FOXNEWS,Special Report With Bret Baier,FOXNEWS_20091209_230000_Special_Report_With_Bret_Baier,https://archive.org/download/FOXNEWS_20091209_230000_Special_Report_With_Bret_Baier/FOXNEWS_20091209_230000_Special_Report_With_Bret_Baier.thumbs/FOXNEWS_20091209_230000_Special_Report_With_Bret_Baier_000835.jpg,"issued a warning to congress, where the house has approved a cap and trade bill to curb greenhouse gases but the senate has not. if you don't pass this legislation, the advisor said, then the environmental protection agency or epa will have to regulate in this area and it is not going to be able"
https://archive.org/details/FOXNEWS_20091209_230000_Special_Report_With_Bret_Baier#start/15/end/50,12/9/2009 23:00:30,FOXNEWS,Special Report With Bret Baier,FOXNEWS_20091209_230000_Special_Report_With_Bret_Baier,https://archive.org/download/FOXNEWS_20091209_230000_Special_Report_With_Bret_Baier/FOXNEWS_20091209_230000_Special_Report_With_Bret_Baier.thumbs/FOXNEWS_20091209_230000_Special_Report_With_Bret_Baier_000026.jpg,"we'll lift the veil. president obama will talk about going to war when he accepts the nobel peace prize in norway. we have a live report from oslo. the white house gives congress an ultimatum. do something about greenhouse gases or we'll do it for you, and does the leaking of a secret"
https://archive.org/details/FOXNEWS_20091210_040000_The_OReilly_Factor#start/780/end/815,12/10/2009 4:13:15,FOXNEWS,The OReilly Factor,FOXNEWS_20091210_040000_The_OReilly_Factor,https://archive.org/download/FOXNEWS_20091210_040000_The_OReilly_Factor/FOXNEWS_20091210_040000_The_OReilly_Factor.thumbs/FOXNEWS_20091210_040000_The_OReilly_Factor_000780.jpg,"response, al gore said this about global warming. they have worked intensively for 20 years with in this process and they say the evidence is unequivocal. 150 years ago this year was the discovery that co2 traps heat. that is a principle in physics. it is not a question of debate. it is like gravity. it exists. bill: there is evidence the global warming industry is not telling the whole truth."
https://archive.org/details/FOXNEWS_20091207_180000_The_Live_Desk#start/4593/end/4628,12/7/2009 19:16:48,FOXNEWS,The Live Desk,FOXNEWS_20091207_180000_The_Live_Desk,https://archive.org/download/FOXNEWS_20091207_180000_The_Live_Desk/FOXNEWS_20091207_180000_The_Live_Desk.thumbs/FOXNEWS_20091207_180000_The_Live_Desk_004549.jpg,"you to get certain bills? the copenhagen meeting is an international meeting. we are trying to reach consensus internationally to reduce greenhouse gas emissions so that"
https://archive.org/details/FOXNEWS_20091207_180000_The_Live_Desk#start/920/end/955,12/7/2009 18:15:35,FOXNEWS,The Live Desk,FOXNEWS_20091207_180000_The_Live_Desk,https://archive.org/download/FOXNEWS_20091207_180000_The_Live_Desk/FOXNEWS_20091207_180000_The_Live_Desk.thumbs/FOXNEWS_20091207_180000_The_Live_Desk_000893.jpg,"into greenhouse gas emissions. for dirt, that is not enough. they are offering 20% and plan to go to 30%. the head of the united nations"
https://archive.org/details/FOXNEWS_20091215_070000_Glenn_Beck#start/1573/end/1608,12/15/2009 7:26:28,FOXNEWS,Glenn Beck,FOXNEWS_20091215_070000_Glenn_Beck,https://archive.org/download/FOXNEWS_20091215_070000_Glenn_Beck/FOXNEWS_20091215_070000_Glenn_Beck.thumbs/FOXNEWS_20091215_070000_Glenn_Beck_001555.jpg,"themselves, maybe -- what was it she said? curb their enthusiasm about some of their statements about climate change and the climate change hoax, because i have seen this kind of violence before."
https://archive.org/details/FOXNEWS_20091206_050000_Red_Eye#start/2207/end/2242,12/6/2009 5:37:02,FOXNEWS,Red Eye,FOXNEWS_20091206_050000_Red_Eye,https://archive.org/download/FOXNEWS_20091206_050000_Red_Eye/FOXNEWS_20091206_050000_Red_Eye.thumbs/FOXNEWS_20091206_050000_Red_Eye_002190.jpg,"kind of agnostic on climate change. i'm pro science but not pro trying to detry the data. if they are doing this to climate change data, what else are they screwing with."
https://archive.org/details/FOXNEWS_20091206_150000_Americas_News_HQ#start/5651/end/5686,12/6/2009 16:34:26,FOXNEWS,Americas News HQ,FOXNEWS_20091206_150000_Americas_News_HQ,https://archive.org/download/FOXNEWS_20091206_150000_Americas_News_HQ/FOXNEWS_20091206_150000_Americas_News_HQ.thumbs/FOXNEWS_20091206_150000_Americas_News_HQ_005627.jpg,"moves forward and we'll follow developments here at fox on monday. thank you very much. the leaders from around the world gather in copen hague on the reach a new global deal on climate"
https://archive.org/details/FOXNEWS_20091212_090000_Special_Report_With_Bret_Baier#start/1449/end/1484,12/12/2009 9:24:24,FOXNEWS,Special Report With Bret Baier,FOXNEWS_20091212_090000_Special_Report_With_Bret_Baier,https://archive.org/download/FOXNEWS_20091212_090000_Special_Report_With_Bret_Baier/FOXNEWS_20091212_090000_Special_Report_With_Bret_Baier.thumbs/FOXNEWS_20091212_090000_Special_Report_With_Bret_Baier_001434.jpg,"occurred today at the same time about 200 people rallying downtown. police detained 40 demonstrators there. in brussels, european union leaders agreed to commit $3.6 billion a year to help poor countries deal with climate"
https://archive.org/details/FOXNEWS_20091211_180000_The_Live_Desk#start/3903/end/3938,12/11/2009 19:05:18,FOXNEWS,The Live Desk,FOXNEWS_20091211_180000_The_Live_Desk,https://archive.org/download/FOXNEWS_20091211_180000_The_Live_Desk/FOXNEWS_20091211_180000_The_Live_Desk.thumbs/FOXNEWS_20091211_180000_The_Live_Desk_003900.jpg,"number three, four, five in the region is just as important as taking out the big figureheads. trace: thank you. juliet: police in copenhagen making dozens of arrests outside of protests outside the climate"
https://archive.org/details/FOXNEWS_20091221_050000_Red_Eye#start/3253/end/3288,12/21/2009 5:54:28,FOXNEWS,Red Eye,FOXNEWS_20091221_050000_Red_Eye,https://archive.org/download/FOXNEWS_20091221_050000_Red_Eye/FOXNEWS_20091221_050000_Red_Eye.thumbs/FOXNEWS_20091221_050000_Red_Eye_003240.jpg,"endangerment finding on greenhouse gas solution and is now authorized and obligated to make reasonable efforts to reduce greenhouse pollutants under the clean air act. so said environmental"
https://archive.org/details/FOXNEWS_20091221_020000_Hannity#start/3253/end/3288,12/21/2009 2:54:28,FOXNEWS,Hannity,FOXNEWS_20091221_020000_Hannity,https://archive.org/download/FOXNEWS_20091221_020000_Hannity/FOXNEWS_20091221_020000_Hannity.thumbs/FOXNEWS_20091221_020000_Hannity_003240.jpg,"endangerment finding on greenhouse gas solution and is now authorized and obligated to make reasonable efforts to reduce greenhouse pollutants under the clean air act. so said environmental"
https://archive.org/details/FOXNEWS_20091204_100000_The_OReilly_Factor#start/3036/end/3071,12/4/2009 10:50:51,FOXNEWS,The OReilly Factor,FOXNEWS_20091204_100000_The_OReilly_Factor,https://archive.org/download/FOXNEWS_20091204_100000_The_OReilly_Factor/FOXNEWS_20091204_100000_The_OReilly_Factor.thumbs/FOXNEWS_20091204_100000_The_OReilly_Factor_003030.jpg,"[ laughter ] poor al gore. global warming completely debunked via the very internet you invented. [ laughter ] oh, the irony.                 _"
https://archive.org/details/FOXNEWS_20091209_230000_Special_Report_With_Bret_Baier#start/3548/end/3583,12/9/2009 23:59:23,FOXNEWS,Special Report With Bret Baier,FOXNEWS_20091209_230000_Special_Report_With_Bret_Baier,https://archive.org/download/FOXNEWS_20091209_230000_Special_Report_With_Bret_Baier/FOXNEWS_20091209_230000_Special_Report_With_Bret_Baier.thumbs/FOXNEWS_20091209_230000_Special_Report_With_Bret_Baier_003502.jpg,"u.n. climate change conference continues in copenhagen one u.s. state is taking measures here. arnold schwarzenegger talked many times about his concern of climate change and now apparently has launched a new website to track its effects."
https://archive.org/details/FOXNEWS_20091211_090000_Special_Report_With_Bret_Baier#start/1388/end/1423,12/11/2009 9:23:23,FOXNEWS,Special Report With Bret Baier,FOXNEWS_20091211_090000_Special_Report_With_Bret_Baier,https://archive.org/download/FOXNEWS_20091211_090000_Special_Report_With_Bret_Baier/FOXNEWS_20091211_090000_Special_Report_With_Bret_Baier.thumbs/FOXNEWS_20091211_090000_Special_Report_With_Bret_Baier_001374.jpg,"and destroying of data and attempts to prevent the publication of opposing views on climate change is that 1700 brittish scientists have issued a statement standing bind the research that climate change is a man made phenomenon."
https://archive.org/details/FOXNEWS_20091221_050000_Red_Eye#start/2272/end/2307,12/21/2009 5:38:07,FOXNEWS,Red Eye,FOXNEWS_20091221_050000_Red_Eye,https://archive.org/download/FOXNEWS_20091221_050000_Red_Eye/FOXNEWS_20091221_050000_Red_Eye.thumbs/FOXNEWS_20091221_050000_Red_Eye_002250.jpg,"spending it on climate change policies. the amazing thing is they claim we could save 4.3 million kids. on the other hand if we spend it on climate change policies even if we did it in the most"
https://archive.org/details/FOXNEWS_20091214_220000_Glenn_Beck#start/1579/end/1614,12/14/2009 22:26:34,FOXNEWS,Glenn Beck,FOXNEWS_20091214_220000_Glenn_Beck,https://archive.org/download/FOXNEWS_20091214_220000_Glenn_Beck/FOXNEWS_20091214_220000_Glenn_Beck.thumbs/FOXNEWS_20091214_220000_Glenn_Beck_001555.jpg,"she said? curb their enthusiasm about some of their statements about climate change and the climate change hoax, because i have seen this kind of violence before. i've seen this kind of violence before. well, i haven't, but nancy"
https://archive.org/details/FOXNEWS_20091210_090000_Special_Report_With_Bret_Baier#start/19/end/54,12/10/2009 9:00:34,FOXNEWS,Special Report With Bret Baier,FOXNEWS_20091210_090000_Special_Report_With_Bret_Baier,https://archive.org/download/FOXNEWS_20091210_090000_Special_Report_With_Bret_Baier/FOXNEWS_20091210_090000_Special_Report_With_Bret_Baier.thumbs/FOXNEWS_20091210_090000_Special_Report_With_Bret_Baier_000027.jpg,"nobel peace prize in norway. we have a live report from oslo. the white house gives congress an ultimatum. do something about greenhouse gases or we'll do it for you, and does the leaking of a secret government document about security screening put you in danger? all that, plus the all-star"
https://archive.org/details/FOXNEWS_20091203_110000_FOX_and_Friends#start/7243/end/7278,12/3/2009 13:00:58,FOXNEWS,FOX and Friends,FOXNEWS_20091203_110000_FOX_and_Friends,https://archive.org/download/FOXNEWS_20091203_110000_FOX_and_Friends/FOXNEWS_20091203_110000_FOX_and_Friends.thumbs/FOXNEWS_20091203_110000_FOX_and_Friends_007186.jpg,"national captioning institute --www.ncicap.org-- creating jobs is at the top of the agenda at the white house, but the people responsible for that were not even invited to the meeting. steve: meanwhile, scientists accused of punching climate"
https://archive.org/details/FOXNEWS_20091209_230000_Special_Report_With_Bret_Baier#start/643/end/678,12/9/2009 23:10:58,FOXNEWS,Special Report With Bret Baier,FOXNEWS_20091209_230000_Special_Report_With_Bret_Baier,https://archive.org/download/FOXNEWS_20091209_230000_Special_Report_With_Bret_Baier/FOXNEWS_20091209_230000_Special_Report_With_Bret_Baier.thumbs/FOXNEWS_20091209_230000_Special_Report_With_Bret_Baier_000625.jpg,"believe the five went to pakistan to join the terror group. one of the missing men is howard university student amy zhamzham. a christmas treat raises eyebrows at the white house and a veiled threat over climate"
https://archive.org/details/FOXNEWS_20091221_050000_Red_Eye#start/297/end/332,12/21/2009 5:05:12,FOXNEWS,Red Eye,FOXNEWS_20091221_050000_Red_Eye,https://archive.org/download/FOXNEWS_20091221_050000_Red_Eye/FOXNEWS_20091221_050000_Red_Eye.thumbs/FOXNEWS_20091221_050000_Red_Eye_000270.jpg,"billions of dollars away. it doesn't force the united states to give billions of dollars away. having said that i do hope america will reach out to developing countries. americans have to realize that we wouldn't have a climate"
https://archive.org/details/FOXNEWS_20091208_180000_The_Live_Desk#start/5183/end/5218,12/8/2009 19:26:38,FOXNEWS,The Live Desk,FOXNEWS_20091208_180000_The_Live_Desk,https://archive.org/download/FOXNEWS_20091208_180000_The_Live_Desk/FOXNEWS_20091208_180000_The_Live_Desk.thumbs/FOXNEWS_20091208_180000_The_Live_Desk_005148.jpg,"then there was a leak of a draft from developing nations that changes the spirit of kyoto, actually making cuts in their greenhouse gas emissions and putting in charge -- putting the            _"
https://archive.org/details/FOXNEWS_20091209_160000_Happening_Now#start/3932/end/3967,12/9/2009 17:05:47,FOXNEWS,Happening Now,FOXNEWS_20091209_160000_Happening_Now,https://archive.org/download/FOXNEWS_20091209_160000_Happening_Now/FOXNEWS_20091209_160000_Happening_Now.thumbs/FOXNEWS_20091209_160000_Happening_Now_003900.jpg,"legislation which would cut greenhouse gas emissions like carbon dioxide. they say in response -- they say in response -- the official continued --. bottom line, this senior adviser to president obama was"
https://archive.org/details/FOXNEWS_20091214_070000_Hannity#start/1077/end/1112,12/14/2009 7:18:12,FOXNEWS,Hannity,FOXNEWS_20091214_070000_Hannity,https://archive.org/download/FOXNEWS_20091214_070000_Hannity/FOXNEWS_20091214_070000_Hannity.thumbs/FOXNEWS_20091214_070000_Hannity_001076.jpg,"author of the house cap and trade bill. nor inhoffe, in copenhagen the president will pledge to reduce greenhouse gas emissions by 17% by 2020 and will contribute billions of dollars"
https://archive.org/details/FOXNEWS_20091210_140000_Americas_Newsroom#start/3882/end/3917,12/10/2009 15:04:57,FOXNEWS,Americas Newsroom,FOXNEWS_20091210_140000_Americas_Newsroom,https://archive.org/download/FOXNEWS_20091210_140000_Americas_Newsroom/FOXNEWS_20091210_140000_Americas_Newsroom.thumbs/FOXNEWS_20091210_140000_Americas_Newsroom_003870.jpg,"white house. it did not get a lot of coverage. ceo's meeting with the president about epa regulations on greenhouse gas emissions. more than a half-dozen"
https://archive.org/details/FOXNEWS_20091213_230000_FOX_News_Sunday_With_Chris_Wallace#start/1077/end/1112,12/13/2009 23:18:12,FOXNEWS,FOX News Sunday With Chris Wallace,FOXNEWS_20091213_230000_FOX_News_Sunday_With_Chris_Wallace,https://archive.org/download/FOXNEWS_20091213_230000_FOX_News_Sunday_With_Chris_Wallace/FOXNEWS_20091213_230000_FOX_News_Sunday_With_Chris_Wallace.thumbs/FOXNEWS_20091213_230000_FOX_News_Sunday_With_Chris_Wallace_001072.jpg,"author of the house cap and trade bill. nor inhoffe, in copenhagen the president will pledge to reduce greenhouse gas emissions by 17% by 2020 and will contribute billions of dollars"
https://archive.org/details/FOXNEWS_20091207_020000_Hannity#start/2076/end/2111,12/7/2009 2:34:51,FOXNEWS,Hannity,FOXNEWS_20091207_020000_Hannity,https://archive.org/download/FOXNEWS_20091207_020000_Hannity/FOXNEWS_20091207_020000_Hannity.thumbs/FOXNEWS_20091207_020000_Hannity_002070.jpg,"on the content. it is having an impact. 59 percent of americans think the global warming data is rigged."
https://archive.org/details/FOXNEWS_20091218_180000_The_Live_Desk#start/5845/end/5880,12/18/2009 19:37:40,FOXNEWS,The Live Desk,FOXNEWS_20091218_180000_The_Live_Desk,https://archive.org/download/FOXNEWS_20091218_180000_The_Live_Desk/FOXNEWS_20091218_180000_The_Live_Desk.thumbs/FOXNEWS_20091218_180000_The_Live_Desk_005807.jpg,"climate forecast decades in the future. global warming is unequivocally happening because of human actions. and with disastrous results,"
https://archive.org/details/FOXNEWS_20091210_160000_Happening_Now#start/1319/end/1354,12/10/2009 16:22:14,FOXNEWS,Happening Now,FOXNEWS_20091210_160000_Happening_Now,https://archive.org/download/FOXNEWS_20091210_160000_Happening_Now/FOXNEWS_20091210_160000_Happening_Now.thumbs/FOXNEWS_20091210_160000_Happening_Now_001312.jpg,"that showed attempts to doctored data when it comes to global warming, to also try and banned journalists -- banned journals            _"
https://archive.org/details/FOXNEWS_20091210_090000_Special_Report_With_Bret_Baier#start/3546/end/3581,12/10/2009 9:59:21,FOXNEWS,Special Report With Bret Baier,FOXNEWS_20091210_090000_Special_Report_With_Bret_Baier,https://archive.org/download/FOXNEWS_20091210_090000_Special_Report_With_Bret_Baier/FOXNEWS_20091210_090000_Special_Report_With_Bret_Baier.thumbs/FOXNEWS_20091210_090000_Special_Report_With_Bret_Baier_003533.jpg,"bret: finally tonight as the u.n. climate change conference continues in copenhagen one u.s. state is taking measures here. arnold schwarzenegger talked many times about his concern of climate change and now apparently has launched a new website to track its effects."
https://archive.org/details/FOXNEWS_20091218_110000_FOX_and_Friends#start/4619/end/4654,12/18/2009 12:17:14,FOXNEWS,FOX and Friends,FOXNEWS_20091218_110000_FOX_and_Friends,https://archive.org/download/FOXNEWS_20091218_110000_FOX_and_Friends/FOXNEWS_20091218_110000_FOX_and_Friends.thumbs/FOXNEWS_20091218_110000_FOX_and_Friends_004608.jpg,"like climate change is such a crisis is beyond me. gretchen: yet, he said, kelly, that he believes that if they enacted climate change regulations that it would create jobs for americans. you know, gretchen, i was also prepared with the analysis"
https://archive.org/details/FOXNEWS_20091201_090000_Special_Report_With_Bret_Baier#start/3046/end/3081,12/1/2009 9:51:01,FOXNEWS,Special Report With Bret Baier,FOXNEWS_20091201_090000_Special_Report_With_Bret_Baier,https://archive.org/download/FOXNEWS_20091201_090000_Special_Report_With_Bret_Baier/FOXNEWS_20091201_090000_Special_Report_With_Bret_Baier.thumbs/FOXNEWS_20091201_090000_Special_Report_With_Bret_Baier_003023.jpg,"deal, something that can take the type of action that scientists say need to be taken to stop and reverse climate change. well, the president is heading to the u.n. climate change summit in copenhagen. robert gibbs went on to say"
https://archive.org/details/FOXNEWS_20091204_040000_The_OReilly_Factor#start/3033/end/3068,12/4/2009 4:50:48,FOXNEWS,The OReilly Factor,FOXNEWS_20091204_040000_The_OReilly_Factor,https://archive.org/download/FOXNEWS_20091204_040000_The_OReilly_Factor/FOXNEWS_20091204_040000_The_OReilly_Factor.thumbs/FOXNEWS_20091204_040000_The_OReilly_Factor_003030.jpg,"against it. oh for [bleep] sake. [ laughter ] poor al gore. global warming completely debunked via the very internet you invented."
https://archive.org/details/FOXNEWS_20091206_120000_FOX_and_Friends_Sunday#start/5718/end/5753,12/6/2009 13:35:33,FOXNEWS,FOX and Friends Sunday,FOXNEWS_20091206_120000_FOX_and_Friends_Sunday,https://archive.org/download/FOXNEWS_20091206_120000_FOX_and_Friends_Sunday/FOXNEWS_20091206_120000_FOX_and_Friends_Sunday.thumbs/FOXNEWS_20091206_120000_FOX_and_Friends_Sunday_005700.jpg,"e-mail us. during its part to curb global warming, the epa announcement they say will give president obama negotiati"
https://archive.org/details/FOXNEWS_20091218_110000_FOX_and_Friends#start/7697/end/7732,12/18/2009 13:08:32,FOXNEWS,FOX and Friends,FOXNEWS_20091218_110000_FOX_and_Friends,https://archive.org/download/FOXNEWS_20091218_110000_FOX_and_Friends/FOXNEWS_20091218_110000_FOX_and_Friends.thumbs/FOXNEWS_20091218_110000_FOX_and_Friends_007665.jpg,"blizzard in copenhagen as the global warming summit. watching the volcano erupting, you wonder how much cocaine nothey have contributedl warming."
https://archive.org/details/FOXNEWS_20091207_180000_The_Live_Desk#start/902/end/937,12/7/2009 18:15:17,FOXNEWS,The Live Desk,FOXNEWS_20091207_180000_The_Live_Desk,https://archive.org/download/FOXNEWS_20091207_180000_The_Live_Desk/FOXNEWS_20091207_180000_The_Live_Desk.thumbs/FOXNEWS_20091207_180000_The_Live_Desk_000893.jpg,"we have two issues. a production and greenhouse gas emissions -- or the rate of producing those gases come in the case of the developing world. the u.s. offering a 17% cut in"
https://archive.org/details/FOXNEWS_20091207_000000_FOX_Report#start/1269/end/1304,12/7/2009 0:21:24,FOXNEWS,FOX Report,FOXNEWS_20091207_000000_FOX_Report,https://archive.org/download/FOXNEWS_20091207_000000_FOX_Report/FOXNEWS_20091207_000000_FOX_Report.thumbs/FOXNEWS_20091207_000000_FOX_Report_001080.jpg,"it's willed billed as an opportunity for 192 nations to take unprecedented action to cut greenhouse gas emission, but a dark cloud now hanging over the start of tomorrow's u.n. climate summit in"
https://archive.org/details/FOXNEWS_20091213_120000_FOX_and_Friends_Sunday#start/8159/end/8194,12/13/2009 14:16:14,FOXNEWS,FOX and Friends Sunday,FOXNEWS_20091213_120000_FOX_and_Friends_Sunday,https://archive.org/download/FOXNEWS_20091213_120000_FOX_and_Friends_Sunday/FOXNEWS_20091213_120000_FOX_and_Friends_Sunday.thumbs/FOXNEWS_20091213_120000_FOX_and_Friends_Sunday_008070.jpg,"i'm proud to announce epa has finalized the endangerment finding on greenhouse gas pollution and is now authorized and obligated to make reasonable efforts to reduce greenhouse pollutants under the clean air"
https://archive.org/details/FOXNEWS_20091213_210000_Americas_News_HQ#start/1420/end/1455,12/13/2009 21:23:55,FOXNEWS,Americas News HQ,FOXNEWS_20091213_210000_Americas_News_HQ,https://archive.org/download/FOXNEWS_20091213_210000_Americas_News_HQ/FOXNEWS_20091213_210000_Americas_News_HQ.thumbs/FOXNEWS_20091213_210000_Americas_News_HQ_001405.jpg,"climate talks. week two to set to get underway tomorrow. they are looking to cut greenhouse gas emissions worldwide. they released hundreds of protestors detained during a mass rally against the meeting."
https://archive.org/details/FOXNEWS_20091217_180000_The_Live_Desk#start/76/end/111,12/17/2009 18:01:31,FOXNEWS,The Live Desk,FOXNEWS_20091217_180000_The_Live_Desk,https://archive.org/download/FOXNEWS_20091217_180000_The_Live_Desk/FOXNEWS_20091217_180000_The_Live_Desk.thumbs/FOXNEWS_20091217_180000_The_Live_Desk_000053.jpg,"to prove they are trying to curb greenhouse gas emissions. major garrett streaming live from copenhagen. good afternoon to you, trace and martha. it is just after 7:00 in the"
https://archive.org/details/FOXNEWS_20091206_120000_FOX_and_Friends_Sunday#start/911/end/946,12/6/2009 12:15:26,FOXNEWS,FOX and Friends Sunday,FOXNEWS_20091206_120000_FOX_and_Friends_Sunday,https://archive.org/download/FOXNEWS_20091206_120000_FOX_and_Friends_Sunday/FOXNEWS_20091206_120000_FOX_and_Friends_Sunday.thumbs/FOXNEWS_20091206_120000_FOX_and_Friends_Sunday_000780.jpg,"to block pain for hours. new capzasin, takes the pain out of arthritis. with unemployment at 10% in america, is it the right time for the president to pursue cap and trade legislation? will the so-called climate"
