URL,MatchDateTime,Station,Show,IAShowID,IAPreviewThumb,Snippet
https://archive.org/details/FOXNEWSW_20170808_210000_The_Fox_News_Specialists#start/2553/end/2588,8/8/2017 21:42:48,FOXNEWS,The Fox News Specialists,FOXNEWSW_20170808_210000_The_Fox_News_Specialists,https://archive.org/download/FOXNEWSW_20170808_210000_The_Fox_News_Specialists/FOXNEWSW_20170808_210000_The_Fox_News_Specialists.thumbs/FOXNEWSW_20170808_210000_The_Fox_News_Specialists_002548.jpg,"environment. the question is what are you going to do for the united states, their economy, their security, their way of life? it's funny because the people who are pushing this climate change radical legislation work for the little guy. what's going to happen when"
https://archive.org/details/FOXNEWSW_20170808_220000_Special_Report_With_Bret_Baier#start/999/end/1034,8/8/2017 22:16:54,FOXNEWS,Special Report With Bret Baier,FOXNEWSW_20170808_220000_Special_Report_With_Bret_Baier,https://archive.org/download/FOXNEWSW_20170808_220000_Special_Report_With_Bret_Baier/FOXNEWSW_20170808_220000_Special_Report_With_Bret_Baier.thumbs/FOXNEWSW_20170808_220000_Special_Report_With_Bret_Baier_000988.jpg,"promote his agenda. a new report on climate change significant information or the same old scare tactics? fair and balanced look next. but if that's not enough, we have 7500 allys looking out for one thing, you. call in the next ten minutes to save on."
https://archive.org/details/FOXNEWSW_20170808_230000_The_Story_With_Martha_MacCallum#start/1734/end/1769,8/8/2017 23:29:09,FOXNEWS,The Story With Martha MacCallum,FOXNEWSW_20170808_230000_The_Story_With_Martha_MacCallum,https://archive.org/download/FOXNEWSW_20170808_230000_The_Story_With_Martha_MacCallum/FOXNEWSW_20170808_230000_The_Story_With_Martha_MacCallum.thumbs/FOXNEWSW_20170808_230000_The_Story_With_Martha_MacCallum_001707.jpg,"americans are seeing more heat waves and rainfall because of climate change. despite any disputes about which version of the report, there is action that's going to have to be taken at some point. dana: joining me now, governor mike huckabee. and jessica tarlov, both are"
https://archive.org/details/FOXNEWSW_20170809_000000_Tucker_Carlson_Tonight#start/2887/end/2922,8/9/2017 0:48:22,FOXNEWS,Tucker Carlson Tonight,FOXNEWSW_20170809_000000_Tucker_Carlson_Tonight,https://archive.org/download/FOXNEWSW_20170809_000000_Tucker_Carlson_Tonight/FOXNEWSW_20170809_000000_Tucker_Carlson_Tonight.thumbs/FOXNEWSW_20170809_000000_Tucker_Carlson_Tonight_002877.jpg,"report on climate change to 'the new york times.' they are claiming that they feared suppression by the trump administration. of course, there is no such evidence of suppression, and the leaked draft was almost identical to an earlier draft that had been public for months."
https://archive.org/details/FOXNEWSW_20170809_000000_Tucker_Carlson_Tonight#start/2965/end/3000,8/9/2017 0:49:40,FOXNEWS,Tucker Carlson Tonight,FOXNEWSW_20170809_000000_Tucker_Carlson_Tonight,https://archive.org/download/FOXNEWSW_20170809_000000_Tucker_Carlson_Tonight/FOXNEWSW_20170809_000000_Tucker_Carlson_Tonight.thumbs/FOXNEWSW_20170809_000000_Tucker_Carlson_Tonight_002937.jpg,"should recycle, we should change our light bulbs, we should do all sort of these consumer habits, and this study was comparing those sort of very minimal efforts to curtail climate change with other things like not flying, being a vegetarian, not having a car,"
https://archive.org/details/FOXNEWSW_20170809_000000_Tucker_Carlson_Tonight#start/3043/end/3078,8/9/2017 0:50:58,FOXNEWS,Tucker Carlson Tonight,FOXNEWSW_20170809_000000_Tucker_Carlson_Tonight,https://archive.org/download/FOXNEWSW_20170809_000000_Tucker_Carlson_Tonight/FOXNEWSW_20170809_000000_Tucker_Carlson_Tonight.thumbs/FOXNEWSW_20170809_000000_Tucker_Carlson_Tonight_003027.jpg,"fewer kids, you must change your light bulbs, is crazy, because there is no individual solution for climate change, right? there are ways we can be more responsible citizens, absolutely, but what i would suggest is that that is like running into a burning in"
https://archive.org/details/FOXNEWSW_20170809_000000_Tucker_Carlson_Tonight#start/3122/end/3157,8/9/2017 0:52:17,FOXNEWS,Tucker Carlson Tonight,FOXNEWSW_20170809_000000_Tucker_Carlson_Tonight,https://archive.org/download/FOXNEWSW_20170809_000000_Tucker_Carlson_Tonight/FOXNEWSW_20170809_000000_Tucker_Carlson_Tonight.thumbs/FOXNEWSW_20170809_000000_Tucker_Carlson_Tonight_003117.jpg,"tucker, science controls -- besides dictate everything we do in our society paid science means that climate change is real. that fracking pollutes groundwater. that this television works, that car's work. it presumably says that underneath your hair there is a brain behind those eyes."
https://archive.org/details/FOXNEWSW_20170809_000000_Tucker_Carlson_Tonight#start/3250/end/3285,8/9/2017 0:54:25,FOXNEWS,Tucker Carlson Tonight,FOXNEWSW_20170809_000000_Tucker_Carlson_Tonight,https://archive.org/download/FOXNEWSW_20170809_000000_Tucker_Carlson_Tonight/FOXNEWSW_20170809_000000_Tucker_Carlson_Tonight.thumbs/FOXNEWSW_20170809_000000_Tucker_Carlson_Tonight_003237.jpg,"saying. tucker: when you say that climate change is destroying the world and it is the thing we should worry about most, and then you say simultaneously, it's not really dependent upon our individual choices, aren't you giving a pass to some of the big individual polluters?"
https://archive.org/details/FOXNEWSW_20170809_000000_Tucker_Carlson_Tonight#start/3264/end/3299,8/9/2017 0:54:39,FOXNEWS,Tucker Carlson Tonight,FOXNEWSW_20170809_000000_Tucker_Carlson_Tonight,https://archive.org/download/FOXNEWSW_20170809_000000_Tucker_Carlson_Tonight/FOXNEWSW_20170809_000000_Tucker_Carlson_Tonight.thumbs/FOXNEWSW_20170809_000000_Tucker_Carlson_Tonight_003237.jpg,"if i say really care about climate change and i fly around -- it is group actions. millennials, who are by and large the people of childbearing age now -- no you're not letting me talk, so i'm just going to talk. millennials, who are of"
https://archive.org/details/FOXNEWSW_20170809_030000_Tucker_Carlson_Tonight#start/3256/end/3291,8/9/2017 3:54:31,FOXNEWS,Tucker Carlson Tonight,FOXNEWSW_20170809_030000_Tucker_Carlson_Tonight,https://archive.org/download/FOXNEWSW_20170809_030000_Tucker_Carlson_Tonight/FOXNEWSW_20170809_030000_Tucker_Carlson_Tonight.thumbs/FOXNEWSW_20170809_030000_Tucker_Carlson_Tonight_003238.jpg,"you giving a pass to some of the big individual polluters?you if i say really care about climate change and i fly around -- it is group actions. millennials, who are by andç large the people of childbearing age now -- now you're not w"
https://archive.org/details/FOXNEWSW_20170809_060000_Tucker_Carlson_Tonight#start/2961/end/2996,8/9/2017 6:49:36,FOXNEWS,Tucker Carlson Tonight,FOXNEWSW_20170809_060000_Tucker_Carlson_Tonight,https://archive.org/download/FOXNEWSW_20170809_060000_Tucker_Carlson_Tonight/FOXNEWSW_20170809_060000_Tucker_Carlson_Tonight.thumbs/FOXNEWSW_20170809_060000_Tucker_Carlson_Tonight_002937.jpg,"i think the study was saying that governments are saying we should recycle, we should change our light bulbs, we should do all sort of these consumer habits, and this study was comparing those sort of very minimal efforts to curtail climate change with other things"
https://archive.org/details/FOXNEWSW_20170809_060000_Tucker_Carlson_Tonight#start/3264/end/3299,8/9/2017 6:54:39,FOXNEWS,Tucker Carlson Tonight,FOXNEWSW_20170809_060000_Tucker_Carlson_Tonight,https://archive.org/download/FOXNEWSW_20170809_060000_Tucker_Carlson_Tonight/FOXNEWSW_20170809_060000_Tucker_Carlson_Tonight.thumbs/FOXNEWSW_20170809_060000_Tucker_Carlson_Tonight_003237.jpg,"big individual polluters? if i say really care about climate change and i fly around -- it is group actions. millennials, who are by and large the people of childbearing age now -- no you're not letting me talk, so i'm just going to talk. millennials, who are of"
https://archive.org/details/FOXNEWSW_20170809_080000_Special_Report_With_Bret_Baier#start/1221/end/1256,8/9/2017 8:20:36,FOXNEWS,Special Report With Bret Baier,FOXNEWSW_20170809_080000_Special_Report_With_Bret_Baier,https://archive.org/download/FOXNEWSW_20170809_080000_Special_Report_With_Bret_Baier/FOXNEWSW_20170809_080000_Special_Report_With_Bret_Baier.thumbs/FOXNEWSW_20170809_080000_Special_Report_With_Bret_Baier_001198.jpg,"obtained by the 'new york times' sounds a dire warning about climate change that average temperatures in the u.s. have risen rapidly since 1980 and recent decades have been the warmest of the past 1500 years. it projects increases of 5 to 7.5 degrees fahrenheit by"
https://archive.org/details/FOXNEWSW_20170830_040000_The_Five#start/2597/end/2632,8/30/2017 4:43:32,FOXNEWS,The Five,FOXNEWSW_20170830_040000_The_Five,https://archive.org/download/FOXNEWSW_20170830_040000_The_Five/FOXNEWSW_20170830_040000_The_Five.thumbs/FOXNEWSW_20170830_040000_The_Five_002578.jpg,"greg: he can sure pick a cause, he's the expert in climate change. this is my point, donald trump is now at death metal to the left. he is now officially a scare, triggered by a trump selection, the aftershock creates uncertainty which leads to this"
https://archive.org/details/FOXNEWSW_20170830_070000_The_Five#start/2596/end/2631,8/30/2017 7:43:31,FOXNEWS,The Five,FOXNEWSW_20170830_070000_The_Five,https://archive.org/download/FOXNEWSW_20170830_070000_The_Five/FOXNEWSW_20170830_070000_The_Five.thumbs/FOXNEWSW_20170830_070000_The_Five_002578.jpg,"greg: he can sure pick a cause, he's the expert in climate change. this is my point, donald trump is now at death metal to the left. he is now officially a scare, triggered by a trump selection, the aftershock creates uncertainty which leads to this"
https://archive.org/details/FOXNEWSW_20170816_080000_Special_Report_With_Bret_Baier#start/244/end/279,8/16/2017 8:04:19,FOXNEWS,Special Report With Bret Baier,FOXNEWSW_20170816_080000_Special_Report_With_Bret_Baier,https://archive.org/download/FOXNEWSW_20170816_080000_Special_Report_With_Bret_Baier/FOXNEWSW_20170816_080000_Special_Report_With_Bret_Baier.thumbs/FOXNEWSW_20170816_080000_Special_Report_With_Bret_Baier_000237.jpg,"you have to ask yourself where does it stop. and revoking an obama-era executive order that required builders to consider how climate change might affect flooding and rising sea levels, president trump today said by comparison his executive order would make it much easier to get"
https://archive.org/details/FOXNEWSW_20170815_220000_Special_Report_With_Bret_Baier#start/245/end/280,8/15/2017 22:04:20,FOXNEWS,Special Report With Bret Baier,FOXNEWSW_20170815_220000_Special_Report_With_Bret_Baier,https://archive.org/download/FOXNEWSW_20170815_220000_Special_Report_With_Bret_Baier/FOXNEWSW_20170815_220000_Special_Report_With_Bret_Baier.thumbs/FOXNEWSW_20170815_220000_Special_Report_With_Bret_Baier_000237.jpg,"you have to ask yourself where does it stop. and revoking an obama-era executive order that required builders to consider how climate change might affect flooding and rising sea levels, president trump today said by comparison his executive order would make it much easier to get"
https://archive.org/details/FOXNEWSW_20170812_000000_Tucker_Carlson_Tonight#start/1940/end/1975,8/12/2017 0:32:35,FOXNEWS,Tucker Carlson Tonight,FOXNEWSW_20170812_000000_Tucker_Carlson_Tonight,https://archive.org/download/FOXNEWSW_20170812_000000_Tucker_Carlson_Tonight/FOXNEWSW_20170812_000000_Tucker_Carlson_Tonight.thumbs/FOXNEWSW_20170812_000000_Tucker_Carlson_Tonight_001918.jpg,"if you're not sitting down, listen to my voice, this is an exact question the 'new york times' is asking the question. what is a greater threat to guam? north korea or climate change? i'm thinking when the mustard cloud goes off, it might get"
https://archive.org/details/FOXNEWSW_20170803_100000_FOX__Friends#start/5452/end/5487,8/3/2017 11:31:07,FOXNEWS,FOX  Friends,FOXNEWSW_20170803_100000_FOX__Friends,https://archive.org/download/FOXNEWSW_20170803_100000_FOX__Friends/FOXNEWSW_20170803_100000_FOX__Friends.thumbs/FOXNEWSW_20170803_100000_FOX__Friends_005427.jpg,"elvira salazar thank you very much. we appreciate it. thank you. brian: al gore comparing climate change battle to civil rights. gee anna caldwell here with the inconvenient truth next about his house as well. college students beware. your safe spaces are no longer safe."
https://archive.org/details/FOXNEWSW_20170802_010000_The_Five#start/408/end/443,8/2/2017 1:07:03,FOXNEWS,The Five,FOXNEWSW_20170802_010000_The_Five,https://archive.org/download/FOXNEWSW_20170802_010000_The_Five/FOXNEWSW_20170802_010000_The_Five.thumbs/FOXNEWSW_20170802_010000_The_Five_000388.jpg,"presence. when you get out of the climate accord, that's a great accomplishment? greg: people who believe in climate change even admit the paris accord was a disaster because $100 trillion went to nowhere, that was a great move he's going to go further in the"
https://archive.org/details/FOXNEWSW_20170810_060000_Tucker_Carlson_Tonight#start/2059/end/2094,8/10/2017 6:34:34,FOXNEWS,Tucker Carlson Tonight,FOXNEWSW_20170810_060000_Tucker_Carlson_Tonight,https://archive.org/download/FOXNEWSW_20170810_060000_Tucker_Carlson_Tonight/FOXNEWSW_20170810_060000_Tucker_Carlson_Tonight.thumbs/FOXNEWSW_20170810_060000_Tucker_Carlson_Tonight_002037.jpg,"questions in my book. 'climate change, what everybody needs to know' which is a primer that i did for oxford university after reading the literature -- if they don't agree with you should they die? are they deniers or people with different views? that's not what i said."
https://archive.org/details/FOXNEWSW_20170819_010000_The_Five#start/2466/end/2501,8/19/2017 1:41:21,FOXNEWS,The Five,FOXNEWSW_20170819_010000_The_Five,https://archive.org/download/FOXNEWSW_20170819_010000_The_Five/FOXNEWSW_20170819_010000_The_Five.thumbs/FOXNEWSW_20170819_010000_The_Five_002457.jpg,"kennedy: welcome back. al gore's film on climate change has been a disaster. that has not stopped the failed presidential candidate to give advice on someone who did find a way to enact the electoral college. if i had to give one piece of"
https://archive.org/details/FOXNEWSW_20170819_040000_The_Five#start/2479/end/2514,8/19/2017 4:41:34,FOXNEWS,The Five,FOXNEWSW_20170819_040000_The_Five,https://archive.org/download/FOXNEWSW_20170819_040000_The_Five/FOXNEWSW_20170819_040000_The_Five.thumbs/FOXNEWSW_20170819_040000_The_Five_002457.jpg,"if you had to give trump one piece of advice, what would it be? resign. kennedy: oh, albert. greg, this is just sad. his movie is floundering like a dying carp on a hot dock. greg: i blame climate change on that, by the way."
https://archive.org/details/FOXNEWSW_20170808_010000_The_Five#start/3022/end/3057,8/8/2017 1:50:37,FOXNEWS,The Five,FOXNEWSW_20170808_010000_The_Five,https://archive.org/download/FOXNEWSW_20170808_010000_The_Five/FOXNEWSW_20170808_010000_The_Five.thumbs/FOXNEWSW_20170808_010000_The_Five_002998.jpg,"you can't link extreme weather incidents to climate change. we should all be praying for the people of new orleans. don't try to change on it me and say i'm being mean. one of the things i think that if you want to be successful, don't narrate it your seven."
https://archive.org/details/FOXNEWSW_20170809_000000_Tucker_Carlson_Tonight#start/3280/end/3315,8/9/2017 0:54:55,FOXNEWS,Tucker Carlson Tonight,FOXNEWSW_20170809_000000_Tucker_Carlson_Tonight,https://archive.org/download/FOXNEWSW_20170809_000000_Tucker_Carlson_Tonight/FOXNEWSW_20170809_000000_Tucker_Carlson_Tonight.thumbs/FOXNEWSW_20170809_000000_Tucker_Carlson_Tonight_003267.jpg,"childbearing age now, number one issue is climate change, because they know they're going to inherit an incredibly unstable world. the united nations predicts -- tucker: or whatever. i'm going to bring this to a close. i like to have a conversation with you, but you but you are"
https://archive.org/details/FOXNEWSW_20170809_030000_Tucker_Carlson_Tonight#start/3046/end/3081,8/9/2017 3:51:01,FOXNEWS,Tucker Carlson Tonight,FOXNEWSW_20170809_030000_Tucker_Carlson_Tonight,https://archive.org/download/FOXNEWSW_20170809_030000_Tucker_Carlson_Tonight/FOXNEWSW_20170809_030000_Tucker_Carlson_Tonight.thumbs/FOXNEWSW_20170809_030000_Tucker_Carlson_Tonight_003028.jpg,"crazy. there's no individual solution for climate change, right?ther there are ways we can be more responsible citizens,sp absolutely, buton what i would suggest i is that that is likegn running into a burning inferno of a building with a thimble of water in saying whoo, i didere"
https://archive.org/details/FOXNEWSW_20170809_060000_Tucker_Carlson_Tonight#start/2880/end/2915,8/9/2017 6:48:15,FOXNEWS,Tucker Carlson Tonight,FOXNEWSW_20170809_060000_Tucker_Carlson_Tonight,https://archive.org/download/FOXNEWSW_20170809_060000_Tucker_Carlson_Tonight/FOXNEWSW_20170809_060000_Tucker_Carlson_Tonight.thumbs/FOXNEWSW_20170809_060000_Tucker_Carlson_Tonight_002667.jpg,"laura: another leak from the trump administration. a group of government climate scientists have leaked a draft report on climate change to 'the new york times.' they are claiming that they feared suppression by the trump administration. of course, there is no such evidence of suppression, and the"
https://archive.org/details/FOXNEWSW_20170809_060000_Tucker_Carlson_Tonight#start/3247/end/3282,8/9/2017 6:54:22,FOXNEWS,Tucker Carlson Tonight,FOXNEWSW_20170809_060000_Tucker_Carlson_Tonight,https://archive.org/download/FOXNEWSW_20170809_060000_Tucker_Carlson_Tonight/FOXNEWSW_20170809_060000_Tucker_Carlson_Tonight.thumbs/FOXNEWSW_20170809_060000_Tucker_Carlson_Tonight_003237.jpg,"go ahead, see what you're saying. tucker: when you say that climate change is destroying the world and it is the thing we should worry about most, and then you say simultaneously, it's not really dependent upon our individual choices, aren't you giving a pass to some of the"
https://archive.org/details/FOXNEWSW_20170809_060000_Tucker_Carlson_Tonight#start/3279/end/3314,8/9/2017 6:54:54,FOXNEWS,Tucker Carlson Tonight,FOXNEWSW_20170809_060000_Tucker_Carlson_Tonight,https://archive.org/download/FOXNEWSW_20170809_060000_Tucker_Carlson_Tonight/FOXNEWSW_20170809_060000_Tucker_Carlson_Tonight.thumbs/FOXNEWSW_20170809_060000_Tucker_Carlson_Tonight_003267.jpg,"childbearing age now, number one issue is climate change, because they know they're going to inherit an incredibly unstable world. the united nations predicts -- tucker: or whatever. i'm going to bring this to a close. i like to have a conversation with you, but you but you are"
https://archive.org/details/FOXNEWSW_20170817_100000_FOX__Friends#start/5800/end/5835,8/17/2017 11:36:55,FOXNEWS,FOX  Friends,FOXNEWSW_20170817_100000_FOX__Friends,https://archive.org/download/FOXNEWSW_20170817_100000_FOX__Friends/FOXNEWSW_20170817_100000_FOX__Friends.thumbs/FOXNEWSW_20170817_100000_FOX__Friends_005787.jpg,"where do you draw the line. the real problem is in silicon valley where i live, frankly the definition of hate speech is so wide, it actually includes basically anyone who voted for trump. anyone who is skeptical about climate change. anyone who thinks anything that doesn't fit the"
https://archive.org/details/FOXNEWSW_20170803_010000_The_Five#start/2484/end/2519,8/3/2017 1:41:39,FOXNEWS,The Five,FOXNEWSW_20170803_010000_The_Five,https://archive.org/download/FOXNEWSW_20170803_010000_The_Five/FOXNEWSW_20170803_010000_The_Five.thumbs/FOXNEWSW_20170803_010000_The_Five_002458.jpg,"that is what happens. he ruined the climate change argument because there is stuff to talk about, whether it is man-made or not, there's a lot of dispute. there's a lot of dispute everywhere, but there is something happening, and we should talk about it, but he has ruined it."
https://archive.org/details/FOXNEWSW_20170803_070000_The_Five#start/2484/end/2519,8/3/2017 7:41:39,FOXNEWS,The Five,FOXNEWSW_20170803_070000_The_Five,https://archive.org/download/FOXNEWSW_20170803_070000_The_Five/FOXNEWSW_20170803_070000_The_Five.thumbs/FOXNEWSW_20170803_070000_The_Five_002458.jpg,"that is what happens. he ruined the climate change argument because there is stuff to talk about, whether it is man-made or not, there's a lot of dispute. there's a lot of dispute everywhere, but there is something happening, and we should talk about it, but he has ruined it."
https://archive.org/details/FOXNEWSW_20170810_040000_The_Five#start/1700/end/1735,8/10/2017 4:28:35,FOXNEWS,The Five,FOXNEWSW_20170810_040000_The_Five,https://archive.org/download/FOXNEWSW_20170810_040000_The_Five/FOXNEWSW_20170810_040000_The_Five.thumbs/FOXNEWSW_20170810_040000_The_Five_001678.jpg,"to be identified, they feel so strongly about something and says the public has to know this. this is a good case in point with the climate change. obviously president trump and those in his administration did not want this information out but somebody somewhere said it you know what?"
https://archive.org/details/FOXNEWSW_20170808_040000_The_Five#start/2963/end/2998,8/8/2017 4:49:38,FOXNEWS,The Five,FOXNEWSW_20170808_040000_The_Five,https://archive.org/download/FOXNEWSW_20170808_040000_The_Five/FOXNEWSW_20170808_040000_The_Five.thumbs/FOXNEWSW_20170808_040000_The_Five_002937.jpg,"i have told you that before, greg, so i think it is suffering from a sequel blues. greg: ifou he was right in the first movie, there wouldn't be a sequel because we were at all be dead. i blame this film bombing on climate change. a warmer climate has moreim peoe"
https://archive.org/details/FOXNEWSW_20170808_210000_The_Fox_News_Specialists#start/2538/end/2573,8/8/2017 21:42:33,FOXNEWS,The Fox News Specialists,FOXNEWSW_20170808_210000_The_Fox_News_Specialists,https://archive.org/download/FOXNEWSW_20170808_210000_The_Fox_News_Specialists/FOXNEWSW_20170808_210000_The_Fox_News_Specialists.thumbs/FOXNEWSW_20170808_210000_The_Fox_News_Specialists_002518.jpg,"is he suppressing. this this climate change thing is not around it's everywhere. it's been going on for years. the question is i take it away from that you can talk about a climate. can you talk about man's effect on it that's not beyond the pale. i think we do influence the"
https://archive.org/details/FOXNEWSW_20170808_230000_The_Story_With_Martha_MacCallum#start/1619/end/1654,8/8/2017 23:27:14,FOXNEWS,The Story With Martha MacCallum,FOXNEWSW_20170808_230000_The_Story_With_Martha_MacCallum,https://archive.org/download/FOXNEWSW_20170808_230000_The_Story_With_Martha_MacCallum/FOXNEWSW_20170808_230000_The_Story_With_Martha_MacCallum.thumbs/FOXNEWSW_20170808_230000_The_Story_With_Martha_MacCallum_001617.jpg,"dana: new details after 'the new york times' publishes details of a government climate change report they say was leaked to them, noting in the headline that scientists fear trump will dismiss blunt climate reports but no details to claim this may have already been a public report and the administration is -- ed henry            _"
https://archive.org/details/FOXNEWSW_20170808_230000_The_Story_With_Martha_MacCallum#start/1752/end/1787,8/8/2017 23:29:27,FOXNEWS,The Story With Martha MacCallum,FOXNEWSW_20170808_230000_The_Story_With_Martha_MacCallum,https://archive.org/download/FOXNEWSW_20170808_230000_The_Story_With_Martha_MacCallum/FOXNEWSW_20170808_230000_The_Story_With_Martha_MacCallum.thumbs/FOXNEWSW_20170808_230000_The_Story_With_Martha_MacCallum_001737.jpg,"fox news contributors. i'm glad you are here. let's talk about climate. i've worked at the white house. i think you were governor at the time. there was always a push. i'm not gonna blame 'the new york times' but from the left and the worry that climate change was going to take a backseat."
https://archive.org/details/FOXNEWSW_20170809_030000_Tucker_Carlson_Tonight#start/2884/end/2919,8/9/2017 3:48:19,FOXNEWS,Tucker Carlson Tonight,FOXNEWSW_20170809_030000_Tucker_Carlson_Tonight,https://archive.org/download/FOXNEWSW_20170809_030000_Tucker_Carlson_Tonight/FOXNEWSW_20170809_030000_Tucker_Carlson_Tonight.thumbs/FOXNEWSW_20170809_030000_Tucker_Carlson_Tonight_002848.jpg,"a group of government climate scientists have leaked a draft report on climate change to 'the new york times.' theyey are claiming they feared suppression by the trump administration. of course, there is no suchs evidence of suppression, and thi leaked draft was almost identical to an earlier draft that had been public for months."
https://archive.org/details/FOXNEWSW_20170809_030000_Tucker_Carlson_Tonight#start/3067/end/3102,8/9/2017 3:51:22,FOXNEWS,Tucker Carlson Tonight,FOXNEWSW_20170809_030000_Tucker_Carlson_Tonight,https://archive.org/download/FOXNEWSW_20170809_030000_Tucker_Carlson_Tonight/FOXNEWSW_20170809_030000_Tucker_Carlson_Tonight.thumbs/FOXNEWSW_20170809_030000_Tucker_Carlson_Tonight_003058.jpg,"something. there is a con afoot that individuals have to take on this responsibility when, in fact, it is governments and major in corporations that are responsible for climate change.n it has been very clear, 100 companies are responsible forlia 71% of climate change emissions. it is those companies which should stop reproducing, not children."
https://archive.org/details/FOXNEWSW_20170809_030000_Tucker_Carlson_Tonight#start/3207/end/3242,8/9/2017 3:53:42,FOXNEWS,Tucker Carlson Tonight,FOXNEWSW_20170809_030000_Tucker_Carlson_Tonight,https://archive.org/download/FOXNEWSW_20170809_030000_Tucker_Carlson_Tonight/FOXNEWSW_20170809_030000_Tucker_Carlson_Tonight.thumbs/FOXNEWSW_20170809_030000_Tucker_Carlson_Tonight_003208.jpg,"dangerous and difficult for civilizations to endure. climate change will raise sea levels to the point to which it is swamped. tucker: can i ask you a question, or are you going to continue with this stuff? let me ask you a simple>> question. you still haven't answered my question.e do you understand?"
