URL,MatchDateTime,Station,Show,IAShowID,IAPreviewThumb,Snippet
https://archive.org/details/FOXNEWS_20091217_140000_Americas_Newsroom#start/5839/end/5874,12/17/2009 15:37:34,FOXNEWS,Americas Newsroom,FOXNEWS_20091217_140000_Americas_Newsroom,https://archive.org/download/FOXNEWS_20091217_140000_Americas_Newsroom/FOXNEWS_20091217_140000_Americas_Newsroom.thumbs/FOXNEWS_20091217_140000_Americas_Newsroom_005820.jpg,"but thank you for coming in today. what did you think? should the u.s. commit $10 billion to fight climate change? go to our website, foxnews.com, and you'll find a link to the survey."
https://archive.org/details/FOXNEWS_20091217_140000_Americas_Newsroom#start/5855/end/5890,12/17/2009 15:37:50,FOXNEWS,Americas Newsroom,FOXNEWS_20091217_140000_Americas_Newsroom,https://archive.org/download/FOXNEWS_20091217_140000_Americas_Newsroom/FOXNEWS_20091217_140000_Americas_Newsroom.thumbs/FOXNEWS_20091217_140000_Americas_Newsroom_005850.jpg,"take our survey in your comments about the u.s. helping developing nations deal with climate change. that is online right now. alisyn: for years scientists have warned that the big one is going to hit."
https://archive.org/details/FOXNEWS_20091216_180000_The_Live_Desk#start/2707/end/2742,12/16/2009 18:45:22,FOXNEWS,The Live Desk,FOXNEWS_20091216_180000_The_Live_Desk,https://archive.org/download/FOXNEWS_20091216_180000_The_Live_Desk/FOXNEWS_20091216_180000_The_Live_Desk.thumbs/FOXNEWS_20091216_180000_The_Live_Desk_002693.jpg,"2020. the u.s. is proposing about 40%. the so-called victims of climate change say that is not good enough. they want money to mitigate future damages and repair what has already been done."
https://archive.org/details/FOXNEWS_20091216_200000_Studio_B_With_Shepard_Smith#start/2991/end/3026,12/16/2009 20:50:06,FOXNEWS,Studio B With Shepard Smith,FOXNEWS_20091216_200000_Studio_B_With_Shepard_Smith,https://archive.org/download/FOXNEWS_20091216_200000_Studio_B_With_Shepard_Smith/FOXNEWS_20091216_200000_Studio_B_With_Shepard_Smith.thumbs/FOXNEWS_20091216_200000_Studio_B_With_Shepard_Smith_002970.jpg,"it has become about the internet. shepard: u.n. climate change conference in copenhagen is supposed to be a serious attempt at finding a common ground. that is the idea, to try to save the planet."
https://archive.org/details/FOXNEWS_20091212_110000_The_OReilly_Factor#start/755/end/790,12/12/2009 11:12:50,FOXNEWS,The OReilly Factor,FOXNEWS_20091212_110000_The_OReilly_Factor,https://archive.org/download/FOXNEWS_20091212_110000_The_OReilly_Factor/FOXNEWS_20091212_110000_The_OReilly_Factor.thumbs/FOXNEWS_20091212_110000_The_OReilly_Factor_000593.jpg,"coming up. laura: in the culture war segment tonight, a shocking proposal to save the earth from climate change. a columnist for one of canada's largest newspapers wants the world to adopt china's one"
https://archive.org/details/FOXNEWS_20091213_150000_Americas_News_HQ#start/4779/end/4814,12/13/2009 16:19:54,FOXNEWS,Americas News HQ,FOXNEWS_20091213_150000_Americas_News_HQ,https://archive.org/download/FOXNEWS_20091213_150000_Americas_News_HQ/FOXNEWS_20091213_150000_Americas_News_HQ.thumbs/FOXNEWS_20091213_150000_Americas_News_HQ_004668.jpg,"good morning. you believe there is climate change and you do not believe it's as bad as some predict. with a do you expect can be achieved at the conference, if anything, by friday?"
https://archive.org/details/FOXNEWS_20091229_110000_FOX_and_Friends#start/9734/end/9769,12/29/2009 13:42:29,FOXNEWS,FOX and Friends,FOXNEWS_20091229_110000_FOX_and_Friends,https://archive.org/download/FOXNEWS_20091229_110000_FOX_and_Friends/FOXNEWS_20091229_110000_FOX_and_Friends.thumbs/FOXNEWS_20091229_110000_FOX_and_Friends_009720.jpg,"school student wants her school to be fair and balanced when it comes to climate change, but they are only showing 'and inconvenient to.' peter: we have been asking you to vote for your favorite"
https://archive.org/details/FOXNEWS_20091210_160000_Happening_Now#start/7086/end/7121,12/10/2009 17:58:21,FOXNEWS,Happening Now,FOXNEWS_20091210_160000_Happening_Now,https://archive.org/download/FOXNEWS_20091210_160000_Happening_Now/FOXNEWS_20091210_160000_Happening_Now.thumbs/FOXNEWS_20091210_160000_Happening_Now_007066.jpg,"pass the sweeping climate change and develop president wants, but if it does pass next year, what do we expect? william la jeunesse has more from los angeles. there are three ways to cut"
https://archive.org/details/FOXNEWS_20091212_210000_Americas_News_HQ#start/1185/end/1220,12/12/2009 21:20:00,FOXNEWS,Americas News HQ,FOXNEWS_20091212_210000_Americas_News_HQ,https://archive.org/download/FOXNEWS_20091212_210000_Americas_News_HQ/FOXNEWS_20091212_210000_Americas_News_HQ.thumbs/FOXNEWS_20091212_210000_Americas_News_HQ_000952.jpg,"about it coming up. <w<w>j)k. gregg: despite all the recent headlines about afghanistan and climate change a new dynamics opinion poll, they say those are not the issues they want the"
https://archive.org/details/FOXNEWS_20091223_230000_Special_Report_With_Bret_Baier#start/1794/end/1829,12/23/2009 23:30:09,FOXNEWS,Special Report With Bret Baier,FOXNEWS_20091223_230000_Special_Report_With_Bret_Baier,https://archive.org/download/FOXNEWS_20091223_230000_Special_Report_With_Bret_Baier/FOXNEWS_20091223_230000_Special_Report_With_Bret_Baier.thumbs/FOXNEWS_20091223_230000_Special_Report_With_Bret_Baier_001795.jpg,"global climate change or offend anyone in any way.' during tuesday's state department hearing, t.j. crawley told reporters about hillary clinton's holiday schedule. he said she stopped off at the north pole for an important"
https://archive.org/details/FOXNEWS_20091210_180000_The_Live_Desk#start/3879/end/3914,12/10/2009 19:04:54,FOXNEWS,The Live Desk,FOXNEWS_20091210_180000_The_Live_Desk,https://archive.org/download/FOXNEWS_20091210_180000_The_Live_Desk/FOXNEWS_20091210_180000_The_Live_Desk.thumbs/FOXNEWS_20091210_180000_The_Live_Desk_003830.jpg,"climate change is man-made. these guys try to block the opposing viewpoints of getting into important and journals. also, when the data from east anglia was questioned, by people who have questions among the"
https://archive.org/details/FOXNEWS_20091218_110000_FOX_and_Friends#start/2051/end/2086,12/18/2009 11:34:26,FOXNEWS,FOX and Friends,FOXNEWS_20091218_110000_FOX_and_Friends,https://archive.org/download/FOXNEWS_20091218_110000_FOX_and_Friends/FOXNEWS_20091218_110000_FOX_and_Friends.thumbs/FOXNEWS_20091218_110000_FOX_and_Friends_002031.jpg,"responsibility. that's why we renewed our leadership within international climate change negotiations. that's why we've worked with other nations to phase out fossil fuel subsidies. that's why we've taken bold action at home, by making"
https://archive.org/details/FOXNEWS_20091219_120000_FOX_and_Friends_Saturday#start/4120/end/4155,12/19/2009 13:08:55,FOXNEWS,FOX and Friends Saturday,FOXNEWS_20091219_120000_FOX_and_Friends_Saturday,https://archive.org/download/FOXNEWS_20091219_120000_FOX_and_Friends_Saturday/FOXNEWS_20091219_120000_FOX_and_Friends_Saturday.thumbs/FOXNEWS_20091219_120000_FOX_and_Friends_Saturday_004110.jpg,"to broker the deal. climate change threatens us all. we must bridge all divides and bridge partnerships to meet the great challenge of our time. another problem with the deal. it was not unanimously agreed"
https://archive.org/details/FOXNEWS_20091219_193000_FOX_News_Watch#start/767/end/802,12/19/2009 19:43:02,FOXNEWS,FOX News Watch,FOXNEWS_20091219_193000_FOX_News_Watch,https://archive.org/download/FOXNEWS_20091219_193000_FOX_News_Watch/FOXNEWS_20091219_193000_FOX_News_Watch.thumbs/FOXNEWS_20091219_193000_FOX_News_Watch_000745.jpg,"news week's blog on tuesday, elliss, highlighted this week in conservative media, climate change denier in the spotlight and went on to describe mark morano, a former spokesman or senator inhofe who created the"
https://archive.org/details/FOXNEWS_20091206_190000_FOX_News_Sunday_With_Chris_Wallace#start/1745/end/1780,12/6/2009 19:29:20,FOXNEWS,FOX News Sunday With Chris Wallace,FOXNEWS_20091206_190000_FOX_News_Sunday_With_Chris_Wallace,https://archive.org/download/FOXNEWS_20091206_190000_FOX_News_Sunday_With_Chris_Wallace/FOXNEWS_20091206_190000_FOX_News_Sunday_With_Chris_Wallace.thumbs/FOXNEWS_20091206_190000_FOX_News_Sunday_With_Chris_Wallace_001732.jpg,"countries like china leap frogging us and moving forward. that creates jobs for japan but not us. not only does it increase the likelihood of danger from climate change. there are many ways to write"
https://archive.org/details/FOXNEWS_20091207_110000_FOX_and_Friends#start/4362/end/4397,12/7/2009 12:12:57,FOXNEWS,FOX and Friends,FOXNEWS_20091207_110000_FOX_and_Friends,https://archive.org/download/FOXNEWS_20091207_110000_FOX_and_Friends/FOXNEWS_20091207_110000_FOX_and_Friends.thumbs/FOXNEWS_20091207_110000_FOX_and_Friends_004350.jpg,"their data underneath doesn't show that theeth is warming and there is climate change. i think we can all agree on that. what is disheartening it is to see all these people show up for"
https://archive.org/details/FOXNEWS_20091204_090000_Special_Report_With_Bret_Baier#start/133/end/168,12/4/2009 9:02:28,FOXNEWS,Special Report With Bret Baier,FOXNEWS_20091204_090000_Special_Report_With_Bret_Baier,https://archive.org/download/FOXNEWS_20091204_090000_Special_Report_With_Bret_Baier/FOXNEWS_20091204_090000_Special_Report_With_Bret_Baier.thumbs/FOXNEWS_20091204_090000_Special_Report_With_Bret_Baier_000115.jpg,"president's stimulus spending and tax increases tied to healthcare and climate change legislation. the biggest problem that we heard from our economists with regard to why employers aren't hiring is all the job killing"
https://archive.org/details/FOXNEWS_20091204_090000_Special_Report_With_Bret_Baier#start/1130/end/1165,12/4/2009 9:19:05,FOXNEWS,Special Report With Bret Baier,FOXNEWS_20091204_090000_Special_Report_With_Bret_Baier,https://archive.org/download/FOXNEWS_20091204_090000_Special_Report_With_Bret_Baier/FOXNEWS_20091204_090000_Special_Report_With_Bret_Baier.thumbs/FOXNEWS_20091204_090000_Special_Report_With_Bret_Baier_001104.jpg,"we're coming out of the recession, there is no single piece of legislation that can do more to create hundreds of thousands, millions of jobs in america than this climate change energy independence legislation."
https://archive.org/details/FOXNEWS_20091202_230000_Special_Report_With_Bret_Baier#start/3158/end/3193,12/2/2009 23:52:53,FOXNEWS,Special Report With Bret Baier,FOXNEWS_20091202_230000_Special_Report_With_Bret_Baier,https://archive.org/download/FOXNEWS_20091202_230000_Special_Report_With_Bret_Baier/FOXNEWS_20091202_230000_Special_Report_With_Bret_Baier.thumbs/FOXNEWS_20091202_230000_Special_Report_With_Bret_Baier_003142.jpg,"senator john kerry calling for $3 billion to be put into the budget next year to help developing nations with their climate change efforts. that has always been a big political issue, of course."
https://archive.org/details/FOXNEWS_20091201_050000_Hannity#start/1775/end/1810,12/1/2009 5:29:50,FOXNEWS,Hannity,FOXNEWS_20091201_050000_Hannity,https://archive.org/download/FOXNEWS_20091201_050000_Hannity/FOXNEWS_20091201_050000_Hannity.thumbs/FOXNEWS_20091201_050000_Hannity_001710.jpg,"sean: president obama and all of his celebrity friends are getting excited about next week's climate change summit in copenhagen, but some say it would generate tons of carbon dioxide, and it will require 900"
https://archive.org/details/FOXNEWS_20091221_020000_Hannity#start/181/end/216,12/21/2009 2:03:16,FOXNEWS,Hannity,FOXNEWS_20091221_020000_Hannity,https://archive.org/download/FOXNEWS_20091221_020000_Hannity/FOXNEWS_20091221_020000_Hannity.thumbs/FOXNEWS_20091221_020000_Hannity_000180.jpg,"helped prepare the european union in the leadup to the negotiations on the keoto protocol. today he is the executive secretary of united nations framework convention on climate change. that makes him among other"
https://archive.org/details/FOXNEWS_20091203_230000_Special_Report_With_Bret_Baier#start/138/end/173,12/3/2009 23:02:33,FOXNEWS,Special Report With Bret Baier,FOXNEWS_20091203_230000_Special_Report_With_Bret_Baier,https://archive.org/download/FOXNEWS_20091203_230000_Special_Report_With_Bret_Baier/FOXNEWS_20091203_230000_Special_Report_With_Bret_Baier.thumbs/FOXNEWS_20091203_230000_Special_Report_With_Bret_Baier_000116.jpg,"and tax increases tied to healthcare and climate change legislation. the biggest problem that we heard from our economists with regard to why employers aren't hiring is all the job killing policies that are being"
https://archive.org/details/FOXNEWS_20091203_230000_Special_Report_With_Bret_Baier#start/1131/end/1166,12/3/2009 23:19:06,FOXNEWS,Special Report With Bret Baier,FOXNEWS_20091203_230000_Special_Report_With_Bret_Baier,https://archive.org/download/FOXNEWS_20091203_230000_Special_Report_With_Bret_Baier/FOXNEWS_20091203_230000_Special_Report_With_Bret_Baier.thumbs/FOXNEWS_20091203_230000_Special_Report_With_Bret_Baier_001105.jpg,"recession, there is no single piece of legislation that can do more to create hundreds of thousands, millions of jobs in america than this climate change energy independence legislation. and while the obama"
https://archive.org/details/FOXNEWS_20091201_050000_Hannity#start/1666/end/1701,12/1/2009 5:28:01,FOXNEWS,Hannity,FOXNEWS_20091201_050000_Hannity,https://archive.org/download/FOXNEWS_20091201_050000_Hannity/FOXNEWS_20091201_050000_Hannity.thumbs/FOXNEWS_20091201_050000_Hannity_001650.jpg,"by the way, to all of you out there, merry christmas, and that is the news tonight from hannity's america. president obama is gearing up for the copenhagen climate change conference, but how big of."
https://archive.org/details/FOXNEWS_20091203_090000_Special_Report_With_Bret_Baier#start/3157/end/3192,12/3/2009 9:52:52,FOXNEWS,Special Report With Bret Baier,FOXNEWS_20091203_090000_Special_Report_With_Bret_Baier,https://archive.org/download/FOXNEWS_20091203_090000_Special_Report_With_Bret_Baier/FOXNEWS_20091203_090000_Special_Report_With_Bret_Baier.thumbs/FOXNEWS_20091203_090000_Special_Report_With_Bret_Baier_003150.jpg,"senator john kerry calling for $3 billion to be put into the budget next year to help developing nations with their climate change efforts. that has always been a big political issue, of course."
https://archive.org/details/FOXNEWS_20091206_230000_FOX_News_Sunday_With_Chris_Wallace#start/2233/end/2268,12/6/2009 23:37:28,FOXNEWS,FOX News Sunday With Chris Wallace,FOXNEWS_20091206_230000_FOX_News_Sunday_With_Chris_Wallace,https://archive.org/download/FOXNEWS_20091206_230000_FOX_News_Sunday_With_Chris_Wallace/FOXNEWS_20091206_230000_FOX_News_Sunday_With_Chris_Wallace.thumbs/FOXNEWS_20091206_230000_FOX_News_Sunday_With_Chris_Wallace_002220.jpg,"to the whole global warming camp. for people going to the meeting. the government, who worked so long to get to the point to have a little bit of progress, is basically following on multi-years of the same process we have been following, get the major economies doings, and these e-mails coming at this point, is a big deal."
https://archive.org/details/FOXNEWS_20091205_170000_Americas_News_HQ#start/2403/end/2438,12/5/2009 17:40:18,FOXNEWS,Americas News HQ,FOXNEWS_20091205_170000_Americas_News_HQ,https://archive.org/download/FOXNEWS_20091205_170000_Americas_News_HQ/FOXNEWS_20091205_170000_Americas_News_HQ.thumbs/FOXNEWS_20091205_170000_Americas_News_HQ_002391.jpg,"seem to suggest that some of this data has been cooked in order to get the answers that you want to show that there is indeed global warming and i guess my question is to you, what are those of us who are still trying it figure out where they come down on this, to believe given what we have"
https://archive.org/details/FOXNEWS_20091220_120000_FOX_and_Friends_Sunday#start/1064/end/1099,12/20/2009 12:17:59,FOXNEWS,FOX and Friends Sunday,FOXNEWS_20091220_120000_FOX_and_Friends_Sunday,https://archive.org/download/FOXNEWS_20091220_120000_FOX_and_Friends_Sunday/FOXNEWS_20091220_120000_FOX_and_Friends_Sunday.thumbs/FOXNEWS_20091220_120000_FOX_and_Friends_Sunday_001050.jpg,"far, it has not. perhaps the telling sign at copenhagen, when he walked into the room, the final negotiation meeting and had no chair at the table. how did this change his standing around the world? well, first of all, i've got to tell you, as far as the global warming goes, i had to take a dog sled to get into"
https://archive.org/details/FOXNEWS_20091220_050000_Red_Eye#start/357/end/392,12/20/2009 5:06:12,FOXNEWS,Red Eye,FOXNEWS_20091220_050000_Red_Eye,https://archive.org/download/FOXNEWS_20091220_050000_Red_Eye/FOXNEWS_20091220_050000_Red_Eye.thumbs/FOXNEWS_20091220_050000_Red_Eye_000356.jpg,"greg: they have no powers. jesse, do you have any sympathy at all for the protesters out there in the freezing cold during a global warming conference? greg, i got to say this because it happens every time and i want to point out that is the conclusion that you draw at the end of your greg-alogue"
https://archive.org/details/FOXNEWS_20091226_153000_Cavuto_on_Business#start/855/end/890,12/26/2009 15:44:30,FOXNEWS,Cavuto on Business,FOXNEWS_20091226_153000_Cavuto_on_Business,https://archive.org/download/FOXNEWS_20091226_153000_Cavuto_on_Business/FOXNEWS_20091226_153000_Cavuto_on_Business.thumbs/FOXNEWS_20091226_153000_Cavuto_on_Business_000835.jpg,"long as they have, it they're going try to weeled t. the problem is, if they don't go trade and trade, they'll go carbon tax. if they don't do that, the eps will usurp the congress and put in laws and regulations that harm the polluting industries that they deem are polluting. and so we will have this burden"
https://archive.org/details/FOXNEWS_20091205_110000_The_OReilly_Factor#start/779/end/814,12/5/2009 11:13:14,FOXNEWS,The OReilly Factor,FOXNEWS_20091205_110000_The_OReilly_Factor,https://archive.org/download/FOXNEWS_20091205_110000_The_OReilly_Factor/FOXNEWS_20091205_110000_The_OReilly_Factor.thumbs/FOXNEWS_20091205_110000_The_OReilly_Factor_000780.jpg,"climate crisis. both of those things are being addressed in a way that will make our foundation of our country stronger, because that is the key to the spending, the excess spending, long-term deficits, bringing that in. and also becoming independent of our energy sources, so we don't have to worry about if"
https://archive.org/details/FOXNEWS_20091207_220000_Glenn_Beck#start/2223/end/2258,12/7/2009 22:37:18,FOXNEWS,Glenn Beck,FOXNEWS_20091207_220000_Glenn_Beck,https://archive.org/download/FOXNEWS_20091207_220000_Glenn_Beck/FOXNEWS_20091207_220000_Glenn_Beck.thumbs/FOXNEWS_20091207_220000_Glenn_Beck_002211.jpg,"yes, it appears that all their homeland, their hunting ground, the largest of any animal on earth is all still there, but the hysterical climate change zealots want to stop air travel. let's think this one through,"
https://archive.org/details/FOXNEWS_20091207_220000_Glenn_Beck#start/2270/end/2305,12/7/2009 22:38:05,FOXNEWS,Glenn Beck,FOXNEWS_20091207_220000_Glenn_Beck,https://archive.org/download/FOXNEWS_20091207_220000_Glenn_Beck/FOXNEWS_20091207_220000_Glenn_Beck.thumbs/FOXNEWS_20091207_220000_Glenn_Beck_002271.jpg,"first snowfall since 1976 in sacremento, california. al gore was just interviewed in 'outside' magazine and asked how do you talk to these climate change naysayers? he said, the answer is he doesn't. no. here is the exact quote."
https://archive.org/details/FOXNEWS_20091207_230000_Special_Report_With_Bret_Baier#start/290/end/325,12/7/2009 23:05:05,FOXNEWS,Special Report With Bret Baier,FOXNEWS_20091207_230000_Special_Report_With_Bret_Baier,https://archive.org/download/FOXNEWS_20091207_230000_Special_Report_With_Bret_Baier/FOXNEWS_20091207_230000_Special_Report_With_Bret_Baier.thumbs/FOXNEWS_20091207_230000_Special_Report_With_Bret_Baier_000266.jpg,"more troops to afghanistan, a war the left opposes. despite the low priority americans now assign to climate change and despite the scandal swirling around the leaked e-mails, it cast doubt on the integrity of climate scientists,"
https://archive.org/details/FOXNEWS_20091207_230000_Special_Report_With_Bret_Baier#start/1613/end/1648,12/7/2009 23:27:08,FOXNEWS,Special Report With Bret Baier,FOXNEWS_20091207_230000_Special_Report_With_Bret_Baier,https://archive.org/download/FOXNEWS_20091207_230000_Special_Report_With_Bret_Baier/FOXNEWS_20091207_230000_Special_Report_With_Bret_Baier.thumbs/FOXNEWS_20091207_230000_Special_Report_With_Bret_Baier_001615.jpg,"in camp lejeune, north carolina, caroline shively, fox news. bret: that is fantastic. president obama and others who attend the u.n. climate change conference will produce more pollution in two weeks than dozens of countries combined in"
https://archive.org/details/FOXNEWS_20091207_230000_Special_Report_With_Bret_Baier#start/1895/end/1930,12/7/2009 23:31:50,FOXNEWS,Special Report With Bret Baier,FOXNEWS_20091207_230000_Special_Report_With_Bret_Baier,https://archive.org/download/FOXNEWS_20091207_230000_Special_Report_With_Bret_Baier/FOXNEWS_20091207_230000_Special_Report_With_Bret_Baier.thumbs/FOXNEWS_20091207_230000_Special_Report_With_Bret_Baier_001885.jpg,"the same thing they're saying in public?' officials say it was kept private so employees could speak openly. organizers say the climate change summit in copenhagen will create 41000 tons of carbon dioxide equivalent as thousands"
https://archive.org/details/FOXNEWS_20091208_180000_The_Live_Desk#start/5057/end/5092,12/8/2009 19:24:32,FOXNEWS,The Live Desk,FOXNEWS_20091208_180000_The_Live_Desk,https://archive.org/download/FOXNEWS_20091208_180000_The_Live_Desk/FOXNEWS_20091208_180000_The_Live_Desk.thumbs/FOXNEWS_20091208_180000_The_Live_Desk_005028.jpg,"now to that pivotal meeting taking place in copenhagen. 192 nation discussing climate change. on day two of the conference, a weather agency has come out with new statistics on the weather. wendell goler, a report this"
https://archive.org/details/FOXNEWS_20091210_230000_Special_Report_With_Bret_Baier#start/1385/end/1420,12/10/2009 23:23:20,FOXNEWS,Special Report With Bret Baier,FOXNEWS_20091210_230000_Special_Report_With_Bret_Baier,https://archive.org/download/FOXNEWS_20091210_230000_Special_Report_With_Bret_Baier/FOXNEWS_20091210_230000_Special_Report_With_Bret_Baier.thumbs/FOXNEWS_20091210_230000_Special_Report_With_Bret_Baier_001374.jpg,"where stolen e-mails suggest the manipulation of trends, deleting and destroying of data and attempts to prevent the publication of opposing views on climate change is that 1700 brittish scientists have issued a statement standing bind the"
https://archive.org/details/FOXNEWS_20091208_090000_Special_Report_With_Bret_Baier#start/1891/end/1926,12/8/2009 9:31:46,FOXNEWS,Special Report With Bret Baier,FOXNEWS_20091208_090000_Special_Report_With_Bret_Baier,https://archive.org/download/FOXNEWS_20091208_090000_Special_Report_With_Bret_Baier/FOXNEWS_20091208_090000_Special_Report_With_Bret_Baier.thumbs/FOXNEWS_20091208_090000_Special_Report_With_Bret_Baier_001800.jpg,"agencies, are they telling them the same thing they're saying in public?' officials say it was kept private so employees could speak openly. organizers say the climate change summit in copenhagen will create 41000 tons of carbon"
https://archive.org/details/FOXNEWS_20091209_140000_Americas_Newsroom#start/2287/end/2322,12/9/2009 14:38:22,FOXNEWS,Americas Newsroom,FOXNEWS_20091209_140000_Americas_Newsroom,https://archive.org/download/FOXNEWS_20091209_140000_Americas_Newsroom/FOXNEWS_20091209_140000_Americas_Newsroom.thumbs/FOXNEWS_20091209_140000_Americas_Newsroom_002271.jpg,"the science could be correct, but once you have the image that it is dogmatic, the climate change science quarters have to prove again why they are correct, if they're going to re-engage. the concept of scientific rigor"
https://archive.org/details/FOXNEWS_20091209_140000_Americas_Newsroom#start/4132/end/4167,12/9/2009 15:09:07,FOXNEWS,Americas Newsroom,FOXNEWS_20091209_140000_Americas_Newsroom,https://archive.org/download/FOXNEWS_20091209_140000_Americas_Newsroom/FOXNEWS_20091209_140000_Americas_Newsroom.thumbs/FOXNEWS_20091209_140000_Americas_Newsroom_004129.jpg,"bill: we will take that. martha: going across the ocean, the head of the epa is there, telling the climate change summit that she will use common sense when it comes to regulating carbon emissions in the u.s."
https://archive.org/details/FOXNEWS_20091210_020000_Hannity#start/898/end/933,12/10/2009 2:15:13,FOXNEWS,Hannity,FOXNEWS_20091210_020000_Hannity,https://archive.org/download/FOXNEWS_20091210_020000_Hannity/FOXNEWS_20091210_020000_Hannity.thumbs/FOXNEWS_20091210_020000_Hannity_000900.jpg,"does this blow all of the hysteria out of the water, the fact that we know -- again, if you look at the inner governmental panel on climate change that the u.n. uses, the science that we now know is"
https://archive.org/details/FOXNEWS_20091204_110000_FOX_and_Friends#start/10085/end/10120,12/4/2009 13:48:20,FOXNEWS,FOX and Friends,FOXNEWS_20091204_110000_FOX_and_Friends,https://archive.org/download/FOXNEWS_20091204_110000_FOX_and_Friends/FOXNEWS_20091204_110000_FOX_and_Friends.thumbs/FOXNEWS_20091204_110000_FOX_and_Friends_010063.jpg,"happens at the climate change conference that will happen in copenhagen on monday. great to you have a guest. thank you. eric: fly accomplishing and repelling down a cliff. all in a day's work for kristin"
