URL,MatchDateTime,Station,Show,IAShowID,IAPreviewThumb,Snippet
https://archive.org/details/FOXNEWS_20110421_030000_The_OReilly_Factor#start/1597/end/1632,4/21/2011 3:26:52,FOXNEWS,The OReilly Factor,FOXNEWS_20110421_030000_The_OReilly_Factor,https://archive.org/download/FOXNEWS_20110421_030000_The_OReilly_Factor/FOXNEWS_20110421_030000_The_OReilly_Factor.thumbs/FOXNEWS_20110421_030000_The_OReilly_Factor_001590.jpg,"big global warming event in washington. jesse watters showed up. you don't want to miss what happened there dennis miller will critique jesse's performance and talk about british troops on the ground in libya. whoa. we hope you stay tuned to those reports. i'm gonna take allison jenkins to the senior prom"
https://archive.org/details/FOXNEWS_20110419_170000_America_Live#start/6033/end/6068,4/19/2011 18:40:48,FOXNEWS,America Live,FOXNEWS_20110419_170000_America_Live,https://archive.org/download/FOXNEWS_20110419_170000_America_Live/FOXNEWS_20110419_170000_America_Live.thumbs/FOXNEWS_20110419_170000_America_Live_006020.jpg,"reporter: it boils down to this, can a handful of states get together with private environmental groups and sue five power companies they say are destroying the world through global warming? that is the arguments the states made to the justices saying they have every right to sue pause those emissions -- because those            _"
https://archive.org/details/FOXNEWS_20110421_060000_Glenn_Beck#start/2444/end/2479,4/21/2011 6:40:59,FOXNEWS,Glenn Beck,FOXNEWS_20110421_060000_Glenn_Beck,https://archive.org/download/FOXNEWS_20110421_060000_Glenn_Beck/FOXNEWS_20110421_060000_Glenn_Beck.thumbs/FOXNEWS_20110421_060000_Glenn_Beck_002424.jpg,"can i ask you a question? do you think there is any chance at all this might be the end of the line for all nukes? do you think? maybe? then we get the happy news today from the supreme court that they are about to turn over the global warming case to the epa"
https://archive.org/details/FOXNEWS_20110419_150000_Happening_Now#start/3740/end/3775,4/19/2011 16:02:35,FOXNEWS,Happening Now,FOXNEWS_20110419_150000_Happening_Now,https://archive.org/download/FOXNEWS_20110419_150000_Happening_Now/FOXNEWS_20110419_150000_Happening_Now.thumbs/FOXNEWS_20110419_150000_Happening_Now_003712.jpg,"their greenhouse emissions. the companies they say are causing all kinds of global warming and are causing heat-related deaths in los angeles and in new york. and in the middle of the country they are reducing crops and livestock industries in places like iowa among other things. they say the epa is not getting"
https://archive.org/details/FOXNEWS_20110422_100000_FOX_and_Friends#start/1491/end/1526,4/22/2011 10:25:06,FOXNEWS,FOX and Friends,FOXNEWS_20110422_100000_FOX_and_Friends,https://archive.org/download/FOXNEWS_20110422_100000_FOX_and_Friends/FOXNEWS_20110422_100000_FOX_and_Friends.thumbs/FOXNEWS_20110422_100000_FOX_and_Friends_001470.jpg,"so the scare tactics that we have seen in media or from the administration and the president talking about the green house gases and global warming and stuff like that, that's not the right approach. clearly it's not. we've been trying that approach for 20 years. all it's managed to do is two"
https://archive.org/details/FOXNEWS_20110429_000000_The_OReilly_Factor#start/598/end/633,4/29/2011 0:10:13,FOXNEWS,The OReilly Factor,FOXNEWS_20110429_000000_The_OReilly_Factor,https://archive.org/download/FOXNEWS_20110429_000000_The_OReilly_Factor/FOXNEWS_20110429_000000_The_OReilly_Factor.thumbs/FOXNEWS_20110429_000000_The_OReilly_Factor_000570.jpg,"states. is global warming behind this? later some left wingers now promoting the race card in a big way. disturbing sound bites for you upcoming. [ male announcer ] this is charlie whose morning flight. to london starts with arthritis pain. and a choice. take tylenol now, and maybe up to 8 in a day."
https://archive.org/details/FOXNEWS_20110428_220000_Special_Report_With_Bret_Baier#start/293/end/328,4/28/2011 22:05:08,FOXNEWS,Special Report With Bret Baier,FOXNEWS_20110428_220000_Special_Report_With_Bret_Baier,https://archive.org/download/FOXNEWS_20110428_220000_Special_Report_With_Bret_Baier/FOXNEWS_20110428_220000_Special_Report_With_Bret_Baier.thumbs/FOXNEWS_20110428_220000_Special_Report_With_Bret_Baier_000266.jpg,"no change in the number of severe to violent ones. heif casualties of 2011 recall the super outbreak of april of 1974 that killed more than 300 people. today, fema chief asked about the climate change told reporters, 'actually, what"
https://archive.org/details/FOXNEWS_20110430_030000_The_OReilly_Factor#start/1709/end/1744,4/30/2011 3:28:44,FOXNEWS,The OReilly Factor,FOXNEWS_20110430_030000_The_OReilly_Factor,https://archive.org/download/FOXNEWS_20110430_030000_The_OReilly_Factor/FOXNEWS_20110430_030000_The_OReilly_Factor.thumbs/FOXNEWS_20110430_030000_The_OReilly_Factor_001710.jpg,"tornadoes on global warming? we will take a look at it we hope you stay tuned to those reports. also get a free flight. you know that comes with a private island. really? no. it comes with a hat. you see, airline credit cards promise flights for 2500miles, but. [ man ] there's never any seats for ,000 miles."
https://archive.org/details/FOXNEWS_20110430_060000_Glenn_Beck#start/1709/end/1744,4/30/2011 6:28:44,FOXNEWS,Glenn Beck,FOXNEWS_20110430_060000_Glenn_Beck,https://archive.org/download/FOXNEWS_20110430_060000_Glenn_Beck/FOXNEWS_20110430_060000_Glenn_Beck.thumbs/FOXNEWS_20110430_060000_Glenn_Beck_001704.jpg,"tornadoes on global warming? we will take a look at it we hope you stay tuned to those reports. you never know when, but thieves can steal your identity. turning your life upside down in a matter of seconds. hi. hi. you know i can save you 15% today if you open up a charge card account with us."
https://archive.org/details/FOXNEWS_20110430_140000_Cost_of_Freedom#start/6412/end/6447,4/30/2011 15:47:07,FOXNEWS,Cost of Freedom,FOXNEWS_20110430_140000_Cost_of_Freedom,https://archive.org/download/FOXNEWS_20110430_140000_Cost_of_Freedom/FOXNEWS_20110430_140000_Cost_of_Freedom.thumbs/FOXNEWS_20110430_140000_Cost_of_Freedom_006390.jpg,"christian 20 seconds left with you. do you think we can do a good climate change as far as green energy and not have the debate now but in a couple of monthings? i think we have to. just like it is unfair to link"
https://archive.org/details/FOXNEWS_20110428_150000_Happening_Now#start/6580/end/6615,4/28/2011 16:49:55,FOXNEWS,Happening Now,FOXNEWS_20110428_150000_Happening_Now,https://archive.org/download/FOXNEWS_20110428_150000_Happening_Now/FOXNEWS_20110428_150000_Happening_Now.thumbs/FOXNEWS_20110428_150000_Happening_Now_006560.jpg,"highly technical questions like climate change and you get two experts battling against each other, how's a person who doesn't have, you know, formal scientific training, how are you supposed to come to a conclusion? reporter: it's very difficult. but i think if you look, and"
https://archive.org/details/FOXNEWS_20110428_150000_Happening_Now#start/6518/end/6553,4/28/2011 16:48:53,FOXNEWS,Happening Now,FOXNEWS_20110428_150000_Happening_Now,https://archive.org/download/FOXNEWS_20110428_150000_Happening_Now/FOXNEWS_20110428_150000_Happening_Now.thumbs/FOXNEWS_20110428_150000_Happening_Now_006500.jpg,"the head of fema has long experience with seve weather. craig fugate served for eight years as the director of florida's state emergency management division, and when asked if climate change is to blame for what we're seeing today, he said, quote, actually what we're seeing is springtime."
https://archive.org/details/FOXNEWS_20110429_200000_Your_World_With_Neil_Cavuto#start/2303/end/2338,4/29/2011 20:38:38,FOXNEWS,Your World With Neil Cavuto,FOXNEWS_20110429_200000_Your_World_With_Neil_Cavuto,https://archive.org/download/FOXNEWS_20110429_200000_Your_World_With_Neil_Cavuto/FOXNEWS_20110429_200000_Your_World_With_Neil_Cavuto.thumbs/FOXNEWS_20110429_200000_Your_World_With_Neil_Cavuto_002304.jpg,"we did not have the data to go back hundreds of years and look at patterns 500 years ago. our data does not go back long enough to draw conclusions so it is difficult to know if it is climate change or, at the same time, whether it is in the."
https://archive.org/details/FOXNEWS_20110422_100000_FOX_and_Friends#start/1384/end/1419,4/22/2011 10:23:19,FOXNEWS,FOX and Friends,FOXNEWS_20110422_100000_FOX_and_Friends,https://archive.org/download/FOXNEWS_20110422_100000_FOX_and_Friends/FOXNEWS_20110422_100000_FOX_and_Friends.thumbs/FOXNEWS_20110422_100000_FOX_and_Friends_001380.jpg,"something is the wrong way to go. if you look at what we're doing with climate change, we're trying to say, oh, let's subsidize extra solar panels or windmills. that makes us feel good. that's not the solution to cut a few tons of co-2. it's about getting everybody to use these green technologies and"
