URL,MatchDateTime,Station,Show,IAShowID,IAPreviewThumb,Snippet
https://archive.org/details/FOXNEWS_20091205_110000_The_OReilly_Factor#start/186/end/221,12/5/2009 11:03:21,FOXNEWS,The OReilly Factor,FOXNEWS_20091205_110000_The_OReilly_Factor,https://archive.org/download/FOXNEWS_20091205_110000_The_OReilly_Factor/FOXNEWS_20091205_110000_The_OReilly_Factor.thumbs/FOXNEWS_20091205_110000_The_OReilly_Factor_000180.jpg,"demand sacrifice from all of us. all these new entitlements are economic suicide. and that includes the health care fiasco and the global warming madness. now, polls show the democrats may lose big next november, even though the country's decline began under a"
https://archive.org/details/FOXNEWS_20091208_230000_Special_Report_With_Bret_Baier#start/827/end/862,12/8/2009 23:14:02,FOXNEWS,Special Report With Bret Baier,FOXNEWS_20091208_230000_Special_Report_With_Bret_Baier,https://archive.org/download/FOXNEWS_20091208_230000_Special_Report_With_Bret_Baier/FOXNEWS_20091208_230000_Special_Report_With_Bret_Baier.thumbs/FOXNEWS_20091208_230000_Special_Report_With_Bret_Baier_000805.jpg,"by global warming. and the rising sea levels has the potential to permanently displace 20 to 25 million people, so that the sheer magnitude, the sheer numbers is something rather unique to bang la dash. a graph report caused other"
https://archive.org/details/FOXNEWS_20091206_150000_Americas_News_HQ#start/5912/end/5947,12/6/2009 16:38:47,FOXNEWS,Americas News HQ,FOXNEWS_20091206_150000_Americas_News_HQ,https://archive.org/download/FOXNEWS_20091206_150000_Americas_News_HQ/FOXNEWS_20091206_150000_Americas_News_HQ.thumbs/FOXNEWS_20091206_150000_Americas_News_HQ_005867.jpg,"desire by people running places like the u.n. who want to use global warming as excuse to create grand giant global governmenting institutions that snap sovereignty from the united states. that should be rejected at all cost. eric: supporters say"
https://archive.org/details/FOXNEWS_20091209_090000_Special_Report_With_Bret_Baier#start/930/end/965,12/9/2009 9:15:45,FOXNEWS,Special Report With Bret Baier,FOXNEWS_20091209_090000_Special_Report_With_Bret_Baier,https://archive.org/download/FOXNEWS_20091209_090000_Special_Report_With_Bret_Baier/FOXNEWS_20091209_090000_Special_Report_With_Bret_Baier.thumbs/FOXNEWS_20091209_090000_Special_Report_With_Bret_Baier_000925.jpg,"regulating truck stops. you're going to be regulating apartment complexes. you're going to be regulating potentially any football game in america that has over 25000 people in attendance. even if you accept the global warming is man made, a small"
https://archive.org/details/FOXNEWS_20091208_040000_The_OReilly_Factor#start/1082/end/1117,12/8/2009 4:18:17,FOXNEWS,The OReilly Factor,FOXNEWS_20091208_040000_The_OReilly_Factor,https://archive.org/download/FOXNEWS_20091208_040000_The_OReilly_Factor/FOXNEWS_20091208_040000_The_OReilly_Factor.thumbs/FOXNEWS_20091208_040000_The_OReilly_Factor_001080.jpg,"can i barely keep awake myself. does brit hume believe in global warming? we will find out. and later, good morning america asks me, your humble correspondent to grade president obama. we will show you how that went down a bit later on."
https://archive.org/details/FOXNEWS_20091208_040000_The_OReilly_Factor#start/2136/end/2171,12/8/2009 4:35:51,FOXNEWS,The OReilly Factor,FOXNEWS_20091208_040000_The_OReilly_Factor,https://archive.org/download/FOXNEWS_20091208_040000_The_OReilly_Factor/FOXNEWS_20091208_040000_The_OReilly_Factor.thumbs/FOXNEWS_20091208_040000_The_OReilly_Factor_002130.jpg,"not lost. bill: keep us posted on this. we don't want any innocent person, 26 years in prison. thank you, peter. you bet. bill: when we come right back, bernie goldberg how the media is covering global warming and frosty the snowman controversy."
https://archive.org/details/FOXNEWS_20091208_160000_Happening_Now#start/5722/end/5757,12/8/2009 17:35:37,FOXNEWS,Happening Now,FOXNEWS_20091208_160000_Happening_Now,https://archive.org/download/FOXNEWS_20091208_160000_Happening_Now/FOXNEWS_20091208_160000_Happening_Now.thumbs/FOXNEWS_20091208_160000_Happening_Now_005700.jpg,"among the most skeptical about global warming, making it difficult for political leaders to get them to do that things that scientists say are needed to counter the problem. they say that americans have been accustomed to energy and the mitigation efforts could"
https://archive.org/details/FOXNEWS_20091208_100000_The_OReilly_Factor#start/2428/end/2463,12/8/2009 10:40:43,FOXNEWS,The OReilly Factor,FOXNEWS_20091208_100000_The_OReilly_Factor,https://archive.org/download/FOXNEWS_20091208_100000_The_OReilly_Factor/FOXNEWS_20091208_100000_The_OReilly_Factor.thumbs/FOXNEWS_20091208_100000_The_OReilly_Factor_002430.jpg,"culpa, not mea culpa but way over did this tape thing in england, that came out the internet thing and all of that the mainstream media doesn't have any, any will to debunk global warming on any level. just doesn't. exactly."
https://archive.org/details/FOXNEWS_20091208_100000_The_OReilly_Factor#start/2441/end/2476,12/8/2009 10:40:56,FOXNEWS,The OReilly Factor,FOXNEWS_20091208_100000_The_OReilly_Factor,https://archive.org/download/FOXNEWS_20091208_100000_The_OReilly_Factor/FOXNEWS_20091208_100000_The_OReilly_Factor.thumbs/FOXNEWS_20091208_100000_The_OReilly_Factor_002430.jpg,"exactly. a few years ago scott pelley of 60 minutes did a totally one-sided story on global warming. and he didn't deny that it was totally one-sided. when he was asked about it, he said if i interview a holocaust"
https://archive.org/details/FOXNEWS_20091210_090000_Special_Report_With_Bret_Baier#start/1048/end/1083,12/10/2009 9:17:43,FOXNEWS,Special Report With Bret Baier,FOXNEWS_20091210_090000_Special_Report_With_Bret_Baier,https://archive.org/download/FOXNEWS_20091210_090000_Special_Report_With_Bret_Baier/FOXNEWS_20091210_090000_Special_Report_With_Bret_Baier.thumbs/FOXNEWS_20091210_090000_Special_Report_With_Bret_Baier_001046.jpg,"ambassador doesn't know about that because he lives in new york but the people in africa know. exhibits designed to show that the threat they say they face from global warming deserves the trillion dollar bailout that banks got after"
https://archive.org/details/FOXNEWS_20091208_010000_The_OReilly_Factor#start/1452/end/1487,12/8/2009 1:24:27,FOXNEWS,The OReilly Factor,FOXNEWS_20091208_010000_The_OReilly_Factor,https://archive.org/download/FOXNEWS_20091208_010000_The_OReilly_Factor/FOXNEWS_20091208_010000_The_OReilly_Factor.thumbs/FOXNEWS_20091208_010000_The_OReilly_Factor_001440.jpg,"base big time a week ago with his decision on afghanistan. and this global warming dogma is very big with the democratic left. you know, you might not -- he couldn't be reelected with the democratic left. it would be very hard abandon"
https://archive.org/details/FOXNEWS_20091208_010000_The_OReilly_Factor#start/2142/end/2177,12/8/2009 1:35:57,FOXNEWS,The OReilly Factor,FOXNEWS_20091208_010000_The_OReilly_Factor,https://archive.org/download/FOXNEWS_20091208_010000_The_OReilly_Factor/FOXNEWS_20091208_010000_The_OReilly_Factor.thumbs/FOXNEWS_20091208_010000_The_OReilly_Factor_002130.jpg,"bill: when we come right back, bernie goldberg how the media is covering global warming and frosty the snowman controversy. there he is i don't want you to think bernie was frosty. bernie goldberg is next. ññ?y@? sfx:racking of a taillight."
https://archive.org/details/FOXNEWS_20091208_010000_The_OReilly_Factor#start/2434/end/2469,12/8/2009 1:40:49,FOXNEWS,The OReilly Factor,FOXNEWS_20091208_010000_The_OReilly_Factor,https://archive.org/download/FOXNEWS_20091208_010000_The_OReilly_Factor/FOXNEWS_20091208_010000_The_OReilly_Factor.thumbs/FOXNEWS_20091208_010000_The_OReilly_Factor_002430.jpg,"internet thing and all of that the mainstream media doesn't have any, any will to debunk global warming on any level. just doesn't. exactly. exactly. a few years ago scott pelley of 60 minutes did a totally"
https://archive.org/details/FOXNEWS_20091208_010000_The_OReilly_Factor#start/2448/end/2483,12/8/2009 1:41:03,FOXNEWS,The OReilly Factor,FOXNEWS_20091208_010000_The_OReilly_Factor,https://archive.org/download/FOXNEWS_20091208_010000_The_OReilly_Factor/FOXNEWS_20091208_010000_The_OReilly_Factor.thumbs/FOXNEWS_20091208_010000_The_OReilly_Factor_002430.jpg,"one-sided story on global warming. and he didn't deny that it was totally one-sided. when he was asked about it, he said if i interview a holocaust survivor, does that mean i have to run out and find a holocaust"
https://archive.org/details/FOXNEWS_20091210_230000_Special_Report_With_Bret_Baier#start/1897/end/1932,12/10/2009 23:31:52,FOXNEWS,Special Report With Bret Baier,FOXNEWS_20091210_230000_Special_Report_With_Bret_Baier,https://archive.org/download/FOXNEWS_20091210_230000_Special_Report_With_Bret_Baier/FOXNEWS_20091210_230000_Special_Report_With_Bret_Baier.thumbs/FOXNEWS_20091210_230000_Special_Report_With_Bret_Baier_001884.jpg,"you have to support projects like this.' we told you wednesday about al gore's claim that the climate-gate e-mails which some experts say impugn global warming science are dated, even though the most recent was sent out just last"
https://archive.org/details/FOXNEWS_20091210_220000_Glenn_Beck#start/2590/end/2625,12/10/2009 22:43:25,FOXNEWS,Glenn Beck,FOXNEWS_20091210_220000_Glenn_Beck,https://archive.org/download/FOXNEWS_20091210_220000_Glenn_Beck/FOXNEWS_20091210_220000_Glenn_Beck.thumbs/FOXNEWS_20091210_220000_Glenn_Beck_002580.jpg,"idiocy of our government policies in the name of global warming. subsidies for electric cars, and the result is that -- glenn: you bought that with my tax dollars? i d it cost $6400, but there is a $6400 federal tax credit"
https://archive.org/details/FOXNEWS_20091210_220000_Glenn_Beck#start/2858/end/2893,12/10/2009 22:47:53,FOXNEWS,Glenn Beck,FOXNEWS_20091210_220000_Glenn_Beck,https://archive.org/download/FOXNEWS_20091210_220000_Glenn_Beck/FOXNEWS_20091210_220000_Glenn_Beck.thumbs/FOXNEWS_20091210_220000_Glenn_Beck_002670.jpg,"tonight, john stossel? no, i have my own show at 8:00. glenn: this is christmas cheer. it is actually green and red. it is the red panic and green for the global warming nonsense. by the way, can you show the"
https://archive.org/details/FOXNEWS_20091214_220000_Glenn_Beck#start/2559/end/2594,12/14/2009 22:42:54,FOXNEWS,Glenn Beck,FOXNEWS_20091214_220000_Glenn_Beck,https://archive.org/download/FOXNEWS_20091214_220000_Glenn_Beck/FOXNEWS_20091214_220000_Glenn_Beck.thumbs/FOXNEWS_20091214_220000_Glenn_Beck_002544.jpg,"like the debate we're having right now? if you want to prepare yourself for the mindless arguments you're going to have to endure over hot holidays about healthcare, global warming and taxes, grab a copy of 'arguing with id yotsd idiots.'"
https://archive.org/details/FOXNEWS_20091216_140000_Americas_Newsroom#start/381/end/416,12/16/2009 14:06:36,FOXNEWS,Americas Newsroom,FOXNEWS_20091216_140000_Americas_Newsroom,https://archive.org/download/FOXNEWS_20091216_140000_Americas_Newsroom/FOXNEWS_20091216_140000_Americas_Newsroom.thumbs/FOXNEWS_20091216_140000_Americas_Newsroom_000356.jpg,"talks on the deals to curb global warming. president obama and other top leaders are due to join on friday. from overseas there is breaking news. tehran has said that it has test fired a long-range missile that"
https://archive.org/details/FOXNEWS_20091218_090000_Special_Report_With_Bret_Baier#start/2548/end/2583,12/18/2009 9:42:43,FOXNEWS,Special Report With Bret Baier,FOXNEWS_20091218_090000_Special_Report_With_Bret_Baier,https://archive.org/download/FOXNEWS_20091218_090000_Special_Report_With_Bret_Baier/FOXNEWS_20091218_090000_Special_Report_With_Bret_Baier.thumbs/FOXNEWS_20091218_090000_Special_Report_With_Bret_Baier_002543.jpg,"included in the figuring on global warming by the folks in england and at the u.n bret: mara, a senior aide said on the way over 'no matter what happens in copenhagen, the president will push hard for legislation in the senate,' even"
https://archive.org/details/FOXNEWS_20091218_160000_Happening_Now#start/2374/end/2409,12/18/2009 16:39:49,FOXNEWS,Happening Now,FOXNEWS_20091218_160000_Happening_Now,https://archive.org/download/FOXNEWS_20091218_160000_Happening_Now/FOXNEWS_20091218_160000_Happening_Now.thumbs/FOXNEWS_20091218_160000_Happening_Now_002370.jpg,"comes to specific problems that we face, global warming, guess what. well, it ranks at the bottom. number one, fixing the economy and creating jobs. those come in at a combined 53%. reforming health care, 10%. the wars in iraq and"
https://archive.org/details/FOXNEWS_20091218_160000_Happening_Now#start/2389/end/2424,12/18/2009 16:40:04,FOXNEWS,Happening Now,FOXNEWS_20091218_160000_Happening_Now,https://archive.org/download/FOXNEWS_20091218_160000_Happening_Now/FOXNEWS_20091218_160000_Happening_Now.thumbs/FOXNEWS_20091218_160000_Happening_Now_002370.jpg,"afghanistan, 8%. 7% cite reducing the deficit. addressing global warming way down there at just 2%. all of these revelations come as the obama administration has pledged to support a plan for countries to kick in $100 billion by 2020 to try"
https://archive.org/details/FOXNEWS_20091216_110000_FOX_and_Friends#start/3746/end/3781,12/16/2009 12:02:41,FOXNEWS,FOX and Friends,FOXNEWS_20091216_110000_FOX_and_Friends,https://archive.org/download/FOXNEWS_20091216_110000_FOX_and_Friends/FOXNEWS_20091216_110000_FOX_and_Friends.thumbs/FOXNEWS_20091216_110000_FOX_and_Friends_003736.jpg,"findings on global warming. now you have got connie, denmark's climate minister. she is going to be replaced by the danish prime minister. she describes the move as procedural though. the talks are currently deadlocked over emissions cuts and for financial and poor"
https://archive.org/details/FOXNEWS_20091221_050000_Red_Eye#start/1115/end/1150,12/21/2009 5:18:50,FOXNEWS,Red Eye,FOXNEWS_20091221_050000_Red_Eye,https://archive.org/download/FOXNEWS_20091221_050000_Red_Eye/FOXNEWS_20091221_050000_Red_Eye.thumbs/FOXNEWS_20091221_050000_Red_Eye_001110.jpg,"to these criticisms of the hockey stick graph is there no chance the argument was wrong? you believe there was global warming? no. how bad do you think it is? i don't know whether it is a big problem medium sized problem"
https://archive.org/details/FOXNEWS_20091221_050000_Red_Eye#start/3224/end/3259,12/21/2009 5:53:59,FOXNEWS,Red Eye,FOXNEWS_20091221_050000_Red_Eye,https://archive.org/download/FOXNEWS_20091221_050000_Red_Eye/FOXNEWS_20091221_050000_Red_Eye.thumbs/FOXNEWS_20091221_050000_Red_Eye_003210.jpg,"opportunity to gain political power and make money. early this hour they told americans not to worry about seeding power or money to halt global warming. the one has written that our concept of ballot box democracy may need to be modified to"
https://archive.org/details/FOXNEWS_20091217_140000_Americas_Newsroom#start/5573/end/5608,12/17/2009 15:33:08,FOXNEWS,Americas Newsroom,FOXNEWS_20091217_140000_Americas_Newsroom,https://archive.org/download/FOXNEWS_20091217_140000_Americas_Newsroom/FOXNEWS_20091217_140000_Americas_Newsroom.thumbs/FOXNEWS_20091217_140000_Americas_Newsroom_005550.jpg,"global warming. does the u.s. gain from this trip or is copenhagen a bust already? a fair and balanced debate with the radio talk-show host and mark williams. good morning to both of you. it has been at some time."
https://archive.org/details/FOXNEWS_20091210_160000_Happening_Now#start/1371/end/1406,12/10/2009 16:23:06,FOXNEWS,Happening Now,FOXNEWS_20091210_160000_Happening_Now,https://archive.org/download/FOXNEWS_20091210_160000_Happening_Now/FOXNEWS_20091210_160000_Happening_Now.thumbs/FOXNEWS_20091210_160000_Happening_Now_001372.jpg,"and this is the statement that was issued. it says we, the members of the science community, have but most confidence in observational evidence for global warming and the scientific basis for concluding it is primarily due to human activities."
https://archive.org/details/FOXNEWS_20091212_163000_Cashin_In#start/955/end/990,12/12/2009 16:46:10,FOXNEWS,Cashin In,FOXNEWS_20091212_163000_Cashin_In,https://archive.org/download/FOXNEWS_20091212_163000_Cashin_In/FOXNEWS_20091212_163000_Cashin_In.thumbs/FOXNEWS_20091212_163000_Cashin_In_000930.jpg,"now you want to throw in global warming and everything else! cheryl: one at a time! there is no accountability and that's the problem. jack in the box had bad meat. we see stock prices fall. people get fired. heads roll. standards change."
https://archive.org/details/FOXNEWS_20091213_210000_Americas_News_HQ#start/4383/end/4418,12/13/2009 22:13:18,FOXNEWS,Americas News HQ,FOXNEWS_20091213_210000_Americas_News_HQ,https://archive.org/download/FOXNEWS_20091213_210000_Americas_News_HQ/FOXNEWS_20091213_210000_Americas_News_HQ.thumbs/FOXNEWS_20091213_210000_Americas_News_HQ_004372.jpg,"take a small percentage of the entire stushgddy, a couple page the thousand pages and throw out the overwhelming conclusion of scientists in the world, there is dangerous global warming. we have to say on the science thing, this is something we saw"
https://archive.org/details/FOXNEWS_20091213_110000_The_OReilly_Factor#start/2980/end/3015,12/13/2009 11:49:55,FOXNEWS,The OReilly Factor,FOXNEWS_20091213_110000_The_OReilly_Factor,https://archive.org/download/FOXNEWS_20091213_110000_The_OReilly_Factor/FOXNEWS_20091213_110000_The_OReilly_Factor.thumbs/FOXNEWS_20091213_110000_The_OReilly_Factor_002910.jpg,"in dun mark, it continues for the next week. the conference opened amid growing controversy over what's been dubbed climate-gate by the press. the release of e-mail messages related to the global warming debate. those messages seem to suggest"
https://archive.org/details/FOXNEWS_20091212_040000_The_OReilly_Factor#start/15/end/50,12/12/2009 4:00:30,FOXNEWS,The OReilly Factor,FOXNEWS_20091212_040000_The_OReilly_Factor,https://archive.org/download/FOXNEWS_20091212_040000_The_OReilly_Factor/FOXNEWS_20091212_040000_The_OReilly_Factor.thumbs/FOXNEWS_20091212_040000_The_OReilly_Factor_000030.jpg,"laura: the climate debate rages on with sarah palin under attack for daring to question al gore's global warming theory. we have reaction from the governor. compared to some of the giants of history who have received this prize, my accomplishments are slight."
https://archive.org/details/FOXNEWS_20091214_030000_Geraldo_at_Large#start/2061/end/2096,12/14/2009 3:34:36,FOXNEWS,Geraldo at Large,FOXNEWS_20091214_030000_Geraldo_at_Large,https://archive.org/download/FOXNEWS_20091214_030000_Geraldo_at_Large/FOXNEWS_20091214_030000_Geraldo_at_Large.thumbs/FOXNEWS_20091214_030000_Geraldo_at_Large_002040.jpg,"issues that effect americans, i believe now republicans and arab solutions are beginning to resinate because of the real challenges before you wills. has your hand on the issue of global warming been strengthened by the so-called climate gate"
https://archive.org/details/FOXNEWS_20091215_070000_Glenn_Beck#start/516/end/551,12/15/2009 7:08:51,FOXNEWS,Glenn Beck,FOXNEWS_20091215_070000_Glenn_Beck,https://archive.org/download/FOXNEWS_20091215_070000_Glenn_Beck/FOXNEWS_20091215_070000_Glenn_Beck.thumbs/FOXNEWS_20091215_070000_Glenn_Beck_000506.jpg,"that's the furthest thing from their mind, and now we're being pummel with all of this in the name of a discredited global warming scam. al gore and his minions are throwing out more lies to cover up their initial inconvenient"
https://archive.org/details/FOXNEWS_20091216_070000_Glenn_Beck#start/2448/end/2483,12/16/2009 7:41:03,FOXNEWS,Glenn Beck,FOXNEWS_20091216_070000_Glenn_Beck,https://archive.org/download/FOXNEWS_20091216_070000_Glenn_Beck/FOXNEWS_20091216_070000_Glenn_Beck.thumbs/FOXNEWS_20091216_070000_Glenn_Beck_002424.jpg,"be a little demeaning. thanks for the lessen on nasty personal attacks there, babs, but i'm all for looking into an honest debate. what we have gotten so far from the global warming crowd, would you call that honesty,"
https://archive.org/details/FOXNEWS_20091216_070000_Glenn_Beck#start/2464/end/2499,12/16/2009 7:41:19,FOXNEWS,Glenn Beck,FOXNEWS_20091216_070000_Glenn_Beck,https://archive.org/download/FOXNEWS_20091216_070000_Glenn_Beck/FOXNEWS_20091216_070000_Glenn_Beck.thumbs/FOXNEWS_20091216_070000_Glenn_Beck_002454.jpg,"scientists shredding e-mails that hurt global warming arguments in response to a freedom of information act, they just put it in the shredder? al gore lying again? alternate agendas hike spreading the wealth? give them the wealth! give them the wealth!"
https://archive.org/details/FOXNEWS_20091215_100000_The_OReilly_Factor#start/157/end/192,12/15/2009 10:02:52,FOXNEWS,The OReilly Factor,FOXNEWS_20091215_100000_The_OReilly_Factor,https://archive.org/download/FOXNEWS_20091215_100000_The_OReilly_Factor/FOXNEWS_20091215_100000_The_OReilly_Factor.thumbs/FOXNEWS_20091215_100000_The_OReilly_Factor_000146.jpg,"in addition, the 52% of americans now say global warming not caused by human activity. just 37% say it is. 12% aren't sure. so another big obama cause is sliding. now, last night on 60 minutes the president expressed anger"
https://archive.org/details/FOXNEWS_20091214_220000_Glenn_Beck#start/519/end/554,12/14/2009 22:08:54,FOXNEWS,Glenn Beck,FOXNEWS_20091214_220000_Glenn_Beck,https://archive.org/download/FOXNEWS_20091214_220000_Glenn_Beck/FOXNEWS_20091214_220000_Glenn_Beck.thumbs/FOXNEWS_20091214_220000_Glenn_Beck_000506.jpg,"pummel with all of this in the name of a discredited global warming scam. al gore and his minions are throwing out more lies to cover up their initial inconvenient lies. when asked a question about the"
https://archive.org/details/FOXNEWS_20091214_103000_Cashin_In#start/953/end/988,12/14/2009 10:46:08,FOXNEWS,Cashin In,FOXNEWS_20091214_103000_Cashin_In,https://archive.org/download/FOXNEWS_20091214_103000_Cashin_In/FOXNEWS_20091214_103000_Cashin_In.thumbs/FOXNEWS_20091214_103000_Cashin_In_000930.jpg,"now you want to throw in global warming and everything else! cheryl: one at a time! there is no accountability and that's the problem. jack in the box had bad meat. we see stock prices fall. people get fired. heads roll. standards change."
https://archive.org/details/FOXNEWS_20091218_140000_Americas_Newsroom#start/1780/end/1815,12/18/2009 14:29:55,FOXNEWS,Americas Newsroom,FOXNEWS_20091218_140000_Americas_Newsroom,https://archive.org/download/FOXNEWS_20091218_140000_Americas_Newsroom/FOXNEWS_20091218_140000_Americas_Newsroom.thumbs/FOXNEWS_20091218_140000_Americas_Newsroom_001770.jpg,"warming is the crisis the u.s. claims it is. a new opinion dynamics poll found that while a majority of us believe global warming is real, only one in six described as a crisis. let's look to some of the"
https://archive.org/details/FOXNEWS_20091218_140000_Americas_Newsroom#start/1828/end/1863,12/18/2009 14:30:43,FOXNEWS,Americas Newsroom,FOXNEWS_20091218_140000_Americas_Newsroom,https://archive.org/download/FOXNEWS_20091218_140000_Americas_Newsroom/FOXNEWS_20091218_140000_Americas_Newsroom.thumbs/FOXNEWS_20091218_140000_Americas_Newsroom_001830.jpg,"8%, the wars in afghanistan and iraq. 7% cite reducing the deficit. addressing global warming is way down there at only 2 the side of the obama administration has pledged to support a plan for countries to kick in a $100"
https://archive.org/details/FOXNEWS_20091218_140000_Americas_Newsroom#start/1874/end/1909,12/18/2009 14:31:29,FOXNEWS,Americas Newsroom,FOXNEWS_20091218_140000_Americas_Newsroom,https://archive.org/download/FOXNEWS_20091218_140000_Americas_Newsroom/FOXNEWS_20091218_140000_Americas_Newsroom.thumbs/FOXNEWS_20091218_140000_Americas_Newsroom_001860.jpg,"from that 2007 poll. you know this issue front and center. we will have a special this week in. it is fox news reporting, global warming or a lot of hot air? it will delve into the e-mailed scandal and examine what"
https://archive.org/details/FOXNEWS_20091218_180000_The_Live_Desk#start/79/end/114,12/18/2009 18:01:34,FOXNEWS,The Live Desk,FOXNEWS_20091218_180000_The_Live_Desk,https://archive.org/download/FOXNEWS_20091218_180000_The_Live_Desk/FOXNEWS_20091218_180000_The_Live_Desk.thumbs/FOXNEWS_20091218_180000_The_Live_Desk_000053.jpg,"man-made global warming, that man's existence on earth is what has caused this. that is the big controversial issue. that is down 5% from back in may. so people have changed their minds a bit. there is a scandal over whether"
https://archive.org/details/FOXNEWS_20091218_160000_Happening_Now#start/2434/end/2469,12/18/2009 16:40:49,FOXNEWS,Happening Now,FOXNEWS_20091218_160000_Happening_Now,https://archive.org/download/FOXNEWS_20091218_160000_Happening_Now/FOXNEWS_20091218_160000_Happening_Now.thumbs/FOXNEWS_20091218_160000_Happening_Now_002430.jpg,"special fox news this weekend, fox news reporting global warming, or a lot of hot air, delves into the e-mail scandal and examines what scientists and others are saying about this issue. we look at it as only fox news"
https://archive.org/details/FOXNEWS_20091215_220000_Glenn_Beck#start/2465/end/2500,12/15/2009 22:41:20,FOXNEWS,Glenn Beck,FOXNEWS_20091215_220000_Glenn_Beck,https://archive.org/download/FOXNEWS_20091215_220000_Glenn_Beck/FOXNEWS_20091215_220000_Glenn_Beck.thumbs/FOXNEWS_20091215_220000_Glenn_Beck_002460.jpg,"scientists shredding e-mails that hurt global warming arguments in response to a freedom of information act, they just put it in the shredder? al gore lying again? alternate agendas hike spreading the wealth? give them the wealth! give them the wealth!"
