URL,MatchDateTime,Station,Show,IAShowID,IAPreviewThumb,Snippet
https://archive.org/details/FOXNEWSW_20151019_170000_Happening_Now#start/3342/end/3377,10/19/2015 17:55:57,FOXNEWS,Happening Now,FOXNEWSW_20151019_170000_Happening_Now,https://archive.org/download/FOXNEWSW_20151019_170000_Happening_Now/FOXNEWSW_20151019_170000_Happening_Now.thumbs/FOXNEWSW_20151019_170000_Happening_Now_003315.jpg,"not arguing that climate change exists but it that there are more obvious causes for the current spade of wildfires and more urgent ways to tackle those causes. development of forested areas is one, the design of houses in those developments another."
https://archive.org/details/FOXNEWSW_20151031_153000_Cashin_In#start/1467/end/1502,10/31/2015 15:54:42,FOXNEWS,Cashin In,FOXNEWSW_20151031_153000_Cashin_In,https://archive.org/download/FOXNEWSW_20151031_153000_Cashin_In/FOXNEWSW_20151031_153000_Cashin_In.thumbs/FOXNEWSW_20151031_153000_Cashin_In_001455.jpg,"pumpkin. they have to feel bad? their parents should know what's going on. over 50% of americans acknowledge that human beings are causing climate change where 97% of scientists are. there is a disconnect there. 97%? we are still looking for that."
https://archive.org/details/FOXNEWSW_20151031_140000_Bulls__Bears#start/1124/end/1159,10/31/2015 14:18:59,FOXNEWS,Bulls  Bears,FOXNEWSW_20151031_140000_Bulls__Bears,https://archive.org/download/FOXNEWSW_20151031_140000_Bulls__Bears/FOXNEWSW_20151031_140000_Bulls__Bears.thumbs/FOXNEWSW_20151031_140000_Bulls__Bears_001125.jpg,"that's certainly a fear. john is absolutely right. the problem is syria here. it will only get worse because we have a president who admittedly has no plan to tackle isis. we have a president who believes that climate change is a bigger"
https://archive.org/details/FOXNEWSW_20151014_100000_FOX__Friends#start/4733/end/4768,10/14/2015 11:19:08,FOXNEWS,FOX  Friends,FOXNEWSW_20151014_100000_FOX__Friends,https://archive.org/download/FOXNEWSW_20151014_100000_FOX__Friends/FOXNEWSW_20151014_100000_FOX__Friends.thumbs/FOXNEWSW_20151014_100000_FOX__Friends_004725.jpg,"are they right? i think nuclear proliferation and that kind of issue is serious. i don't think climate change ranks in the top ten list when you consider that we have these asymmetric threats of islamic terrorism, organized to destroy"
https://archive.org/details/FOXNEWSW_20151004_020000_The_Greg_Gutfeld_Show#start/213/end/248,10/4/2015 2:03:48,FOXNEWS,The Greg Gutfeld Show,FOXNEWSW_20151004_020000_The_Greg_Gutfeld_Show,https://archive.org/download/FOXNEWSW_20151004_020000_The_Greg_Gutfeld_Show/FOXNEWSW_20151004_020000_The_Greg_Gutfeld_Show.thumbs/FOXNEWSW_20151004_020000_The_Greg_Gutfeld_Show_000195.jpg,"president. but he wasn't born here. not like that matters. am i right? but even with the pope, things got polarizing. his stance on climate change is portrayed as moral by those who politicize it every day. the coverage was nonstop, like"
https://archive.org/details/FOXNEWSW_20151012_100000_FOX__Friends#start/372/end/407,10/12/2015 10:06:27,FOXNEWS,FOX  Friends,FOXNEWSW_20151012_100000_FOX__Friends,https://archive.org/download/FOXNEWSW_20151012_100000_FOX__Friends/FOXNEWSW_20151012_100000_FOX__Friends.thumbs/FOXNEWSW_20151012_100000_FOX__Friends_000345.jpg,"order to prop up your only ally, is leadership, then we've got a different definition of leadership. my definition of leadership would be leading on climate change and international accord the potential will get in paris. do you think the world is a"
https://archive.org/details/FOXNEWSW_20151015_200000_Your_World_With_Neil_Cavuto#start/1610/end/1645,10/15/2015 20:27:05,FOXNEWS,Your World With Neil Cavuto,FOXNEWSW_20151015_200000_Your_World_With_Neil_Cavuto,https://archive.org/download/FOXNEWSW_20151015_200000_Your_World_With_Neil_Cavuto/FOXNEWSW_20151015_200000_Your_World_With_Neil_Cavuto.thumbs/FOXNEWSW_20151015_200000_Your_World_With_Neil_Cavuto_001605.jpg,"when to intervene. when democrats were asked to named the greatest national security threat not one but two of the candidates said climate change. one of them said that the earth would be literally uninhabitable to humans by the time of tower"
https://archive.org/details/FOXNEWSW_20151013_220000_Special_Report_With_Bret_Baier#start/2059/end/2094,10/13/2015 22:34:34,FOXNEWS,Special Report With Bret Baier,FOXNEWSW_20151013_220000_Special_Report_With_Bret_Baier,https://archive.org/download/FOXNEWSW_20151013_220000_Special_Report_With_Bret_Baier/FOXNEWSW_20151013_220000_Special_Report_With_Bret_Baier.thumbs/FOXNEWSW_20151013_220000_Special_Report_With_Bret_Baier_002055.jpg,"rival, hillary clinton, especially on key issues for progressives, like the environment and trade. from day one, i opposed the keystone pipeline because i believe that if you're serious about climate change, you don't encourage the excavation and transportation of very dirty"
https://archive.org/details/FOXNEWSW_20151014_000000_The_OReilly_Factor#start/3358/end/3393,10/14/2015 0:56:13,FOXNEWS,The OReilly Factor,FOXNEWSW_20151014_000000_The_OReilly_Factor,https://archive.org/download/FOXNEWSW_20151014_000000_The_OReilly_Factor/FOXNEWSW_20151014_000000_The_OReilly_Factor.thumbs/FOXNEWSW_20151014_000000_The_OReilly_Factor_003345.jpg,"policies to confront world policies. he doesn't want to lead on violence, climate change, high, isis, he withdraws. the president's policy of parity that we are one of many has weakened this nation and caused far more problems than we had before he took officer, in my"
https://archive.org/details/FOXNEWSW_20151019_130000_Americas_Newsroom_With_Bill_Hemmer_and_Martha_MacCallum#start/6978/end/7013,10/19/2015 14:56:33,FOXNEWS,Americas Newsroom With Bill Hemmer and Martha MacCallum,FOXNEWSW_20151019_130000_Americas_Newsroom_With_Bill_Hemmer_and_Martha_MacCallum,https://archive.org/download/FOXNEWSW_20151019_130000_Americas_Newsroom_With_Bill_Hemmer_and_Martha_MacCallum/FOXNEWSW_20151019_130000_Americas_Newsroom_With_Bill_Hemmer_and_Martha_MacCallum.thumbs/FOXNEWSW_20151019_130000_Americas_Newsroom_With_Bill_Hemmer_and_Martha_MacCallum_006975.jpg,"design of homes being put on this land. one of them from the chaparral institute, says if we don't make changes there, the houses will keep burning down and people will keep dying. i don't believe that climate change discussion is helpful. so again, scientists saying it"
https://archive.org/details/FOXNEWSW_20151019_130000_Americas_Newsroom_With_Bill_Hemmer_and_Martha_MacCallum#start/6993/end/7028,10/19/2015 14:56:48,FOXNEWS,Americas Newsroom With Bill Hemmer and Martha MacCallum,FOXNEWSW_20151019_130000_Americas_Newsroom_With_Bill_Hemmer_and_Martha_MacCallum,https://archive.org/download/FOXNEWSW_20151019_130000_Americas_Newsroom_With_Bill_Hemmer_and_Martha_MacCallum/FOXNEWSW_20151019_130000_Americas_Newsroom_With_Bill_Hemmer_and_Martha_MacCallum.thumbs/FOXNEWSW_20151019_130000_Americas_Newsroom_With_Bill_Hemmer_and_Martha_MacCallum_006975.jpg,"is not about climate change when you look at these fires but you can always find one scientist to say one thing, one to say another. one hand of economic advisors of former presidents, bill. bill: thank you, jonathan. from los angeles, thank you, sir. martha."
https://archive.org/details/FOXNEWSW_20151013_080000_The_Kelly_File#start/49/end/84,10/13/2015 8:01:04,FOXNEWS,The Kelly File,FOXNEWSW_20151013_080000_The_Kelly_File,https://archive.org/download/FOXNEWSW_20151013_080000_The_Kelly_File/FOXNEWSW_20151013_080000_The_Kelly_File.thumbs/FOXNEWSW_20151013_080000_The_Kelly_File_000045.jpg,"putin is overplaying an already bad hand while the u.s. stands pat, focusing on the president's leadership in areas such as climate change than the iran nuclear deal. kevin cork has today's top story from the white house. reporter: ask about the failed program to train and"
https://archive.org/details/FOXNEWSW_20151017_000000_The_OReilly_Factor#start/1328/end/1363,10/17/2015 0:22:23,FOXNEWS,The OReilly Factor,FOXNEWSW_20151017_000000_The_OReilly_Factor,https://archive.org/download/FOXNEWSW_20151017_000000_The_OReilly_Factor/FOXNEWSW_20151017_000000_The_OReilly_Factor.thumbs/FOXNEWSW_20151017_000000_The_OReilly_Factor_001305.jpg,"proportion nalt here. i'm actually reminded when he says there are kind of quote terrorists on both sides. it's like people saying there are people on both sides of the climate change issue. it happens among people who are educated about the issue to be wildly"
https://archive.org/details/FOXNEWSW_20151019_030000_The_OReilly_Factor#start/1328/end/1363,10/19/2015 3:22:23,FOXNEWS,The OReilly Factor,FOXNEWSW_20151019_030000_The_OReilly_Factor,https://archive.org/download/FOXNEWSW_20151019_030000_The_OReilly_Factor/FOXNEWSW_20151019_030000_The_OReilly_Factor.thumbs/FOXNEWSW_20151019_030000_The_OReilly_Factor_001305.jpg,"proportion nalt here. i'm actually reminded when he says there are kind of quote terrorists on both sides. it's like people saying there are people on both sides of the climate change issue. it happens among people who are educated about the issue to be wildly"
https://archive.org/details/FOXNEWSW_20151019_170000_Happening_Now#start/3358/end/3393,10/19/2015 17:56:13,FOXNEWS,Happening Now,FOXNEWSW_20151019_170000_Happening_Now,https://archive.org/download/FOXNEWSW_20151019_170000_Happening_Now/FOXNEWSW_20151019_170000_Happening_Now.thumbs/FOXNEWSW_20151019_170000_Happening_Now_003345.jpg,"and if those causes aren't tackled then the effects will continue. according to richard hanscy of the chaparral institute who tolc 'the l.a. times,' quote, the houses will keep burning down and people will keep dying. i don't believe the climate change discussion is helpful."
https://archive.org/details/FOXNEWSW_20151029_230000_On_the_Record_With_Greta_Van_Susteren#start/1425/end/1460,10/29/2015 23:24:00,FOXNEWS,On the Record With Greta Van Susteren,FOXNEWSW_20151029_230000_On_the_Record_With_Greta_Van_Susteren,https://archive.org/download/FOXNEWSW_20151029_230000_On_the_Record_With_Greta_Van_Susteren/FOXNEWSW_20151029_230000_On_the_Record_With_Greta_Van_Susteren.thumbs/FOXNEWSW_20151029_230000_On_the_Record_With_Greta_Van_Susteren_001425.jpg,"not the biggest problem we face in terms of national security. when the democrats. national security threat. they say climate change, that's ridiculous. it's radical islam with a nuclear weapon or chemical biological weapon and very close to it. you vote for the budget"
https://archive.org/details/FOXNEWSW_20151028_080000_The_Kelly_File#start/1380/end/1415,10/28/2015 8:23:15,FOXNEWS,The Kelly File,FOXNEWSW_20151028_080000_The_Kelly_File,https://archive.org/download/FOXNEWSW_20151028_080000_The_Kelly_File/FOXNEWSW_20151028_080000_The_Kelly_File.thumbs/FOXNEWSW_20151028_080000_The_Kelly_File_001365.jpg,"of the united states. which we are so proud of. that we have in the shining light and the refugee to the world. in recent years, the state department has identified combatting climate change and fighting for lgbt rights around the globe as top priorities."
https://archive.org/details/FOXNEWSW_20151014_100000_FOX__Friends#start/3167/end/3202,10/14/2015 10:53:02,FOXNEWS,FOX  Friends,FOXNEWSW_20151014_100000_FOX__Friends,https://archive.org/download/FOXNEWSW_20151014_100000_FOX__Friends/FOXNEWSW_20151014_100000_FOX__Friends.thumbs/FOXNEWSW_20151014_100000_FOX__Friends_003165.jpg,"nuclear weapons, nuclear materials, that could actual into the wrong hands. as far as the business community is telling us if we do not address the global crisis of climate change, transform our energy system away from profit fuel -- our greatest long-term                 _"
https://archive.org/details/FOXNEWSW_20151012_100000_FOX__Friends#start/341/end/376,10/12/2015 10:05:56,FOXNEWS,FOX  Friends,FOXNEWSW_20151012_100000_FOX__Friends,https://archive.org/download/FOXNEWSW_20151012_100000_FOX__Friends/FOXNEWSW_20151012_100000_FOX__Friends.thumbs/FOXNEWSW_20151012_100000_FOX__Friends_000315.jpg,"vladimir putin seems to be winning in the world stage because he's actually doing something. you may not agree about his tactics, but he's doing something. then steve croft questioned the president about putin and somehow it turned around into climate change. watch this head scratcher."
https://archive.org/details/FOXNEWSW_20151012_100000_FOX__Friends#start/7239/end/7274,10/12/2015 12:00:54,FOXNEWS,FOX  Friends,FOXNEWSW_20151012_100000_FOX__Friends,https://archive.org/download/FOXNEWSW_20151012_100000_FOX__Friends/FOXNEWSW_20151012_100000_FOX__Friends.thumbs/FOXNEWSW_20151012_100000_FOX__Friends_007215.jpg,"why we're not making advances in the fight against isis. my definition of leadership would be leading on climate change. he's more concerned about ice caps than isis. is that really the way to earn respect around the world? brett baier here to react in 30"
https://archive.org/details/FOXNEWSW_20151009_210000_The_Five#start/2332/end/2367,10/9/2015 21:39:07,FOXNEWS,The Five,FOXNEWSW_20151009_210000_The_Five,https://archive.org/download/FOXNEWSW_20151009_210000_The_Five/FOXNEWSW_20151009_210000_The_Five.thumbs/FOXNEWSW_20151009_210000_The_Five_002325.jpg,"you think we should build a wall around the earth to keep out the aliens, make the martians pay for it? the big door. and protect us from climate change. eric, what would you say? i would say why are you asking me? he's right there."
https://archive.org/details/FOXNEWSW_20151013_040000_The_Kelly_File#start/524/end/559,10/13/2015 4:08:59,FOXNEWS,The Kelly File,FOXNEWSW_20151013_040000_The_Kelly_File,https://archive.org/download/FOXNEWSW_20151013_040000_The_Kelly_File/FOXNEWSW_20151013_040000_The_Kelly_File.thumbs/FOXNEWSW_20151013_040000_The_Kelly_File_000525.jpg,"nations in the middle east, and he thinks the way leadership should be shown is on climate change? he's so woefully out of touch with the american people and what they're concerned about. it is startling. it's part of his own incredibly liberal agenda, that he doesn't"
https://archive.org/details/FOXNEWSW_20151001_010000_The_Kelly_File#start/649/end/684,10/1/2015 1:11:04,FOXNEWS,The Kelly File,FOXNEWSW_20151001_010000_The_Kelly_File,https://archive.org/download/FOXNEWSW_20151001_010000_The_Kelly_File/FOXNEWSW_20151001_010000_The_Kelly_File.thumbs/FOXNEWSW_20151001_010000_The_Kelly_File_000645.jpg,"remember, 250000 people have died. you can't just do a speech on climate change and expect that these real world problems of today are going to go away. and this is going to be more of a 2016 campaign issue. president obama is leaving"
https://archive.org/details/FOXNEWSW_20151001_040000_The_Kelly_File#start/649/end/684,10/1/2015 4:11:04,FOXNEWS,The Kelly File,FOXNEWSW_20151001_040000_The_Kelly_File,https://archive.org/download/FOXNEWSW_20151001_040000_The_Kelly_File/FOXNEWSW_20151001_040000_The_Kelly_File.thumbs/FOXNEWSW_20151001_040000_The_Kelly_File_000645.jpg,"remember, 250000 people have died. you can't just do a speech on climate change and expect that these real world problems of today are going to go away. and this is going to be more of a 2016 campaign issue. president obama is leaving"
https://archive.org/details/FOXNEWSW_20151023_210000_The_Five#start/1263/end/1298,10/23/2015 21:21:18,FOXNEWS,The Five,FOXNEWSW_20151023_210000_The_Five,https://archive.org/download/FOXNEWSW_20151023_210000_The_Five/FOXNEWSW_20151023_210000_The_Five.thumbs/FOXNEWSW_20151023_210000_The_Five_001245.jpg,"is watch for the two words, he's going to want more money for domestic programs, climate change money and closing gitmo. this will be a mant roh. he wants to have the leverage. it's like a political shakedown. it's becoming as no surprise to anyone."
https://archive.org/details/FOXNEWSW_20151023_210000_The_Five#start/1533/end/1568,10/23/2015 21:25:48,FOXNEWS,The Five,FOXNEWSW_20151023_210000_The_Five,https://archive.org/download/FOXNEWSW_20151023_210000_The_Five/FOXNEWSW_20151023_210000_The_Five.thumbs/FOXNEWSW_20151023_210000_The_Five_001515.jpg,"jose or l.a., given the fact that she believes all of this unrest in syria is caused bay drought, caused by climate change? why isn't california having an incredible civil war among isis and the lapd? very good question. i'm sure she's going to get"
https://archive.org/details/FOXNEWSW_20151019_160000_Outnumbered#start/1820/end/1855,10/19/2015 16:30:35,FOXNEWS,Outnumbered,FOXNEWSW_20151019_160000_Outnumbered,https://archive.org/download/FOXNEWSW_20151019_160000_Outnumbered/FOXNEWSW_20151019_160000_Outnumbered.thumbs/FOXNEWSW_20151019_160000_Outnumbered_001815.jpg,"andrea: that's where he's more use. this is a secretary of state said climate change is the number one greatest threat facing the country and also one that tried to help the israelis and palestinians get to a peace deal and actually negotiated with hamas."
https://archive.org/details/FOXNEWSW_20151015_070000_Red_Eye#start/1640/end/1675,10/15/2015 7:27:35,FOXNEWS,Red Eye,FOXNEWSW_20151015_070000_Red_Eye,https://archive.org/download/FOXNEWSW_20151015_070000_Red_Eye/FOXNEWSW_20151015_070000_Red_Eye.thumbs/FOXNEWSW_20151015_070000_Red_Eye_001635.jpg,"reason for that. if we want to know what happened, ask a syrian. i don't know what to say. susan rice, everybody has their theories and something is shifting. something is happening and i don't know if it is climate change, but something is changing."
https://archive.org/details/FOXNEWSW_20151017_030000_The_OReilly_Factor#start/1328/end/1363,10/17/2015 3:22:23,FOXNEWS,The OReilly Factor,FOXNEWSW_20151017_030000_The_OReilly_Factor,https://archive.org/download/FOXNEWSW_20151017_030000_The_OReilly_Factor/FOXNEWSW_20151017_030000_The_OReilly_Factor.thumbs/FOXNEWSW_20151017_030000_The_OReilly_Factor_001305.jpg,"proportion nalt here. i'm actually reminded when he says there are kind of quote terrorists on both sides. it's like people saying there are people on both sides of the climate change issue. it happens among people who are educated about the issue to be wildly"
https://archive.org/details/FOXNEWSW_20151012_220000_Special_Report_With_Bret_Baier#start/48/end/83,10/12/2015 22:01:03,FOXNEWS,Special Report With Bret Baier,FOXNEWSW_20151012_220000_Special_Report_With_Bret_Baier,https://archive.org/download/FOXNEWSW_20151012_220000_Special_Report_With_Bret_Baier/FOXNEWSW_20151012_220000_Special_Report_With_Bret_Baier.thumbs/FOXNEWSW_20151012_220000_Special_Report_With_Bret_Baier_000045.jpg,"putin is overplaying an already bad hand while the u.s. stands pat, focusing on the president's leadership in areas such as climate change than the iran nuclear deal. kevin cork has today's top story from the white house. reporter: ask about the failed program to train and"
https://archive.org/details/FOXNEWSW_20151026_220000_Special_Report_With_Bret_Baier#start/1996/end/2031,10/26/2015 22:33:31,FOXNEWS,Special Report With Bret Baier,FOXNEWSW_20151026_220000_Special_Report_With_Bret_Baier,https://archive.org/download/FOXNEWSW_20151026_220000_Special_Report_With_Bret_Baier/FOXNEWSW_20151026_220000_Special_Report_With_Bret_Baier.thumbs/FOXNEWSW_20151026_220000_Special_Report_With_Bret_Baier_001995.jpg,"ever taken in the fight against climate change. reporter: but they say it's another new power grab that will end up driving up the cost of electricity, in some areas as much as 20% while putting thousands of american jobs at risks. the president called such"
https://archive.org/details/FOXNEWSW_20151015_020000_Hannity#start/2452/end/2487,10/15/2015 2:41:07,FOXNEWS,Hannity,FOXNEWSW_20151015_020000_Hannity,https://archive.org/download/FOXNEWSW_20151015_020000_Hannity/FOXNEWSW_20151015_020000_Hannity.thumbs/FOXNEWSW_20151015_020000_Hannity_002445.jpg,"equity down. let's talk about black lives matter. let's talk about climate change. let's talk about any damn thing except the assault on the black economy and the assault on the black family as a result of these welfare state policies. it all started under the democrats, is that right, larry?"
https://archive.org/details/FOXNEWSW_20151019_190000_Shepard_Smith_Reporting#start/3619/end/3654,10/19/2015 20:00:34,FOXNEWS,Shepard Smith Reporting,FOXNEWSW_20151019_190000_Shepard_Smith_Reporting,https://archive.org/download/FOXNEWSW_20151019_190000_Shepard_Smith_Reporting/FOXNEWSW_20151019_190000_Shepard_Smith_Reporting.thumbs/FOXNEWSW_20151019_190000_Shepard_Smith_Reporting_003615.jpg,"states. he is addressing a climate change summit going on at the executive office building right next door to the white house. a place that maybe he will want to call home very soon if early indications are he has decided to go ahead and try for a presidential run."
https://archive.org/details/FOXNEWSW_20151029_230000_On_the_Record_With_Greta_Van_Susteren#start/1381/end/1416,10/29/2015 23:23:16,FOXNEWS,On the Record With Greta Van Susteren,FOXNEWSW_20151029_230000_On_the_Record_With_Greta_Van_Susteren,https://archive.org/download/FOXNEWSW_20151029_230000_On_the_Record_With_Greta_Van_Susteren/FOXNEWSW_20151029_230000_On_the_Record_With_Greta_Van_Susteren.thumbs/FOXNEWSW_20151029_230000_On_the_Record_With_Greta_Van_Susteren_001365.jpg,"climate change. you have been very outspoken about it. why is that such a contentious issue in the republican party because you would think that science would prove it or disprove this one. you know, i don't know but i have been to alaska. i have ton gon antarctica and greenland."
https://archive.org/details/FOXNEWSW_20151030_060000_On_the_Record_With_Greta_Van_Susteren#start/1426/end/1461,10/30/2015 6:24:01,FOXNEWS,On the Record With Greta Van Susteren,FOXNEWSW_20151030_060000_On_the_Record_With_Greta_Van_Susteren,https://archive.org/download/FOXNEWSW_20151030_060000_On_the_Record_With_Greta_Van_Susteren/FOXNEWSW_20151030_060000_On_the_Record_With_Greta_Van_Susteren.thumbs/FOXNEWSW_20151030_060000_On_the_Record_With_Greta_Van_Susteren_001425.jpg,"people that hate your guts. not the biggest problem we face in terms of national security. when the democrats. national security threat. they say climate change, that's ridiculous. it's radical islam with a nuclear weapon or chemical biological weapon and very close to it. you vote for the budget"
https://archive.org/details/FOXNEWSW_20151027_080000_The_Kelly_File#start/1996/end/2031,10/27/2015 8:33:31,FOXNEWS,The Kelly File,FOXNEWSW_20151027_080000_The_Kelly_File,https://archive.org/download/FOXNEWSW_20151027_080000_The_Kelly_File/FOXNEWSW_20151027_080000_The_Kelly_File.thumbs/FOXNEWSW_20151027_080000_The_Kelly_File_001995.jpg,"ever taken in the fight against climate change. reporter: but they say it's another new power grab that will end up driving up the cost of electricity, in some areas as much as 20% while putting thousands of american jobs at risks. the president called such"
https://archive.org/details/FOXNEWSW_20151030_060000_On_the_Record_With_Greta_Van_Susteren#start/1376/end/1411,10/30/2015 6:23:11,FOXNEWS,On the Record With Greta Van Susteren,FOXNEWSW_20151030_060000_On_the_Record_With_Greta_Van_Susteren,https://archive.org/download/FOXNEWSW_20151030_060000_On_the_Record_With_Greta_Van_Susteren/FOXNEWSW_20151030_060000_On_the_Record_With_Greta_Van_Susteren.thumbs/FOXNEWSW_20151030_060000_On_the_Record_With_Greta_Van_Susteren_001365.jpg,"clip. fun clips to watch. tell me, what are the issues brought up last night was climate change. you have been very outspoken about it. why is that such a contentious issue in the republican party because you would think that science would prove it or disprove this one."
https://archive.org/details/FOXNEWSW_20151014_100000_FOX__Friends#start/3151/end/3186,10/14/2015 10:52:46,FOXNEWS,FOX  Friends,FOXNEWSW_20151014_100000_FOX__Friends,https://archive.org/download/FOXNEWSW_20151014_100000_FOX__Friends/FOXNEWSW_20151014_100000_FOX__Friends.thumbs/FOXNEWSW_20151014_100000_FOX__Friends_003075.jpg,"it's certainly the chaos in the middle east, there's no doubt about it. i believe the nuclear iran remains the biggest threat along with the spread of isil. climate change, of course, makes a cascading threat even worse. i think it has to be tunely threats from the spread of"
https://archive.org/details/FOXNEWSW_20151014_100000_FOX__Friends#start/4717/end/4752,10/14/2015 11:18:52,FOXNEWS,FOX  Friends,FOXNEWSW_20151014_100000_FOX__Friends,https://archive.org/download/FOXNEWSW_20151014_100000_FOX__Friends/FOXNEWSW_20151014_100000_FOX__Friends.thumbs/FOXNEWSW_20151014_100000_FOX__Friends_004695.jpg,"the scientific community is telling us if we do not address the global crisis of climate change, transform our energy system away from fossil fuel, to sustainable energy the planet that we're going to be leaving our kids and our grandchildren may well not be habitable. that is a major crisis."
https://archive.org/details/FOXNEWSW_20151012_100000_FOX__Friends#start/3829/end/3864,10/12/2015 11:04:04,FOXNEWS,FOX  Friends,FOXNEWSW_20151012_100000_FOX__Friends,https://archive.org/download/FOXNEWSW_20151012_100000_FOX__Friends/FOXNEWSW_20151012_100000_FOX__Friends.thumbs/FOXNEWSW_20151012_100000_FOX__Friends_003825.jpg,"you know, i just i don't get it, what's going on in our country, it can be fixed. it many cases very easily, but we have somebody that's more worried about climate change than he is about all of the problems that we have. well he said leadership is"
https://archive.org/details/FOXNEWSW_20151012_100000_FOX__Friends#start/3922/end/3957,10/12/2015 11:05:37,FOXNEWS,FOX  Friends,FOXNEWSW_20151012_100000_FOX__Friends,https://archive.org/download/FOXNEWSW_20151012_100000_FOX__Friends/FOXNEWSW_20151012_100000_FOX__Friends.thumbs/FOXNEWSW_20151012_100000_FOX__Friends_003915.jpg,"threats to the country, where we have all the problems in the middle east, syria burning, everyplace else and the man is focused on his own political ideology and i guess he wants to be like the climate change czar or something. first of all, hello, kimberly. i love kimberly."
